GO.ID	Term	Annotated	Significant	Expected	pval_test	pval_adj	ontology
GO:0046637	regulation of alpha-beta T cell differen...	9	1	0.15	0.14349	1	BP
GO:0021988	olfactory lobe development	9	1	0.15	0.14349	1	BP
GO:0030706	germarium-derived oocyte differentiation	9	1	0.15	0.14349	1	BP
GO:0000959	mitochondrial RNA metabolic process	9	1	0.15	0.14349	1	BP
GO:0045604	regulation of epidermal cell differentia...	9	1	0.15	0.14349	1	BP
GO:0042987	amyloid precursor protein catabolic proc...	9	1	0.15	0.14349	1	BP
GO:0003383	apical constriction	9	1	0.15	0.14349	1	BP
GO:0046320	regulation of fatty acid oxidation	9	1	0.15	0.14349	1	BP
GO:1904292	regulation of ERAD pathway	9	1	0.15	0.14349	1	BP
GO:0090140	regulation of mitochondrial fission	9	1	0.15	0.14349	1	BP
GO:2000181	negative regulation of blood vessel morp...	9	1	0.15	0.14349	1	BP
GO:0008608	attachment of spindle microtubules to ki...	9	1	0.15	0.14349	1	BP
GO:0043243	positive regulation of protein-containin...	9	1	0.15	0.14349	1	BP
GO:0021772	olfactory bulb development	9	1	0.15	0.14349	1	BP
GO:0051569	regulation of histone H3-K4 methylation	9	1	0.15	0.14349	1	BP
GO:0002448	mast cell mediated immunity	9	1	0.15	0.14349	1	BP
GO:0035126	post-embryonic genitalia morphogenesis	9	1	0.15	0.14349	1	BP
GO:0046189	phenol-containing compound biosynthetic ...	9	1	0.15	0.14349	1	BP
GO:0045923	positive regulation of fatty acid metabo...	9	1	0.15	0.14349	1	BP
GO:0050962	detection of light stimulus involved in ...	9	1	0.15	0.14349	1	BP
GO:0044837	actomyosin contractile ring organization	9	1	0.15	0.14349	1	BP
GO:0033046	negative regulation of sister chromatid ...	9	1	0.15	0.14349	1	BP
GO:0007483	genital disc morphogenesis	9	1	0.15	0.14349	1	BP
GO:0050908	detection of light stimulus involved in ...	9	1	0.15	0.14349	1	BP
GO:0000022	mitotic spindle elongation	9	1	0.15	0.14349	1	BP
GO:0002279	mast cell activation involved in immune ...	9	1	0.15	0.14349	1	BP
GO:0032515	negative regulation of phosphoprotein ph...	9	1	0.15	0.14349	1	BP
GO:0035710	CD4-positive, alpha-beta T cell activati...	9	1	0.15	0.14349	1	BP
GO:0007112	male meiosis cytokinesis	9	1	0.15	0.14349	1	BP
GO:0016525	negative regulation of angiogenesis	9	1	0.15	0.14349	1	BP
GO:0007135	meiosis II	9	1	0.15	0.14349	1	BP
GO:0002762	negative regulation of myeloid leukocyte...	9	1	0.15	0.14349	1	BP
GO:1903513	endoplasmic reticulum to cytosol transpo...	9	1	0.15	0.14349	1	BP
GO:0048803	imaginal disc-derived male genitalia mor...	9	1	0.15	0.14349	1	BP
GO:0048805	imaginal disc-derived genitalia morphoge...	9	1	0.15	0.14349	1	BP
GO:0048808	male genitalia morphogenesis	9	1	0.15	0.14349	1	BP
GO:0030970	retrograde protein transport, ER to cyto...	9	1	0.15	0.14349	1	BP
GO:0031648	protein destabilization	9	1	0.15	0.14349	1	BP
GO:0001737	establishment of imaginal disc-derived w...	9	1	0.15	0.14349	1	BP
GO:0045880	positive regulation of smoothened signal...	9	1	0.15	0.14349	1	BP
GO:0002092	positive regulation of receptor internal...	9	1	0.15	0.14349	1	BP
GO:0002886	regulation of myeloid leukocyte mediated...	9	1	0.15	0.14349	1	BP
GO:0032365	intracellular lipid transport	9	1	0.15	0.14349	1	BP
GO:0043303	mast cell degranulation	9	1	0.15	0.14349	1	BP
GO:0034504	protein localization to nucleus	78	3	1.33	0.14583	1	BP
GO:0043161	proteasome-mediated ubiquitin-dependent ...	122	4	2.08	0.15167	1	BP
GO:0060271	cilium assembly	122	4	2.08	0.15167	1	BP
GO:0045859	regulation of protein kinase activity	167	5	2.85	0.15177	1	BP
GO:0021953	central nervous system neuron differenti...	41	2	0.7	0.15351	1	BP
GO:1901991	negative regulation of mitotic cell cycl...	41	2	0.7	0.15351	1	BP
GO:0032886	regulation of microtubule-based process	80	3	1.36	0.15393	1	BP
GO:0061564	axon development	168	5	2.86	0.1545	1	BP
GO:0030031	cell projection assembly	169	5	2.88	0.15725	1	BP
GO:0022603	regulation of anatomical structure morph...	216	6	3.68	0.15732	1	BP
GO:0043087	regulation of GTPase activity	81	3	1.38	0.15803	1	BP
GO:0048871	multicellular organismal homeostasis	81	3	1.38	0.15803	1	BP
GO:0001816	cytokine production	81	3	1.38	0.15803	1	BP
GO:0090303	positive regulation of wound healing	10	1	0.17	0.15813	1	BP
GO:0030716	oocyte fate determination	10	1	0.17	0.15813	1	BP
GO:0007026	negative regulation of microtubule depol...	10	1	0.17	0.15813	1	BP
GO:0042401	cellular biogenic amine biosynthetic pro...	10	1	0.17	0.15813	1	BP
GO:0090199	regulation of release of cytochrome c fr...	10	1	0.17	0.15813	1	BP
GO:0010659	cardiac muscle cell apoptotic process	10	1	0.17	0.15813	1	BP
GO:0000291	nuclear-transcribed mRNA catabolic proce...	10	1	0.17	0.15813	1	BP
GO:0008354	germ cell migration	10	1	0.17	0.15813	1	BP
GO:0002456	T cell mediated immunity	10	1	0.17	0.15813	1	BP
GO:0060337	type I interferon signaling pathway	10	1	0.17	0.15813	1	BP
GO:0007310	oocyte dorsal/ventral axis specification	10	1	0.17	0.15813	1	BP
GO:1905476	negative regulation of protein localizat...	10	1	0.17	0.15813	1	BP
GO:0072595	maintenance of protein localization in o...	10	1	0.17	0.15813	1	BP
GO:0071599	otic vesicle development	10	1	0.17	0.15813	1	BP
GO:0060986	endocrine hormone secretion	10	1	0.17	0.15813	1	BP
GO:0021515	cell differentiation in spinal cord	10	1	0.17	0.15813	1	BP
GO:0021533	cell differentiation in hindbrain	10	1	0.17	0.15813	1	BP
GO:0070193	synaptonemal complex organization	10	1	0.17	0.15813	1	BP
GO:0071697	ectodermal placode morphogenesis	10	1	0.17	0.15813	1	BP
GO:0006977	DNA damage response, signal transduction...	10	1	0.17	0.15813	1	BP
GO:0035850	epithelial cell differentiation involved...	10	1	0.17	0.15813	1	BP
GO:0036010	protein localization to endosome	10	1	0.17	0.15813	1	BP
GO:0090503	RNA phosphodiester bond hydrolysis, exon...	10	1	0.17	0.15813	1	BP
GO:0050729	positive regulation of inflammatory resp...	10	1	0.17	0.15813	1	BP
GO:0034340	response to type I interferon	10	1	0.17	0.15813	1	BP
GO:0071357	cellular response to type I interferon	10	1	0.17	0.15813	1	BP
GO:0009309	amine biosynthetic process	10	1	0.17	0.15813	1	BP
GO:0048538	thymus development	10	1	0.17	0.15813	1	BP
GO:0032352	positive regulation of hormone metabolic...	10	1	0.17	0.15813	1	BP
GO:2000677	regulation of transcription regulatory r...	10	1	0.17	0.15813	1	BP
GO:0045599	negative regulation of fat cell differen...	10	1	0.17	0.15813	1	BP
GO:1901673	regulation of mitotic spindle assembly	10	1	0.17	0.15813	1	BP
GO:0070734	histone H3-K27 methylation	10	1	0.17	0.15813	1	BP
GO:0043300	regulation of leukocyte degranulation	10	1	0.17	0.15813	1	BP
GO:0045582	positive regulation of T cell differenti...	10	1	0.17	0.15813	1	BP
GO:0035315	hair cell differentiation	42	2	0.72	0.15952	1	BP
GO:0061326	renal tubule development	42	2	0.72	0.15952	1	BP
GO:0044782	cilium organization	125	4	2.13	0.16143	1	BP
GO:0048589	developmental growth	267	7	4.55	0.16336	1	BP
GO:0007093	mitotic cell cycle checkpoint signaling	43	2	0.73	0.16556	1	BP
GO:0000077	DNA damage checkpoint signaling	43	2	0.73	0.16556	1	BP
GO:0043588	skin development	43	2	0.73	0.16556	1	BP
GO:0051640	organelle localization	221	6	3.77	0.16972	1	BP
GO:0016331	morphogenesis of embryonic epithelium	84	3	1.43	0.17054	1	BP
GO:0006816	calcium ion transport	84	3	1.43	0.17054	1	BP
GO:0050801	ion homeostasis	174	5	2.96	0.17133	1	BP
GO:0051224	negative regulation of protein transport	44	2	0.75	0.17165	1	BP
GO:0010632	regulation of epithelial cell migration	44	2	0.75	0.17165	1	BP
GO:0030902	hindbrain development	44	2	0.75	0.17165	1	BP
GO:0045576	mast cell activation	11	1	0.19	0.17252	1	BP
GO:2000369	regulation of clathrin-dependent endocyt...	11	1	0.19	0.17252	1	BP
GO:0002532	production of molecular mediator involve...	11	1	0.19	0.17252	1	BP
GO:0030717	oocyte karyosome formation	11	1	0.19	0.17252	1	BP
GO:0071168	protein localization to chromatin	11	1	0.19	0.17252	1	BP
GO:0045621	positive regulation of lymphocyte differ...	11	1	0.19	0.17252	1	BP
GO:0034260	negative regulation of GTPase activity	11	1	0.19	0.17252	1	BP
GO:0006023	aminoglycan biosynthetic process	11	1	0.19	0.17252	1	BP
GO:0006024	glycosaminoglycan biosynthetic process	11	1	0.19	0.17252	1	BP
GO:0043113	receptor clustering	11	1	0.19	0.17252	1	BP
GO:0031114	regulation of microtubule depolymerizati...	11	1	0.19	0.17252	1	BP
GO:0010662	regulation of striated muscle cell apopt...	11	1	0.19	0.17252	1	BP
GO:0035308	negative regulation of protein dephospho...	11	1	0.19	0.17252	1	BP
GO:0071763	nuclear membrane organization	11	1	0.19	0.17252	1	BP
GO:0003170	heart valve development	11	1	0.19	0.17252	1	BP
GO:0050994	regulation of lipid catabolic process	11	1	0.19	0.17252	1	BP
GO:1901222	regulation of NIK/NF-kappaB signaling	11	1	0.19	0.17252	1	BP
GO:0072002	Malpighian tubule development	11	1	0.19	0.17252	1	BP
GO:1903715	regulation of aerobic respiration	11	1	0.19	0.17252	1	BP
GO:0007300	ovarian nurse cell to oocyte transport	11	1	0.19	0.17252	1	BP
GO:0061525	hindgut development	11	1	0.19	0.17252	1	BP
GO:0007442	hindgut morphogenesis	11	1	0.19	0.17252	1	BP
GO:0055006	cardiac cell development	11	1	0.19	0.17252	1	BP
GO:0010165	response to X-ray	11	1	0.19	0.17252	1	BP
GO:0033692	cellular polysaccharide biosynthetic pro...	11	1	0.19	0.17252	1	BP
GO:0071696	ectodermal placode development	11	1	0.19	0.17252	1	BP
GO:0048854	brain morphogenesis	11	1	0.19	0.17252	1	BP
GO:0050766	positive regulation of phagocytosis	11	1	0.19	0.17252	1	BP
GO:0035065	regulation of histone acetylation	11	1	0.19	0.17252	1	BP
GO:0002702	positive regulation of production of mol...	11	1	0.19	0.17252	1	BP
GO:0046823	negative regulation of nucleocytoplasmic...	11	1	0.19	0.17252	1	BP
GO:0072499	photoreceptor cell axon guidance	11	1	0.19	0.17252	1	BP
GO:0002824	positive regulation of adaptive immune r...	11	1	0.19	0.17252	1	BP
GO:0051985	negative regulation of chromosome segreg...	11	1	0.19	0.17252	1	BP
GO:0043388	positive regulation of DNA binding	11	1	0.19	0.17252	1	BP
GO:0060099	regulation of phagocytosis, engulfment	11	1	0.19	0.17252	1	BP
GO:0051148	negative regulation of muscle cell diffe...	11	1	0.19	0.17252	1	BP
GO:0061983	meiosis II cell cycle process	11	1	0.19	0.17252	1	BP
GO:0061988	karyosome formation	11	1	0.19	0.17252	1	BP
GO:0080134	regulation of response to stress	272	7	4.63	0.17476	1	BP
GO:0051603	proteolysis involved in cellular protein...	176	5	3	0.1771	1	BP
GO:1904950	negative regulation of establishment of ...	45	2	0.77	0.17778	1	BP
GO:0031570	DNA integrity checkpoint signaling	45	2	0.77	0.17778	1	BP
GO:0001838	embryonic epithelial tube formation	45	2	0.77	0.17778	1	BP
GO:0043687	post-translational protein modification	86	3	1.47	0.17905	1	BP
GO:0051493	regulation of cytoskeleton organization	131	4	2.23	0.18163	1	BP
GO:1901652	response to peptide	131	4	2.23	0.18163	1	BP
GO:0048609	multicellular organismal reproductive pr...	455	12	7.75	0.18235	1	BP
GO:0030163	protein catabolic process	226	6	3.85	0.18254	1	BP
GO:0046907	intracellular transport	507	13	8.64	0.18326	1	BP
GO:0071375	cellular response to peptide hormone sti...	87	3	1.48	0.18334	1	BP
GO:0051649	establishment of localization in cell	676	16	11.52	0.18504	1	BP
GO:0010498	proteasomal protein catabolic process	132	4	2.25	0.18508	1	BP
GO:0043086	negative regulation of catalytic activit...	132	4	2.25	0.18508	1	BP
GO:0060284	regulation of cell development	277	7	4.72	0.18651	1	BP
GO:0032418	lysosome localization	12	1	0.2	0.18668	1	BP
GO:0034103	regulation of tissue remodeling	12	1	0.2	0.18668	1	BP
GO:0046632	alpha-beta T cell differentiation	12	1	0.2	0.18668	1	BP
GO:0046634	regulation of alpha-beta T cell activati...	12	1	0.2	0.18668	1	BP
GO:0045610	regulation of hemocyte differentiation	12	1	0.2	0.18668	1	BP
GO:0048483	autonomic nervous system development	12	1	0.2	0.18668	1	BP
GO:0046329	negative regulation of JNK cascade	12	1	0.2	0.18668	1	BP
GO:0008625	extrinsic apoptotic signaling pathway vi...	12	1	0.2	0.18668	1	BP
GO:0000266	mitochondrial fission	12	1	0.2	0.18668	1	BP
GO:0000271	polysaccharide biosynthetic process	12	1	0.2	0.18668	1	BP
GO:1901985	positive regulation of protein acetylati...	12	1	0.2	0.18668	1	BP
GO:0030501	positive regulation of bone mineralizati...	12	1	0.2	0.18668	1	BP
GO:0006622	protein targeting to lysosome	12	1	0.2	0.18668	1	BP
GO:0048102	autophagic cell death	12	1	0.2	0.18668	1	BP
GO:1990849	vacuolar localization	12	1	0.2	0.18668	1	BP
GO:0044819	mitotic G1/S transition checkpoint signa...	12	1	0.2	0.18668	1	BP
GO:2000756	regulation of peptidyl-lysine acetylatio...	12	1	0.2	0.18668	1	BP
GO:0007484	imaginal disc-derived genitalia developm...	12	1	0.2	0.18668	1	BP
GO:0007485	imaginal disc-derived male genitalia dev...	12	1	0.2	0.18668	1	BP
GO:1905153	regulation of membrane invagination	12	1	0.2	0.18668	1	BP
GO:0007406	negative regulation of neuroblast prolif...	12	1	0.2	0.18668	1	BP
GO:0038061	NIK/NF-kappaB signaling	12	1	0.2	0.18668	1	BP
GO:0072676	lymphocyte migration	12	1	0.2	0.18668	1	BP
GO:0061647	histone H3-K9 modification	12	1	0.2	0.18668	1	BP
GO:0031571	mitotic G1 DNA damage checkpoint signali...	12	1	0.2	0.18668	1	BP
GO:0048013	ephrin receptor signaling pathway	12	1	0.2	0.18668	1	BP
GO:0030166	proteoglycan biosynthetic process	12	1	0.2	0.18668	1	BP
GO:0070286	axonemal dynein complex assembly	12	1	0.2	0.18668	1	BP
GO:2001222	regulation of neuron migration	12	1	0.2	0.18668	1	BP
GO:0010799	regulation of peptidyl-threonine phospho...	12	1	0.2	0.18668	1	BP
GO:0002821	positive regulation of adaptive immune r...	12	1	0.2	0.18668	1	BP
GO:0045070	positive regulation of viral genome repl...	12	1	0.2	0.18668	1	BP
GO:0045839	negative regulation of mitotic nuclear d...	12	1	0.2	0.18668	1	BP
GO:0045022	early endosome to late endosome transpor...	12	1	0.2	0.18668	1	BP
GO:0007034	vacuolar transport	47	2	0.8	0.19014	1	BP
GO:0022612	gland morphogenesis	47	2	0.8	0.19014	1	BP
GO:0007399	nervous system development	647	14	11.02	0.19192	1	BP
GO:0031347	regulation of defense response	89	3	1.52	0.19202	1	BP
GO:0030003	cellular cation homeostasis	134	4	2.28	0.19205	1	BP
GO:0071363	cellular response to growth factor stimu...	134	4	2.28	0.19205	1	BP
GO:1904019	epithelial cell apoptotic process	18	3	0.31	0.19304	1	BP
GO:0043549	regulation of kinase activity	182	5	3.1	0.19486	1	BP
GO:0051234	establishment of localization	1032	22	17.58	0.19627	1	BP
GO:0007052	mitotic spindle organization	48	2	0.82	0.19637	1	BP
GO:0036294	cellular response to decreased oxygen le...	48	2	0.82	0.19637	1	BP
GO:0034620	cellular response to unfolded protein	48	2	0.82	0.19637	1	BP
GO:0045216	cell-cell junction organization	48	2	0.82	0.19637	1	BP
GO:0051302	regulation of cell division	48	2	0.82	0.19637	1	BP
GO:0070848	response to growth factor	136	4	2.32	0.1991	1	BP
GO:0070830	bicellular tight junction assembly	13	1	0.22	0.2006	1	BP
GO:0051231	spindle elongation	13	1	0.22	0.2006	1	BP
GO:0045652	regulation of megakaryocyte differentiat...	13	1	0.22	0.2006	1	BP
GO:0042982	amyloid precursor protein metabolic proc...	13	1	0.22	0.2006	1	BP
GO:0090169	regulation of spindle assembly	13	1	0.22	0.2006	1	BP
GO:0031145	anaphase-promoting complex-dependent cat...	13	1	0.22	0.2006	1	BP
GO:0006584	catecholamine metabolic process	13	1	0.22	0.2006	1	BP
GO:0010658	striated muscle cell apoptotic process	13	1	0.22	0.2006	1	BP
GO:1903146	regulation of autophagy of mitochondrion	13	1	0.22	0.2006	1	BP
GO:0009712	catechol-containing compound metabolic p...	13	1	0.22	0.2006	1	BP
GO:0070671	response to interleukin-12	13	1	0.22	0.2006	1	BP
GO:0006656	phosphatidylcholine biosynthetic process	13	1	0.22	0.2006	1	BP
GO:0007608	sensory perception of smell	13	1	0.22	0.2006	1	BP
GO:0003401	axis elongation	13	1	0.22	0.2006	1	BP
GO:0035172	hemocyte proliferation	13	1	0.22	0.2006	1	BP
GO:0035112	genitalia morphogenesis	13	1	0.22	0.2006	1	BP
GO:0035215	genital disc development	13	1	0.22	0.2006	1	BP
GO:0032527	protein exit from endoplasmic reticulum	13	1	0.22	0.2006	1	BP
GO:0035722	interleukin-12-mediated signaling pathwa...	13	1	0.22	0.2006	1	BP
GO:1903573	negative regulation of response to endop...	13	1	0.22	0.2006	1	BP
GO:1903510	mucopolysaccharide metabolic process	13	1	0.22	0.2006	1	BP
GO:0042509	regulation of tyrosine phosphorylation o...	13	1	0.22	0.2006	1	BP
GO:0007260	tyrosine phosphorylation of STAT protein	13	1	0.22	0.2006	1	BP
GO:0002708	positive regulation of lymphocyte mediat...	13	1	0.22	0.2006	1	BP
GO:0051438	regulation of ubiquitin-protein transfer...	13	1	0.22	0.2006	1	BP
GO:0071349	cellular response to interleukin-12	13	1	0.22	0.2006	1	BP
GO:2000647	negative regulation of stem cell prolife...	13	1	0.22	0.2006	1	BP
GO:0002040	sprouting angiogenesis	13	1	0.22	0.2006	1	BP
GO:0042386	hemocyte differentiation	13	1	0.22	0.2006	1	BP
GO:0030029	actin filament-based process	184	5	3.13	0.20092	1	BP
GO:0001700	embryonic development via the syncytial ...	49	2	0.83	0.20262	1	BP
GO:0045807	positive regulation of endocytosis	49	2	0.83	0.20262	1	BP
GO:0043412	macromolecule modification	875	18	14.91	0.20344	1	BP
GO:0033554	cellular response to stress	546	12	9.3	0.20435	1	BP
GO:0010631	epithelial cell migration	92	3	1.57	0.20523	1	BP
GO:0007267	cell-cell signaling	326	11	5.55	0.20818	1	BP
GO:0046661	male sex differentiation	50	2	0.85	0.2089	1	BP
GO:0072175	epithelial tube formation	50	2	0.85	0.2089	1	BP
GO:0019058	viral life cycle	50	2	0.85	0.2089	1	BP
GO:1901701	cellular response to oxygen-containing c...	236	6	4.02	0.20933	1	BP
GO:0016310	phosphorylation	442	10	7.53	0.20937	1	BP
GO:0048584	positive regulation of response to stimu...	390	9	6.64	0.21056	1	BP
GO:0048468	cell development	673	17	11.47	0.21179	1	BP
GO:0032268	regulation of cellular protein metabolic...	522	13	8.89	0.21369	1	BP
GO:0000003	reproduction	583	14	9.93	0.21384	1	BP
GO:0090132	epithelium migration	94	3	1.6	0.21416	1	BP
GO:2000378	negative regulation of reactive oxygen s...	14	1	0.24	0.21428	1	BP
GO:1903307	positive regulation of regulated secreto...	14	1	0.24	0.21428	1	BP
GO:0021983	pituitary gland development	14	1	0.24	0.21428	1	BP
GO:0045646	regulation of erythrocyte differentiatio...	14	1	0.24	0.21428	1	BP
GO:0045639	positive regulation of myeloid cell diff...	14	1	0.24	0.21428	1	BP
GO:0036335	intestinal stem cell homeostasis	14	1	0.24	0.21428	1	BP
GO:0031111	negative regulation of microtubule polym...	14	1	0.24	0.21428	1	BP
GO:0034754	cellular hormone metabolic process	14	1	0.24	0.21428	1	BP
GO:0051893	regulation of focal adhesion assembly	14	1	0.24	0.21428	1	BP
GO:0040019	positive regulation of embryonic develop...	14	1	0.24	0.21428	1	BP
GO:0090109	regulation of cell-substrate junction as...	14	1	0.24	0.21428	1	BP
GO:0030539	male genitalia development	14	1	0.24	0.21428	1	BP
GO:0006623	protein targeting to vacuole	14	1	0.24	0.21428	1	BP
GO:0006635	fatty acid beta-oxidation	14	1	0.24	0.21428	1	BP
GO:0045992	negative regulation of embryonic develop...	14	1	0.24	0.21428	1	BP
GO:0045143	homologous chromosome segregation	14	1	0.24	0.21428	1	BP
GO:0033559	unsaturated fatty acid metabolic process	14	1	0.24	0.21428	1	BP
GO:0033574	response to testosterone	14	1	0.24	0.21428	1	BP
GO:0048730	epidermis morphogenesis	14	1	0.24	0.21428	1	BP
GO:0000002	mitochondrial genome maintenance	14	1	0.24	0.21428	1	BP
GO:0043574	peroxisomal transport	14	1	0.24	0.21428	1	BP
GO:1903035	negative regulation of response to wound...	14	1	0.24	0.21428	1	BP
GO:0070169	positive regulation of biomineral tissue...	14	1	0.24	0.21428	1	BP
GO:0007189	adenylate cyclase-activating G protein-c...	14	1	0.24	0.21428	1	BP
GO:0098927	vesicle-mediated transport between endos...	14	1	0.24	0.21428	1	BP
GO:1902036	regulation of hematopoietic stem cell di...	14	1	0.24	0.21428	1	BP
GO:0150116	regulation of cell-substrate junction or...	14	1	0.24	0.21428	1	BP
GO:0110151	positive regulation of biomineralization	14	1	0.24	0.21428	1	BP
GO:0035023	regulation of Rho protein signal transdu...	14	1	0.24	0.21428	1	BP
GO:0032350	regulation of hormone metabolic process	14	1	0.24	0.21428	1	BP
GO:0071300	cellular response to retinoic acid	14	1	0.24	0.21428	1	BP
GO:0045598	regulation of fat cell differentiation	14	1	0.24	0.21428	1	BP
GO:0051145	smooth muscle cell differentiation	14	1	0.24	0.21428	1	BP
GO:0007405	neuroblast proliferation	51	2	0.87	0.2152	1	BP
GO:0031032	actomyosin structure organization	51	2	0.87	0.2152	1	BP
GO:0002164	larval development	141	4	2.4	0.21709	1	BP
GO:0051241	negative regulation of multicellular org...	239	6	4.07	0.21765	1	BP
GO:0007186	G protein-coupled receptor signaling pat...	105	5	1.79	0.21819	1	BP
GO:0090130	tissue migration	95	3	1.62	0.21866	1	BP
GO:0045595	regulation of cell differentiation	394	9	6.71	0.21934	1	BP
GO:0006873	cellular ion homeostasis	142	4	2.42	0.22074	1	BP
GO:0051345	positive regulation of hydrolase activit...	142	4	2.42	0.22074	1	BP
GO:0007098	centrosome cycle	52	2	0.89	0.22152	1	BP
GO:0071453	cellular response to oxygen levels	52	2	0.89	0.22152	1	BP
GO:0010948	negative regulation of cell cycle proces...	96	3	1.64	0.22318	1	BP
GO:0010975	regulation of neuron projection developm...	143	4	2.44	0.22441	1	BP
GO:0050767	regulation of neurogenesis	242	6	4.12	0.22609	1	BP
GO:0001568	blood vessel development	97	3	1.65	0.22772	1	BP
GO:1903046	meiotic cell cycle process	97	3	1.65	0.22772	1	BP
GO:0060071	Wnt signaling pathway, planar cell polar...	15	1	0.26	0.22774	1	BP
GO:0061180	mammary gland epithelium development	15	1	0.26	0.22774	1	BP
GO:0043457	regulation of cellular respiration	15	1	0.26	0.22774	1	BP
GO:0007080	mitotic metaphase plate congression	15	1	0.26	0.22774	1	BP
GO:0001541	ovarian follicle development	15	1	0.26	0.22774	1	BP
GO:0007019	microtubule depolymerization	15	1	0.26	0.22774	1	BP
GO:0045682	regulation of epidermis development	15	1	0.26	0.22774	1	BP
GO:0099175	regulation of postsynapse organization	15	1	0.26	0.22774	1	BP
GO:0006029	proteoglycan metabolic process	15	1	0.26	0.22774	1	BP
GO:0007520	myoblast fusion	15	1	0.26	0.22774	1	BP
GO:0051784	negative regulation of nuclear division	15	1	0.26	0.22774	1	BP
GO:0030071	regulation of mitotic metaphase/anaphase...	15	1	0.26	0.22774	1	BP
GO:0071260	cellular response to mechanical stimulus	15	1	0.26	0.22774	1	BP
GO:0040020	regulation of meiotic nuclear division	15	1	0.26	0.22774	1	BP
GO:0015914	phospholipid transport	15	1	0.26	0.22774	1	BP
GO:0040036	regulation of fibroblast growth factor r...	15	1	0.26	0.22774	1	BP
GO:0015908	fatty acid transport	15	1	0.26	0.22774	1	BP
GO:0000245	spliceosomal complex assembly	15	1	0.26	0.22774	1	BP
GO:0014009	glial cell proliferation	15	1	0.26	0.22774	1	BP
GO:0035167	larval lymph gland hemopoiesis	15	1	0.26	0.22774	1	BP
GO:0061515	myeloid cell development	15	1	0.26	0.22774	1	BP
GO:0032008	positive regulation of TOR signaling	15	1	0.26	0.22774	1	BP
GO:0003208	cardiac ventricle morphogenesis	15	1	0.26	0.22774	1	BP
GO:0034637	cellular carbohydrate biosynthetic proce...	15	1	0.26	0.22774	1	BP
GO:0071674	mononuclear cell migration	15	1	0.26	0.22774	1	BP
GO:0048041	focal adhesion assembly	15	1	0.26	0.22774	1	BP
GO:0051496	positive regulation of stress fiber asse...	15	1	0.26	0.22774	1	BP
GO:0050777	negative regulation of immune response	15	1	0.26	0.22774	1	BP
GO:0034308	primary alcohol metabolic process	15	1	0.26	0.22774	1	BP
GO:0050886	endocrine process	15	1	0.26	0.22774	1	BP
GO:0003341	cilium movement	53	2	0.9	0.22785	1	BP
GO:0050770	regulation of axonogenesis	53	2	0.9	0.22785	1	BP
GO:0003006	developmental process involved in reprod...	424	11	7.22	0.23014	1	BP
GO:0045596	negative regulation of cell differentiat...	145	4	2.47	0.2318	1	BP
GO:0006839	mitochondrial transport	60	4	1.02	0.23194	1	BP
GO:0051128	regulation of cellular component organiz...	615	13	10.48	0.23207	1	BP
GO:0016358	dendrite development	98	3	1.67	0.23228	1	BP
GO:0035967	cellular response to topologically incor...	54	2	0.92	0.2342	1	BP
GO:0016042	lipid catabolic process	54	2	0.92	0.2342	1	BP
GO:0051346	negative regulation of hydrolase activit...	54	2	0.92	0.2342	1	BP
GO:0044092	negative regulation of molecular functio...	195	5	3.32	0.23541	1	BP
GO:0051301	cell division	146	4	2.49	0.23552	1	BP
GO:1901653	cellular response to peptide	99	3	1.69	0.23686	1	BP
GO:0070647	protein modification by small protein co...	246	6	4.19	0.23751	1	BP
GO:0050793	regulation of developmental process	591	15	10.07	0.24049	1	BP
GO:2000026	regulation of multicellular organismal d...	475	13	8.09	0.24051	1	BP
GO:0006869	lipid transport	55	2	0.94	0.24057	1	BP
GO:0031023	microtubule organizing center organizati...	55	2	0.94	0.24057	1	BP
GO:0006986	response to unfolded protein	55	2	0.94	0.24057	1	BP
GO:0051179	localization	1284	27	21.88	0.24095	1	BP
GO:0007031	peroxisome organization	16	1	0.27	0.24097	1	BP
GO:1902414	protein localization to cell junction	16	1	0.27	0.24097	1	BP
GO:0035317	imaginal disc-derived wing hair organiza...	16	1	0.27	0.24097	1	BP
GO:0003382	epithelial cell morphogenesis	16	1	0.27	0.24097	1	BP
GO:0051897	positive regulation of protein kinase B ...	16	1	0.27	0.24097	1	BP
GO:1901998	toxin transport	16	1	0.27	0.24097	1	BP
GO:2000179	positive regulation of neural precursor ...	16	1	0.27	0.24097	1	BP
GO:1901983	regulation of protein acetylation	16	1	0.27	0.24097	1	BP
GO:1902106	negative regulation of leukocyte differe...	16	1	0.27	0.24097	1	BP
GO:0045451	pole plasm oskar mRNA localization	16	1	0.27	0.24097	1	BP
GO:0033077	T cell differentiation in thymus	16	1	0.27	0.24097	1	BP
GO:1901799	negative regulation of proteasomal prote...	16	1	0.27	0.24097	1	BP
GO:0043536	positive regulation of blood vessel endo...	16	1	0.27	0.24097	1	BP
GO:0046785	microtubule polymerization	16	1	0.27	0.24097	1	BP
GO:1901880	negative regulation of protein depolymer...	16	1	0.27	0.24097	1	BP
GO:0060236	regulation of mitotic spindle organizati...	16	1	0.27	0.24097	1	BP
GO:0070887	cellular response to chemical stimulus	566	12	9.64	0.24298	1	BP
GO:0045892	negative regulation of transcription, DN...	249	6	4.24	0.24621	1	BP
GO:0048284	organelle fusion	56	2	0.95	0.24694	1	BP
GO:0035148	tube formation	56	2	0.95	0.24694	1	BP
GO:0098662	inorganic cation transmembrane transport	150	4	2.56	0.25055	1	BP
GO:0002119	nematode larval development	102	3	1.74	0.25068	1	BP
GO:0009617	response to bacterium	102	3	1.74	0.25068	1	BP
GO:0030098	lymphocyte differentiation	57	2	0.97	0.25332	1	BP
