GO.ID	Term	Annotated	Significant	Expected	pval_test	pval_adj	ontology
GO:0048915	posterior lateral line system developmen...	2	1	0.08	0.0817	1	BP
GO:0048916	posterior lateral line development	2	1	0.08	0.0817	1	BP
GO:0035811	negative regulation of urine volume	2	1	0.08	0.0817	1	BP
GO:0086004	regulation of cardiac muscle cell contra...	2	1	0.08	0.0817	1	BP
GO:0048703	embryonic viscerocranium morphogenesis	2	1	0.08	0.0817	1	BP
GO:0019240	citrulline biosynthetic process	2	1	0.08	0.0817	1	BP
GO:0003057	regulation of the force of heart contrac...	2	1	0.08	0.0817	1	BP
GO:0001578	microtubule bundle formation	2	1	0.08	0.0817	1	BP
GO:0003298	physiological muscle hypertrophy	2	1	0.08	0.0817	1	BP
GO:0034110	regulation of homotypic cell-cell adhesi...	2	1	0.08	0.0817	1	BP
GO:0034111	negative regulation of homotypic cell-ce...	2	1	0.08	0.0817	1	BP
GO:0003011	involuntary skeletal muscle contraction	2	1	0.08	0.0817	1	BP
GO:0006023	aminoglycan biosynthetic process	2	1	0.08	0.0817	1	BP
GO:0006024	glycosaminoglycan biosynthetic process	2	1	0.08	0.0817	1	BP
GO:0050881	musculoskeletal movement	2	1	0.08	0.0817	1	BP
GO:0050873	brown fat cell differentiation	2	1	0.08	0.0817	1	BP
GO:0048881	mechanosensory lateral line system devel...	2	1	0.08	0.0817	1	BP
GO:0048882	lateral line development	2	1	0.08	0.0817	1	BP
GO:0071384	cellular response to corticosteroid stim...	2	1	0.08	0.0817	1	BP
GO:0071385	cellular response to glucocorticoid stim...	2	1	0.08	0.0817	1	BP
GO:2000036	regulation of stem cell population maint...	2	1	0.08	0.0817	1	BP
GO:0034109	homotypic cell-cell adhesion	2	1	0.08	0.0817	1	BP
GO:0003009	skeletal muscle contraction	2	1	0.08	0.0817	1	BP
GO:0010717	regulation of epithelial to mesenchymal ...	2	1	0.08	0.0817	1	BP
GO:0050849	negative regulation of calcium-mediated ...	2	1	0.08	0.0817	1	BP
GO:0035313	wound healing, spreading of epidermal ce...	2	1	0.08	0.0817	1	BP
GO:0010737	protein kinase A signaling	2	1	0.08	0.0817	1	BP
GO:0010738	regulation of protein kinase A signaling	2	1	0.08	0.0817	1	BP
GO:0032525	somite rostral/caudal axis specification	2	1	0.08	0.0817	1	BP
GO:0071548	response to dexamethasone	2	1	0.08	0.0817	1	BP
GO:0008333	endosome to lysosome transport	2	1	0.08	0.0817	1	BP
GO:0035502	metanephric part of ureteric bud develop...	2	1	0.08	0.0817	1	BP
GO:0034244	negative regulation of transcription elo...	2	1	0.08	0.0817	1	BP
GO:0072182	regulation of nephron tubule epithelial ...	2	1	0.08	0.0817	1	BP
GO:0072177	mesonephric duct development	2	1	0.08	0.0817	1	BP
GO:0072178	nephric duct morphogenesis	2	1	0.08	0.0817	1	BP
GO:0072179	nephric duct formation	2	1	0.08	0.0817	1	BP
GO:0002032	desensitization of G protein-coupled rec...	2	1	0.08	0.0817	1	BP
GO:0060122	inner ear receptor cell stereocilium org...	2	1	0.08	0.0817	1	BP
GO:0007398	ectoderm development	2	1	0.08	0.0817	1	BP
GO:0090330	regulation of platelet aggregation	2	1	0.08	0.0817	1	BP
GO:0090331	negative regulation of platelet aggregat...	2	1	0.08	0.0817	1	BP
GO:0060117	auditory receptor cell development	2	1	0.08	0.0817	1	BP
GO:0072102	glomerulus morphogenesis	2	1	0.08	0.0817	1	BP
GO:0043951	negative regulation of cAMP-mediated sig...	2	1	0.08	0.0817	1	BP
GO:0090307	mitotic spindle assembly	2	1	0.08	0.0817	1	BP
GO:0031328	positive regulation of cellular biosynth...	78	6	3.25	0.0841	1	BP
GO:0045216	cell-cell junction organization	12	2	0.5	0.0844	1	BP
GO:1901654	response to ketone	12	2	0.5	0.0844	1	BP
GO:0008361	regulation of cell size	12	2	0.5	0.0844	1	BP
GO:0051258	protein polymerization	12	2	0.5	0.0844	1	BP
GO:0019935	cyclic-nucleotide-mediated signaling	12	2	0.5	0.0844	1	BP
GO:0031330	negative regulation of cellular cataboli...	12	2	0.5	0.0844	1	BP
GO:1901362	organic cyclic compound biosynthetic pro...	140	9	5.83	0.0844	1	BP
GO:0010468	regulation of gene expression	142	9	5.92	0.0917	1	BP
GO:0061564	axon development	43	4	1.79	0.0919	1	BP
GO:1903530	regulation of secretion by cell	43	4	1.79	0.0919	1	BP
GO:0009891	positive regulation of biosynthetic proc...	80	6	3.33	0.0933	1	BP
GO:0048638	regulation of developmental growth	27	3	1.12	0.0942	1	BP
GO:0002164	larval development	27	3	1.12	0.0942	1	BP
GO:0060041	retina development in camera-type eye	13	2	0.54	0.0973	1	BP
GO:0051650	establishment of vesicle localization	13	2	0.54	0.0973	1	BP
GO:0051648	vesicle localization	13	2	0.54	0.0973	1	BP
GO:0071867	response to monoamine	13	2	0.54	0.0973	1	BP
GO:0021761	limbic system development	13	2	0.54	0.0973	1	BP
GO:0007155	cell adhesion	28	3	1.17	0.1028	1	BP
GO:0060627	regulation of vesicle-mediated transport	28	3	1.17	0.1028	1	BP
GO:0040007	growth	63	5	2.62	0.1043	1	BP
GO:0007034	vacuolar transport	6	3	0.25	0.1073	1	BP
GO:0060249	anatomical structure homeostasis	14	2	0.58	0.1108	1	BP
GO:0099643	signal release from synapse	14	2	0.58	0.1108	1	BP
GO:0110053	regulation of actin filament organizatio...	14	2	0.58	0.1108	1	BP
GO:1901888	regulation of cell junction assembly	14	2	0.58	0.1108	1	BP
GO:0007269	neurotransmitter secretion	14	2	0.58	0.1108	1	BP
GO:0007411	axon guidance	29	3	1.21	0.1117	1	BP
GO:0097485	neuron projection guidance	29	3	1.21	0.1117	1	BP
GO:0010628	positive regulation of gene expression	85	6	3.54	0.1188	1	BP
GO:0051046	regulation of secretion	47	4	1.96	0.1193	1	BP
GO:0046716	muscle cell cellular homeostasis	3	1	0.12	0.1201	1	BP
GO:1904646	cellular response to amyloid-beta	3	1	0.12	0.1201	1	BP
GO:1903510	mucopolysaccharide metabolic process	3	1	0.12	0.1201	1	BP
GO:1903306	negative regulation of regulated secreto...	3	1	0.12	0.1201	1	BP
GO:0021871	forebrain regionalization	3	1	0.12	0.1201	1	BP
GO:0051895	negative regulation of focal adhesion as...	3	1	0.12	0.1201	1	BP
GO:0060042	retina morphogenesis in camera-type eye	3	1	0.12	0.1201	1	BP
GO:0030203	glycosaminoglycan metabolic process	3	1	0.12	0.1201	1	BP
GO:1990090	cellular response to nerve growth factor...	3	1	0.12	0.1201	1	BP
GO:2001057	reactive nitrogen species metabolic proc...	3	1	0.12	0.1201	1	BP
GO:0007492	endoderm development	3	1	0.12	0.1201	1	BP
GO:2001013	epithelial cell proliferation involved i...	3	1	0.12	0.1201	1	BP
GO:0031670	cellular response to nutrient	3	1	0.12	0.1201	1	BP
GO:0046877	regulation of saliva secretion	3	1	0.12	0.1201	1	BP
GO:0005980	glycogen catabolic process	3	1	0.12	0.1201	1	BP
GO:0046878	positive regulation of saliva secretion	3	1	0.12	0.1201	1	BP
GO:1902369	negative regulation of RNA catabolic pro...	3	1	0.12	0.1201	1	BP
GO:0006809	nitric oxide biosynthetic process	3	1	0.12	0.1201	1	BP
GO:1902373	negative regulation of mRNA catabolic pr...	3	1	0.12	0.1201	1	BP
GO:0017158	regulation of calcium ion-dependent exoc...	3	1	0.12	0.1201	1	BP
GO:2000378	negative regulation of reactive oxygen s...	3	1	0.12	0.1201	1	BP
GO:0045920	negative regulation of exocytosis	3	1	0.12	0.1201	1	BP
GO:0045921	positive regulation of exocytosis	3	1	0.12	0.1201	1	BP
GO:2000311	regulation of AMPA receptor activity	3	1	0.12	0.1201	1	BP
GO:0090183	regulation of kidney development	3	1	0.12	0.1201	1	BP
GO:0090184	positive regulation of kidney developmen...	3	1	0.12	0.1201	1	BP
GO:1905332	positive regulation of morphogenesis of ...	3	1	0.12	0.1201	1	BP
GO:0051590	positive regulation of neurotransmitter ...	3	1	0.12	0.1201	1	BP
GO:0051385	response to mineralocorticoid	3	1	0.12	0.1201	1	BP
GO:0021516	dorsal spinal cord development	3	1	0.12	0.1201	1	BP
GO:0021517	ventral spinal cord development	3	1	0.12	0.1201	1	BP
GO:0010613	positive regulation of cardiac muscle hy...	3	1	0.12	0.1201	1	BP
GO:0001756	somitogenesis	3	1	0.12	0.1201	1	BP
GO:0031123	RNA 3'-end processing	3	1	0.12	0.1201	1	BP
GO:0051568	histone H3-K4 methylation	3	1	0.12	0.1201	1	BP
GO:0031112	positive regulation of microtubule polym...	3	1	0.12	0.1201	1	BP
GO:0031116	positive regulation of microtubule polym...	3	1	0.12	0.1201	1	BP
GO:0001956	positive regulation of neurotransmitter ...	3	1	0.12	0.1201	1	BP
GO:0048024	regulation of mRNA splicing, via spliceo...	3	1	0.12	0.1201	1	BP
GO:0030858	positive regulation of epithelial cell d...	3	1	0.12	0.1201	1	BP
GO:0046541	saliva secretion	3	1	0.12	0.1201	1	BP
GO:0016198	axon choice point recognition	3	1	0.12	0.1201	1	BP
GO:0016199	axon midline choice point recognition	3	1	0.12	0.1201	1	BP
GO:2000463	positive regulation of excitatory postsy...	3	1	0.12	0.1201	1	BP
GO:0080164	regulation of nitric oxide metabolic pro...	3	1	0.12	0.1201	1	BP
GO:0001702	gastrulation with mouth forming second	3	1	0.12	0.1201	1	BP
GO:0051497	negative regulation of stress fiber asse...	3	1	0.12	0.1201	1	BP
GO:0032785	negative regulation of DNA-templated tra...	3	1	0.12	0.1201	1	BP
GO:0048008	platelet-derived growth factor receptor ...	3	1	0.12	0.1201	1	BP
GO:0009651	response to salt stress	3	1	0.12	0.1201	1	BP
GO:1903053	regulation of extracellular matrix organ...	3	1	0.12	0.1201	1	BP
GO:0061063	positive regulation of nematode larval d...	3	1	0.12	0.1201	1	BP
GO:0061053	somite development	3	1	0.12	0.1201	1	BP
GO:0071711	basement membrane organization	3	1	0.12	0.1201	1	BP
GO:0007293	germarium-derived egg chamber formation	3	1	0.12	0.1201	1	BP
GO:0051412	response to corticosterone	3	1	0.12	0.1201	1	BP
GO:1900046	regulation of hemostasis	3	1	0.12	0.1201	1	BP
GO:1900047	negative regulation of hemostasis	3	1	0.12	0.1201	1	BP
GO:0046622	positive regulation of organ growth	3	1	0.12	0.1201	1	BP
GO:1900006	positive regulation of dendrite developm...	3	1	0.12	0.1201	1	BP
GO:0007041	lysosomal transport	3	1	0.12	0.1201	1	BP
GO:0007274	neuromuscular synaptic transmission	3	1	0.12	0.1201	1	BP
GO:0061213	positive regulation of mesonephros devel...	3	1	0.12	0.1201	1	BP
GO:0061217	regulation of mesonephros development	3	1	0.12	0.1201	1	BP
GO:0055023	positive regulation of cardiac muscle ti...	3	1	0.12	0.1201	1	BP
GO:0044275	cellular carbohydrate catabolic process	3	1	0.12	0.1201	1	BP
GO:0014742	positive regulation of muscle hypertroph...	3	1	0.12	0.1201	1	BP
GO:0055013	cardiac muscle cell development	3	1	0.12	0.1201	1	BP
GO:0051155	positive regulation of striated muscle c...	3	1	0.12	0.1201	1	BP
GO:0044247	cellular polysaccharide catabolic proces...	3	1	0.12	0.1201	1	BP
GO:0045453	bone resorption	3	1	0.12	0.1201	1	BP
GO:0055006	cardiac cell development	3	1	0.12	0.1201	1	BP
GO:0042428	serotonin metabolic process	3	1	0.12	0.1201	1	BP
GO:0003081	regulation of systemic arterial blood pr...	3	1	0.12	0.1201	1	BP
GO:0048934	peripheral nervous system neuron differe...	3	1	0.12	0.1201	1	BP
GO:0048935	peripheral nervous system neuron develop...	3	1	0.12	0.1201	1	BP
GO:0003071	renal system process involved in regulat...	3	1	0.12	0.1201	1	BP
GO:0045428	regulation of nitric oxide biosynthetic ...	3	1	0.12	0.1201	1	BP
GO:0042430	indole-containing compound metabolic pro...	3	1	0.12	0.1201	1	BP
GO:0009065	glutamine family amino acid catabolic pr...	3	1	0.12	0.1201	1	BP
GO:1903779	regulation of cardiac conduction	3	1	0.12	0.1201	1	BP
GO:0000272	polysaccharide catabolic process	3	1	0.12	0.1201	1	BP
GO:0098693	regulation of synaptic vesicle cycle	3	1	0.12	0.1201	1	BP
GO:0006022	aminoglycan metabolic process	3	1	0.12	0.1201	1	BP
GO:0006029	proteoglycan metabolic process	3	1	0.12	0.1201	1	BP
GO:1901160	primary amino compound metabolic process	3	1	0.12	0.1201	1	BP
GO:0097352	autophagosome maturation	3	1	0.12	0.1201	1	BP
GO:0050879	multicellular organismal movement	3	1	0.12	0.1201	1	BP
GO:0040026	positive regulation of vulval developmen...	3	1	0.12	0.1201	1	BP
GO:0040010	positive regulation of growth rate	3	1	0.12	0.1201	1	BP
GO:0051294	establishment of spindle orientation	3	1	0.12	0.1201	1	BP
GO:0060456	positive regulation of digestive system ...	3	1	0.12	0.1201	1	BP
GO:0009251	glucan catabolic process	3	1	0.12	0.1201	1	BP
GO:0050818	regulation of coagulation	3	1	0.12	0.1201	1	BP
GO:0050819	negative regulation of coagulation	3	1	0.12	0.1201	1	BP
GO:0010715	regulation of extracellular matrix disas...	3	1	0.12	0.1201	1	BP
GO:0060421	positive regulation of heart growth	3	1	0.12	0.1201	1	BP
GO:0030193	regulation of blood coagulation	3	1	0.12	0.1201	1	BP
GO:0030195	negative regulation of blood coagulation	3	1	0.12	0.1201	1	BP
GO:0040001	establishment of mitotic spindle localiz...	3	1	0.12	0.1201	1	BP
GO:0032526	response to retinoic acid	3	1	0.12	0.1201	1	BP
GO:0040009	regulation of growth rate	3	1	0.12	0.1201	1	BP
GO:0060688	regulation of morphogenesis of a branchi...	3	1	0.12	0.1201	1	BP
GO:0001659	temperature homeostasis	3	1	0.12	0.1201	1	BP
GO:0051225	spindle assembly	3	1	0.12	0.1201	1	BP
GO:1905209	positive regulation of cardiocyte differ...	3	1	0.12	0.1201	1	BP
GO:0030166	proteoglycan biosynthetic process	3	1	0.12	0.1201	1	BP
GO:0046209	nitric oxide metabolic process	3	1	0.12	0.1201	1	BP
GO:0072176	nephric duct development	3	1	0.12	0.1201	1	BP
GO:0048582	positive regulation of post-embryonic de...	3	1	0.12	0.1201	1	BP
GO:1903392	negative regulation of adherens junction...	3	1	0.12	0.1201	1	BP
GO:2000727	positive regulation of cardiac muscle ce...	3	1	0.12	0.1201	1	BP
GO:0010842	retina layer formation	3	1	0.12	0.1201	1	BP
GO:0150118	negative regulation of cell-substrate ju...	3	1	0.12	0.1201	1	BP
GO:0045893	positive regulation of transcription, DN...	66	5	2.75	0.1223	1	BP
GO:0140352	export from cell	66	5	2.75	0.1223	1	BP
GO:0051924	regulation of calcium ion transport	15	2	0.62	0.1247	1	BP
GO:0009895	negative regulation of catabolic process	15	2	0.62	0.1247	1	BP
GO:0061333	renal tubule morphogenesis	15	2	0.62	0.1247	1	BP
GO:0021543	pallium development	15	2	0.62	0.1247	1	BP
GO:0043583	ear development	15	2	0.62	0.1247	1	BP
GO:0007162	negative regulation of cell adhesion	15	2	0.62	0.1247	1	BP
GO:0048839	inner ear development	15	2	0.62	0.1247	1	BP
GO:0044271	cellular nitrogen compound biosynthetic ...	150	9	6.25	0.1247	1	BP
GO:0009792	embryo development ending in birth or eg...	48	4	2	0.1267	1	BP
GO:0055080	cation homeostasis	37	5	1.54	0.1301	1	BP
GO:0006139	nucleobase-containing compound metabolic...	152	9	6.33	0.1341	1	BP
GO:1903508	positive regulation of nucleic acid-temp...	68	5	2.83	0.1351	1	BP
GO:1902680	positive regulation of RNA biosynthetic ...	68	5	2.83	0.1351	1	BP
GO:0120031	plasma membrane bounded cell projection ...	16	2	0.67	0.1391	1	BP
GO:0046394	carboxylic acid biosynthetic process	16	2	0.67	0.1391	1	BP
GO:0031099	regeneration	16	2	0.67	0.1391	1	BP
GO:0007015	actin filament organization	16	2	0.67	0.1391	1	BP
GO:0016053	organic acid biosynthetic process	16	2	0.67	0.1391	1	BP
GO:0061061	muscle structure development	32	3	1.33	0.1401	1	BP
GO:0098771	inorganic ion homeostasis	39	5	1.62	0.1476	1	BP
GO:0010467	gene expression	155	9	6.46	0.1489	1	BP
GO:0046483	heterocycle metabolic process	155	9	6.46	0.1489	1	BP
GO:0048522	positive regulation of cellular process	179	11	7.46	0.1492	1	BP
GO:0065003	protein-containing complex assembly	51	4	2.12	0.1501	1	BP
GO:0033993	response to lipid	33	3	1.38	0.1502	1	BP
GO:0007169	transmembrane receptor protein tyrosine ...	33	3	1.38	0.1502	1	BP
GO:0030031	cell projection assembly	17	2	0.71	0.1539	1	BP
GO:0032956	regulation of actin cytoskeleton organiz...	17	2	0.71	0.1539	1	BP
GO:0055067	monovalent inorganic cation homeostasis	17	2	0.71	0.1539	1	BP
GO:1901576	organic substance biosynthetic process	179	10	7.46	0.1541	1	BP
GO:0044249	cellular biosynthetic process	179	10	7.46	0.1541	1	BP
GO:1903312	negative regulation of mRNA metabolic pr...	4	1	0.17	0.1571	1	BP
GO:0030279	negative regulation of ossification	4	1	0.17	0.1571	1	BP
GO:1904645	response to amyloid-beta	4	1	0.17	0.1571	1	BP
GO:0034968	histone lysine methylation	4	1	0.17	0.1571	1	BP
GO:0006903	vesicle targeting	4	1	0.17	0.1571	1	BP
GO:0050684	regulation of mRNA processing	4	1	0.17	0.1571	1	BP
GO:0072273	metanephric nephron morphogenesis	4	1	0.17	0.1571	1	BP
GO:0010524	positive regulation of calcium ion trans...	4	1	0.17	0.1571	1	BP
GO:0021846	cell proliferation in forebrain	4	1	0.17	0.1571	1	BP
GO:0016525	negative regulation of angiogenesis	4	1	0.17	0.1571	1	BP
GO:0048636	positive regulation of muscle organ deve...	4	1	0.17	0.1571	1	BP
GO:0018022	peptidyl-lysine methylation	4	1	0.17	0.1571	1	BP
GO:1990089	response to nerve growth factor	4	1	0.17	0.1571	1	BP
GO:1900449	regulation of glutamate receptor signali...	4	1	0.17	0.1571	1	BP
GO:0045776	negative regulation of blood pressure	4	1	0.17	0.1571	1	BP
GO:0006368	transcription elongation from RNA polyme...	4	1	0.17	0.1571	1	BP
GO:0097065	anterior head development	4	1	0.17	0.1571	1	BP
GO:1901863	positive regulation of muscle tissue dev...	4	1	0.17	0.1571	1	BP
GO:0022617	extracellular matrix disassembly	4	1	0.17	0.1571	1	BP
GO:0003338	metanephros morphogenesis	4	1	0.17	0.1571	1	BP
GO:0021515	cell differentiation in spinal cord	4	1	0.17	0.1571	1	BP
GO:0099601	regulation of neurotransmitter receptor ...	4	1	0.17	0.1571	1	BP
GO:0010614	negative regulation of cardiac muscle hy...	4	1	0.17	0.1571	1	BP
GO:0007638	mechanosensory behavior	4	1	0.17	0.1571	1	BP
GO:0001990	regulation of systemic arterial blood pr...	4	1	0.17	0.1571	1	BP
GO:0032232	negative regulation of actin filament bu...	4	1	0.17	0.1571	1	BP
GO:0031113	regulation of microtubule polymerization	4	1	0.17	0.1571	1	BP
GO:0046580	negative regulation of Ras protein signa...	4	1	0.17	0.1571	1	BP
GO:0008049	male courtship behavior	4	1	0.17	0.1571	1	BP
GO:0001953	negative regulation of cell-matrix adhes...	4	1	0.17	0.1571	1	BP
GO:0045844	positive regulation of striated muscle t...	4	1	0.17	0.1571	1	BP
GO:0032781	positive regulation of ATP-dependent act...	4	1	0.17	0.1571	1	BP
GO:0043484	regulation of RNA splicing	4	1	0.17	0.1571	1	BP
GO:1901343	negative regulation of vasculature devel...	4	1	0.17	0.1571	1	BP
GO:0098815	modulation of excitatory postsynaptic po...	4	1	0.17	0.1571	1	BP
GO:0097711	ciliary basal body-plasma membrane docki...	4	1	0.17	0.1571	1	BP
GO:0046660	female sex differentiation	4	1	0.17	0.1571	1	BP
GO:0051653	spindle localization	4	1	0.17	0.1571	1	BP
GO:0042311	vasodilation	4	1	0.17	0.1571	1	BP
GO:0043627	response to estrogen	4	1	0.17	0.1571	1	BP
GO:0007215	glutamate receptor signaling pathway	4	1	0.17	0.1571	1	BP
GO:2000181	negative regulation of blood vessel morp...	4	1	0.17	0.1571	1	BP
GO:0034405	response to fluid shear stress	4	1	0.17	0.1571	1	BP
GO:0055025	positive regulation of cardiac muscle ti...	4	1	0.17	0.1571	1	BP
GO:0014741	negative regulation of muscle hypertroph...	4	1	0.17	0.1571	1	BP
GO:0042698	ovulation cycle	4	1	0.17	0.1571	1	BP
GO:0003299	muscle hypertrophy in response to stress	4	1	0.17	0.1571	1	BP
GO:0014898	cardiac muscle hypertrophy in response t...	4	1	0.17	0.1571	1	BP
GO:0003085	negative regulation of systemic arterial...	4	1	0.17	0.1571	1	BP
GO:0051149	positive regulation of muscle cell diffe...	4	1	0.17	0.1571	1	BP
GO:1901606	alpha-amino acid catabolic process	4	1	0.17	0.1571	1	BP
GO:1901607	alpha-amino acid biosynthetic process	4	1	0.17	0.1571	1	BP
GO:0003016	respiratory system process	4	1	0.17	0.1571	1	BP
GO:0003044	regulation of systemic arterial blood pr...	4	1	0.17	0.1571	1	BP
GO:0014887	cardiac muscle adaptation	4	1	0.17	0.1571	1	BP
GO:0014888	striated muscle adaptation	4	1	0.17	0.1571	1	BP
GO:0051058	negative regulation of small GTPase medi...	4	1	0.17	0.1571	1	BP
GO:0051293	establishment of spindle localization	4	1	0.17	0.1571	1	BP
GO:0032570	response to progesterone	4	1	0.17	0.1571	1	BP
GO:1905207	regulation of cardiocyte differentiation	4	1	0.17	0.1571	1	BP
GO:0030168	platelet activation	4	1	0.17	0.1571	1	BP
GO:0042133	neurotransmitter metabolic process	4	1	0.17	0.1571	1	BP
GO:0071498	cellular response to fluid shear stress	4	1	0.17	0.1571	1	BP
GO:0034243	regulation of transcription elongation f...	4	1	0.17	0.1571	1	BP
GO:0002011	morphogenesis of an epithelial sheet	4	1	0.17	0.1571	1	BP
GO:0033138	positive regulation of peptidyl-serine p...	4	1	0.17	0.1571	1	BP
GO:0097475	motor neuron migration	4	1	0.17	0.1571	1	BP
GO:0010812	negative regulation of cell-substrate ad...	4	1	0.17	0.1571	1	BP
GO:2000725	regulation of cardiac muscle cell differ...	4	1	0.17	0.1571	1	BP
GO:0060119	inner ear receptor cell development	4	1	0.17	0.1571	1	BP
GO:0046785	microtubule polymerization	4	1	0.17	0.1571	1	BP
GO:0045944	positive regulation of transcription by ...	52	4	2.17	0.1583	1	BP
GO:0009058	biosynthetic process	180	10	7.5	0.1592	1	BP
GO:0006928	movement of cell or subcellular componen...	92	6	3.83	0.1605	1	BP
GO:0048880	sensory system development	34	3	1.42	0.1605	1	BP
GO:0031329	regulation of cellular catabolic process	34	3	1.42	0.1605	1	BP
GO:0046903	secretion	72	5	3	0.1628	1	BP
GO:0051254	positive regulation of RNA metabolic pro...	72	5	3	0.1628	1	BP
GO:0048589	developmental growth	53	4	2.21	0.1667	1	BP
GO:0033043	regulation of organelle organization	43	5	1.79	0.1677	1	BP
GO:0001101	response to acid chemical	18	2	0.75	0.1689	1	BP
GO:0021537	telencephalon development	18	2	0.75	0.1689	1	BP
GO:0007265	Ras protein signal transduction	18	2	0.75	0.1689	1	BP
GO:0001558	regulation of cell growth	18	2	0.75	0.1689	1	BP
GO:0043010	camera-type eye development	18	2	0.75	0.1689	1	BP
GO:0032535	regulation of cellular component size	18	2	0.75	0.1689	1	BP
GO:0008306	associative learning	18	2	0.75	0.1689	1	BP
GO:0048545	response to steroid hormone	18	2	0.75	0.1689	1	BP
GO:0006725	cellular aromatic compound metabolic pro...	159	9	6.62	0.17	1	BP
GO:0061024	membrane organization	35	3	1.46	0.171	1	BP
GO:0065008	regulation of biological quality	159	10	6.62	0.172	1	BP
GO:0050801	ion homeostasis	42	5	1.75	0.1754	1	BP
GO:0048609	multicellular organismal reproductive pr...	74	5	3.08	0.1775	1	BP
GO:0006935	chemotaxis	36	3	1.5	0.1817	1	BP
GO:0051960	regulation of nervous system development	55	4	2.29	0.184	1	BP
GO:0006813	potassium ion transport	19	2	0.79	0.1843	1	BP
GO:0032504	multicellular organism reproduction	75	5	3.12	0.1851	1	BP
GO:0008652	cellular amino acid biosynthetic process	5	1	0.21	0.1925	1	BP
GO:0010389	regulation of G2/M transition of mitotic...	5	1	0.21	0.1925	1	BP
GO:0051893	regulation of focal adhesion assembly	5	1	0.21	0.1925	1	BP
GO:0072210	metanephric nephron development	5	1	0.21	0.1925	1	BP
GO:0010522	regulation of calcium ion transport into...	5	1	0.21	0.1925	1	BP
GO:0033238	regulation of cellular amine metabolic p...	5	1	0.21	0.1925	1	BP
GO:0048641	regulation of skeletal muscle tissue dev...	5	1	0.21	0.1925	1	BP
GO:1903426	regulation of reactive oxygen species bi...	5	1	0.21	0.1925	1	BP
GO:0007480	imaginal disc-derived leg morphogenesis	5	1	0.21	0.1925	1	BP
GO:0010460	positive regulation of heart rate	5	1	0.21	0.1925	1	BP
GO:0046849	bone remodeling	5	1	0.21	0.1925	1	BP
GO:0031646	positive regulation of nervous system pr...	5	1	0.21	0.1925	1	BP
GO:0007478	leg disc morphogenesis	5	1	0.21	0.1925	1	BP
GO:0045986	negative regulation of smooth muscle con...	5	1	0.21	0.1925	1	BP
GO:1903409	reactive oxygen species biosynthetic pro...	5	1	0.21	0.1925	1	BP
GO:0022401	negative adaptation of signaling pathway	5	1	0.21	0.1925	1	BP
GO:0023058	adaptation of signaling pathway	5	1	0.21	0.1925	1	BP
GO:1901889	negative regulation of cell junction ass...	5	1	0.21	0.1925	1	BP
GO:0032233	positive regulation of actin filament bu...	5	1	0.21	0.1925	1	BP
GO:0035218	leg disc development	5	1	0.21	0.1925	1	BP
GO:0090109	regulation of cell-substrate junction as...	5	1	0.21	0.1925	1	BP
GO:0030856	regulation of epithelial cell differenti...	5	1	0.21	0.1925	1	BP
GO:0031062	positive regulation of histone methylati...	5	1	0.21	0.1925	1	BP
GO:0048041	focal adhesion assembly	5	1	0.21	0.1925	1	BP
GO:0030879	mammary gland development	5	1	0.21	0.1925	1	BP
GO:0043462	regulation of ATP-dependent activity	5	1	0.21	0.1925	1	BP
GO:0043487	regulation of RNA stability	5	1	0.21	0.1925	1	BP
GO:0043488	regulation of mRNA stability	5	1	0.21	0.1925	1	BP
GO:0007052	mitotic spindle organization	5	1	0.21	0.1925	1	BP
GO:0001889	liver development	5	1	0.21	0.1925	1	BP
GO:1900271	regulation of long-term synaptic potenti...	5	1	0.21	0.1925	1	BP
GO:0048793	pronephros development	5	1	0.21	0.1925	1	BP
GO:0032941	secretion by tissue	5	1	0.21	0.1925	1	BP
GO:0061008	hepaticobiliary system development	5	1	0.21	0.1925	1	BP
GO:0042491	inner ear auditory receptor cell differe...	5	1	0.21	0.1925	1	BP
GO:0055021	regulation of cardiac muscle tissue grow...	5	1	0.21	0.1925	1	BP
GO:1990823	response to leukemia inhibitory factor	5	1	0.21	0.1925	1	BP
GO:0055017	cardiac muscle tissue growth	5	1	0.21	0.1925	1	BP
GO:1901655	cellular response to ketone	5	1	0.21	0.1925	1	BP
GO:0051153	regulation of striated muscle cell diffe...	5	1	0.21	0.1925	1	BP
GO:1990830	cellular response to leukemia inhibitory...	5	1	0.21	0.1925	1	BP
GO:0000086	G2/M transition of mitotic cell cycle	5	1	0.21	0.1925	1	BP
GO:0016239	positive regulation of macroautophagy	5	1	0.21	0.1925	1	BP
GO:0055007	cardiac muscle cell differentiation	5	1	0.21	0.1925	1	BP
GO:0003084	positive regulation of systemic arterial...	5	1	0.21	0.1925	1	BP
GO:0009063	cellular amino acid catabolic process	5	1	0.21	0.1925	1	BP
GO:0035809	regulation of urine volume	5	1	0.21	0.1925	1	BP
GO:0040028	regulation of vulval development	5	1	0.21	0.1925	1	BP
GO:0097327	response to antineoplastic agent	5	1	0.21	0.1925	1	BP
GO:0060420	regulation of heart growth	5	1	0.21	0.1925	1	BP
GO:0060419	heart growth	5	1	0.21	0.1925	1	BP
GO:0097306	cellular response to alcohol	5	1	0.21	0.1925	1	BP
GO:0048593	camera-type eye morphogenesis	5	1	0.21	0.1925	1	BP
GO:0002029	desensitization of G protein-coupled rec...	5	1	0.21	0.1925	1	BP
GO:1903391	regulation of adherens junction organiza...	5	1	0.21	0.1925	1	BP
GO:1902749	regulation of cell cycle G2/M phase tran...	5	1	0.21	0.1925	1	BP
GO:1904427	positive regulation of calcium ion trans...	5	1	0.21	0.1925	1	BP
GO:0150116	regulation of cell-substrate junction or...	5	1	0.21	0.1925	1	BP
GO:0044839	cell cycle G2/M phase transition	5	1	0.21	0.1925	1	BP
GO:0042330	taxis	37	3	1.54	0.1926	1	BP
GO:0009890	negative regulation of biosynthetic proc...	76	5	3.17	0.1928	1	BP
GO:0045935	positive regulation of nucleobase-contai...	76	5	3.17	0.1928	1	BP
GO:0031327	negative regulation of cellular biosynth...	76	5	3.17	0.1928	1	BP
GO:0035150	regulation of tube size	20	2	0.83	0.1998	1	BP
GO:0006836	neurotransmitter transport	20	2	0.83	0.1998	1	BP
