GO.ID	Term	Annotated	Significant	Expected	pval_test	pval_adj	ontology
GO:0016236	macroautophagy	87	5	3.45	0.26072	1	BP
GO:0055086	nucleobase-containing small molecule met...	199	10	7.89	0.26095	1	BP
GO:0001838	embryonic epithelial tube formation	45	3	1.78	0.2631	1	BP
GO:1903052	positive regulation of proteolysis invol...	45	3	1.78	0.2631	1	BP
GO:0071456	cellular response to hypoxia	45	3	1.78	0.2631	1	BP
GO:1903322	positive regulation of protein modificat...	45	3	1.78	0.2631	1	BP
GO:0033500	carbohydrate homeostasis	66	4	2.62	0.26446	1	BP
GO:1903311	regulation of mRNA metabolic process	66	4	2.62	0.26446	1	BP
GO:0005996	monosaccharide metabolic process	66	4	2.62	0.26446	1	BP
GO:0001816	cytokine production	81	9	3.21	0.26489	1	BP
GO:0043086	negative regulation of catalytic activit...	132	7	5.23	0.26672	1	BP
GO:0009150	purine ribonucleotide metabolic process	132	7	5.23	0.26672	1	BP
GO:0048706	embryonic skeletal system development	37	6	1.47	0.26795	1	BP
GO:0051047	positive regulation of secretion	88	5	3.49	0.26839	1	BP
GO:0043254	regulation of protein-containing complex...	110	6	4.36	0.26855	1	BP
GO:0010324	membrane invagination	30	4	1.19	0.26888	1	BP
GO:2000145	regulation of cell motility	155	8	6.14	0.26951	1	BP
GO:1905153	regulation of membrane invagination	12	3	0.48	0.27256	1	BP
GO:0009152	purine ribonucleotide biosynthetic proce...	67	4	2.66	0.27338	1	BP
GO:0009755	hormone-mediated signaling pathway	46	3	1.82	0.27401	1	BP
GO:0072593	reactive oxygen species metabolic proces...	46	3	1.82	0.27401	1	BP
GO:0051495	positive regulation of cytoskeleton orga...	46	3	1.82	0.27401	1	BP
GO:0043062	extracellular structure organization	46	3	1.82	0.27401	1	BP
GO:0038127	ERBB signaling pathway	46	3	1.82	0.27401	1	BP
GO:0007631	feeding behavior	46	3	1.82	0.27401	1	BP
GO:0042177	negative regulation of protein catabolic...	26	2	1.03	0.27557	1	BP
GO:0010594	regulation of endothelial cell migration	26	2	1.03	0.27557	1	BP
GO:0046928	regulation of neurotransmitter secretion	26	2	1.03	0.27557	1	BP
GO:2001022	positive regulation of response to DNA d...	26	2	1.03	0.27557	1	BP
GO:0021549	cerebellum development	26	2	1.03	0.27557	1	BP
GO:1903578	regulation of ATP metabolic process	26	2	1.03	0.27557	1	BP
GO:1904888	cranial skeletal system development	26	2	1.03	0.27557	1	BP
GO:0034219	carbohydrate transmembrane transport	26	2	1.03	0.27557	1	BP
GO:0046364	monosaccharide biosynthetic process	26	2	1.03	0.27557	1	BP
GO:0043500	muscle adaptation	26	2	1.03	0.27557	1	BP
GO:0007349	cellularization	26	2	1.03	0.27557	1	BP
GO:0031058	positive regulation of histone modificat...	26	2	1.03	0.27557	1	BP
GO:0022037	metencephalon development	26	2	1.03	0.27557	1	BP
GO:0071242	cellular response to ammonium ion	26	2	1.03	0.27557	1	BP
GO:0051283	negative regulation of sequestering of c...	26	2	1.03	0.27557	1	BP
GO:1903169	regulation of calcium ion transmembrane ...	26	2	1.03	0.27557	1	BP
GO:0051896	regulation of protein kinase B signaling	26	2	1.03	0.27557	1	BP
GO:0031347	regulation of defense response	89	5	3.53	0.27612	1	BP
GO:0055074	calcium ion homeostasis	89	5	3.53	0.27612	1	BP
GO:0030813	positive regulation of nucleotide catabo...	8	1	0.32	0.27669	1	BP
GO:0098586	cellular response to virus	8	1	0.32	0.27669	1	BP
GO:0010882	regulation of cardiac muscle contraction...	8	1	0.32	0.27669	1	BP
GO:0050687	negative regulation of defense response ...	8	1	0.32	0.27669	1	BP
GO:1903204	negative regulation of oxidative stress-...	8	1	0.32	0.27669	1	BP
GO:0006929	substrate-dependent cell migration	8	1	0.32	0.27669	1	BP
GO:0042100	B cell proliferation	8	1	0.32	0.27669	1	BP
GO:0086010	membrane depolarization during action po...	8	1	0.32	0.27669	1	BP
GO:0086011	membrane repolarization during action po...	8	1	0.32	0.27669	1	BP
GO:0086013	membrane repolarization during cardiac m...	8	1	0.32	0.27669	1	BP
GO:0010586	miRNA metabolic process	8	1	0.32	0.27669	1	BP
GO:0010518	positive regulation of phospholipase act...	8	1	0.32	0.27669	1	BP
GO:0003148	outflow tract septum morphogenesis	8	1	0.32	0.27669	1	BP
GO:0001569	branching involved in blood vessel morph...	8	1	0.32	0.27669	1	BP
GO:0048619	embryonic hindgut morphogenesis	8	1	0.32	0.27669	1	BP
GO:0042790	nucleolar large rRNA transcription by RN...	8	1	0.32	0.27669	1	BP
GO:0010665	regulation of cardiac muscle cell apopto...	8	1	0.32	0.27669	1	BP
GO:0002709	regulation of T cell mediated immunity	8	1	0.32	0.27669	1	BP
GO:0036092	phosphatidylinositol-3-phosphate biosynt...	8	1	0.32	0.27669	1	BP
GO:0010613	positive regulation of cardiac muscle hy...	8	1	0.32	0.27669	1	BP
GO:0033146	regulation of intracellular estrogen rec...	8	1	0.32	0.27669	1	BP
GO:0032715	negative regulation of interleukin-6 pro...	8	1	0.32	0.27669	1	BP
GO:0072528	pyrimidine-containing compound biosynthe...	8	1	0.32	0.27669	1	BP
GO:0072529	pyrimidine-containing compound catabolic...	8	1	0.32	0.27669	1	BP
GO:1904748	regulation of apoptotic process involved...	8	1	0.32	0.27669	1	BP
GO:0060967	negative regulation of gene silencing by...	8	1	0.32	0.27669	1	BP
GO:0097065	anterior head development	8	1	0.32	0.27669	1	BP
GO:0019692	deoxyribose phosphate metabolic process	8	1	0.32	0.27669	1	BP
GO:2000300	regulation of synaptic vesicle exocytosi...	8	1	0.32	0.27669	1	BP
GO:0035332	positive regulation of hippo signaling	8	1	0.32	0.27669	1	BP
GO:0032528	microvillus organization	8	1	0.32	0.27669	1	BP
GO:0042532	negative regulation of tyrosine phosphor...	8	1	0.32	0.27669	1	BP
GO:0030953	astral microtubule organization	8	1	0.32	0.27669	1	BP
GO:1901020	negative regulation of calcium ion trans...	8	1	0.32	0.27669	1	BP
GO:1901021	positive regulation of calcium ion trans...	8	1	0.32	0.27669	1	BP
GO:0010996	response to auditory stimulus	8	1	0.32	0.27669	1	BP
GO:1901028	regulation of mitochondrial outer membra...	8	1	0.32	0.27669	1	BP
GO:0101023	vascular endothelial cell proliferation	8	1	0.32	0.27669	1	BP
GO:0048915	posterior lateral line system developmen...	8	1	0.32	0.27669	1	BP
GO:0048916	posterior lateral line development	8	1	0.32	0.27669	1	BP
GO:0051953	negative regulation of amine transport	8	1	0.32	0.27669	1	BP
GO:0051954	positive regulation of amine transport	8	1	0.32	0.27669	1	BP
GO:0090036	regulation of protein kinase C signaling	8	1	0.32	0.27669	1	BP
GO:0001963	synaptic transmission, dopaminergic	8	1	0.32	0.27669	1	BP
GO:0036342	post-anal tail morphogenesis	8	1	0.32	0.27669	1	BP
GO:1905562	regulation of vascular endothelial cell ...	8	1	0.32	0.27669	1	BP
GO:0014742	positive regulation of muscle hypertroph...	8	1	0.32	0.27669	1	BP
GO:0010042	response to manganese ion	8	1	0.32	0.27669	1	BP
GO:0097300	programmed necrotic cell death	8	1	0.32	0.27669	1	BP
GO:1900424	regulation of defense response to bacter...	8	1	0.32	0.27669	1	BP
GO:2000758	positive regulation of peptidyl-lysine a...	8	1	0.32	0.27669	1	BP
GO:2000781	positive regulation of double-strand bre...	8	1	0.32	0.27669	1	BP
GO:0007469	antennal development	8	1	0.32	0.27669	1	BP
GO:1900193	regulation of oocyte maturation	8	1	0.32	0.27669	1	BP
GO:0036120	cellular response to platelet-derived gr...	8	1	0.32	0.27669	1	BP
GO:0046131	pyrimidine ribonucleoside metabolic proc...	8	1	0.32	0.27669	1	BP
GO:0036119	response to platelet-derived growth fact...	8	1	0.32	0.27669	1	BP
GO:0007443	Malpighian tubule morphogenesis	8	1	0.32	0.27669	1	BP
GO:1903053	regulation of extracellular matrix organ...	8	1	0.32	0.27669	1	BP
GO:2001258	negative regulation of cation channel ac...	8	1	0.32	0.27669	1	BP
GO:0045898	regulation of RNA polymerase II transcri...	8	1	0.32	0.27669	1	BP
GO:0045899	positive regulation of RNA polymerase II...	8	1	0.32	0.27669	1	BP
GO:0034508	centromere complex assembly	8	1	0.32	0.27669	1	BP
GO:0060421	positive regulation of heart growth	8	1	0.32	0.27669	1	BP
GO:0032924	activin receptor signaling pathway	8	1	0.32	0.27669	1	BP
GO:0002093	auditory receptor cell morphogenesis	8	1	0.32	0.27669	1	BP
GO:0045821	positive regulation of glycolytic proces...	8	1	0.32	0.27669	1	BP
GO:0050435	amyloid-beta metabolic process	8	1	0.32	0.27669	1	BP
GO:0034656	nucleobase-containing small molecule cat...	8	1	0.32	0.27669	1	BP
GO:0002026	regulation of the force of heart contrac...	8	1	0.32	0.27669	1	BP
GO:0060193	positive regulation of lipase activity	8	1	0.32	0.27669	1	BP
GO:0110110	positive regulation of animal organ morp...	8	1	0.32	0.27669	1	BP
GO:0071498	cellular response to fluid shear stress	8	1	0.32	0.27669	1	BP
GO:0009394	2'-deoxyribonucleotide metabolic process	8	1	0.32	0.27669	1	BP
GO:0070296	sarcoplasmic reticulum calcium ion trans...	8	1	0.32	0.27669	1	BP
GO:0071475	cellular hyperosmotic salinity response	8	1	0.32	0.27669	1	BP
GO:0046850	regulation of bone remodeling	8	1	0.32	0.27669	1	BP
GO:0051412	response to corticosterone	8	1	0.32	0.27669	1	BP
GO:1990874	vascular associated smooth muscle cell p...	8	1	0.32	0.27669	1	BP
GO:0031341	regulation of cell killing	8	1	0.32	0.27669	1	BP
GO:0060760	positive regulation of response to cytok...	8	1	0.32	0.27669	1	BP
GO:0000289	nuclear-transcribed mRNA poly(A) tail sh...	8	1	0.32	0.27669	1	BP
GO:1902176	negative regulation of oxidative stress-...	8	1	0.32	0.27669	1	BP
GO:0070861	regulation of protein exit from endoplas...	8	1	0.32	0.27669	1	BP
GO:0098751	bone cell development	8	1	0.32	0.27669	1	BP
GO:1902254	negative regulation of intrinsic apoptot...	8	1	0.32	0.27669	1	BP
GO:0050854	regulation of antigen receptor-mediated ...	8	1	0.32	0.27669	1	BP
GO:0030201	heparan sulfate proteoglycan metabolic p...	8	1	0.32	0.27669	1	BP
GO:0050849	negative regulation of calcium-mediated ...	8	1	0.32	0.27669	1	BP
GO:0042307	positive regulation of protein import in...	8	1	0.32	0.27669	1	BP
GO:0010765	positive regulation of sodium ion transp...	8	1	0.32	0.27669	1	BP
GO:1903170	negative regulation of calcium ion trans...	8	1	0.32	0.27669	1	BP
GO:0031101	fin regeneration	8	1	0.32	0.27669	1	BP
GO:0055023	positive regulation of cardiac muscle ti...	8	1	0.32	0.27669	1	BP
GO:0048881	mechanosensory lateral line system devel...	8	1	0.32	0.27669	1	BP
GO:0001782	B cell homeostasis	8	1	0.32	0.27669	1	BP
GO:0046903	secretion	343	16	13.59	0.27832	1	BP
GO:0002790	peptide secretion	134	7	5.31	0.2793	1	BP
GO:0050808	synapse organization	134	7	5.31	0.2793	1	BP
GO:0097305	response to alcohol	95	7	3.76	0.27948	1	BP
GO:0019725	cellular homeostasis	226	11	8.96	0.28045	1	BP
GO:0009117	nucleotide metabolic process	180	9	7.13	0.28175	1	BP
GO:0045935	positive regulation of nucleobase-contai...	392	18	15.53	0.28388	1	BP
GO:0072503	cellular divalent inorganic cation homeo...	90	5	3.57	0.2839	1	BP
GO:0062012	regulation of small molecule metabolic p...	90	5	3.57	0.2839	1	BP
GO:0044706	multi-multicellular organism process	47	3	1.86	0.28496	1	BP
GO:0006606	protein import into nucleus	47	3	1.86	0.28496	1	BP
GO:0032496	response to lipopolysaccharide	47	3	1.86	0.28496	1	BP
GO:0044419	biological process involved in interspec...	282	15	11.18	0.2865	1	BP
GO:0006753	nucleoside phosphate metabolic process	181	9	7.17	0.28726	1	BP
GO:0043434	response to peptide hormone	113	6	4.48	0.28937	1	BP
GO:0006875	cellular metal ion homeostasis	113	6	4.48	0.28937	1	BP
GO:1901701	cellular response to oxygen-containing c...	236	13	9.35	0.29027	1	BP
GO:0043491	protein kinase B signaling	27	2	1.07	0.2905	1	BP
GO:0035051	cardiocyte differentiation	27	2	1.07	0.2905	1	BP
GO:0008643	carbohydrate transport	27	2	1.07	0.2905	1	BP
GO:1903708	positive regulation of hemopoiesis	27	2	1.07	0.2905	1	BP
GO:0001510	RNA methylation	27	2	1.07	0.2905	1	BP
GO:0042551	neuron maturation	27	2	1.07	0.2905	1	BP
GO:0090090	negative regulation of canonical Wnt sig...	27	2	1.07	0.2905	1	BP
GO:0010906	regulation of glucose metabolic process	27	2	1.07	0.2905	1	BP
GO:0016322	neuron remodeling	27	2	1.07	0.2905	1	BP
GO:0006766	vitamin metabolic process	27	2	1.07	0.2905	1	BP
GO:0072347	response to anesthetic	27	2	1.07	0.2905	1	BP
GO:0030218	erythrocyte differentiation	27	2	1.07	0.2905	1	BP
GO:0051282	regulation of sequestering of calcium io...	27	2	1.07	0.2905	1	BP
GO:0002478	antigen processing and presentation of e...	27	2	1.07	0.2905	1	BP
GO:0002449	lymphocyte mediated immunity	27	2	1.07	0.2905	1	BP
GO:0006915	apoptotic process	370	17	14.66	0.29122	1	BP
GO:0008654	phospholipid biosynthetic process	69	4	2.73	0.29137	1	BP
GO:0072522	purine-containing compound biosynthetic ...	69	4	2.73	0.29137	1	BP
GO:0050954	sensory perception of mechanical stimulu...	69	4	2.73	0.29137	1	BP
GO:0006164	purine nucleotide biosynthetic process	69	4	2.73	0.29137	1	BP
GO:1903050	regulation of proteolysis involved in ce...	69	4	2.73	0.29137	1	BP
GO:0000819	sister chromatid segregation	69	4	2.73	0.29137	1	BP
GO:0012501	programmed cell death	394	18	15.61	0.29161	1	BP
GO:0043414	macromolecule methylation	91	5	3.61	0.29172	1	BP
GO:0009165	nucleotide biosynthetic process	91	5	3.61	0.29172	1	BP
GO:0043549	regulation of kinase activity	182	9	7.21	0.2928	1	BP
GO:0007052	mitotic spindle organization	48	3	1.9	0.29595	1	BP
GO:0036294	cellular response to decreased oxygen le...	48	3	1.9	0.29595	1	BP
GO:0007204	positive regulation of cytosolic calcium...	48	3	1.9	0.29595	1	BP
GO:0007165	signal transduction	936	46	37.09	0.29645	1	BP
GO:0010256	endomembrane system organization	137	7	5.43	0.29846	1	BP
GO:0009259	ribonucleotide metabolic process	137	7	5.43	0.29846	1	BP
GO:0010631	epithelial cell migration	92	5	3.65	0.29958	1	BP
GO:1901293	nucleoside phosphate biosynthetic proces...	92	5	3.65	0.29958	1	BP
GO:0007178	transmembrane receptor protein serine/th...	70	4	2.77	0.30044	1	BP
GO:0002009	morphogenesis of an epithelium	251	15	9.95	0.30124	1	BP
GO:0051270	regulation of cellular component movemen...	184	9	7.29	0.30396	1	BP
GO:0006886	intracellular protein transport	278	13	11.02	0.3045	1	BP
GO:0019220	regulation of phosphate metabolic proces...	334	21	13.24	0.30504	1	BP
GO:0051174	regulation of phosphorus metabolic proce...	334	21	13.24	0.30504	1	BP
GO:0051591	response to cAMP	28	2	1.11	0.3054	1	BP
GO:0048546	digestive tract morphogenesis	28	2	1.11	0.3054	1	BP
GO:0043433	negative regulation of DNA-binding trans...	28	2	1.11	0.3054	1	BP
GO:0019884	antigen processing and presentation of e...	28	2	1.11	0.3054	1	BP
GO:1905269	positive regulation of chromatin organiz...	28	2	1.11	0.3054	1	BP
GO:0140029	exocytic process	28	2	1.11	0.3054	1	BP
GO:0034101	erythrocyte homeostasis	28	2	1.11	0.3054	1	BP
GO:0051952	regulation of amine transport	28	2	1.11	0.3054	1	BP
GO:1905897	regulation of response to endoplasmic re...	28	2	1.11	0.3054	1	BP
GO:0007140	male meiotic nuclear division	28	2	1.11	0.3054	1	BP
GO:0051298	centrosome duplication	28	2	1.11	0.3054	1	BP
GO:0097553	calcium ion transmembrane import into cy...	28	2	1.11	0.3054	1	BP
GO:0009119	ribonucleoside metabolic process	28	2	1.11	0.3054	1	BP
GO:0051208	sequestering of calcium ion	28	2	1.11	0.3054	1	BP
GO:0055002	striated muscle cell development	28	2	1.11	0.3054	1	BP
GO:0001711	endodermal cell fate commitment	9	1	0.36	0.30544	1	BP
GO:0070613	regulation of protein processing	9	1	0.36	0.30544	1	BP
GO:0060603	mammary gland duct morphogenesis	9	1	0.36	0.30544	1	BP
GO:0048581	negative regulation of post-embryonic de...	9	1	0.36	0.30544	1	BP
GO:0021772	olfactory bulb development	9	1	0.36	0.30544	1	BP
GO:0098659	inorganic cation import across plasma me...	9	1	0.36	0.30544	1	BP
GO:0071542	dopaminergic neuron differentiation	9	1	0.36	0.30544	1	BP
GO:1903727	positive regulation of phospholipid meta...	9	1	0.36	0.30544	1	BP
GO:0010517	regulation of phospholipase activity	9	1	0.36	0.30544	1	BP
GO:1904292	regulation of ERAD pathway	9	1	0.36	0.30544	1	BP
GO:0099587	inorganic ion import across plasma membr...	9	1	0.36	0.30544	1	BP
GO:0043162	ubiquitin-dependent protein catabolic pr...	9	1	0.36	0.30544	1	BP
GO:0034331	cell junction maintenance	9	1	0.36	0.30544	1	BP
GO:0034333	adherens junction assembly	9	1	0.36	0.30544	1	BP
GO:0036075	replacement ossification	9	1	0.36	0.30544	1	BP
GO:0099623	regulation of cardiac muscle cell membra...	9	1	0.36	0.30544	1	BP
GO:1903513	endoplasmic reticulum to cytosol transpo...	9	1	0.36	0.30544	1	BP
GO:0050962	detection of light stimulus involved in ...	9	1	0.36	0.30544	1	BP
GO:0043243	positive regulation of protein-containin...	9	1	0.36	0.30544	1	BP
GO:2000380	regulation of mesoderm development	9	1	0.36	0.30544	1	BP
GO:0007063	regulation of sister chromatid cohesion	9	1	0.36	0.30544	1	BP
GO:0050908	detection of light stimulus involved in ...	9	1	0.36	0.30544	1	BP
GO:0060043	regulation of cardiac muscle cell prolif...	9	1	0.36	0.30544	1	BP
GO:0060037	pharyngeal system development	9	1	0.36	0.30544	1	BP
GO:0030970	retrograde protein transport, ER to cyto...	9	1	0.36	0.30544	1	BP
GO:0000022	mitotic spindle elongation	9	1	0.36	0.30544	1	BP
GO:2000181	negative regulation of blood vessel morp...	9	1	0.36	0.30544	1	BP
GO:0008078	mesodermal cell migration	9	1	0.36	0.30544	1	BP
GO:0046326	positive regulation of glucose import	9	1	0.36	0.30544	1	BP
GO:0001953	negative regulation of cell-matrix adhes...	9	1	0.36	0.30544	1	BP
GO:0001958	endochondral ossification	9	1	0.36	0.30544	1	BP
GO:0043552	positive regulation of phosphatidylinosi...	9	1	0.36	0.30544	1	BP
GO:0043555	regulation of translation in response to...	9	1	0.36	0.30544	1	BP
GO:0016325	oocyte microtubule cytoskeleton organiza...	9	1	0.36	0.30544	1	BP
GO:0033522	histone H2A ubiquitination	9	1	0.36	0.30544	1	BP
GO:0097366	response to bronchodilator	9	1	0.36	0.30544	1	BP
GO:0021988	olfactory lobe development	9	1	0.36	0.30544	1	BP
GO:0044837	actomyosin contractile ring organization	9	1	0.36	0.30544	1	BP
GO:1901381	positive regulation of potassium ion tra...	9	1	0.36	0.30544	1	BP
GO:0070306	lens fiber cell differentiation	9	1	0.36	0.30544	1	BP
GO:0035710	CD4-positive, alpha-beta T cell activati...	9	1	0.36	0.30544	1	BP
GO:0006213	pyrimidine nucleoside metabolic process	9	1	0.36	0.30544	1	BP
GO:0042987	amyloid precursor protein catabolic proc...	9	1	0.36	0.30544	1	BP
GO:0060425	lung morphogenesis	9	1	0.36	0.30544	1	BP
GO:0060416	response to growth hormone	9	1	0.36	0.30544	1	BP
GO:0045880	positive regulation of smoothened signal...	9	1	0.36	0.30544	1	BP
GO:0007176	regulation of epidermal growth factor-ac...	9	1	0.36	0.30544	1	BP
GO:0071398	cellular response to fatty acid	9	1	0.36	0.30544	1	BP
GO:1900273	positive regulation of long-term synapti...	9	1	0.36	0.30544	1	BP
GO:0061383	trabecula morphogenesis	9	1	0.36	0.30544	1	BP
GO:0007296	vitellogenesis	9	1	0.36	0.30544	1	BP
GO:1902369	negative regulation of RNA catabolic pro...	9	1	0.36	0.30544	1	BP
GO:0051339	regulation of lyase activity	9	1	0.36	0.30544	1	BP
GO:0006858	extracellular transport	9	1	0.36	0.30544	1	BP
GO:0008407	chaeta morphogenesis	9	1	0.36	0.30544	1	BP
GO:0071472	cellular response to salt stress	9	1	0.36	0.30544	1	BP
GO:0046856	phosphatidylinositol dephosphorylation	9	1	0.36	0.30544	1	BP
GO:0046886	positive regulation of hormone biosynthe...	9	1	0.36	0.30544	1	BP
GO:0046834	lipid phosphorylation	9	1	0.36	0.30544	1	BP
GO:1903361	protein localization to basolateral plas...	9	1	0.36	0.30544	1	BP
GO:0045604	regulation of epidermal cell differentia...	9	1	0.36	0.30544	1	BP
GO:0008258	head involution	9	1	0.36	0.30544	1	BP
GO:0090218	positive regulation of lipid kinase acti...	9	1	0.36	0.30544	1	BP
GO:0070741	response to interleukin-6	9	1	0.36	0.30544	1	BP
GO:0048261	negative regulation of receptor-mediated...	9	1	0.36	0.30544	1	BP
GO:0016525	negative regulation of angiogenesis	9	1	0.36	0.30544	1	BP
GO:0032365	intracellular lipid transport	9	1	0.36	0.30544	1	BP
GO:0044060	regulation of endocrine process	9	1	0.36	0.30544	1	BP
GO:0042304	regulation of fatty acid biosynthetic pr...	9	1	0.36	0.30544	1	BP
GO:0031128	developmental induction	9	1	0.36	0.30544	1	BP
GO:0048710	regulation of astrocyte differentiation	9	1	0.36	0.30544	1	BP
GO:0010761	fibroblast migration	9	1	0.36	0.30544	1	BP
GO:0010762	regulation of fibroblast migration	9	1	0.36	0.30544	1	BP
GO:0031297	replication fork processing	9	1	0.36	0.30544	1	BP
GO:0055070	copper ion homeostasis	9	1	0.36	0.30544	1	BP
GO:0003351	epithelial cilium movement involved in e...	9	1	0.36	0.30544	1	BP
GO:0071709	membrane assembly	9	1	0.36	0.30544	1	BP
GO:0014014	negative regulation of gliogenesis	9	1	0.36	0.30544	1	BP
GO:0003383	apical constriction	9	1	0.36	0.30544	1	BP
GO:0045923	positive regulation of fatty acid metabo...	9	1	0.36	0.30544	1	BP
GO:0045948	positive regulation of translational ini...	9	1	0.36	0.30544	1	BP
GO:0031279	regulation of cyclase activity	9	1	0.36	0.30544	1	BP
GO:0014003	oligodendrocyte development	9	1	0.36	0.30544	1	BP
GO:0055008	cardiac muscle tissue morphogenesis	9	1	0.36	0.30544	1	BP
GO:0051898	negative regulation of protein kinase B ...	9	1	0.36	0.30544	1	BP
GO:0002697	regulation of immune effector process	49	3	1.94	0.30697	1	BP
GO:1903364	positive regulation of cellular protein ...	49	3	1.94	0.30697	1	BP
GO:0071248	cellular response to metal ion	49	3	1.94	0.30697	1	BP
GO:1902275	regulation of chromatin organization	49	3	1.94	0.30697	1	BP
GO:0032434	regulation of proteasomal ubiquitin-depe...	49	3	1.94	0.30697	1	BP
GO:0006464	cellular protein modification process	813	35	32.22	0.30845	1	BP
GO:0036211	protein modification process	813	35	32.22	0.30845	1	BP
GO:0031330	negative regulation of cellular cataboli...	71	4	2.81	0.30953	1	BP
GO:0009260	ribonucleotide biosynthetic process	71	4	2.81	0.30953	1	BP
GO:0009056	catabolic process	569	25	22.55	0.31267	1	BP
GO:0006351	transcription, DNA-templated	594	33	23.54	0.31275	1	BP
GO:1901700	response to oxygen-containing compound	362	18	14.35	0.31465	1	BP
GO:0090132	epithelium migration	94	5	3.73	0.31541	1	BP
GO:0023052	signaling	1024	49	40.58	0.31594	1	BP
GO:0001738	morphogenesis of a polarized epithelium	50	3	1.98	0.31801	1	BP
GO:0002237	response to molecule of bacterial origin	50	3	1.98	0.31801	1	BP
GO:0006479	protein methylation	50	3	1.98	0.31801	1	BP
GO:0008213	protein alkylation	50	3	1.98	0.31801	1	BP
GO:0065004	protein-DNA complex assembly	50	3	1.98	0.31801	1	BP
GO:0045017	glycerolipid biosynthetic process	72	4	2.85	0.31866	1	BP
GO:1903320	regulation of protein modification by sm...	72	4	2.85	0.31866	1	BP
GO:0048814	regulation of dendrite morphogenesis	29	2	1.15	0.32025	1	BP
GO:0072655	establishment of protein localization to...	29	2	1.15	0.32025	1	BP
GO:0006400	tRNA modification	29	2	1.15	0.32025	1	BP
GO:0048002	antigen processing and presentation of p...	29	2	1.15	0.32025	1	BP
GO:1903008	organelle disassembly	29	2	1.15	0.32025	1	BP
GO:0015837	amine transport	29	2	1.15	0.32025	1	BP
GO:1903313	positive regulation of mRNA metabolic pr...	29	2	1.15	0.32025	1	BP
GO:0008277	regulation of G protein-coupled receptor...	29	2	1.15	0.32025	1	BP
GO:0070727	cellular macromolecule localization	474	21	18.78	0.32086	1	BP
GO:0120031	plasma membrane bounded cell projection ...	164	8	6.5	0.32301	1	BP
GO:0090130	tissue migration	95	5	3.76	0.32336	1	BP
GO:0019693	ribose phosphate metabolic process	141	7	5.59	0.32443	1	BP
GO:0006163	purine nucleotide metabolic process	141	7	5.59	0.32443	1	BP
GO:0032879	regulation of localization	550	29	21.8	0.32592	1	BP
GO:0051239	regulation of multicellular organismal p...	634	40	25.13	0.32762	1	BP
GO:0046390	ribose phosphate biosynthetic process	73	4	2.89	0.32781	1	BP
GO:0030335	positive regulation of cell migration	73	4	2.89	0.32781	1	BP
GO:0046883	regulation of hormone secretion	73	4	2.89	0.32781	1	BP
GO:0048565	digestive tract development	51	3	2.02	0.32906	1	BP
GO:0007405	neuroblast proliferation	51	3	2.02	0.32906	1	BP
GO:0050796	regulation of insulin secretion	51	3	2.02	0.32906	1	BP
GO:0006873	cellular ion homeostasis	142	7	5.63	0.33099	1	BP
GO:0010948	negative regulation of cell cycle proces...	96	5	3.8	0.33134	1	BP
GO:2001233	regulation of apoptotic signaling pathwa...	96	5	3.8	0.33134	1	BP
GO:0001667	ameboidal-type cell migration	119	6	4.72	0.33196	1	BP
GO:0010828	positive regulation of glucose transmemb...	10	1	0.4	0.33306	1	BP
GO:0010803	regulation of tumor necrosis factor-medi...	10	1	0.4	0.33306	1	BP
GO:0048557	embryonic digestive tract morphogenesis	10	1	0.4	0.33306	1	BP
GO:0048536	spleen development	10	1	0.4	0.33306	1	BP
GO:0071548	response to dexamethasone	10	1	0.4	0.33306	1	BP
GO:0086009	membrane repolarization	10	1	0.4	0.33306	1	BP
GO:0039702	viral budding via host ESCRT complex	10	1	0.4	0.33306	1	BP
GO:0010524	positive regulation of calcium ion trans...	10	1	0.4	0.33306	1	BP
GO:1905476	negative regulation of protein localizat...	10	1	0.4	0.33306	1	BP
GO:0034381	plasma lipoprotein particle clearance	10	1	0.4	0.33306	1	BP
GO:0010659	cardiac muscle cell apoptotic process	10	1	0.4	0.33306	1	BP
GO:0034315	regulation of Arp2/3 complex-mediated ac...	10	1	0.4	0.33306	1	BP
GO:0021591	ventricular system development	10	1	0.4	0.33306	1	BP
GO:0036010	protein localization to endosome	10	1	0.4	0.33306	1	BP
GO:0099622	cardiac muscle cell membrane repolarizat...	10	1	0.4	0.33306	1	BP
GO:0043278	response to morphine	10	1	0.4	0.33306	1	BP
GO:0060986	endocrine hormone secretion	10	1	0.4	0.33306	1	BP
GO:1904893	negative regulation of receptor signalin...	10	1	0.4	0.33306	1	BP
GO:0034405	response to fluid shear stress	10	1	0.4	0.33306	1	BP
GO:0045332	phospholipid translocation	10	1	0.4	0.33306	1	BP
GO:0060042	retina morphogenesis in camera-type eye	10	1	0.4	0.33306	1	BP
GO:0045472	response to ether	10	1	0.4	0.33306	1	BP
GO:0045445	myoblast differentiation	10	1	0.4	0.33306	1	BP
GO:0032509	endosome transport via multivesicular bo...	10	1	0.4	0.33306	1	BP
GO:0006336	DNA replication-independent chromatin as...	10	1	0.4	0.33306	1	BP
GO:0034204	lipid translocation	10	1	0.4	0.33306	1	BP
GO:0009954	proximal/distal pattern formation	10	1	0.4	0.33306	1	BP
GO:0061099	negative regulation of protein tyrosine ...	10	1	0.4	0.33306	1	BP
GO:0009988	cell-cell recognition	10	1	0.4	0.33306	1	BP
GO:0016333	morphogenesis of follicular epithelium	10	1	0.4	0.33306	1	BP
GO:0046426	negative regulation of receptor signalin...	10	1	0.4	0.33306	1	BP
GO:0060350	endochondral bone morphogenesis	10	1	0.4	0.33306	1	BP
GO:0070316	regulation of G0 to G1 transition	10	1	0.4	0.33306	1	BP
GO:0070317	negative regulation of G0 to G1 transiti...	10	1	0.4	0.33306	1	BP
