GO.ID	Term	Annotated	Significant	Expected	pval_test	pval_adj	ontology
GO:0071478	cellular response to radiation	52	3	0.89	0.53418	1	BP
GO:1901990	regulation of mitotic cell cycle phase t...	104	2	1.77	0.53524	1	BP
GO:0033044	regulation of chromosome organization	104	2	1.77	0.53524	1	BP
GO:0099537	trans-synaptic signaling	164	3	2.79	0.53664	1	BP
GO:0098916	anterograde trans-synaptic signaling	164	3	2.79	0.53664	1	BP
GO:0007268	chemical synaptic transmission	164	3	2.79	0.53664	1	BP
GO:0010033	response to organic substance	610	12	10.39	0.53809	1	BP
GO:0032870	cellular response to hormone stimulus	165	3	2.81	0.54086	1	BP
GO:1903322	positive regulation of protein modificat...	45	1	0.77	0.54146	1	BP
GO:0006575	cellular modified amino acid metabolic p...	45	1	0.77	0.54146	1	BP
GO:0035272	exocrine system development	45	1	0.77	0.54146	1	BP
GO:1903052	positive regulation of proteolysis invol...	45	1	0.77	0.54146	1	BP
GO:0048705	skeletal system morphogenesis	45	1	0.77	0.54146	1	BP
GO:0050730	regulation of peptidyl-tyrosine phosphor...	45	1	0.77	0.54146	1	BP
GO:0071456	cellular response to hypoxia	45	1	0.77	0.54146	1	BP
GO:0009607	response to biotic stimulus	217	7	3.7	0.54457	1	BP
GO:0099536	synaptic signaling	166	3	2.83	0.54506	1	BP
GO:0045666	positive regulation of neuron differenti...	106	2	1.81	0.54571	1	BP
GO:0008380	RNA splicing	106	2	1.81	0.54571	1	BP
GO:0044419	biological process involved in interspec...	282	8	4.8	0.54621	1	BP
GO:0045637	regulation of myeloid cell differentiati...	46	1	0.78	0.5494	1	BP
GO:0043903	regulation of biological process involve...	46	1	0.78	0.5494	1	BP
GO:0072593	reactive oxygen species metabolic proces...	46	1	0.78	0.5494	1	BP
GO:0007498	mesoderm development	46	1	0.78	0.5494	1	BP
GO:0043062	extracellular structure organization	46	1	0.78	0.5494	1	BP
GO:0071560	cellular response to transforming growth...	46	1	0.78	0.5494	1	BP
GO:0071559	response to transforming growth factor b...	46	1	0.78	0.5494	1	BP
GO:0006475	internal protein amino acid acetylation	46	1	0.78	0.5494	1	BP
GO:0006997	nucleus organization	46	1	0.78	0.5494	1	BP
GO:0002757	immune response-activating signal transd...	46	1	0.78	0.5494	1	BP
GO:0051495	positive regulation of cytoskeleton orga...	46	1	0.78	0.5494	1	BP
GO:0050714	positive regulation of protein secretion	46	1	0.78	0.5494	1	BP
GO:0055123	digestive system development	55	3	0.94	0.54967	1	BP
GO:0044403	biological process involved in symbiotic...	107	2	1.82	0.55089	1	BP
GO:0007059	chromosome segregation	107	2	1.82	0.55089	1	BP
GO:0001505	regulation of neurotransmitter levels	107	2	1.82	0.55089	1	BP
GO:1901615	organic hydroxy compound metabolic proce...	107	2	1.82	0.55089	1	BP
GO:0045944	positive regulation of transcription by ...	228	4	3.88	0.55294	1	BP
GO:0090087	regulation of peptide transport	168	3	2.86	0.5534	1	BP
GO:0070201	regulation of establishment of protein l...	168	3	2.86	0.5534	1	BP
GO:0035556	intracellular signal transduction	522	13	8.89	0.55537	1	BP
GO:0046677	response to antibiotic	108	2	1.84	0.55602	1	BP
GO:0070482	response to oxygen levels	108	2	1.84	0.55602	1	BP
GO:0016477	cell migration	289	5	4.92	0.5567	1	BP
GO:0097237	cellular response to toxic substance	47	1	0.8	0.55721	1	BP
GO:0048640	negative regulation of developmental gro...	47	1	0.8	0.55721	1	BP
GO:0032496	response to lipopolysaccharide	47	1	0.8	0.55721	1	BP
GO:0051240	positive regulation of multicellular org...	349	6	5.95	0.55751	1	BP
GO:0048519	negative regulation of biological proces...	1071	20	18.25	0.55807	1	BP
GO:0016311	dephosphorylation	109	2	1.86	0.56112	1	BP
GO:0033674	positive regulation of kinase activity	109	2	1.86	0.56112	1	BP
GO:0048569	post-embryonic animal organ development	170	3	2.9	0.56166	1	BP
GO:0043406	positive regulation of MAP kinase activi...	48	1	0.82	0.56489	1	BP
GO:0050678	regulation of epithelial cell proliferat...	48	1	0.82	0.56489	1	BP
GO:0010389	regulation of G2/M transition of mitotic...	48	1	0.82	0.56489	1	BP
GO:0007224	smoothened signaling pathway	48	1	0.82	0.56489	1	BP
GO:0007204	positive regulation of cytosolic calcium...	48	1	0.82	0.56489	1	BP
GO:1901617	organic hydroxy compound biosynthetic pr...	48	1	0.82	0.56489	1	BP
GO:1901699	cellular response to nitrogen compound	171	3	2.91	0.56575	1	BP
GO:0007018	microtubule-based movement	110	2	1.87	0.56617	1	BP
GO:0042176	regulation of protein catabolic process	111	2	1.89	0.57119	1	BP
GO:0040017	positive regulation of locomotion	111	2	1.89	0.57119	1	BP
GO:0002444	myeloid leukocyte mediated immunity	111	2	1.89	0.57119	1	BP
GO:0002275	myeloid cell activation involved in immu...	111	2	1.89	0.57119	1	BP
GO:0050776	regulation of immune response	111	2	1.89	0.57119	1	BP
GO:0032434	regulation of proteasomal ubiquitin-depe...	49	1	0.83	0.57244	1	BP
GO:0002697	regulation of immune effector process	49	1	0.83	0.57244	1	BP
GO:0010001	glial cell differentiation	49	1	0.83	0.57244	1	BP
GO:0071248	cellular response to metal ion	49	1	0.83	0.57244	1	BP
GO:2000146	negative regulation of cell motility	49	1	0.83	0.57244	1	BP
GO:1902275	regulation of chromatin organization	49	1	0.83	0.57244	1	BP
GO:0000578	embryonic axis specification	49	1	0.83	0.57244	1	BP
GO:0045088	regulation of innate immune response	49	1	0.83	0.57244	1	BP
GO:0030258	lipid modification	49	1	0.83	0.57244	1	BP
GO:1903364	positive regulation of cellular protein ...	49	1	0.83	0.57244	1	BP
GO:0009966	regulation of signal transduction	596	14	10.15	0.57396	1	BP
GO:0010817	regulation of hormone levels	112	2	1.91	0.57616	1	BP
GO:0043299	leukocyte degranulation	112	2	1.91	0.57616	1	BP
GO:0043413	macromolecule glycosylation	50	1	0.85	0.57985	1	BP
GO:0035303	regulation of dephosphorylation	50	1	0.85	0.57985	1	BP
GO:0140056	organelle localization by membrane tethe...	50	1	0.85	0.57985	1	BP
GO:0008306	associative learning	50	1	0.85	0.57985	1	BP
GO:0060485	mesenchyme development	50	1	0.85	0.57985	1	BP
GO:0006486	protein glycosylation	50	1	0.85	0.57985	1	BP
GO:0006479	protein methylation	50	1	0.85	0.57985	1	BP
GO:0099504	synaptic vesicle cycle	50	1	0.85	0.57985	1	BP
GO:0002237	response to molecule of bacterial origin	50	1	0.85	0.57985	1	BP
GO:0045785	positive regulation of cell adhesion	50	1	0.85	0.57985	1	BP
GO:0008213	protein alkylation	50	1	0.85	0.57985	1	BP
GO:0042326	negative regulation of phosphorylation	113	2	1.93	0.5811	1	BP
GO:1905114	cell surface receptor signaling pathway ...	123	6	2.1	0.58212	1	BP
GO:0006811	ion transport	298	5	5.08	0.58539	1	BP
GO:0022406	membrane docking	51	1	0.87	0.58715	1	BP
GO:0002253	activation of immune response	51	1	0.87	0.58715	1	BP
GO:0010212	response to ionizing radiation	51	1	0.87	0.58715	1	BP
GO:0008202	steroid metabolic process	51	1	0.87	0.58715	1	BP
GO:0071495	cellular response to endogenous stimulus	299	5	5.09	0.58852	1	BP
GO:0034248	regulation of cellular amide metabolic p...	122	4	2.08	0.59037	1	BP
GO:0035295	tube development	320	7	5.45	0.59265	1	BP
GO:0002181	cytoplasmic translation	52	1	0.89	0.59432	1	BP
GO:0009056	catabolic process	569	11	9.69	0.5968	1	BP
GO:0009719	response to endogenous stimulus	363	6	6.18	0.59839	1	BP
GO:0035107	appendage morphogenesis	117	2	1.99	0.60043	1	BP
GO:0009968	negative regulation of signal transducti...	303	5	5.16	0.60092	1	BP
GO:0070085	glycosylation	53	1	0.9	0.60136	1	BP
GO:0007088	regulation of mitotic nuclear division	53	1	0.9	0.60136	1	BP
GO:0090257	regulation of muscle system process	53	1	0.9	0.60136	1	BP
GO:0006399	tRNA metabolic process	53	1	0.9	0.60136	1	BP
GO:1902749	regulation of cell cycle G2/M phase tran...	53	1	0.9	0.60136	1	BP
GO:0072659	protein localization to plasma membrane	53	1	0.9	0.60136	1	BP
GO:0002793	positive regulation of peptide secretion	53	1	0.9	0.60136	1	BP
GO:0019722	calcium-mediated signaling	53	1	0.9	0.60136	1	BP
GO:0009605	response to external stimulus	526	13	8.96	0.60772	1	BP
GO:0051271	negative regulation of cellular componen...	54	1	0.92	0.60829	1	BP
GO:0016241	regulation of macroautophagy	54	1	0.92	0.60829	1	BP
GO:0006473	protein acetylation	54	1	0.92	0.60829	1	BP
GO:0006909	phagocytosis	54	1	0.92	0.60829	1	BP
GO:2001252	positive regulation of chromosome organi...	54	1	0.92	0.60829	1	BP
GO:0043393	regulation of protein binding	54	1	0.92	0.60829	1	BP
GO:0016567	protein ubiquitination	182	3	3.1	0.60931	1	BP
GO:0010646	regulation of cell communication	680	15	11.59	0.61392	1	BP
GO:0007611	learning or memory	120	2	2.04	0.6145	1	BP
GO:0002274	myeloid leukocyte activation	120	2	2.04	0.6145	1	BP
GO:0051056	regulation of small GTPase mediated sign...	55	1	0.94	0.6151	1	BP
GO:2000058	regulation of ubiquitin-dependent protei...	55	1	0.94	0.6151	1	BP
GO:2001234	negative regulation of apoptotic signali...	55	1	0.94	0.6151	1	BP
GO:0040008	regulation of growth	247	4	4.21	0.61871	1	BP
GO:0009894	regulation of catabolic process	260	6	4.43	0.61903	1	BP
GO:0008593	regulation of Notch signaling pathway	56	1	0.95	0.6218	1	BP
GO:0007605	sensory perception of sound	56	1	0.95	0.6218	1	BP
GO:0009060	aerobic respiration	56	1	0.95	0.6218	1	BP
GO:0048839	inner ear development	56	1	0.95	0.6218	1	BP
GO:0019827	stem cell population maintenance	56	1	0.95	0.6218	1	BP
GO:0098727	maintenance of cell number	56	1	0.95	0.6218	1	BP
GO:0022407	regulation of cell-cell adhesion	57	1	0.97	0.62838	1	BP
GO:0050673	epithelial cell proliferation	57	1	0.97	0.62838	1	BP
GO:0032388	positive regulation of intracellular tra...	57	1	0.97	0.62838	1	BP
GO:0031325	positive regulation of cellular metaboli...	646	12	11.01	0.62928	1	BP
GO:0007346	regulation of mitotic cell cycle	188	3	3.2	0.63188	1	BP
GO:0048736	appendage development	124	2	2.11	0.63268	1	BP
GO:0045665	negative regulation of neuron differenti...	58	1	0.99	0.63484	1	BP
GO:0009267	cellular response to starvation	58	1	0.99	0.63484	1	BP
GO:1901654	response to ketone	58	1	0.99	0.63484	1	BP
GO:0000302	response to reactive oxygen species	58	1	0.99	0.63484	1	BP
GO:0006366	transcription by RNA polymerase II	438	7	7.46	0.63638	1	BP
GO:0031323	regulation of cellular metabolic process	1087	19	18.52	0.641	1	BP
GO:0009948	anterior/posterior axis specification	59	1	1.01	0.6412	1	BP
GO:0051249	regulation of lymphocyte activation	59	1	1.01	0.6412	1	BP
GO:0110053	regulation of actin filament organizatio...	59	1	1.01	0.6412	1	BP
GO:0071241	cellular response to inorganic substance	59	1	1.01	0.6412	1	BP
GO:0051090	regulation of DNA-binding transcription ...	59	1	1.01	0.6412	1	BP
GO:0052548	regulation of endopeptidase activity	59	1	1.01	0.6412	1	BP
GO:0006338	chromatin remodeling	59	1	1.01	0.6412	1	BP
GO:0051604	protein maturation	59	1	1.01	0.6412	1	BP
GO:0008104	protein localization	619	12	10.55	0.64158	1	BP
GO:0044248	cellular catabolic process	526	10	8.96	0.64364	1	BP
GO:0033365	protein localization to organelle	255	4	4.34	0.64464	1	BP
GO:0005975	carbohydrate metabolic process	127	2	2.16	0.64589	1	BP
GO:0032446	protein modification by small protein co...	192	3	3.27	0.64644	1	BP
GO:0071103	DNA conformation change	60	1	1.02	0.64745	1	BP
GO:0090287	regulation of cellular response to growt...	60	1	1.02	0.64745	1	BP
GO:0021543	pallium development	60	1	1.02	0.64745	1	BP
GO:0001708	cell fate specification	60	1	1.02	0.64745	1	BP
GO:0031396	regulation of protein ubiquitination	60	1	1.02	0.64745	1	BP
GO:0051276	chromosome organization	319	5	5.43	0.64852	1	BP
GO:0061024	membrane organization	205	5	3.49	0.64875	1	BP
GO:0006979	response to oxidative stress	128	2	2.18	0.65022	1	BP
GO:1902115	regulation of organelle assembly	61	1	1.04	0.65359	1	BP
GO:0052547	regulation of peptidase activity	61	1	1.04	0.65359	1	BP
GO:0043543	protein acylation	61	1	1.04	0.65359	1	BP
GO:0006936	muscle contraction	61	1	1.04	0.65359	1	BP
GO:0072331	signal transduction by p53 class mediato...	61	1	1.04	0.65359	1	BP
GO:0051049	regulation of transport	384	6	6.54	0.6561	1	BP
GO:0006820	anion transport	130	2	2.21	0.65874	1	BP
GO:0050890	cognition	130	2	2.21	0.65874	1	BP
GO:0051258	protein polymerization	62	1	1.06	0.65963	1	BP
GO:0040013	negative regulation of locomotion	62	1	1.06	0.65963	1	BP
GO:0006611	protein export from nucleus	62	1	1.06	0.65963	1	BP
GO:0007350	blastoderm segmentation	62	1	1.06	0.65963	1	BP
GO:1901215	negative regulation of neuron death	62	1	1.06	0.65963	1	BP
GO:0099003	vesicle-mediated transport in synapse	62	1	1.06	0.65963	1	BP
GO:0043583	ear development	62	1	1.06	0.65963	1	BP
GO:0061919	process utilizing autophagic mechanism	131	2	2.23	0.66294	1	BP
GO:0002366	leukocyte activation involved in immune ...	131	2	2.23	0.66294	1	BP
GO:0006914	autophagy	131	2	2.23	0.66294	1	BP
GO:0022607	cellular component assembly	753	12	12.83	0.66295	1	BP
GO:0021915	neural tube development	63	1	1.07	0.66557	1	BP
GO:0032147	activation of protein kinase activity	63	1	1.07	0.66557	1	BP
GO:0007623	circadian rhythm	63	1	1.07	0.66557	1	BP
GO:0002263	cell activation involved in immune respo...	132	2	2.25	0.6671	1	BP
GO:1901564	organonitrogen compound metabolic proces...	1347	23	22.95	0.66836	1	BP
GO:0002443	leukocyte mediated immunity	133	2	2.27	0.67122	1	BP
GO:0071902	positive regulation of protein serine/th...	64	1	1.09	0.6714	1	BP
GO:0000086	G2/M transition of mitotic cell cycle	64	1	1.09	0.6714	1	BP
GO:0002764	immune response-regulating signaling pat...	64	1	1.09	0.6714	1	BP
GO:0006898	receptor-mediated endocytosis	65	1	1.11	0.67713	1	BP
GO:0006066	alcohol metabolic process	65	1	1.11	0.67713	1	BP
GO:0006915	apoptotic process	370	9	6.3	0.67832	1	BP
GO:0050769	positive regulation of neurogenesis	135	2	2.3	0.67935	1	BP
GO:0051236	establishment of RNA localization	66	1	1.12	0.68277	1	BP
GO:0051783	regulation of nuclear division	66	1	1.12	0.68277	1	BP
GO:0042110	T cell activation	66	1	1.12	0.68277	1	BP
GO:0006470	protein dephosphorylation	66	1	1.12	0.68277	1	BP
GO:0009612	response to mechanical stimulus	66	1	1.12	0.68277	1	BP
GO:0002831	regulation of response to biotic stimulu...	66	1	1.12	0.68277	1	BP
GO:0051146	striated muscle cell differentiation	66	1	1.12	0.68277	1	BP
GO:0071407	cellular response to organic cyclic comp...	136	2	2.32	0.68335	1	BP
GO:0008219	cell death	441	10	7.51	0.68419	1	BP
GO:0010629	negative regulation of gene expression	415	8	7.07	0.68606	1	BP
GO:0022613	ribonucleoprotein complex biogenesis	137	2	2.33	0.68731	1	BP
GO:0010256	endomembrane system organization	137	2	2.33	0.68731	1	BP
GO:0006955	immune response	269	4	4.58	0.68733	1	BP
GO:1901605	alpha-amino acid metabolic process	67	1	1.14	0.68831	1	BP
GO:0051168	nuclear export	67	1	1.14	0.68831	1	BP
GO:1902531	regulation of intracellular signal trans...	361	10	6.15	0.68996	1	BP
GO:0009888	tissue development	506	10	8.62	0.69008	1	BP
GO:1901987	regulation of cell cycle phase transitio...	138	2	2.35	0.69123	1	BP
GO:0007612	learning	68	1	1.16	0.69376	1	BP
GO:0032869	cellular response to insulin stimulus	68	1	1.16	0.69376	1	BP
GO:0009892	negative regulation of metabolic process	613	11	10.44	0.69404	1	BP
GO:0010648	negative regulation of cell communicatio...	336	5	5.72	0.69528	1	BP
GO:0010941	regulation of cell death	377	9	6.42	0.69561	1	BP
GO:0023057	negative regulation of signaling	337	5	5.74	0.6979	1	BP
GO:0046942	carboxylic acid transport	69	1	1.18	0.69911	1	BP
GO:0050954	sensory perception of mechanical stimulu...	69	1	1.18	0.69911	1	BP
GO:0044839	cell cycle G2/M phase transition	69	1	1.18	0.69911	1	BP
GO:0023052	signaling	1024	23	17.45	0.70171	1	BP
GO:0002694	regulation of leukocyte activation	70	1	1.19	0.70437	1	BP
GO:0044262	cellular carbohydrate metabolic process	70	1	1.19	0.70437	1	BP
GO:0045321	leukocyte activation	210	3	3.58	0.70707	1	BP
GO:0045597	positive regulation of cell differentiat...	210	3	3.58	0.70707	1	BP
GO:0009790	embryo development	423	11	7.21	0.70905	1	BP
GO:0031330	negative regulation of cellular cataboli...	71	1	1.21	0.70954	1	BP
GO:0009953	dorsal/ventral pattern formation	71	1	1.21	0.70954	1	BP
GO:1990778	protein localization to cell periphery	71	1	1.21	0.70954	1	BP
GO:0000082	G1/S transition of mitotic cell cycle	71	1	1.21	0.70954	1	BP
GO:0015849	organic acid transport	71	1	1.21	0.70954	1	BP
GO:0000280	nuclear division	143	2	2.44	0.71026	1	BP
GO:0007600	sensory perception	143	2	2.44	0.71026	1	BP
GO:0072657	protein localization to membrane	143	2	2.44	0.71026	1	BP
GO:1903320	regulation of protein modification by sm...	72	1	1.23	0.71462	1	BP
GO:0090305	nucleic acid phosphodiester bond hydroly...	72	1	1.23	0.71462	1	BP
GO:0042063	gliogenesis	72	1	1.23	0.71462	1	BP
GO:0010605	negative regulation of macromolecule met...	559	10	9.52	0.71573	1	BP
GO:0002682	regulation of immune system process	213	3	3.63	0.7164	1	BP
GO:0044089	positive regulation of cellular componen...	145	2	2.47	0.7176	1	BP
GO:0042981	regulation of apoptotic process	316	8	5.38	0.71864	1	BP
GO:0032103	positive regulation of response to exter...	73	1	1.24	0.71962	1	BP
GO:0034599	cellular response to oxidative stress	73	1	1.24	0.71962	1	BP
GO:0050865	regulation of cell activation	73	1	1.24	0.71962	1	BP
GO:0007389	pattern specification process	215	3	3.66	0.7225	1	BP
GO:0030334	regulation of cell migration	147	2	2.5	0.72479	1	BP
GO:0040012	regulation of locomotion	217	3	3.7	0.72849	1	BP
GO:0006355	regulation of transcription, DNA-templat...	540	8	9.2	0.72875	1	BP
GO:0140013	meiotic nuclear division	75	1	1.28	0.72935	1	BP
GO:1903706	regulation of hemopoiesis	75	1	1.28	0.72935	1	BP
GO:0010628	positive regulation of gene expression	414	6	7.05	0.72977	1	BP
GO:0009880	embryonic pattern specification	76	1	1.29	0.7341	1	BP
GO:0032868	response to insulin	76	1	1.29	0.7341	1	BP
GO:0045732	positive regulation of protein catabolic...	76	1	1.29	0.7341	1	BP
GO:0050778	positive regulation of immune response	76	1	1.29	0.7341	1	BP
GO:0001775	cell activation	219	3	3.73	0.73439	1	BP
GO:0012501	programmed cell death	394	9	6.71	0.73509	1	BP
GO:0044772	mitotic cell cycle phase transition	150	2	2.56	0.7353	1	BP
GO:0040029	regulation of gene expression, epigeneti...	77	1	1.31	0.73876	1	BP
GO:0009895	negative regulation of catabolic process	77	1	1.31	0.73876	1	BP
GO:0044843	cell cycle G1/S phase transition	77	1	1.31	0.73876	1	BP
GO:0048813	dendrite morphogenesis	77	1	1.31	0.73876	1	BP
GO:0048511	rhythmic process	77	1	1.31	0.73876	1	BP
GO:0050878	regulation of body fluid levels	77	1	1.31	0.73876	1	BP
GO:0001822	kidney development	77	1	1.31	0.73876	1	BP
GO:0034097	response to cytokine	165	4	2.81	0.74081	1	BP
GO:0045055	regulated exocytosis	152	2	2.59	0.74211	1	BP
GO:0030707	ovarian follicle cell development	78	1	1.33	0.74334	1	BP
GO:0006631	fatty acid metabolic process	78	1	1.33	0.74334	1	BP
GO:0097193	intrinsic apoptotic signaling pathway	78	1	1.33	0.74334	1	BP
GO:0031669	cellular response to nutrient levels	78	1	1.33	0.74334	1	BP
GO:0031667	response to nutrient levels	153	2	2.61	0.74547	1	BP
GO:0071704	organic substance metabolic process	1982	34	33.77	0.7477	1	BP
GO:0001701	in utero embryonic development	79	1	1.35	0.74784	1	BP
GO:2000145	regulation of cell motility	155	2	2.64	0.75207	1	BP
GO:0015931	nucleobase-containing compound transport	80	1	1.36	0.75227	1	BP
GO:0003012	muscle system process	80	1	1.36	0.75227	1	BP
GO:0043067	regulation of programmed cell death	330	8	5.62	0.75228	1	BP
GO:2001141	regulation of RNA biosynthetic process	553	8	9.42	0.75474	1	BP
GO:1903506	regulation of nucleic acid-templated tra...	553	8	9.42	0.75474	1	BP
GO:0051222	positive regulation of protein transport	81	1	1.38	0.75662	1	BP
GO:0046879	hormone secretion	81	1	1.38	0.75662	1	BP
GO:0031647	regulation of protein stability	81	1	1.38	0.75662	1	BP
GO:0009893	positive regulation of metabolic process	712	12	12.13	0.75924	1	BP
GO:0016043	cellular component organization	1406	24	23.95	0.76051	1	BP
GO:0010720	positive regulation of cell development	158	2	2.69	0.7617	1	BP
GO:0045893	positive regulation of transcription, DN...	298	4	5.08	0.76442	1	BP
GO:1901137	carbohydrate derivative biosynthetic pro...	159	2	2.71	0.76484	1	BP
GO:0045926	negative regulation of growth	83	1	1.41	0.76509	1	BP
GO:0010976	positive regulation of neuron projection...	83	1	1.41	0.76509	1	BP
GO:0048639	positive regulation of developmental gro...	83	1	1.41	0.76509	1	BP
GO:0010557	positive regulation of macromolecule bio...	365	5	6.22	0.76534	1	BP
GO:0061061	muscle structure development	160	2	2.73	0.76794	1	BP
GO:0009991	response to extracellular stimulus	160	2	2.73	0.76794	1	BP
GO:0000209	protein polyubiquitination	84	1	1.43	0.76922	1	BP
GO:1903532	positive regulation of secretion by cell	84	1	1.43	0.76922	1	BP
GO:0045184	establishment of protein localization	434	6	7.39	0.7727	1	BP
GO:0009914	hormone transport	85	1	1.45	0.77328	1	BP
GO:1904951	positive regulation of establishment of ...	85	1	1.45	0.77328	1	BP
GO:0019932	second-messenger-mediated signaling	85	1	1.45	0.77328	1	BP
GO:0080090	regulation of primary metabolic process	1040	17	17.72	0.77425	1	BP
GO:0007568	aging	163	2	2.78	0.77705	1	BP
GO:0098609	cell-cell adhesion	86	1	1.47	0.77727	1	BP
GO:0031668	cellular response to extracellular stimu...	86	1	1.47	0.77727	1	BP
GO:0048583	regulation of response to stimulus	764	15	13.02	0.78035	1	BP
GO:0062197	cellular response to chemical stress	87	1	1.48	0.78119	1	BP
GO:0007015	actin filament organization	88	1	1.5	0.78504	1	BP
GO:0051047	positive regulation of secretion	88	1	1.5	0.78504	1	BP
GO:0001101	response to acid chemical	88	1	1.5	0.78504	1	BP
GO:0019216	regulation of lipid metabolic process	88	1	1.5	0.78504	1	BP
GO:0048562	embryonic organ morphogenesis	88	1	1.5	0.78504	1	BP
GO:0090407	organophosphate biosynthetic process	166	2	2.83	0.78586	1	BP
GO:0044085	cellular component biogenesis	822	12	14	0.78866	1	BP
GO:0043010	camera-type eye development	89	1	1.52	0.78882	1	BP
GO:0009653	anatomical structure morphogenesis	666	13	11.35	0.78997	1	BP
GO:0043436	oxoacid metabolic process	240	3	4.09	0.79057	1	BP
GO:1903508	positive regulation of nucleic acid-temp...	310	4	5.28	0.79187	1	BP
GO:1902680	positive regulation of RNA biosynthetic ...	310	4	5.28	0.79187	1	BP
GO:0010038	response to metal ion	90	1	1.53	0.79255	1	BP
GO:0062012	regulation of small molecule metabolic p...	90	1	1.53	0.79255	1	BP
GO:0003008	system process	378	5	6.44	0.79273	1	BP
GO:0007166	cell surface receptor signaling pathway	481	10	8.19	0.79449	1	BP
GO:0034976	response to endoplasmic reticulum stress	91	1	1.55	0.7962	1	BP
GO:0043414	macromolecule methylation	91	1	1.55	0.7962	1	BP
GO:0001666	response to hypoxia	91	1	1.55	0.7962	1	BP
GO:0010506	regulation of autophagy	92	1	1.57	0.79979	1	BP
GO:0050708	regulation of protein secretion	92	1	1.57	0.79979	1	BP
GO:0006082	organic acid metabolic process	244	3	4.16	0.80012	1	BP
GO:0051668	localization within membrane	172	2	2.93	0.80258	1	BP
GO:0006520	cellular amino acid metabolic process	93	1	1.58	0.80333	1	BP
GO:0035282	segmentation	93	1	1.58	0.80333	1	BP
GO:0019222	regulation of metabolic process	1186	19	20.21	0.80466	1	BP
GO:0044237	cellular metabolic process	1990	33	33.9	0.80539	1	BP
GO:0009952	anterior/posterior pattern specification	94	1	1.6	0.8068	1	BP
GO:0000398	mRNA splicing, via spliceosome	94	1	1.6	0.8068	1	BP
GO:0000375	RNA splicing, via transesterification re...	94	1	1.6	0.8068	1	BP
GO:0000377	RNA splicing, via transesterification re...	94	1	1.6	0.8068	1	BP
GO:0006887	exocytosis	175	2	2.98	0.81051	1	BP
GO:0031328	positive regulation of cellular biosynth...	388	5	6.61	0.81213	1	BP
GO:0042127	regulation of cell population proliferat...	307	7	5.23	0.81669	1	BP
GO:0030855	epithelial cell differentiation	191	4	3.25	0.81913	1	BP
GO:0043170	macromolecule metabolic process	1696	28	28.89	0.81917	1	BP
GO:0048193	Golgi vesicle transport	98	1	1.67	0.82009	1	BP
GO:0051171	regulation of nitrogen compound metaboli...	1010	16	17.21	0.82154	1	BP
GO:0006417	regulation of translation	105	3	1.79	0.82214	1	BP
GO:0008340	determination of adult lifespan	99	1	1.69	0.82327	1	BP
GO:0002066	columnar/cuboidal epithelial cell develo...	99	1	1.69	0.82327	1	BP
GO:0009891	positive regulation of biosynthetic proc...	396	5	6.75	0.82663	1	BP
GO:0060255	regulation of macromolecule metabolic pr...	1078	17	18.37	0.82763	1	BP
GO:0099177	regulation of trans-synaptic signaling	101	1	1.72	0.82947	1	BP
GO:0050804	modulation of chemical synaptic transmis...	101	1	1.72	0.82947	1	BP
GO:0071840	cellular component organization or bioge...	1456	24	24.81	0.82973	1	BP
GO:0051270	regulation of cellular component movemen...	184	2	3.13	0.83267	1	BP
GO:0044770	cell cycle phase transition	184	2	3.13	0.83267	1	BP
GO:0007154	cell communication	1035	22	17.63	0.83309	1	BP
GO:0071702	organic substance transport	535	7	9.11	0.83524	1	BP
GO:0002791	regulation of peptide secretion	103	1	1.75	0.83545	1	BP
GO:0010259	multicellular organism aging	103	1	1.75	0.83545	1	BP
GO:0042119	neutrophil activation	104	1	1.77	0.83836	1	BP
GO:0036230	granulocyte activation	104	1	1.77	0.83836	1	BP
GO:0002283	neutrophil activation involved in immune...	104	1	1.77	0.83836	1	BP
GO:0043312	neutrophil degranulation	104	1	1.77	0.83836	1	BP
GO:0002446	neutrophil mediated immunity	105	1	1.79	0.84123	1	BP
GO:0048568	embryonic organ development	129	4	2.2	0.84503	1	BP
GO:0006913	nucleocytoplasmic transport	107	1	1.82	0.84681	1	BP
GO:0090596	sensory organ morphogenesis	129	4	2.2	0.84751	1	BP
GO:0006605	protein targeting	108	1	1.84	0.84953	1	BP
GO:0051169	nuclear transport	109	1	1.86	0.8522	1	BP
GO:0031346	positive regulation of cell projection o...	109	1	1.86	0.8522	1	BP
GO:0048856	anatomical structure development	1287	25	21.93	0.85383	1	BP
GO:0050877	nervous system process	270	3	4.6	0.85391	1	BP
GO:0009628	response to abiotic stimulus	363	6	6.18	0.85424	1	BP
GO:0051052	regulation of DNA metabolic process	111	1	1.89	0.8574	1	BP
GO:0009987	cellular process	2635	45	44.89	0.85835	1	BP
GO:0016570	histone modification	112	1	1.91	0.85993	1	BP
GO:0006325	chromatin organization	197	2	3.36	0.86066	1	BP
GO:0048522	positive regulation of cellular process	1026	17	17.48	0.86163	1	BP
GO:0034470	ncRNA processing	113	1	1.93	0.86242	1	BP
GO:0008152	metabolic process	2058	34	35.06	0.8633	1	BP
GO:0019637	organophosphate metabolic process	276	3	4.7	0.86443	1	BP
GO:0002684	positive regulation of immune system pro...	114	1	1.94	0.86487	1	BP
GO:0045927	positive regulation of growth	115	1	1.96	0.86727	1	BP
