GO.ID	Term	Annotated	Significant	Expected	pval_test	pval_adj	ontology
GO:0099518	vesicle cytoskeletal trafficking	15	1	0.35	0.29888	1	BP
GO:0015914	phospholipid transport	15	1	0.35	0.29888	1	BP
GO:0017158	regulation of calcium ion-dependent exoc...	15	1	0.35	0.29888	1	BP
GO:0071230	cellular response to amino acid stimulus	15	1	0.35	0.29888	1	BP
GO:0086001	cardiac muscle cell action potential	15	1	0.35	0.29888	1	BP
GO:0009247	glycolipid biosynthetic process	15	1	0.35	0.29888	1	BP
GO:0032410	negative regulation of transporter activ...	15	1	0.35	0.29888	1	BP
GO:0045739	positive regulation of DNA repair	15	1	0.35	0.29888	1	BP
GO:0061180	mammary gland epithelium development	15	1	0.35	0.29888	1	BP
GO:0071674	mononuclear cell migration	15	1	0.35	0.29888	1	BP
GO:0000245	spliceosomal complex assembly	15	1	0.35	0.29888	1	BP
GO:0050850	positive regulation of calcium-mediated ...	15	1	0.35	0.29888	1	BP
GO:0021795	cerebral cortex cell migration	15	1	0.35	0.29888	1	BP
GO:0006940	regulation of smooth muscle contraction	15	1	0.35	0.29888	1	BP
GO:0007530	sex determination	15	1	0.35	0.29888	1	BP
GO:0048641	regulation of skeletal muscle tissue dev...	15	1	0.35	0.29888	1	BP
GO:1900368	regulation of post-transcriptional gene ...	15	1	0.35	0.29888	1	BP
GO:0099175	regulation of postsynapse organization	15	1	0.35	0.29888	1	BP
GO:0003208	cardiac ventricle morphogenesis	15	1	0.35	0.29888	1	BP
GO:0061515	myeloid cell development	15	1	0.35	0.29888	1	BP
GO:0070534	protein K63-linked ubiquitination	15	1	0.35	0.29888	1	BP
GO:0043038	amino acid activation	15	1	0.35	0.29888	1	BP
GO:0060147	regulation of post-transcriptional gene ...	15	1	0.35	0.29888	1	BP
GO:0006296	nucleotide-excision repair, DNA incision...	15	1	0.35	0.29888	1	BP
GO:0051279	regulation of release of sequestered cal...	15	1	0.35	0.29888	1	BP
GO:0032008	positive regulation of TOR signaling	15	1	0.35	0.29888	1	BP
GO:0055021	regulation of cardiac muscle tissue grow...	15	1	0.35	0.29888	1	BP
GO:0051252	regulation of RNA metabolic process	616	18	14.37	0.29981	1	BP
GO:0022612	gland morphogenesis	47	2	1.1	0.30039	1	BP
GO:0032496	response to lipopolysaccharide	47	2	1.1	0.30039	1	BP
GO:0098876	vesicle-mediated transport to the plasma...	47	2	1.1	0.30039	1	BP
GO:0048640	negative regulation of developmental gro...	47	2	1.1	0.30039	1	BP
GO:0001101	response to acid chemical	88	5	2.05	0.30164	1	BP
GO:0048017	inositol lipid-mediated signaling	31	4	0.72	0.30415	1	BP
GO:0042692	muscle cell differentiation	83	3	1.94	0.30558	1	BP
GO:0031326	regulation of cellular biosynthetic proc...	718	21	16.75	0.30579	1	BP
GO:0007611	learning or memory	120	4	2.8	0.30633	1	BP
GO:0009719	response to endogenous stimulus	363	15	8.47	0.30722	1	BP
GO:0002822	regulation of adaptive immune response b...	20	3	0.47	0.30734	1	BP
GO:0012501	programmed cell death	394	11	9.19	0.30744	1	BP
GO:0042593	glucose homeostasis	62	5	1.45	0.30764	1	BP
GO:0032409	regulation of transporter activity	48	2	1.12	0.30911	1	BP
GO:0060359	response to ammonium ion	48	2	1.12	0.30911	1	BP
GO:0043207	response to external biotic stimulus	208	8	4.85	0.30946	1	BP
GO:0051707	response to other organism	208	8	4.85	0.30946	1	BP
GO:0043410	positive regulation of MAPK cascade	84	3	1.96	0.31206	1	BP
GO:0008361	regulation of cell size	84	3	1.96	0.31206	1	BP
GO:0048588	developmental cell growth	84	3	1.96	0.31206	1	BP
GO:0009967	positive regulation of signal transducti...	295	11	6.88	0.31494	1	BP
GO:0051897	positive regulation of protein kinase B ...	16	1	0.37	0.31533	1	BP
GO:1901983	regulation of protein acetylation	16	1	0.37	0.31533	1	BP
GO:0071277	cellular response to calcium ion	16	1	0.37	0.31533	1	BP
GO:0044091	membrane biogenesis	16	1	0.37	0.31533	1	BP
GO:0010470	regulation of gastrulation	16	1	0.37	0.31533	1	BP
GO:0034766	negative regulation of ion transmembrane...	16	1	0.37	0.31533	1	BP
GO:0032465	regulation of cytokinesis	16	1	0.37	0.31533	1	BP
GO:0033077	T cell differentiation in thymus	16	1	0.37	0.31533	1	BP
GO:0097006	regulation of plasma lipoprotein particl...	16	1	0.37	0.31533	1	BP
GO:0045844	positive regulation of striated muscle t...	16	1	0.37	0.31533	1	BP
GO:0044380	protein localization to cytoskeleton	16	1	0.37	0.31533	1	BP
GO:0050775	positive regulation of dendrite morphoge...	16	1	0.37	0.31533	1	BP
GO:0060998	regulation of dendritic spine developmen...	16	1	0.37	0.31533	1	BP
GO:0051930	regulation of sensory perception of pain	16	1	0.37	0.31533	1	BP
GO:2000179	positive regulation of neural precursor ...	16	1	0.37	0.31533	1	BP
GO:0048582	positive regulation of post-embryonic de...	16	1	0.37	0.31533	1	BP
GO:0035162	embryonic hemopoiesis	16	1	0.37	0.31533	1	BP
GO:0043536	positive regulation of blood vessel endo...	16	1	0.37	0.31533	1	BP
GO:0048679	regulation of axon regeneration	16	1	0.37	0.31533	1	BP
GO:0035262	gonad morphogenesis	16	1	0.37	0.31533	1	BP
GO:1901863	positive regulation of muscle tissue dev...	16	1	0.37	0.31533	1	BP
GO:0019985	translesion synthesis	16	1	0.37	0.31533	1	BP
GO:0070570	regulation of neuron projection regenera...	16	1	0.37	0.31533	1	BP
GO:0007031	peroxisome organization	16	1	0.37	0.31533	1	BP
GO:0070509	calcium ion import	16	1	0.37	0.31533	1	BP
GO:0006120	mitochondrial electron transport, NADH t...	16	1	0.37	0.31533	1	BP
GO:0051049	regulation of transport	384	18	8.96	0.3163	1	BP
GO:0061061	muscle structure development	160	5	3.73	0.31678	1	BP
GO:0071248	cellular response to metal ion	49	2	1.14	0.31781	1	BP
GO:0060041	retina development in camera-type eye	49	2	1.14	0.31781	1	BP
GO:2000116	regulation of cysteine-type endopeptidas...	49	2	1.14	0.31781	1	BP
GO:0030705	cytoskeleton-dependent intracellular tra...	49	2	1.14	0.31781	1	BP
GO:1902275	regulation of chromatin organization	49	2	1.14	0.31781	1	BP
GO:0009268	response to pH	20	3	0.47	0.323	1	BP
GO:0002819	regulation of adaptive immune response	21	3	0.49	0.3231	1	BP
GO:0050866	negative regulation of cell activation	23	3	0.54	0.3233	1	BP
GO:0007610	behavior	319	9	7.44	0.32397	1	BP
GO:0009889	regulation of biosynthetic process	726	21	16.94	0.3248	1	BP
GO:0006874	cellular calcium ion homeostasis	86	3	2.01	0.32504	1	BP
GO:0010876	lipid localization	86	3	2.01	0.32504	1	BP
GO:0043687	post-translational protein modification	86	3	2.01	0.32504	1	BP
GO:0032984	protein-containing complex disassembly	86	3	2.01	0.32504	1	BP
GO:0045785	positive regulation of cell adhesion	50	2	1.17	0.32648	1	BP
GO:0002237	response to molecule of bacterial origin	50	2	1.17	0.32648	1	BP
GO:0008306	associative learning	50	2	1.17	0.32648	1	BP
GO:0035303	regulation of dephosphorylation	50	2	1.17	0.32648	1	BP
GO:0008213	protein alkylation	50	2	1.17	0.32648	1	BP
GO:0006479	protein methylation	50	2	1.17	0.32648	1	BP
GO:0046661	male sex differentiation	50	2	1.17	0.32648	1	BP
GO:0008219	cell death	441	12	10.29	0.32729	1	BP
GO:0048707	instar larval or pupal morphogenesis	124	4	2.89	0.32785	1	BP
GO:0032535	regulation of cellular component size	124	4	2.89	0.32785	1	BP
GO:0071363	cellular response to growth factor stimu...	134	6	3.13	0.32899	1	BP
GO:0010646	regulation of cell communication	680	26	15.87	0.33034	1	BP
GO:0021954	central nervous system neuron developmen...	17	1	0.4	0.3314	1	BP
GO:0055007	cardiac muscle cell differentiation	17	1	0.4	0.3314	1	BP
GO:0051899	membrane depolarization	17	1	0.4	0.3314	1	BP
GO:0033683	nucleotide-excision repair, DNA incision	17	1	0.4	0.3314	1	BP
GO:0016574	histone ubiquitination	17	1	0.4	0.3314	1	BP
GO:0019228	neuronal action potential	17	1	0.4	0.3314	1	BP
GO:0060632	regulation of microtubule-based movement	17	1	0.4	0.3314	1	BP
GO:0001658	branching involved in ureteric bud morph...	17	1	0.4	0.3314	1	BP
GO:0050864	regulation of B cell activation	17	1	0.4	0.3314	1	BP
GO:0006984	ER-nucleus signaling pathway	17	1	0.4	0.3314	1	BP
GO:2000178	negative regulation of neural precursor ...	17	1	0.4	0.3314	1	BP
GO:0001938	positive regulation of endothelial cell ...	17	1	0.4	0.3314	1	BP
GO:0048636	positive regulation of muscle organ deve...	17	1	0.4	0.3314	1	BP
GO:0006493	protein O-linked glycosylation	17	1	0.4	0.3314	1	BP
GO:0046888	negative regulation of hormone secretion	17	1	0.4	0.3314	1	BP
GO:0090329	regulation of DNA-templated DNA replicat...	17	1	0.4	0.3314	1	BP
GO:0062149	detection of stimulus involved in sensor...	17	1	0.4	0.3314	1	BP
GO:0002062	chondrocyte differentiation	17	1	0.4	0.3314	1	BP
GO:0031338	regulation of vesicle fusion	17	1	0.4	0.3314	1	BP
GO:0036445	neuronal stem cell division	17	1	0.4	0.3314	1	BP
GO:0043966	histone H3 acetylation	17	1	0.4	0.3314	1	BP
GO:0000079	regulation of cyclin-dependent protein s...	17	1	0.4	0.3314	1	BP
GO:0060795	cell fate commitment involved in formati...	17	1	0.4	0.3314	1	BP
GO:0055057	neuroblast division	17	1	0.4	0.3314	1	BP
GO:1901019	regulation of calcium ion transmembrane ...	17	1	0.4	0.3314	1	BP
GO:0030072	peptide hormone secretion	65	5	1.52	0.33255	1	BP
GO:0051171	regulation of nitrogen compound metaboli...	1010	28	23.57	0.33297	1	BP
GO:0090304	nucleic acid metabolic process	973	26	22.7	0.33333	1	BP
GO:0007405	neuroblast proliferation	51	2	1.19	0.33513	1	BP
GO:0046328	regulation of JNK cascade	51	2	1.19	0.33513	1	BP
GO:0014070	response to organic cyclic compound	218	8	5.09	0.33541	1	BP
GO:0033554	cellular response to stress	546	16	12.74	0.33755	1	BP
GO:1903305	regulation of regulated secretory pathwa...	24	3	0.56	0.33872	1	BP
GO:0008104	protein localization	619	23	14.44	0.33895	1	BP
GO:0070848	response to growth factor	136	6	3.17	0.33948	1	BP
GO:0098660	inorganic ion transmembrane transport	165	5	3.85	0.34037	1	BP
GO:0033500	carbohydrate homeostasis	66	5	1.54	0.34081	1	BP
GO:0051674	localization of cell	324	9	7.56	0.34111	1	BP
GO:0048870	cell motility	324	9	7.56	0.34111	1	BP
GO:0030307	positive regulation of cell growth	52	2	1.21	0.34375	1	BP
GO:0051924	regulation of calcium ion transport	52	2	1.21	0.34375	1	BP
GO:0007033	vacuole organization	52	2	1.21	0.34375	1	BP
GO:0006405	RNA export from nucleus	52	2	1.21	0.34375	1	BP
GO:0071478	cellular response to radiation	52	2	1.21	0.34375	1	BP
GO:0007552	metamorphosis	127	4	2.96	0.34407	1	BP
GO:0055074	calcium ion homeostasis	89	3	2.08	0.34452	1	BP
GO:0048638	regulation of developmental growth	166	5	3.87	0.34511	1	BP
GO:0030001	metal ion transport	166	5	3.87	0.34511	1	BP
GO:0009607	response to biotic stimulus	217	8	5.06	0.34657	1	BP
GO:1904029	regulation of cyclin-dependent protein k...	18	1	0.42	0.3471	1	BP
GO:1903432	regulation of TORC1 signaling	18	1	0.42	0.3471	1	BP
GO:0007492	endoderm development	18	1	0.42	0.3471	1	BP
GO:1905268	negative regulation of chromatin organiz...	18	1	0.42	0.3471	1	BP
GO:0001892	embryonic placenta development	18	1	0.42	0.3471	1	BP
GO:0070936	protein K48-linked ubiquitination	18	1	0.42	0.3471	1	BP
GO:0048199	vesicle targeting, to, from or within Go...	18	1	0.42	0.3471	1	BP
GO:0043122	regulation of I-kappaB kinase/NF-kappaB ...	18	1	0.42	0.3471	1	BP
GO:0022029	telencephalon cell migration	18	1	0.42	0.3471	1	BP
GO:0046470	phosphatidylcholine metabolic process	18	1	0.42	0.3471	1	BP
GO:0000288	nuclear-transcribed mRNA catabolic proce...	18	1	0.42	0.3471	1	BP
GO:0050764	regulation of phagocytosis	18	1	0.42	0.3471	1	BP
GO:0045806	negative regulation of endocytosis	18	1	0.42	0.3471	1	BP
GO:0002700	regulation of production of molecular me...	18	1	0.42	0.3471	1	BP
GO:0051931	regulation of sensory perception	18	1	0.42	0.3471	1	BP
GO:0040024	dauer larval development	18	1	0.42	0.3471	1	BP
GO:0045638	negative regulation of myeloid cell diff...	18	1	0.42	0.3471	1	BP
GO:0021885	forebrain cell migration	18	1	0.42	0.3471	1	BP
GO:0046716	muscle cell cellular homeostasis	18	1	0.42	0.3471	1	BP
GO:0006301	postreplication repair	18	1	0.42	0.3471	1	BP
GO:0009950	dorsal/ventral axis specification	18	1	0.42	0.3471	1	BP
GO:0060420	regulation of heart growth	18	1	0.42	0.3471	1	BP
GO:0030500	regulation of bone mineralization	18	1	0.42	0.3471	1	BP
GO:0070542	response to fatty acid	18	1	0.42	0.3471	1	BP
GO:1902107	positive regulation of leukocyte differe...	18	1	0.42	0.3471	1	BP
GO:0043967	histone H4 acetylation	18	1	0.42	0.3471	1	BP
GO:0090102	cochlea development	18	1	0.42	0.3471	1	BP
GO:0034198	cellular response to amino acid starvati...	18	1	0.42	0.3471	1	BP
GO:0055017	cardiac muscle tissue growth	18	1	0.42	0.3471	1	BP
GO:0048477	oogenesis	206	6	4.81	0.34811	1	BP
GO:0006811	ion transport	298	10	6.95	0.34872	1	BP
GO:0070647	protein modification by small protein co...	246	7	5.74	0.34915	1	BP
GO:0023051	regulation of signaling	688	26	16.05	0.34923	1	BP
GO:0030900	forebrain development	107	6	2.5	0.35074	1	BP
GO:0072503	cellular divalent inorganic cation homeo...	90	3	2.1	0.35101	1	BP
GO:0000278	mitotic cell cycle	327	9	7.63	0.35148	1	BP
GO:0031331	positive regulation of cellular cataboli...	122	8	2.85	0.35191	1	BP
GO:0006643	membrane lipid metabolic process	53	2	1.24	0.35234	1	BP
GO:0046434	organophosphate catabolic process	53	2	1.24	0.35234	1	BP
GO:0050821	protein stabilization	53	2	1.24	0.35234	1	BP
GO:0002285	lymphocyte activation involved in immune...	23	3	0.54	0.35358	1	BP
GO:0010556	regulation of macromolecule biosynthetic...	680	19	15.87	0.35378	1	BP
GO:0080090	regulation of primary metabolic process	1040	29	24.27	0.35482	1	BP
GO:0009267	cellular response to starvation	58	4	1.35	0.35502	1	BP
GO:0009968	negative regulation of signal transducti...	303	10	7.07	0.35705	1	BP
GO:0033043	regulation of organelle organization	329	9	7.68	0.35842	1	BP
GO:0098655	cation transmembrane transport	169	5	3.94	0.35937	1	BP
GO:0016477	cell migration	289	8	6.74	0.36004	1	BP
GO:0050890	cognition	130	4	3.03	0.36033	1	BP
GO:0001754	eye photoreceptor cell differentiation	54	2	1.26	0.36089	1	BP
GO:0045892	negative regulation of transcription, DN...	249	7	5.81	0.361	1	BP
GO:0031327	negative regulation of cellular biosynth...	330	9	7.7	0.3619	1	BP
GO:1990928	response to amino acid starvation	19	1	0.44	0.36244	1	BP
GO:0051646	mitochondrion localization	19	1	0.44	0.36244	1	BP
GO:0045833	negative regulation of lipid metabolic p...	19	1	0.44	0.36244	1	BP
GO:1903524	positive regulation of blood circulation	19	1	0.44	0.36244	1	BP
GO:0060966	regulation of gene silencing by RNA	19	1	0.44	0.36244	1	BP
GO:0035195	miRNA-mediated gene silencing	19	1	0.44	0.36244	1	BP
GO:0043535	regulation of blood vessel endothelial c...	19	1	0.44	0.36244	1	BP
GO:0043507	positive regulation of JUN kinase activi...	19	1	0.44	0.36244	1	BP
GO:0007632	visual behavior	19	1	0.44	0.36244	1	BP
GO:0022416	chaeta development	19	1	0.44	0.36244	1	BP
GO:1903076	regulation of protein localization to pl...	19	1	0.44	0.36244	1	BP
GO:0033260	nuclear DNA replication	19	1	0.44	0.36244	1	BP
GO:0051489	regulation of filopodium assembly	19	1	0.44	0.36244	1	BP
GO:0060411	cardiac septum morphogenesis	19	1	0.44	0.36244	1	BP
GO:0002090	regulation of receptor internalization	19	1	0.44	0.36244	1	BP
GO:0051153	regulation of striated muscle cell diffe...	19	1	0.44	0.36244	1	BP
GO:0042446	hormone biosynthetic process	19	1	0.44	0.36244	1	BP
GO:0055024	regulation of cardiac muscle tissue deve...	19	1	0.44	0.36244	1	BP
GO:0010906	regulation of glucose metabolic process	27	4	0.63	0.36381	1	BP
GO:0016032	viral process	92	3	2.15	0.36397	1	BP
GO:0010631	epithelial cell migration	92	3	2.15	0.36397	1	BP
GO:0071496	cellular response to external stimulus	98	5	2.29	0.36454	1	BP
GO:0006641	triglyceride metabolic process	23	3	0.54	0.3682	1	BP
GO:0002460	adaptive immune response based on somati...	24	3	0.56	0.36831	1	BP
GO:0050851	antigen receptor-mediated signaling path...	26	3	0.61	0.36853	1	BP
GO:0008543	fibroblast growth factor receptor signal...	26	3	0.61	0.36853	1	BP
GO:0009890	negative regulation of biosynthetic proc...	332	9	7.75	0.36888	1	BP
GO:0006869	lipid transport	55	2	1.28	0.3694	1	BP
GO:0061640	cytoskeleton-dependent cytokinesis	55	2	1.28	0.3694	1	BP
GO:1904062	regulation of cation transmembrane trans...	55	2	1.28	0.3694	1	BP
GO:1901701	cellular response to oxygen-containing c...	236	11	5.51	0.37107	1	BP
GO:0061351	neural precursor cell proliferation	71	5	1.66	0.37369	1	BP
GO:0034645	cellular macromolecule biosynthetic proc...	916	23	21.37	0.37617	1	BP
GO:1902679	negative regulation of RNA biosynthetic ...	253	7	5.9	0.37687	1	BP
GO:1903507	negative regulation of nucleic acid-temp...	253	7	5.9	0.37687	1	BP
GO:0060560	developmental growth involved in morphog...	94	3	2.19	0.3769	1	BP
GO:0090132	epithelium migration	94	3	2.19	0.3769	1	BP
GO:0010332	response to gamma radiation	20	1	0.47	0.37742	1	BP
GO:0031646	positive regulation of nervous system pr...	20	1	0.47	0.37742	1	BP
GO:0006939	smooth muscle contraction	20	1	0.47	0.37742	1	BP
GO:0001936	regulation of endothelial cell prolifera...	20	1	0.47	0.37742	1	BP
GO:0043666	regulation of phosphoprotein phosphatase...	20	1	0.47	0.37742	1	BP
GO:0035249	synaptic transmission, glutamatergic	20	1	0.47	0.37742	1	BP
GO:0042491	inner ear auditory receptor cell differe...	20	1	0.47	0.37742	1	BP
GO:0046662	regulation of oviposition	20	1	0.47	0.37742	1	BP
GO:0010923	negative regulation of phosphatase activ...	20	1	0.47	0.37742	1	BP
GO:0060828	regulation of canonical Wnt signaling pa...	56	2	1.31	0.37787	1	BP
GO:0008593	regulation of Notch signaling pathway	56	2	1.31	0.37787	1	BP
GO:0010564	regulation of cell cycle process	213	6	4.97	0.37821	1	BP
GO:0006950	response to stress	807	23	18.83	0.38144	1	BP
GO:0098657	import into cell	134	4	3.13	0.38201	1	BP
GO:0030003	cellular cation homeostasis	134	4	3.13	0.38201	1	BP
GO:0090066	regulation of anatomical structure size	174	5	4.06	0.38319	1	BP
GO:0090130	tissue migration	95	3	2.22	0.38335	1	BP
GO:0032879	regulation of localization	550	21	12.83	0.38433	1	BP
GO:0019219	regulation of nucleobase-containing comp...	693	19	16.17	0.38725	1	BP
GO:0009636	response to toxic substance	135	4	3.15	0.38742	1	BP
GO:1903530	regulation of secretion by cell	160	12	3.73	0.3903	1	BP
GO:0034220	ion transmembrane transport	216	6	5.04	0.39116	1	BP
GO:0001824	blastocyst development	21	1	0.49	0.39206	1	BP
GO:0005977	glycogen metabolic process	21	1	0.49	0.39206	1	BP
GO:0072384	organelle transport along microtubule	21	1	0.49	0.39206	1	BP
GO:0044042	glucan metabolic process	21	1	0.49	0.39206	1	BP
GO:0048103	somatic stem cell division	21	1	0.49	0.39206	1	BP
GO:0045793	positive regulation of cell size	21	1	0.49	0.39206	1	BP
GO:0098722	asymmetric stem cell division	21	1	0.49	0.39206	1	BP
GO:0010257	NADH dehydrogenase complex assembly	21	1	0.49	0.39206	1	BP
GO:0006073	cellular glucan metabolic process	21	1	0.49	0.39206	1	BP
GO:0070167	regulation of biomineral tissue developm...	21	1	0.49	0.39206	1	BP
GO:0000731	DNA synthesis involved in DNA repair	21	1	0.49	0.39206	1	BP
GO:0001935	endothelial cell proliferation	21	1	0.49	0.39206	1	BP
GO:0110149	regulation of biomineralization	21	1	0.49	0.39206	1	BP
GO:0072583	clathrin-dependent endocytosis	21	1	0.49	0.39206	1	BP
GO:0050680	negative regulation of epithelial cell p...	21	1	0.49	0.39206	1	BP
GO:0046889	positive regulation of lipid biosyntheti...	21	1	0.49	0.39206	1	BP
GO:0060419	heart growth	21	1	0.49	0.39206	1	BP
GO:0032981	mitochondrial respiratory chain complex ...	21	1	0.49	0.39206	1	BP
GO:0061041	regulation of wound healing	21	1	0.49	0.39206	1	BP
GO:0051603	proteolysis involved in cellular protein...	176	5	4.11	0.39273	1	BP
GO:0099643	signal release from synapse	58	2	1.35	0.39467	1	BP
GO:0007269	neurotransmitter secretion	58	2	1.35	0.39467	1	BP
GO:0051963	regulation of synapse assembly	58	2	1.35	0.39467	1	BP
GO:2001020	regulation of response to DNA damage sti...	58	2	1.35	0.39467	1	BP
GO:0001568	blood vessel development	97	3	2.26	0.39621	1	BP
GO:0050803	regulation of synapse structure or activ...	97	3	2.26	0.39621	1	BP
GO:0072507	divalent inorganic cation homeostasis	97	3	2.26	0.39621	1	BP
GO:0033036	macromolecule localization	690	24	16.1	0.3966	1	BP
GO:0002703	regulation of leukocyte mediated immunit...	28	3	0.65	0.39702	1	BP
GO:0022408	negative regulation of cell-cell adhesio...	28	3	0.65	0.39702	1	BP
GO:0022613	ribonucleoprotein complex biogenesis	137	4	3.2	0.39823	1	BP
GO:0045786	negative regulation of cell cycle	137	4	3.2	0.39823	1	BP
GO:0048193	Golgi vesicle transport	98	3	2.29	0.40261	1	BP
GO:0006644	phospholipid metabolic process	98	3	2.29	0.40261	1	BP
GO:0045471	response to ethanol	59	2	1.38	0.403	1	BP
GO:0071241	cellular response to inorganic substance	59	2	1.38	0.403	1	BP
GO:0007254	JNK cascade	59	2	1.38	0.403	1	BP
GO:0051604	protein maturation	59	2	1.38	0.403	1	BP
GO:0052548	regulation of endopeptidase activity	59	2	1.38	0.403	1	BP
GO:0006338	chromatin remodeling	59	2	1.38	0.403	1	BP
GO:0006469	negative regulation of protein kinase ac...	59	2	1.38	0.403	1	BP
GO:0044267	cellular protein metabolic process	1049	27	24.48	0.40374	1	BP
GO:0009605	response to external stimulus	526	18	12.27	0.40423	1	BP
GO:1903429	regulation of cell maturation	22	1	0.51	0.40635	1	BP
GO:0009409	response to cold	22	1	0.51	0.40635	1	BP
GO:0038093	Fc receptor signaling pathway	22	1	0.51	0.40635	1	BP
GO:0003073	regulation of systemic arterial blood pr...	22	1	0.51	0.40635	1	BP
GO:0007249	I-kappaB kinase/NF-kappaB signaling	22	1	0.51	0.40635	1	BP
GO:0061157	mRNA destabilization	22	1	0.51	0.40635	1	BP
GO:0019646	aerobic electron transport chain	22	1	0.51	0.40635	1	BP
GO:0050779	RNA destabilization	22	1	0.51	0.40635	1	BP
GO:0006959	humoral immune response	22	1	0.51	0.40635	1	BP
GO:0050870	positive regulation of T cell activation	22	1	0.51	0.40635	1	BP
GO:2001021	negative regulation of response to DNA d...	22	1	0.51	0.40635	1	BP
GO:0006497	protein lipidation	22	1	0.51	0.40635	1	BP
GO:0046847	filopodium assembly	22	1	0.51	0.40635	1	BP
GO:0044728	DNA methylation or demethylation	22	1	0.51	0.40635	1	BP
GO:0046546	development of primary male sexual chara...	22	1	0.51	0.40635	1	BP
GO:0008584	male gonad development	22	1	0.51	0.40635	1	BP
GO:0035567	non-canonical Wnt signaling pathway	22	1	0.51	0.40635	1	BP
GO:0042158	lipoprotein biosynthetic process	22	1	0.51	0.40635	1	BP
GO:1903321	negative regulation of protein modificat...	22	1	0.51	0.40635	1	BP
GO:0031100	animal organ regeneration	22	1	0.51	0.40635	1	BP
GO:0042246	tissue regeneration	22	1	0.51	0.40635	1	BP
GO:0061014	positive regulation of mRNA catabolic pr...	22	1	0.51	0.40635	1	BP
GO:0051701	biological process involved in interacti...	22	1	0.51	0.40635	1	BP
GO:0002165	instar larval or pupal development	139	4	3.24	0.40902	1	BP
GO:0006638	neutral lipid metabolic process	26	3	0.61	0.41043	1	BP
GO:0006639	acylglycerol metabolic process	26	3	0.61	0.41043	1	BP
GO:0002250	adaptive immune response	27	3	0.63	0.41055	1	BP
GO:0070302	regulation of stress-activated protein k...	60	2	1.4	0.41127	1	BP
GO:1903828	negative regulation of protein localizat...	60	2	1.4	0.41127	1	BP
GO:0032872	regulation of stress-activated MAPK casc...	60	2	1.4	0.41127	1	BP
GO:0031396	regulation of protein ubiquitination	60	2	1.4	0.41127	1	BP
GO:0048468	cell development	673	21	15.7	0.41185	1	BP
GO:0050794	regulation of cellular process	1684	48	39.29	0.41254	1	BP
GO:0031323	regulation of cellular metabolic process	1087	31	25.36	0.41504	1	BP
GO:0007169	transmembrane receptor protein tyrosine ...	151	6	3.52	0.41825	1	BP
GO:0052547	regulation of peptidase activity	61	2	1.42	0.41949	1	BP
GO:1902115	regulation of organelle assembly	61	2	1.42	0.41949	1	BP
GO:0043065	positive regulation of apoptotic process	141	4	3.29	0.41978	1	BP
GO:0051046	regulation of secretion	172	12	4.01	0.41995	1	BP
GO:0034763	negative regulation of transmembrane tra...	23	1	0.54	0.42032	1	BP
GO:0090598	male anatomical structure morphogenesis	23	1	0.54	0.42032	1	BP
GO:0097061	dendritic spine organization	23	1	0.54	0.42032	1	BP
GO:0002761	regulation of myeloid leukocyte differen...	23	1	0.54	0.42032	1	BP
GO:1901185	negative regulation of ERBB signaling pa...	23	1	0.54	0.42032	1	BP
GO:0035305	negative regulation of dephosphorylation	23	1	0.54	0.42032	1	BP
GO:0042059	negative regulation of epidermal growth ...	23	1	0.54	0.42032	1	BP
GO:0060996	dendritic spine development	23	1	0.54	0.42032	1	BP
GO:0015748	organophosphate ester transport	23	1	0.54	0.42032	1	BP
GO:1903039	positive regulation of leukocyte cell-ce...	23	1	0.54	0.42032	1	BP
GO:0007062	sister chromatid cohesion	23	1	0.54	0.42032	1	BP
GO:1990542	mitochondrial transmembrane transport	23	1	0.54	0.42032	1	BP
GO:0106027	neuron projection organization	23	1	0.54	0.42032	1	BP
GO:0006112	energy reserve metabolic process	23	1	0.54	0.42032	1	BP
GO:0051209	release of sequestered calcium ion into ...	23	1	0.54	0.42032	1	BP
GO:0031103	axon regeneration	23	1	0.54	0.42032	1	BP
GO:0019222	regulation of metabolic process	1186	33	27.67	0.42165	1	BP
GO:2000113	negative regulation of cellular macromol...	306	8	7.14	0.4233	1	BP
GO:0006873	cellular ion homeostasis	142	4	3.31	0.42514	1	BP
GO:0042176	regulation of protein catabolic process	111	5	2.59	0.42739	1	BP
GO:0006611	protein export from nucleus	62	2	1.45	0.42766	1	BP
GO:0046530	photoreceptor cell differentiation	62	2	1.45	0.42766	1	BP
GO:0009266	response to temperature stimulus	102	3	2.38	0.42804	1	BP
GO:0018193	peptidyl-amino acid modification	266	7	6.21	0.42869	1	BP
GO:0009991	response to extracellular stimulus	160	8	3.73	0.42936	1	BP
GO:0019538	protein metabolic process	1104	28	25.76	0.43033	1	BP
GO:0045934	negative regulation of nucleobase-contai...	308	8	7.19	0.43076	1	BP
GO:0019226	transmission of nerve impulse	24	1	0.56	0.43396	1	BP
GO:1902692	regulation of neuroblast proliferation	24	1	0.56	0.43396	1	BP
GO:0071867	response to monoamine	24	1	0.56	0.43396	1	BP
GO:0061337	cardiac conduction	24	1	0.56	0.43396	1	BP
GO:0030433	ubiquitin-dependent ERAD pathway	24	1	0.56	0.43396	1	BP
GO:1900076	regulation of cellular response to insul...	24	1	0.56	0.43396	1	BP
GO:0043506	regulation of JUN kinase activity	24	1	0.56	0.43396	1	BP
GO:0032507	maintenance of protein location in cell	24	1	0.56	0.43396	1	BP
GO:0038202	TORC1 signaling	24	1	0.56	0.43396	1	BP
GO:0030510	regulation of BMP signaling pathway	24	1	0.56	0.43396	1	BP
GO:0060179	male mating behavior	24	1	0.56	0.43396	1	BP
GO:0046660	female sex differentiation	24	1	0.56	0.43396	1	BP
GO:0051289	protein homotetramerization	24	1	0.56	0.43396	1	BP
