GO.ID	Term	Annotated	Significant	Expected	pval_test	pval_adj	ontology
GO:0071345	cellular response to cytokine stimulus	26	4	2.23	0.1737	1	BP
GO:0060548	negative regulation of cell death	45	6	3.86	0.1742	1	BP
GO:0031175	neuron projection development	65	8	5.58	0.1742	1	BP
GO:0009791	post-embryonic development	55	7	4.72	0.1754	1	BP
GO:0048667	cell morphogenesis involved in neuron di...	55	7	4.72	0.1754	1	BP
GO:0072171	mesonephric tubule morphogenesis	9	2	0.77	0.1759	1	BP
GO:0046651	lymphocyte proliferation	9	2	0.77	0.1759	1	BP
GO:0032943	mononuclear cell proliferation	9	2	0.77	0.1759	1	BP
GO:0032944	regulation of mononuclear cell prolifera...	9	2	0.77	0.1759	1	BP
GO:0050670	regulation of lymphocyte proliferation	9	2	0.77	0.1759	1	BP
GO:0055123	digestive system development	9	2	0.77	0.1759	1	BP
GO:0014896	muscle hypertrophy	9	2	0.77	0.1759	1	BP
GO:0014897	striated muscle hypertrophy	9	2	0.77	0.1759	1	BP
GO:0001649	osteoblast differentiation	9	2	0.77	0.1759	1	BP
GO:0060675	ureteric bud morphogenesis	9	2	0.77	0.1759	1	BP
GO:0042113	B cell activation	9	2	0.77	0.1759	1	BP
GO:0003300	cardiac muscle hypertrophy	9	2	0.77	0.1759	1	BP
GO:0070661	leukocyte proliferation	9	2	0.77	0.1759	1	BP
GO:0070663	regulation of leukocyte proliferation	9	2	0.77	0.1759	1	BP
GO:0071774	response to fibroblast growth factor	9	2	0.77	0.1759	1	BP
GO:0060348	bone development	9	2	0.77	0.1759	1	BP
GO:0016202	regulation of striated muscle tissue dev...	9	2	0.77	0.1759	1	BP
GO:0002429	immune response-activating cell surface ...	9	2	0.77	0.1759	1	BP
GO:0072078	nephron tubule morphogenesis	9	2	0.77	0.1759	1	BP
GO:0019915	lipid storage	9	2	0.77	0.1759	1	BP
GO:0050920	regulation of chemotaxis	9	2	0.77	0.1759	1	BP
GO:0033002	muscle cell proliferation	9	2	0.77	0.1759	1	BP
GO:0035265	organ growth	9	2	0.77	0.1759	1	BP
GO:0006469	negative regulation of protein kinase ac...	9	2	0.77	0.1759	1	BP
GO:0140694	non-membrane-bounded organelle assembly	9	2	0.77	0.1759	1	BP
GO:1901861	regulation of muscle tissue development	9	2	0.77	0.1759	1	BP
GO:0033673	negative regulation of kinase activity	9	2	0.77	0.1759	1	BP
GO:0051348	negative regulation of transferase activ...	9	2	0.77	0.1759	1	BP
GO:0048017	inositol lipid-mediated signaling	9	2	0.77	0.1759	1	BP
GO:0007254	JNK cascade	9	2	0.77	0.1759	1	BP
GO:0048565	digestive tract development	9	2	0.77	0.1759	1	BP
GO:0048520	positive regulation of behavior	9	2	0.77	0.1759	1	BP
GO:0044344	cellular response to fibroblast growth f...	9	2	0.77	0.1759	1	BP
GO:0001894	tissue homeostasis	9	2	0.77	0.1759	1	BP
GO:0048634	regulation of muscle organ development	9	2	0.77	0.1759	1	BP
GO:0031349	positive regulation of defense response	9	2	0.77	0.1759	1	BP
GO:0034645	cellular macromolecule biosynthetic proc...	140	15	12.01	0.1763	1	BP
GO:0036211	protein modification process	122	15	10.47	0.1773	1	BP
GO:0006464	cellular protein modification process	122	15	10.47	0.1773	1	BP
GO:0050790	regulation of catalytic activity	76	9	6.52	0.1819	1	BP
GO:0045595	regulation of cell differentiation	76	9	6.52	0.1819	1	BP
GO:0010942	positive regulation of cell death	36	5	3.09	0.1841	1	BP
GO:0010646	regulation of cell communication	141	15	12.1	0.1849	1	BP
GO:0000902	cell morphogenesis	66	8	5.66	0.1857	1	BP
GO:0010563	negative regulation of phosphorus metabo...	27	4	2.32	0.1917	1	BP
GO:0007560	imaginal disc morphogenesis	27	4	2.32	0.1917	1	BP
GO:0007552	metamorphosis	27	4	2.32	0.1917	1	BP
GO:0002164	larval development	27	4	2.32	0.1917	1	BP
GO:0045936	negative regulation of phosphate metabol...	27	4	2.32	0.1917	1	BP
GO:0010975	regulation of neuron projection developm...	27	4	2.32	0.1917	1	BP
GO:0048707	instar larval or pupal morphogenesis	27	4	2.32	0.1917	1	BP
GO:0030900	forebrain development	27	4	2.32	0.1917	1	BP
GO:0009953	dorsal/ventral pattern formation	18	3	1.54	0.1935	1	BP
GO:0032412	regulation of ion transmembrane transpor...	18	3	1.54	0.1935	1	BP
GO:0071902	positive regulation of protein serine/th...	18	3	1.54	0.1935	1	BP
GO:0032147	activation of protein kinase activity	18	3	1.54	0.1935	1	BP
GO:0022898	regulation of transmembrane transporter ...	18	3	1.54	0.1935	1	BP
GO:0043087	regulation of GTPase activity	18	3	1.54	0.1935	1	BP
GO:0021537	telencephalon development	18	3	1.54	0.1935	1	BP
GO:0006974	cellular response to DNA damage stimulus	18	3	1.54	0.1935	1	BP
GO:0071396	cellular response to lipid	18	3	1.54	0.1935	1	BP
GO:0023051	regulation of signaling	142	15	12.18	0.1937	1	BP
GO:0009059	macromolecule biosynthetic process	142	15	12.18	0.1937	1	BP
GO:0001944	vasculature development	21	5	1.8	0.1937	1	BP
GO:0065007	biological regulation	330	31	28.31	0.2015	1	BP
GO:0043412	macromolecule modification	125	15	10.72	0.2045	1	BP
GO:0022408	negative regulation of cell-cell adhesio...	10	2	0.86	0.2084	1	BP
GO:0072163	mesonephric epithelium development	10	2	0.86	0.2084	1	BP
GO:0072164	mesonephric tubule development	10	2	0.86	0.2084	1	BP
GO:0043467	regulation of generation of precursor me...	10	2	0.86	0.2084	1	BP
GO:0001657	ureteric bud development	10	2	0.86	0.2084	1	BP
GO:0030010	establishment of cell polarity	10	2	0.86	0.2084	1	BP
GO:0040014	regulation of multicellular organism gro...	10	2	0.86	0.2084	1	BP
GO:0051090	regulation of DNA-binding transcription ...	10	2	0.86	0.2084	1	BP
GO:0048167	regulation of synaptic plasticity	10	2	0.86	0.2084	1	BP
GO:0046434	organophosphate catabolic process	10	2	0.86	0.2084	1	BP
GO:0008340	determination of adult lifespan	10	2	0.86	0.2084	1	BP
GO:0033555	multicellular organismal response to str...	10	2	0.86	0.2084	1	BP
GO:0002253	activation of immune response	10	2	0.86	0.2084	1	BP
GO:0031032	actomyosin structure organization	10	2	0.86	0.2084	1	BP
GO:0043524	negative regulation of neuron apoptotic ...	10	2	0.86	0.2084	1	BP
GO:1903037	regulation of leukocyte cell-cell adhesi...	10	2	0.86	0.2084	1	BP
GO:0002237	response to molecule of bacterial origin	10	2	0.86	0.2084	1	BP
GO:0043500	muscle adaptation	10	2	0.86	0.2084	1	BP
GO:0002757	immune response-activating signal transd...	10	2	0.86	0.2084	1	BP
GO:0050866	negative regulation of cell activation	10	2	0.86	0.2084	1	BP
GO:0001823	mesonephros development	10	2	0.86	0.2084	1	BP
GO:0032496	response to lipopolysaccharide	10	2	0.86	0.2084	1	BP
GO:0032879	regulation of localization	119	14	10.21	0.21	1	BP
GO:0050896	response to stimulus	272	26	23.33	0.2102	1	BP
GO:0007155	cell adhesion	28	4	2.4	0.2104	1	BP
GO:0033674	positive regulation of kinase activity	28	4	2.4	0.2104	1	BP
GO:0048563	post-embryonic animal organ morphogenesi...	28	4	2.4	0.2104	1	BP
GO:0051962	positive regulation of nervous system de...	28	4	2.4	0.2104	1	BP
GO:0000904	cell morphogenesis involved in different...	58	7	4.98	0.2139	1	BP
GO:0051240	positive regulation of multicellular org...	79	9	6.78	0.2158	1	BP
GO:0010562	positive regulation of phosphorus metabo...	38	5	3.26	0.2161	1	BP
GO:0045937	positive regulation of phosphate metabol...	38	5	3.26	0.2161	1	BP
GO:0043549	regulation of kinase activity	38	5	3.26	0.2161	1	BP
GO:0008284	positive regulation of cell population p...	38	5	3.26	0.2161	1	BP
GO:0048569	post-embryonic animal organ development	38	5	3.26	0.2161	1	BP
GO:0032409	regulation of transporter activity	19	3	1.63	0.2168	1	BP
GO:0043405	regulation of MAP kinase activity	19	3	1.63	0.2168	1	BP
GO:0098609	cell-cell adhesion	19	3	1.63	0.2168	1	BP
GO:0090068	positive regulation of cell cycle proces...	19	3	1.63	0.2168	1	BP
GO:0043523	regulation of neuron apoptotic process	19	3	1.63	0.2168	1	BP
GO:0051402	neuron apoptotic process	19	3	1.63	0.2168	1	BP
GO:0050865	regulation of cell activation	19	3	1.63	0.2168	1	BP
GO:0002065	columnar/cuboidal epithelial cell differ...	19	3	1.63	0.2168	1	BP
GO:0023052	signaling	202	20	17.33	0.2214	1	BP
GO:0030182	neuron differentiation	86	11	7.38	0.2219	1	BP
GO:0051253	negative regulation of RNA metabolic pro...	69	8	5.92	0.2221	1	BP
GO:0042127	regulation of cell population proliferat...	69	8	5.92	0.2221	1	BP
GO:0051179	localization	216	22	18.53	0.2224	1	BP
GO:0030336	negative regulation of cell migration	13	4	1.12	0.2224	1	BP
GO:0070887	cellular response to chemical stimulus	112	12	9.61	0.2236	1	BP
GO:0010243	response to organonitrogen compound	59	7	5.06	0.2275	1	BP
GO:0034097	response to cytokine	29	4	2.49	0.2296	1	BP
GO:0002165	instar larval or pupal development	29	4	2.49	0.2296	1	BP
GO:0007411	axon guidance	29	4	2.49	0.2296	1	BP
GO:0097485	neuron projection guidance	29	4	2.49	0.2296	1	BP
GO:0051347	positive regulation of transferase activ...	29	4	2.49	0.2296	1	BP
GO:0022603	regulation of anatomical structure morph...	43	7	3.69	0.2301	1	BP
GO:0007154	cell communication	203	20	17.41	0.2306	1	BP
GO:0051338	regulation of transferase activity	39	5	3.35	0.2327	1	BP
GO:0010941	regulation of cell death	70	8	6	0.2349	1	BP
GO:0010092	specification of animal organ identity	3	1	0.26	0.2364	1	BP
GO:0043496	regulation of protein homodimerization a...	3	1	0.26	0.2364	1	BP
GO:0010882	regulation of cardiac muscle contraction...	3	1	0.26	0.2364	1	BP
GO:1903317	regulation of protein maturation	3	1	0.26	0.2364	1	BP
GO:0009161	ribonucleoside monophosphate metabolic p...	3	1	0.26	0.2364	1	BP
GO:0016333	morphogenesis of follicular epithelium	3	1	0.26	0.2364	1	BP
GO:0009167	purine ribonucleoside monophosphate meta...	3	1	0.26	0.2364	1	BP
GO:0009154	purine ribonucleotide catabolic process	3	1	0.26	0.2364	1	BP
GO:0051294	establishment of spindle orientation	3	1	0.26	0.2364	1	BP
GO:0042306	regulation of protein import into nucleu...	3	1	0.26	0.2364	1	BP
GO:1902369	negative regulation of RNA catabolic pro...	3	1	0.26	0.2364	1	BP
GO:0060043	regulation of cardiac muscle cell prolif...	3	1	0.26	0.2364	1	BP
GO:0043486	histone exchange	3	1	0.26	0.2364	1	BP
GO:0046662	regulation of oviposition	3	1	0.26	0.2364	1	BP
GO:0032413	negative regulation of ion transmembrane...	3	1	0.26	0.2364	1	BP
GO:0072176	nephric duct development	3	1	0.26	0.2364	1	BP
GO:0060038	cardiac muscle cell proliferation	3	1	0.26	0.2364	1	BP
GO:0009123	nucleoside monophosphate metabolic proce...	3	1	0.26	0.2364	1	BP
GO:1905562	regulation of vascular endothelial cell ...	3	1	0.26	0.2364	1	BP
GO:0009126	purine nucleoside monophosphate metaboli...	3	1	0.26	0.2364	1	BP
GO:1902373	negative regulation of mRNA catabolic pr...	3	1	0.26	0.2364	1	BP
GO:0009116	nucleoside metabolic process	3	1	0.26	0.2364	1	BP
GO:0009119	ribonucleoside metabolic process	3	1	0.26	0.2364	1	BP
GO:0002504	antigen processing and presentation of p...	3	1	0.26	0.2364	1	BP
GO:2000311	regulation of AMPA receptor activity	3	1	0.26	0.2364	1	BP
GO:0046622	positive regulation of organ growth	3	1	0.26	0.2364	1	BP
GO:0007088	regulation of mitotic nuclear division	3	1	0.26	0.2364	1	BP
GO:0046636	negative regulation of alpha-beta T cell...	3	1	0.26	0.2364	1	BP
GO:2001013	epithelial cell proliferation involved i...	3	1	0.26	0.2364	1	BP
GO:0045652	regulation of megakaryocyte differentiat...	3	1	0.26	0.2364	1	BP
GO:1901374	acetate ester transport	3	1	0.26	0.2364	1	BP
GO:0008586	imaginal disc-derived wing vein morphoge...	3	1	0.26	0.2364	1	BP
GO:0099175	regulation of postsynapse organization	3	1	0.26	0.2364	1	BP
GO:0043954	cellular component maintenance	3	1	0.26	0.2364	1	BP
GO:0045620	negative regulation of lymphocyte differ...	3	1	0.26	0.2364	1	BP
GO:0009261	ribonucleotide catabolic process	3	1	0.26	0.2364	1	BP
GO:0032946	positive regulation of mononuclear cell ...	3	1	0.26	0.2364	1	BP
GO:0014742	positive regulation of muscle hypertroph...	3	1	0.26	0.2364	1	BP
GO:0050671	positive regulation of lymphocyte prolif...	3	1	0.26	0.2364	1	BP
GO:0030858	positive regulation of epithelial cell d...	3	1	0.26	0.2364	1	BP
GO:0061213	positive regulation of mesonephros devel...	3	1	0.26	0.2364	1	BP
GO:0061217	regulation of mesonephros development	3	1	0.26	0.2364	1	BP
GO:2000479	regulation of cAMP-dependent protein kin...	3	1	0.26	0.2364	1	BP
GO:0101023	vascular endothelial cell proliferation	3	1	0.26	0.2364	1	BP
GO:0043122	regulation of I-kappaB kinase/NF-kappaB ...	3	1	0.26	0.2364	1	BP
GO:0009214	cyclic nucleotide catabolic process	3	1	0.26	0.2364	1	BP
GO:0070572	positive regulation of neuron projection...	3	1	0.26	0.2364	1	BP
GO:0030812	negative regulation of nucleotide catabo...	3	1	0.26	0.2364	1	BP
GO:0043117	positive regulation of vascular permeabi...	3	1	0.26	0.2364	1	BP
GO:0007520	myoblast fusion	3	1	0.26	0.2364	1	BP
GO:0051783	regulation of nuclear division	3	1	0.26	0.2364	1	BP
GO:1902414	protein localization to cell junction	3	1	0.26	0.2364	1	BP
GO:0042159	lipoprotein catabolic process	3	1	0.26	0.2364	1	BP
GO:0070534	protein K63-linked ubiquitination	3	1	0.26	0.2364	1	BP
GO:0030809	negative regulation of nucleotide biosyn...	3	1	0.26	0.2364	1	BP
GO:0060688	regulation of morphogenesis of a branchi...	3	1	0.26	0.2364	1	BP
GO:0014855	striated muscle cell proliferation	3	1	0.26	0.2364	1	BP
GO:0090183	regulation of kidney development	3	1	0.26	0.2364	1	BP
GO:0090184	positive regulation of kidney developmen...	3	1	0.26	0.2364	1	BP
GO:0034766	negative regulation of ion transmembrane...	3	1	0.26	0.2364	1	BP
GO:0014055	acetylcholine secretion, neurotransmissi...	3	1	0.26	0.2364	1	BP
GO:0014056	regulation of acetylcholine secretion, n...	3	1	0.26	0.2364	1	BP
GO:0051895	negative regulation of focal adhesion as...	3	1	0.26	0.2364	1	BP
GO:0010613	positive regulation of cardiac muscle hy...	3	1	0.26	0.2364	1	BP
GO:0045324	late endosome to vacuole transport	3	1	0.26	0.2364	1	BP
GO:0040026	positive regulation of vulval developmen...	3	1	0.26	0.2364	1	BP
GO:0070665	positive regulation of leukocyte prolife...	3	1	0.26	0.2364	1	BP
GO:0034728	nucleosome organization	3	1	0.26	0.2364	1	BP
GO:0048190	wing disc dorsal/ventral pattern formati...	3	1	0.26	0.2364	1	BP
GO:0048194	Golgi vesicle budding	3	1	0.26	0.2364	1	BP
GO:0046467	membrane lipid biosynthetic process	3	1	0.26	0.2364	1	BP
GO:1901985	positive regulation of protein acetylati...	3	1	0.26	0.2364	1	BP
GO:0040001	establishment of mitotic spindle localiz...	3	1	0.26	0.2364	1	BP
GO:1901185	negative regulation of ERBB signaling pa...	3	1	0.26	0.2364	1	BP
GO:0007603	phototransduction, visible light	3	1	0.26	0.2364	1	BP
GO:0002495	antigen processing and presentation of p...	3	1	0.26	0.2364	1	BP
GO:0060350	endochondral bone morphogenesis	3	1	0.26	0.2364	1	BP
GO:0048146	positive regulation of fibroblast prolif...	3	1	0.26	0.2364	1	BP
GO:1905332	positive regulation of morphogenesis of ...	3	1	0.26	0.2364	1	BP
GO:0061099	negative regulation of protein tyrosine ...	3	1	0.26	0.2364	1	BP
GO:0045453	bone resorption	3	1	0.26	0.2364	1	BP
GO:0051590	positive regulation of neurotransmitter ...	3	1	0.26	0.2364	1	BP
GO:1990874	vascular associated smooth muscle cell p...	3	1	0.26	0.2364	1	BP
GO:0061063	positive regulation of nematode larval d...	3	1	0.26	0.2364	1	BP
GO:0002478	antigen processing and presentation of e...	3	1	0.26	0.2364	1	BP
GO:0061053	somite development	3	1	0.26	0.2364	1	BP
GO:0008347	glial cell migration	3	1	0.26	0.2364	1	BP
GO:0021702	cerebellar Purkinje cell differentiation	3	1	0.26	0.2364	1	BP
GO:1903793	positive regulation of anion transport	3	1	0.26	0.2364	1	BP
GO:0009048	dosage compensation by inactivation of X...	3	1	0.26	0.2364	1	BP
GO:1904705	regulation of vascular associated smooth...	3	1	0.26	0.2364	1	BP
GO:1901222	regulation of NIK/NF-kappaB signaling	3	1	0.26	0.2364	1	BP
GO:0003143	embryonic heart tube morphogenesis	3	1	0.26	0.2364	1	BP
GO:0033077	T cell differentiation in thymus	3	1	0.26	0.2364	1	BP
GO:0072002	Malpighian tubule development	3	1	0.26	0.2364	1	BP
GO:0021871	forebrain regionalization	3	1	0.26	0.2364	1	BP
GO:1903715	regulation of aerobic respiration	3	1	0.26	0.2364	1	BP
GO:0060421	positive regulation of heart growth	3	1	0.26	0.2364	1	BP
GO:0060412	ventricular septum morphogenesis	3	1	0.26	0.2364	1	BP
GO:2000758	positive regulation of peptidyl-lysine a...	3	1	0.26	0.2364	1	BP
GO:0061525	hindgut development	3	1	0.26	0.2364	1	BP
GO:0061526	acetylcholine secretion	3	1	0.26	0.2364	1	BP
GO:0007492	endoderm development	3	1	0.26	0.2364	1	BP
GO:0072523	purine-containing compound catabolic pro...	3	1	0.26	0.2364	1	BP
GO:0001956	positive regulation of neurotransmitter ...	3	1	0.26	0.2364	1	BP
GO:0001958	endochondral ossification	3	1	0.26	0.2364	1	BP
GO:2000727	positive regulation of cardiac muscle ce...	3	1	0.26	0.2364	1	BP
GO:0001974	blood vessel remodeling	3	1	0.26	0.2364	1	BP
GO:0001975	response to amphetamine	3	1	0.26	0.2364	1	BP
GO:0007450	dorsal/ventral pattern formation, imagin...	3	1	0.26	0.2364	1	BP
GO:0001947	heart looping	3	1	0.26	0.2364	1	BP
GO:0055023	positive regulation of cardiac muscle ti...	3	1	0.26	0.2364	1	BP
GO:0033523	histone H2B ubiquitination	3	1	0.26	0.2364	1	BP
GO:0055013	cardiac muscle cell development	3	1	0.26	0.2364	1	BP
GO:0060976	coronary vasculature development	3	1	0.26	0.2364	1	BP
GO:0007442	hindgut morphogenesis	3	1	0.26	0.2364	1	BP
GO:0007443	Malpighian tubule morphogenesis	3	1	0.26	0.2364	1	BP
GO:0007446	imaginal disc growth	3	1	0.26	0.2364	1	BP
GO:0042059	negative regulation of epidermal growth ...	3	1	0.26	0.2364	1	BP
GO:0072698	protein localization to microtubule cyto...	3	1	0.26	0.2364	1	BP
GO:0016056	rhodopsin mediated signaling pathway	3	1	0.26	0.2364	1	BP
GO:0021587	cerebellum morphogenesis	3	1	0.26	0.2364	1	BP
GO:0090050	positive regulation of cell migration in...	3	1	0.26	0.2364	1	BP
GO:0055002	striated muscle cell development	3	1	0.26	0.2364	1	BP
GO:0055006	cardiac cell development	3	1	0.26	0.2364	1	BP
GO:0038061	NIK/NF-kappaB signaling	3	1	0.26	0.2364	1	BP
GO:0021516	dorsal spinal cord development	3	1	0.26	0.2364	1	BP
GO:0032528	microvillus organization	3	1	0.26	0.2364	1	BP
GO:0061614	miRNA transcription	3	1	0.26	0.2364	1	BP
GO:0015870	acetylcholine transport	3	1	0.26	0.2364	1	BP
GO:0009629	response to gravity	3	1	0.26	0.2364	1	BP
GO:1904589	regulation of protein import	3	1	0.26	0.2364	1	BP
GO:0070979	protein K11-linked ubiquitination	3	1	0.26	0.2364	1	BP
GO:0032506	cytokinetic process	3	1	0.26	0.2364	1	BP
GO:2001170	negative regulation of ATP biosynthetic ...	3	1	0.26	0.2364	1	BP
GO:0021692	cerebellar Purkinje cell layer morphogen...	3	1	0.26	0.2364	1	BP
GO:0021694	cerebellar Purkinje cell layer formation	3	1	0.26	0.2364	1	BP
GO:0021696	cerebellar cortex morphogenesis	3	1	0.26	0.2364	1	BP
GO:0021697	cerebellar cortex formation	3	1	0.26	0.2364	1	BP
GO:1901862	negative regulation of muscle tissue dev...	3	1	0.26	0.2364	1	BP
GO:0006195	purine nucleotide catabolic process	3	1	0.26	0.2364	1	BP
GO:1900372	negative regulation of purine nucleotide...	3	1	0.26	0.2364	1	BP
GO:0021680	cerebellar Purkinje cell layer developme...	3	1	0.26	0.2364	1	BP
GO:0097150	neuronal stem cell population maintenanc...	3	1	0.26	0.2364	1	BP
GO:0150118	negative regulation of cell-substrate ju...	3	1	0.26	0.2364	1	BP
GO:0045724	positive regulation of cilium assembly	3	1	0.26	0.2364	1	BP
GO:1905209	positive regulation of cardiocyte differ...	3	1	0.26	0.2364	1	BP
GO:0036075	replacement ossification	3	1	0.26	0.2364	1	BP
GO:0006900	vesicle budding from membrane	3	1	0.26	0.2364	1	BP
GO:0048002	antigen processing and presentation of p...	3	1	0.26	0.2364	1	BP
GO:0051497	negative regulation of stress fiber asse...	3	1	0.26	0.2364	1	BP
GO:0036010	protein localization to endosome	3	1	0.26	0.2364	1	BP
GO:0050729	positive regulation of inflammatory resp...	3	1	0.26	0.2364	1	BP
GO:0001756	somitogenesis	3	1	0.26	0.2364	1	BP
GO:0009311	oligosaccharide metabolic process	3	1	0.26	0.2364	1	BP
GO:0001782	B cell homeostasis	3	1	0.26	0.2364	1	BP
GO:0051452	intracellular pH reduction	3	1	0.26	0.2364	1	BP
GO:0048581	negative regulation of post-embryonic de...	3	1	0.26	0.2364	1	BP
GO:0007274	neuromuscular synaptic transmission	3	1	0.26	0.2364	1	BP
GO:0048582	positive regulation of post-embryonic de...	3	1	0.26	0.2364	1	BP
GO:0030148	sphingolipid biosynthetic process	3	1	0.26	0.2364	1	BP
GO:0046069	cGMP catabolic process	3	1	0.26	0.2364	1	BP
GO:0007249	I-kappaB kinase/NF-kappaB signaling	3	1	0.26	0.2364	1	BP
GO:1903672	positive regulation of sprouting angioge...	3	1	0.26	0.2364	1	BP
GO:0051445	regulation of meiotic cell cycle	3	1	0.26	0.2364	1	BP
GO:0044380	protein localization to cytoskeleton	3	1	0.26	0.2364	1	BP
GO:0071377	cellular response to glucagon stimulus	3	1	0.26	0.2364	1	BP
GO:0007202	activation of phospholipase C activity	3	1	0.26	0.2364	1	BP
GO:0014911	positive regulation of smooth muscle cel...	3	1	0.26	0.2364	1	BP
GO:0001702	gastrulation with mouth forming second	3	1	0.26	0.2364	1	BP
GO:0019882	antigen processing and presentation	3	1	0.26	0.2364	1	BP
GO:0019884	antigen processing and presentation of e...	3	1	0.26	0.2364	1	BP
GO:0019886	antigen processing and presentation of e...	3	1	0.26	0.2364	1	BP
GO:0045820	negative regulation of glycolytic proces...	3	1	0.26	0.2364	1	BP
GO:0050864	regulation of B cell activation	3	1	0.26	0.2364	1	BP
GO:0032350	regulation of hormone metabolic process	3	1	0.26	0.2364	1	BP
GO:0002062	chondrocyte differentiation	3	1	0.26	0.2364	1	BP
GO:0050853	B cell receptor signaling pathway	3	1	0.26	0.2364	1	BP
GO:0050854	regulation of antigen receptor-mediated ...	3	1	0.26	0.2364	1	BP
GO:0045843	negative regulation of striated muscle t...	3	1	0.26	0.2364	1	BP
GO:0050879	multicellular organismal movement	3	1	0.26	0.2364	1	BP
GO:0048668	collateral sprouting	3	1	0.26	0.2364	1	BP
GO:0051155	positive regulation of striated muscle c...	3	1	0.26	0.2364	1	BP
GO:0048680	positive regulation of axon regeneration	3	1	0.26	0.2364	1	BP
GO:0048682	sprouting of injured axon	3	1	0.26	0.2364	1	BP
GO:1903392	negative regulation of adherens junction...	3	1	0.26	0.2364	1	BP
GO:0048619	embryonic hindgut morphogenesis	3	1	0.26	0.2364	1	BP
GO:1900119	positive regulation of execution phase o...	3	1	0.26	0.2364	1	BP
GO:0051145	smooth muscle cell differentiation	3	1	0.26	0.2364	1	BP
GO:0048635	negative regulation of muscle organ deve...	3	1	0.26	0.2364	1	BP
GO:0061982	meiosis I cell cycle process	3	1	0.26	0.2364	1	BP
GO:0045581	negative regulation of T cell differenti...	3	1	0.26	0.2364	1	BP
GO:0001501	skeletal system development	23	5	1.97	0.2382	1	BP
GO:0033554	cellular response to stress	81	9	6.95	0.2398	1	BP
GO:0050877	nervous system process	81	9	6.95	0.2398	1	BP
GO:0001503	ossification	20	3	1.72	0.2406	1	BP
GO:0043086	negative regulation of catalytic activit...	20	3	1.72	0.2406	1	BP
GO:0035220	wing disc development	20	3	1.72	0.2406	1	BP
GO:0040011	locomotion	99	12	8.49	0.2407	1	BP
GO:0042981	regulation of apoptotic process	60	7	5.15	0.2414	1	BP
GO:1903320	regulation of protein modification by sm...	11	2	0.94	0.2415	1	BP
GO:0038127	ERBB signaling pathway	11	2	0.94	0.2415	1	BP
GO:0000280	nuclear division	11	2	0.94	0.2415	1	BP
GO:0048285	organelle fission	11	2	0.94	0.2415	1	BP
GO:0072594	establishment of protein localization to...	11	2	0.94	0.2415	1	BP
GO:0048762	mesenchymal cell differentiation	11	2	0.94	0.2415	1	BP
GO:0007159	leukocyte cell-cell adhesion	11	2	0.94	0.2415	1	BP
GO:0007173	epidermal growth factor receptor signali...	11	2	0.94	0.2415	1	BP
GO:2000045	regulation of G1/S transition of mitotic...	11	2	0.94	0.2415	1	BP
GO:0042542	response to hydrogen peroxide	11	2	0.94	0.2415	1	BP
GO:0010259	multicellular organism aging	11	2	0.94	0.2415	1	BP
GO:0050778	positive regulation of immune response	11	2	0.94	0.2415	1	BP
GO:0051403	stress-activated MAPK cascade	11	2	0.94	0.2415	1	BP
GO:0050863	regulation of T cell activation	11	2	0.94	0.2415	1	BP
GO:0046578	regulation of Ras protein signal transdu...	11	2	0.94	0.2415	1	BP
GO:0001818	negative regulation of cytokine producti...	11	2	0.94	0.2415	1	BP
GO:0010604	positive regulation of macromolecule met...	125	13	10.72	0.2445	1	BP
GO:0031324	negative regulation of cellular metaboli...	103	11	8.84	0.2445	1	BP
GO:0006355	regulation of transcription, DNA-templat...	114	12	9.78	0.245	1	BP
GO:0016310	phosphorylation	71	8	6.09	0.248	1	BP
GO:0065008	regulation of biological quality	159	16	13.64	0.2483	1	BP
GO:0009886	post-embryonic animal morphogenesis	30	4	2.57	0.2493	1	BP
GO:0009314	response to radiation	30	4	2.57	0.2493	1	BP
GO:0051336	regulation of hydrolase activity	40	5	3.43	0.2498	1	BP
GO:0006811	ion transport	82	9	7.03	0.2522	1	BP
GO:0048585	negative regulation of response to stimu...	82	9	7.03	0.2522	1	BP
GO:2000146	negative regulation of cell motility	14	4	1.2	0.2539	1	BP
GO:0071702	organic substance transport	93	10	7.98	0.2547	1	BP
GO:0043067	regulation of programmed cell death	61	7	5.23	0.2556	1	BP
GO:2001141	regulation of RNA biosynthetic process	115	12	9.87	0.256	1	BP
GO:1903506	regulation of nucleic acid-templated tra...	115	12	9.87	0.256	1	BP
GO:0048699	generation of neurons	89	11	7.63	0.2568	1	BP
GO:0045934	negative regulation of nucleobase-contai...	72	8	6.18	0.2613	1	BP
GO:0043410	positive regulation of MAPK cascade	21	3	1.8	0.265	1	BP
GO:1901987	regulation of cell cycle phase transitio...	21	3	1.8	0.265	1	BP
GO:0022604	regulation of cell morphogenesis	21	3	1.8	0.265	1	BP
GO:0045787	positive regulation of cell cycle	21	3	1.8	0.265	1	BP
GO:0010256	endomembrane system organization	21	3	1.8	0.265	1	BP
GO:0002064	epithelial cell development	21	3	1.8	0.265	1	BP
GO:0007409	axonogenesis	41	5	3.52	0.2672	1	BP
GO:0065009	regulation of molecular function	105	11	9.01	0.2675	1	BP
GO:0070848	response to growth factor	31	4	2.66	0.2693	1	BP
GO:0000165	MAPK cascade	31	4	2.66	0.2693	1	BP
GO:0071363	cellular response to growth factor stimu...	31	4	2.66	0.2693	1	BP
GO:0010720	positive regulation of cell development	31	4	2.66	0.2693	1	BP
GO:1901698	response to nitrogen compound	62	7	5.32	0.27	1	BP
GO:0055085	transmembrane transport	73	8	6.26	0.2749	1	BP
GO:0090304	nucleic acid metabolic process	139	14	11.92	0.2749	1	BP
GO:0031330	negative regulation of cellular cataboli...	12	2	1.03	0.275	1	BP
GO:0002573	myeloid leukocyte differentiation	12	2	1.03	0.275	1	BP
GO:0051224	negative regulation of protein transport	12	2	1.03	0.275	1	BP
GO:1904950	negative regulation of establishment of ...	12	2	1.03	0.275	1	BP
GO:0007519	skeletal muscle tissue development	12	2	1.03	0.275	1	BP
GO:0048193	Golgi vesicle transport	12	2	1.03	0.275	1	BP
GO:0060485	mesenchyme development	12	2	1.03	0.275	1	BP
