GO.ID	Term	Annotated	Significant	Expected	pval_test	pval_adj	ontology
GO:0048844	artery morphogenesis	13	1	0.65	0.49004	1	BP
GO:0070671	response to interleukin-12	13	1	0.65	0.49004	1	BP
GO:0009712	catechol-containing compound metabolic p...	13	1	0.65	0.49004	1	BP
GO:0050688	regulation of defense response to virus	13	1	0.65	0.49004	1	BP
GO:1901616	organic hydroxy compound catabolic proce...	13	1	0.65	0.49004	1	BP
GO:0030520	intracellular estrogen receptor signalin...	13	1	0.65	0.49004	1	BP
GO:0034394	protein localization to cell surface	13	1	0.65	0.49004	1	BP
GO:0010658	striated muscle cell apoptotic process	13	1	0.65	0.49004	1	BP
GO:1902653	secondary alcohol biosynthetic process	13	1	0.65	0.49004	1	BP
GO:0043123	positive regulation of I-kappaB kinase/N...	13	1	0.65	0.49004	1	BP
GO:0010677	negative regulation of cellular carbohyd...	13	1	0.65	0.49004	1	BP
GO:0002576	platelet degranulation	13	1	0.65	0.49004	1	BP
GO:1903649	regulation of cytoplasmic transport	13	1	0.65	0.49004	1	BP
GO:0045466	R7 cell differentiation	13	1	0.65	0.49004	1	BP
GO:0030952	establishment or maintenance of cytoskel...	13	1	0.65	0.49004	1	BP
GO:0048069	eye pigmentation	13	1	0.65	0.49004	1	BP
GO:0035172	hemocyte proliferation	13	1	0.65	0.49004	1	BP
GO:0035112	genitalia morphogenesis	13	1	0.65	0.49004	1	BP
GO:0046460	neutral lipid biosynthetic process	13	1	0.65	0.49004	1	BP
GO:0046463	acylglycerol biosynthetic process	13	1	0.65	0.49004	1	BP
GO:0044550	secondary metabolite biosynthetic proces...	13	1	0.65	0.49004	1	BP
GO:0006270	DNA replication initiation	13	1	0.65	0.49004	1	BP
GO:0047496	vesicle transport along microtubule	13	1	0.65	0.49004	1	BP
GO:0035722	interleukin-12-mediated signaling pathwa...	13	1	0.65	0.49004	1	BP
GO:0042982	amyloid precursor protein metabolic proc...	13	1	0.65	0.49004	1	BP
GO:0071349	cellular response to interleukin-12	13	1	0.65	0.49004	1	BP
GO:0042073	intraciliary transport	13	1	0.65	0.49004	1	BP
GO:0042078	germ-line stem cell division	13	1	0.65	0.49004	1	BP
GO:0015800	acidic amino acid transport	13	1	0.65	0.49004	1	BP
GO:1904063	negative regulation of cation transmembr...	13	1	0.65	0.49004	1	BP
GO:0090169	regulation of spindle assembly	13	1	0.65	0.49004	1	BP
GO:0007200	phospholipase C-activating G protein-cou...	13	1	0.65	0.49004	1	BP
GO:0009311	oligosaccharide metabolic process	13	1	0.65	0.49004	1	BP
GO:0048190	wing disc dorsal/ventral pattern formati...	13	1	0.65	0.49004	1	BP
GO:0070207	protein homotrimerization	13	1	0.65	0.49004	1	BP
GO:0006584	catecholamine metabolic process	13	1	0.65	0.49004	1	BP
GO:0090207	regulation of triglyceride metabolic pro...	13	1	0.65	0.49004	1	BP
GO:1900544	positive regulation of purine nucleotide...	13	1	0.65	0.49004	1	BP
GO:0051299	centrosome separation	13	1	0.65	0.49004	1	BP
GO:0009187	cyclic nucleotide metabolic process	13	1	0.65	0.49004	1	BP
GO:0042386	hemocyte differentiation	13	1	0.65	0.49004	1	BP
GO:0098739	import across plasma membrane	13	1	0.65	0.49004	1	BP
GO:0019432	triglyceride biosynthetic process	13	1	0.65	0.49004	1	BP
GO:0051231	spindle elongation	13	1	0.65	0.49004	1	BP
GO:0031145	anaphase-promoting complex-dependent cat...	13	1	0.65	0.49004	1	BP
GO:0055059	asymmetric neuroblast division	13	1	0.65	0.49004	1	BP
GO:0045981	positive regulation of nucleotide metabo...	13	1	0.65	0.49004	1	BP
GO:0048865	stem cell fate commitment	13	1	0.65	0.49004	1	BP
GO:0045892	negative regulation of transcription, DN...	249	13	12.54	0.49013	1	BP
GO:0002275	myeloid cell activation involved in immu...	111	6	5.59	0.4912	1	BP
GO:0050776	regulation of immune response	111	6	5.59	0.4912	1	BP
GO:0002444	myeloid leukocyte mediated immunity	111	6	5.59	0.4912	1	BP
GO:0048880	sensory system development	190	10	9.57	0.49173	1	BP
GO:0007033	vacuole organization	52	3	2.62	0.49181	1	BP
GO:0051924	regulation of calcium ion transport	52	3	2.62	0.49181	1	BP
GO:0030307	positive regulation of cell growth	52	3	2.62	0.49181	1	BP
GO:0071453	cellular response to oxygen levels	52	3	2.62	0.49181	1	BP
GO:0002181	cytoplasmic translation	52	3	2.62	0.49181	1	BP
GO:0033554	cellular response to stress	546	28	27.5	0.49235	1	BP
GO:0006914	autophagy	131	7	6.6	0.49353	1	BP
GO:0061919	process utilizing autophagic mechanism	131	7	6.6	0.49353	1	BP
GO:0051347	positive regulation of transferase activ...	131	7	6.6	0.49353	1	BP
GO:0010506	regulation of autophagy	92	5	4.63	0.49814	1	BP
GO:0050708	regulation of protein secretion	92	5	4.63	0.49814	1	BP
GO:0048749	compound eye development	92	5	4.63	0.49814	1	BP
GO:0120035	regulation of plasma membrane bounded ce...	191	10	9.62	0.49866	1	BP
GO:0043299	leukocyte degranulation	112	6	5.64	0.50014	1	BP
GO:0008589	regulation of smoothened signaling pathw...	33	2	1.66	0.50155	1	BP
GO:1901655	cellular response to ketone	33	2	1.66	0.50155	1	BP
GO:0030518	intracellular steroid hormone receptor s...	33	2	1.66	0.50155	1	BP
GO:0048678	response to axon injury	33	2	1.66	0.50155	1	BP
GO:0060048	cardiac muscle contraction	33	2	1.66	0.50155	1	BP
GO:0035113	embryonic appendage morphogenesis	33	2	1.66	0.50155	1	BP
GO:0007391	dorsal closure	33	2	1.66	0.50155	1	BP
GO:0006406	mRNA export from nucleus	33	2	1.66	0.50155	1	BP
GO:0006289	nucleotide-excision repair	33	2	1.66	0.50155	1	BP
GO:0031497	chromatin assembly	33	2	1.66	0.50155	1	BP
GO:0098781	ncRNA transcription	33	2	1.66	0.50155	1	BP
GO:0009179	purine ribonucleoside diphosphate metabo...	33	2	1.66	0.50155	1	BP
GO:0009135	purine nucleoside diphosphate metabolic ...	33	2	1.66	0.50155	1	BP
GO:0042462	eye photoreceptor cell development	33	2	1.66	0.50155	1	BP
GO:0055080	cation homeostasis	152	8	7.66	0.50319	1	BP
GO:0070085	glycosylation	53	3	2.67	0.50474	1	BP
GO:0035150	regulation of tube size	53	3	2.67	0.50474	1	BP
GO:0046434	organophosphate catabolic process	53	3	2.67	0.50474	1	BP
GO:0050770	regulation of axonogenesis	53	3	2.67	0.50474	1	BP
GO:0006643	membrane lipid metabolic process	53	3	2.67	0.50474	1	BP
GO:0050821	protein stabilization	53	3	2.67	0.50474	1	BP
GO:0031344	regulation of cell projection organizati...	192	10	9.67	0.50557	1	BP
GO:0006875	cellular metal ion homeostasis	113	6	5.69	0.50902	1	BP
GO:0071495	cellular response to endogenous stimulus	299	17	15.06	0.51001	1	BP
GO:0045859	regulation of protein kinase activity	167	12	8.41	0.5105	1	BP
GO:0044281	small molecule metabolic process	440	24	22.16	0.51057	1	BP
GO:0031667	response to nutrient levels	153	8	7.71	0.51087	1	BP
GO:0090329	regulation of DNA-templated DNA replicat...	17	3	0.86	0.51092	1	BP
GO:0055057	neuroblast division	17	3	0.86	0.51092	1	BP
GO:1902679	negative regulation of RNA biosynthetic ...	253	13	12.74	0.51454	1	BP
GO:1903507	negative regulation of nucleic acid-temp...	253	13	12.74	0.51454	1	BP
GO:0009792	embryo development ending in birth or eg...	273	14	13.75	0.51519	1	BP
GO:0030521	androgen receptor signaling pathway	14	1	0.71	0.51585	1	BP
GO:0006099	tricarboxylic acid cycle	14	1	0.71	0.51585	1	BP
GO:0033143	regulation of intracellular steroid horm...	14	1	0.71	0.51585	1	BP
GO:0060997	dendritic spine morphogenesis	14	1	0.71	0.51585	1	BP
GO:1903533	regulation of protein targeting	14	1	0.71	0.51585	1	BP
GO:0032835	glomerulus development	14	1	0.71	0.51585	1	BP
GO:0098927	vesicle-mediated transport between endos...	14	1	0.71	0.51585	1	BP
GO:0045453	bone resorption	14	1	0.71	0.51585	1	BP
GO:0044273	sulfur compound catabolic process	14	1	0.71	0.51585	1	BP
GO:1902930	regulation of alcohol biosynthetic proce...	14	1	0.71	0.51585	1	BP
GO:0006458	'de novo' protein folding	14	1	0.71	0.51585	1	BP
GO:0045143	homologous chromosome segregation	14	1	0.71	0.51585	1	BP
GO:0061063	positive regulation of nematode larval d...	14	1	0.71	0.51585	1	BP
GO:0033574	response to testosterone	14	1	0.71	0.51585	1	BP
GO:0031987	locomotion involved in locomotory behavi...	14	1	0.71	0.51585	1	BP
GO:0006101	citrate metabolic process	14	1	0.71	0.51585	1	BP
GO:0007450	dorsal/ventral pattern formation, imagin...	14	1	0.71	0.51585	1	BP
GO:1901379	regulation of potassium ion transmembran...	14	1	0.71	0.51585	1	BP
GO:0016126	sterol biosynthetic process	14	1	0.71	0.51585	1	BP
GO:0007189	adenylate cyclase-activating G protein-c...	14	1	0.71	0.51585	1	BP
GO:0008333	endosome to lysosome transport	14	1	0.71	0.51585	1	BP
GO:1900271	regulation of long-term synaptic potenti...	14	1	0.71	0.51585	1	BP
GO:0006720	isoprenoid metabolic process	14	1	0.71	0.51585	1	BP
GO:0016226	iron-sulfur cluster assembly	14	1	0.71	0.51585	1	BP
GO:0045598	regulation of fat cell differentiation	14	1	0.71	0.51585	1	BP
GO:0032088	negative regulation of NF-kappaB transcr...	14	1	0.71	0.51585	1	BP
GO:0090181	regulation of cholesterol metabolic proc...	14	1	0.71	0.51585	1	BP
GO:0010458	exit from mitosis	14	1	0.71	0.51585	1	BP
GO:0045646	regulation of erythrocyte differentiatio...	14	1	0.71	0.51585	1	BP
GO:0030104	water homeostasis	14	1	0.71	0.51585	1	BP
GO:1903307	positive regulation of regulated secreto...	14	1	0.71	0.51585	1	BP
GO:0032350	regulation of hormone metabolic process	14	1	0.71	0.51585	1	BP
GO:0031163	metallo-sulfur cluster assembly	14	1	0.71	0.51585	1	BP
GO:0055093	response to hyperoxia	14	1	0.71	0.51585	1	BP
GO:0032413	negative regulation of ion transmembrane...	14	1	0.71	0.51585	1	BP
GO:0065002	intracellular protein transmembrane tran...	14	1	0.71	0.51585	1	BP
GO:0006260	DNA replication	78	6	3.93	0.51722	1	BP
GO:0006909	phagocytosis	54	3	2.72	0.51749	1	BP
GO:0016241	regulation of macroautophagy	54	3	2.72	0.51749	1	BP
GO:0051170	import into nucleus	54	3	2.72	0.51749	1	BP
GO:0007584	response to nutrient	54	3	2.72	0.51749	1	BP
GO:0001649	osteoblast differentiation	34	2	1.71	0.51768	1	BP
GO:0051053	negative regulation of DNA metabolic pro...	34	2	1.71	0.51768	1	BP
GO:0007127	meiosis I	34	2	1.71	0.51768	1	BP
GO:0060402	calcium ion transport into cytosol	34	2	1.71	0.51768	1	BP
GO:0051384	response to glucocorticoid	34	2	1.71	0.51768	1	BP
GO:0009185	ribonucleoside diphosphate metabolic pro...	34	2	1.71	0.51768	1	BP
GO:0055076	transition metal ion homeostasis	34	2	1.71	0.51768	1	BP
GO:0090066	regulation of anatomical structure size	174	9	8.76	0.5189	1	BP
GO:0000226	microtubule cytoskeleton organization	194	10	9.77	0.51931	1	BP
GO:0051338	regulation of transferase activity	210	14	10.58	0.52509	1	BP
GO:0006887	exocytosis	175	9	8.81	0.52608	1	BP
GO:0006412	translation	195	10	9.82	0.52614	1	BP
GO:0045927	positive regulation of growth	115	6	5.79	0.52661	1	BP
GO:0065007	biological regulation	1908	101	96.11	0.52686	1	BP
GO:1903706	regulation of hemopoiesis	75	4	3.78	0.52826	1	BP
GO:0051403	stress-activated MAPK cascade	75	4	3.78	0.52826	1	BP
GO:1901888	regulation of cell junction assembly	75	4	3.78	0.52826	1	BP
GO:1904062	regulation of cation transmembrane trans...	55	3	2.77	0.53007	1	BP
GO:0007423	sensory organ development	236	12	11.89	0.53268	1	BP
GO:0030516	regulation of axon extension	35	2	1.76	0.53346	1	BP
GO:0048663	neuron fate commitment	35	2	1.76	0.53346	1	BP
GO:0018022	peptidyl-lysine methylation	35	2	1.76	0.53346	1	BP
GO:0051028	mRNA transport	35	2	1.76	0.53346	1	BP
GO:0070371	ERK1 and ERK2 cascade	35	2	1.76	0.53346	1	BP
GO:0072091	regulation of stem cell proliferation	35	2	1.76	0.53346	1	BP
GO:1903037	regulation of leukocyte cell-cell adhesi...	35	2	1.76	0.53346	1	BP
GO:0006754	ATP biosynthetic process	35	2	1.76	0.53346	1	BP
GO:0032436	positive regulation of proteasomal ubiqu...	35	2	1.76	0.53346	1	BP
GO:0009059	macromolecule biosynthetic process	940	51	47.35	0.53415	1	BP
GO:0051051	negative regulation of transport	116	6	5.84	0.53532	1	BP
GO:0007264	small GTPase mediated signal transductio...	96	5	4.84	0.53675	1	BP
GO:0032868	response to insulin	76	4	3.83	0.53894	1	BP
GO:0007416	synapse assembly	76	4	3.83	0.53894	1	BP
GO:0050778	positive regulation of immune response	76	4	3.83	0.53894	1	BP
GO:0062207	regulation of pattern recognition recept...	15	1	0.76	0.54036	1	BP
GO:0015908	fatty acid transport	15	1	0.76	0.54036	1	BP
GO:0045010	actin nucleation	15	1	0.76	0.54036	1	BP
GO:0006940	regulation of smooth muscle contraction	15	1	0.76	0.54036	1	BP
GO:0042220	response to cocaine	15	1	0.76	0.54036	1	BP
GO:0002758	innate immune response-activating signal...	15	1	0.76	0.54036	1	BP
GO:0046902	regulation of mitochondrial membrane per...	15	1	0.76	0.54036	1	BP
GO:0099518	vesicle cytoskeletal trafficking	15	1	0.76	0.54036	1	BP
GO:0001541	ovarian follicle development	15	1	0.76	0.54036	1	BP
GO:0034308	primary alcohol metabolic process	15	1	0.76	0.54036	1	BP
GO:0072698	protein localization to microtubule cyto...	15	1	0.76	0.54036	1	BP
GO:0033238	regulation of cellular amine metabolic p...	15	1	0.76	0.54036	1	BP
GO:0060021	roof of mouth development	15	1	0.76	0.54036	1	BP
GO:0045187	regulation of circadian sleep/wake cycle...	15	1	0.76	0.54036	1	BP
GO:0035167	larval lymph gland hemopoiesis	15	1	0.76	0.54036	1	BP
GO:0006296	nucleotide-excision repair, DNA incision...	15	1	0.76	0.54036	1	BP
GO:0045739	positive regulation of DNA repair	15	1	0.76	0.54036	1	BP
GO:0045840	positive regulation of mitotic nuclear d...	15	1	0.76	0.54036	1	BP
GO:0071385	cellular response to glucocorticoid stim...	15	1	0.76	0.54036	1	BP
GO:0051496	positive regulation of stress fiber asse...	15	1	0.76	0.54036	1	BP
GO:0070265	necrotic cell death	15	1	0.76	0.54036	1	BP
GO:0032007	negative regulation of TOR signaling	15	1	0.76	0.54036	1	BP
GO:0032008	positive regulation of TOR signaling	15	1	0.76	0.54036	1	BP
GO:0051446	positive regulation of meiotic cell cycl...	15	1	0.76	0.54036	1	BP
GO:0050777	negative regulation of immune response	15	1	0.76	0.54036	1	BP
GO:0016575	histone deacetylation	15	1	0.76	0.54036	1	BP
GO:0099175	regulation of postsynapse organization	15	1	0.76	0.54036	1	BP
GO:0007520	myoblast fusion	15	1	0.76	0.54036	1	BP
GO:0050802	circadian sleep/wake cycle, sleep	15	1	0.76	0.54036	1	BP
GO:0009247	glycolipid biosynthetic process	15	1	0.76	0.54036	1	BP
GO:0032410	negative regulation of transporter activ...	15	1	0.76	0.54036	1	BP
GO:0022410	circadian sleep/wake cycle process	15	1	0.76	0.54036	1	BP
GO:0014009	glial cell proliferation	15	1	0.76	0.54036	1	BP
GO:0035148	tube formation	56	3	2.82	0.54247	1	BP
GO:0021543	pallium development	60	5	3.02	0.54519	1	BP
GO:1903046	meiotic cell cycle process	97	5	4.89	0.5462	1	BP
GO:0000122	negative regulation of transcription by ...	178	9	8.97	0.54742	1	BP
GO:0055082	cellular chemical homeostasis	178	9	8.97	0.54742	1	BP
GO:0030833	regulation of actin filament polymerizat...	36	2	1.81	0.5489	1	BP
GO:0006941	striated muscle contraction	36	2	1.81	0.5489	1	BP
GO:1905475	regulation of protein localization to me...	36	2	1.81	0.5489	1	BP
GO:0097306	cellular response to alcohol	36	2	1.81	0.5489	1	BP
GO:0019935	cyclic-nucleotide-mediated signaling	36	2	1.81	0.5489	1	BP
GO:0062013	positive regulation of small molecule me...	36	2	1.81	0.5489	1	BP
GO:0061387	regulation of extent of cell growth	36	2	1.81	0.5489	1	BP
GO:0007298	border follicle cell migration	36	2	1.81	0.5489	1	BP
GO:0032006	regulation of TOR signaling	36	2	1.81	0.5489	1	BP
GO:0000184	nuclear-transcribed mRNA catabolic proce...	36	2	1.81	0.5489	1	BP
GO:0051402	neuron apoptotic process	77	4	3.88	0.54949	1	BP
GO:0030100	regulation of endocytosis	77	4	3.88	0.54949	1	BP
GO:1901987	regulation of cell cycle phase transitio...	138	7	6.95	0.55033	1	BP
GO:0032388	positive regulation of intracellular tra...	57	3	2.87	0.55469	1	BP
GO:0007167	enzyme linked receptor protein signaling...	205	12	10.33	0.55485	1	BP
GO:0048608	reproductive structure development	123	8	6.2	0.55565	1	BP
GO:0021782	glial cell development	25	4	1.26	0.55662	1	BP
GO:0031324	negative regulation of cellular metaboli...	524	29	26.39	0.55692	1	BP
GO:0033260	nuclear DNA replication	19	3	0.96	0.55856	1	BP
GO:0031016	pancreas development	19	3	0.96	0.55856	1	BP
GO:0050810	regulation of steroid biosynthetic proce...	19	3	0.96	0.55856	1	BP
GO:0098656	anion transmembrane transport	78	4	3.93	0.55993	1	BP
GO:0031669	cellular response to nutrient levels	78	4	3.93	0.55993	1	BP
GO:0051348	negative regulation of transferase activ...	69	7	3.48	0.56038	1	BP
GO:0010467	gene expression	1040	52	52.39	0.56115	1	BP
GO:0009117	nucleotide metabolic process	180	9	9.07	0.56144	1	BP
GO:0045787	positive regulation of cell cycle	103	7	5.19	0.56148	1	BP
GO:0009991	response to extracellular stimulus	160	8	8.06	0.56349	1	BP
GO:0061061	muscle structure development	160	8	8.06	0.56349	1	BP
GO:0030838	positive regulation of actin filament po...	16	1	0.81	0.56364	1	BP
GO:0048582	positive regulation of post-embryonic de...	16	1	0.81	0.56364	1	BP
GO:0048665	neuron fate specification	16	1	0.81	0.56364	1	BP
GO:0044380	protein localization to cytoskeleton	16	1	0.81	0.56364	1	BP
GO:0060998	regulation of dendritic spine developmen...	16	1	0.81	0.56364	1	BP
GO:1901998	toxin transport	16	1	0.81	0.56364	1	BP
GO:1901983	regulation of protein acetylation	16	1	0.81	0.56364	1	BP
GO:0007031	peroxisome organization	16	1	0.81	0.56364	1	BP
GO:0002698	negative regulation of immune effector p...	16	1	0.81	0.56364	1	BP
GO:0045451	pole plasm oskar mRNA localization	16	1	0.81	0.56364	1	BP
GO:0010951	negative regulation of endopeptidase act...	16	1	0.81	0.56364	1	BP
GO:0051932	synaptic transmission, GABAergic	16	1	0.81	0.56364	1	BP
GO:0035162	embryonic hemopoiesis	16	1	0.81	0.56364	1	BP
GO:0034766	negative regulation of ion transmembrane...	16	1	0.81	0.56364	1	BP
GO:0006476	protein deacetylation	16	1	0.81	0.56364	1	BP
GO:0033619	membrane protein proteolysis	16	1	0.81	0.56364	1	BP
GO:1900182	positive regulation of protein localizat...	16	1	0.81	0.56364	1	BP
GO:2001259	positive regulation of cation channel ac...	16	1	0.81	0.56364	1	BP
GO:1903038	negative regulation of leukocyte cell-ce...	16	1	0.81	0.56364	1	BP
GO:0045815	epigenetic maintenance of chromatin in t...	16	1	0.81	0.56364	1	BP
GO:0071346	cellular response to interferon-gamma	16	1	0.81	0.56364	1	BP
GO:0007229	integrin-mediated signaling pathway	16	1	0.81	0.56364	1	BP
GO:0010466	negative regulation of peptidase activit...	16	1	0.81	0.56364	1	BP
GO:0072350	tricarboxylic acid metabolic process	16	1	0.81	0.56364	1	BP
GO:0030148	sphingolipid biosynthetic process	16	1	0.81	0.56364	1	BP
GO:0050775	positive regulation of dendrite morphoge...	16	1	0.81	0.56364	1	BP
GO:0050868	negative regulation of T cell activation	16	1	0.81	0.56364	1	BP
GO:0044091	membrane biogenesis	16	1	0.81	0.56364	1	BP
GO:0090559	regulation of membrane permeability	16	1	0.81	0.56364	1	BP
GO:0010921	regulation of phosphatase activity	37	2	1.86	0.56397	1	BP
GO:0060401	cytosolic calcium ion transport	37	2	1.86	0.56397	1	BP
GO:0061448	connective tissue development	37	2	1.86	0.56397	1	BP
GO:0009145	purine nucleoside triphosphate biosynthe...	37	2	1.86	0.56397	1	BP
GO:0009132	nucleoside diphosphate metabolic process	37	2	1.86	0.56397	1	BP
GO:0048706	embryonic skeletal system development	37	2	1.86	0.56397	1	BP
GO:0042471	ear morphogenesis	37	2	1.86	0.56397	1	BP
GO:0009206	purine ribonucleoside triphosphate biosy...	37	2	1.86	0.56397	1	BP
GO:0006790	sulfur compound metabolic process	99	5	4.99	0.56483	1	BP
GO:0099643	signal release from synapse	58	3	2.92	0.5667	1	BP
GO:0000075	cell cycle checkpoint signaling	58	3	2.92	0.5667	1	BP
GO:0007269	neurotransmitter secretion	58	3	2.92	0.5667	1	BP
GO:0044419	biological process involved in interspec...	282	14	14.2	0.5672	1	BP
GO:0006753	nucleoside phosphate metabolic process	181	9	9.12	0.56839	1	BP
GO:0048232	male gamete generation	181	9	9.12	0.56839	1	BP
GO:0002274	myeloid leukocyte activation	120	6	6.04	0.56946	1	BP
GO:0001701	in utero embryonic development	79	4	3.98	0.57023	1	BP
GO:0051223	regulation of protein transport	161	8	8.11	0.57081	1	BP
GO:0097191	extrinsic apoptotic signaling pathway	41	4	2.07	0.57105	1	BP
GO:0061458	reproductive system development	125	8	6.3	0.5723	1	BP
GO:0044057	regulation of system process	125	8	6.3	0.5723	1	BP
GO:0006163	purine nucleotide metabolic process	141	7	7.1	0.57386	1	BP
GO:0050790	regulation of catalytic activity	425	24	21.41	0.5748	1	BP
GO:0035556	intracellular signal transduction	522	28	26.29	0.57571	1	BP
GO:0042326	negative regulation of phosphorylation	113	9	5.69	0.57709	1	BP
GO:0051054	positive regulation of DNA metabolic pro...	65	7	3.27	0.57757	1	BP
GO:0001894	tissue homeostasis	59	3	2.97	0.57853	1	BP
GO:0032102	negative regulation of response to exter...	59	3	2.97	0.57853	1	BP
GO:0030522	intracellular receptor signaling pathway	59	3	2.97	0.57853	1	BP
GO:0051604	protein maturation	59	3	2.97	0.57853	1	BP
GO:0110053	regulation of actin filament organizatio...	59	3	2.97	0.57853	1	BP
GO:0051249	regulation of lymphocyte activation	59	3	2.97	0.57853	1	BP
GO:0030832	regulation of actin filament length	38	2	1.91	0.57868	1	BP
GO:1903825	organic acid transmembrane transport	38	2	1.91	0.57868	1	BP
GO:0009615	response to virus	38	2	1.91	0.57868	1	BP
GO:1903509	liposaccharide metabolic process	38	2	1.91	0.57868	1	BP
GO:0051983	regulation of chromosome segregation	38	2	1.91	0.57868	1	BP
GO:0008064	regulation of actin polymerization or de...	38	2	1.91	0.57868	1	BP
GO:0046496	nicotinamide nucleotide metabolic proces...	38	2	1.91	0.57868	1	BP
GO:0019362	pyridine nucleotide metabolic process	38	2	1.91	0.57868	1	BP
GO:0006664	glycolipid metabolic process	38	2	1.91	0.57868	1	BP
GO:1905039	carboxylic acid transmembrane transport	38	2	1.91	0.57868	1	BP
GO:0030217	T cell differentiation	38	2	1.91	0.57868	1	BP
GO:0009142	nucleoside triphosphate biosynthetic pro...	38	2	1.91	0.57868	1	BP
GO:0009201	ribonucleoside triphosphate biosynthetic...	38	2	1.91	0.57868	1	BP
GO:0019220	regulation of phosphate metabolic proces...	334	22	16.82	0.57903	1	BP
GO:0051174	regulation of phosphorus metabolic proce...	334	22	16.82	0.57903	1	BP
GO:1903532	positive regulation of secretion by cell	84	6	4.23	0.57934	1	BP
GO:0015931	nucleobase-containing compound transport	80	4	4.03	0.5804	1	BP
GO:0032886	regulation of microtubule-based process	80	4	4.03	0.5804	1	BP
GO:0051668	localization within membrane	172	11	8.66	0.58318	1	BP
GO:0016070	RNA metabolic process	847	42	42.66	0.58333	1	BP
GO:0046907	intracellular transport	507	25	25.54	0.58454	1	BP
GO:0030811	regulation of nucleotide catabolic proce...	17	1	0.86	0.58576	1	BP
GO:0071806	protein transmembrane transport	17	1	0.86	0.58576	1	BP
GO:0042129	regulation of T cell proliferation	17	1	0.86	0.58576	1	BP
GO:0060632	regulation of microtubule-based movement	17	1	0.86	0.58576	1	BP
GO:0006984	ER-nucleus signaling pathway	17	1	0.86	0.58576	1	BP
GO:0098693	regulation of synaptic vesicle cycle	17	1	0.86	0.58576	1	BP
GO:1901019	regulation of calcium ion transmembrane ...	17	1	0.86	0.58576	1	BP
GO:0006305	DNA alkylation	17	1	0.86	0.58576	1	BP
GO:0006306	DNA methylation	17	1	0.86	0.58576	1	BP
GO:0000079	regulation of cyclin-dependent protein s...	17	1	0.86	0.58576	1	BP
GO:0061005	cell differentiation involved in kidney ...	17	1	0.86	0.58576	1	BP
GO:0007316	pole plasm RNA localization	17	1	0.86	0.58576	1	BP
GO:0006110	regulation of glycolytic process	17	1	0.86	0.58576	1	BP
GO:0033683	nucleotide-excision repair, DNA incision	17	1	0.86	0.58576	1	BP
GO:0070328	triglyceride homeostasis	17	1	0.86	0.58576	1	BP
GO:0019094	pole plasm mRNA localization	17	1	0.86	0.58576	1	BP
GO:0042052	rhabdomere development	17	1	0.86	0.58576	1	BP
GO:0120254	olefinic compound metabolic process	17	1	0.86	0.58576	1	BP
GO:0046824	positive regulation of nucleocytoplasmic...	17	1	0.86	0.58576	1	BP
GO:0070206	protein trimerization	17	1	0.86	0.58576	1	BP
GO:0019320	hexose catabolic process	17	1	0.86	0.58576	1	BP
GO:0016574	histone ubiquitination	17	1	0.86	0.58576	1	BP
GO:0046631	alpha-beta T cell activation	17	1	0.86	0.58576	1	BP
GO:0045912	negative regulation of carbohydrate meta...	17	1	0.86	0.58576	1	BP
GO:0055007	cardiac muscle cell differentiation	17	1	0.86	0.58576	1	BP
GO:0051899	membrane depolarization	17	1	0.86	0.58576	1	BP
GO:0022604	regulation of cell morphogenesis	122	6	6.15	0.58607	1	BP
GO:0031331	positive regulation of cellular cataboli...	122	6	6.15	0.58607	1	BP
GO:0019216	regulation of lipid metabolic process	88	8	4.43	0.58747	1	BP
GO:2000113	negative regulation of cellular macromol...	306	15	15.41	0.58812	1	BP
GO:0030029	actin filament-based process	184	9	9.27	0.58896	1	BP
GO:0010975	regulation of neuron projection developm...	143	7	7.2	0.58924	1	BP
GO:1903828	negative regulation of protein localizat...	60	3	3.02	0.59015	1	BP
GO:0000956	nuclear-transcribed mRNA catabolic proce...	60	3	3.02	0.59015	1	BP
GO:0006364	rRNA processing	60	3	3.02	0.59015	1	BP
GO:0048545	response to steroid hormone	81	4	4.08	0.59044	1	BP
GO:0019953	sexual reproduction	428	21	21.56	0.59154	1	BP
GO:0008015	blood circulation	102	5	5.14	0.59203	1	BP
GO:0009101	glycoprotein biosynthetic process	64	5	3.22	0.59206	1	BP
GO:0061024	membrane organization	205	10	10.33	0.59255	1	BP
GO:0050684	regulation of mRNA processing	39	2	1.96	0.59303	1	BP
GO:1901657	glycosyl compound metabolic process	39	2	1.96	0.59303	1	BP
GO:0001508	action potential	39	2	1.96	0.59303	1	BP
GO:0072524	pyridine-containing compound metabolic p...	39	2	1.96	0.59303	1	BP
GO:0006119	oxidative phosphorylation	39	2	1.96	0.59303	1	BP
GO:0007159	leukocyte cell-cell adhesion	39	2	1.96	0.59303	1	BP
GO:0030198	extracellular matrix organization	39	2	1.96	0.59303	1	BP
GO:0051641	cellular localization	832	43	41.91	0.59325	1	BP
GO:0051130	positive regulation of cellular componen...	307	15	15.46	0.59352	1	BP
GO:0070647	protein modification by small protein co...	246	12	12.39	0.5936	1	BP
GO:0045934	negative regulation of nucleobase-contai...	308	15	15.51	0.59888	1	BP
GO:0034097	response to cytokine	165	8	8.31	0.59957	1	BP
GO:0031098	stress-activated protein kinase signalin...	82	4	4.13	0.60033	1	BP
GO:0002791	regulation of peptide secretion	103	5	5.19	0.6009	1	BP
GO:0003013	circulatory system process	103	5	5.19	0.6009	1	BP
GO:0070507	regulation of microtubule cytoskeleton o...	61	3	3.07	0.60156	1	BP
GO:0071692	protein localization to extracellular re...	124	6	6.25	0.60237	1	BP
GO:0035592	establishment of protein localization to...	124	6	6.25	0.60237	1	BP
GO:0009306	protein secretion	124	6	6.25	0.60237	1	BP
GO:0010468	regulation of gene expression	793	39	39.94	0.60552	1	BP
