GO.ID	Term	Annotated	Significant	Expected	pval_test	pval_adj	ontology
GO:0051146	striated muscle cell differentiation	66	4	2.13	0.1615	1	BP
GO:0031344	regulation of cell projection organizati...	192	9	6.19	0.1617	1	BP
GO:0010038	response to metal ion	90	5	2.9	0.1621	1	BP
GO:0010942	positive regulation of cell death	166	8	5.35	0.1626	1	BP
GO:0030001	metal ion transport	166	8	5.35	0.1626	1	BP
GO:0065003	protein-containing complex assembly	441	18	14.21	0.1653	1	BP
GO:0048608	reproductive structure development	123	8	3.96	0.1657	1	BP
GO:0043065	positive regulation of apoptotic process	141	7	4.54	0.1661	1	BP
GO:0030902	hindbrain development	44	3	1.42	0.1672	1	BP
GO:0002768	immune response-regulating cell surface ...	44	3	1.42	0.1672	1	BP
GO:0010632	regulation of epithelial cell migration	44	3	1.42	0.1672	1	BP
GO:0008595	anterior/posterior axis specification, e...	44	3	1.42	0.1672	1	BP
GO:0007351	tripartite regional subdivision	44	3	1.42	0.1672	1	BP
GO:0001503	ossification	67	4	2.16	0.1678	1	BP
GO:0007315	pole plasm assembly	23	2	0.74	0.1682	1	BP
GO:0009584	detection of visible light	23	2	0.74	0.1682	1	BP
GO:0035305	negative regulation of dephosphorylation	23	2	0.74	0.1682	1	BP
GO:0015748	organophosphate ester transport	23	2	0.74	0.1682	1	BP
GO:0043525	positive regulation of neuron apoptotic ...	23	2	0.74	0.1682	1	BP
GO:0007062	sister chromatid cohesion	23	2	0.74	0.1682	1	BP
GO:1990542	mitochondrial transmembrane transport	23	2	0.74	0.1682	1	BP
GO:0042476	odontogenesis	23	2	0.74	0.1682	1	BP
GO:0006112	energy reserve metabolic process	23	2	0.74	0.1682	1	BP
GO:0031327	negative regulation of cellular biosynth...	330	14	10.63	0.1687	1	BP
GO:0072359	circulatory system development	194	9	6.25	0.169	1	BP
GO:0009790	embryo development	423	20	13.63	0.1697	1	BP
GO:0006812	cation transport	221	10	7.12	0.17	1	BP
GO:0048667	cell morphogenesis involved in neuron di...	221	10	7.12	0.17	1	BP
GO:0001932	regulation of protein phosphorylation	259	13	8.35	0.1718	1	BP
GO:0019637	organophosphate metabolic process	276	12	8.89	0.1723	1	BP
GO:0015980	energy derivation by oxidation of organi...	92	5	2.96	0.1728	1	BP
GO:0045892	negative regulation of transcription, DN...	249	11	8.02	0.1732	1	BP
GO:0006304	DNA modification	28	4	0.9	0.1738	1	BP
GO:0007612	learning	68	4	2.19	0.1741	1	BP
GO:0009890	negative regulation of biosynthetic proc...	332	14	10.7	0.1744	1	BP
GO:0007600	sensory perception	143	7	4.61	0.1747	1	BP
GO:0034330	cell junction organization	175	10	5.64	0.1749	1	BP
GO:0019233	sensory perception of pain	45	3	1.45	0.1752	1	BP
GO:0003018	vascular process in circulatory system	45	3	1.45	0.1752	1	BP
GO:0032412	regulation of ion transmembrane transpor...	45	3	1.45	0.1752	1	BP
GO:1903322	positive regulation of protein modificat...	45	3	1.45	0.1752	1	BP
GO:0022898	regulation of transmembrane transporter ...	45	3	1.45	0.1752	1	BP
GO:0048666	neuron development	361	15	11.63	0.1774	1	BP
GO:0080111	DNA demethylation	6	1	0.19	0.1786	1	BP
GO:0031281	positive regulation of cyclase activity	6	1	0.19	0.1786	1	BP
GO:1904031	positive regulation of cyclin-dependent ...	6	1	0.19	0.1786	1	BP
GO:0033687	osteoblast proliferation	6	1	0.19	0.1786	1	BP
GO:0071287	cellular response to manganese ion	6	1	0.19	0.1786	1	BP
GO:0006862	nucleotide transport	6	1	0.19	0.1786	1	BP
GO:0017121	plasma membrane phospholipid scrambling	6	1	0.19	0.1786	1	BP
GO:0086069	bundle of His cell to Purkinje myocyte c...	6	1	0.19	0.1786	1	BP
GO:0086050	membrane repolarization during bundle of...	6	1	0.19	0.1786	1	BP
GO:0086052	membrane repolarization during SA node c...	6	1	0.19	0.1786	1	BP
GO:0035095	behavioral response to nicotine	6	1	0.19	0.1786	1	BP
GO:0099624	atrial cardiac muscle cell membrane repo...	6	1	0.19	0.1786	1	BP
GO:0086028	bundle of His cell to Purkinje myocyte s...	6	1	0.19	0.1786	1	BP
GO:0086043	bundle of His cell action potential	6	1	0.19	0.1786	1	BP
GO:2001224	positive regulation of neuron migration	6	1	0.19	0.1786	1	BP
GO:0006553	lysine metabolic process	6	1	0.19	0.1786	1	BP
GO:0007156	homophilic cell adhesion via plasma memb...	6	1	0.19	0.1786	1	BP
GO:0048150	behavioral response to ether	6	1	0.19	0.1786	1	BP
GO:0060572	morphogenesis of an epithelial bud	6	1	0.19	0.1786	1	BP
GO:0140353	lipid export from cell	6	1	0.19	0.1786	1	BP
GO:0035988	chondrocyte proliferation	6	1	0.19	0.1786	1	BP
GO:0009750	response to fructose	6	1	0.19	0.1786	1	BP
GO:0006658	phosphatidylserine metabolic process	6	1	0.19	0.1786	1	BP
GO:0071800	podosome assembly	6	1	0.19	0.1786	1	BP
GO:0016056	rhodopsin mediated signaling pathway	6	1	0.19	0.1786	1	BP
GO:0022011	myelination in peripheral nervous system	6	1	0.19	0.1786	1	BP
GO:0060601	lateral sprouting from an epithelium	6	1	0.19	0.1786	1	BP
GO:0060602	branch elongation of an epithelium	6	1	0.19	0.1786	1	BP
GO:0032292	peripheral nervous system axon ensheathm...	6	1	0.19	0.1786	1	BP
GO:1903818	positive regulation of voltage-gated pot...	6	1	0.19	0.1786	1	BP
GO:0048712	negative regulation of astrocyte differe...	6	1	0.19	0.1786	1	BP
GO:0035313	wound healing, spreading of epidermal ce...	6	1	0.19	0.1786	1	BP
GO:0018195	peptidyl-arginine modification	6	1	0.19	0.1786	1	BP
GO:0045822	negative regulation of heart contraction	6	1	0.19	0.1786	1	BP
GO:0002775	antimicrobial peptide production	6	1	0.19	0.1786	1	BP
GO:0010715	regulation of extracellular matrix disas...	6	1	0.19	0.1786	1	BP
GO:0034661	ncRNA catabolic process	6	1	0.19	0.1786	1	BP
GO:0046471	phosphatidylglycerol metabolic process	6	1	0.19	0.1786	1	BP
GO:1902969	mitotic DNA replication	6	1	0.19	0.1786	1	BP
GO:0055115	entry into diapause	6	1	0.19	0.1786	1	BP
GO:0071634	regulation of transforming growth factor...	6	1	0.19	0.1786	1	BP
GO:0060045	positive regulation of cardiac muscle ce...	6	1	0.19	0.1786	1	BP
GO:0014002	astrocyte development	6	1	0.19	0.1786	1	BP
GO:0071600	otic vesicle morphogenesis	6	1	0.19	0.1786	1	BP
GO:0071604	transforming growth factor beta producti...	6	1	0.19	0.1786	1	BP
GO:1903537	meiotic cell cycle process involved in o...	6	1	0.19	0.1786	1	BP
GO:1903538	regulation of meiotic cell cycle process...	6	1	0.19	0.1786	1	BP
GO:0035456	response to interferon-beta	6	1	0.19	0.1786	1	BP
GO:0031055	chromatin remodeling at centromere	6	1	0.19	0.1786	1	BP
GO:2000105	positive regulation of DNA-templated DNA...	6	1	0.19	0.1786	1	BP
GO:0001975	response to amphetamine	6	1	0.19	0.1786	1	BP
GO:0034080	CENP-A containing chromatin assembly	6	1	0.19	0.1786	1	BP
GO:0001941	postsynaptic membrane organization	6	1	0.19	0.1786	1	BP
GO:0003149	membranous septum morphogenesis	6	1	0.19	0.1786	1	BP
GO:0021860	pyramidal neuron development	6	1	0.19	0.1786	1	BP
GO:0048681	negative regulation of axon regeneration	6	1	0.19	0.1786	1	BP
GO:0021869	forebrain ventricular zone progenitor ce...	6	1	0.19	0.1786	1	BP
GO:0021859	pyramidal neuron differentiation	6	1	0.19	0.1786	1	BP
GO:0007637	proboscis extension reflex	6	1	0.19	0.1786	1	BP
GO:0010667	negative regulation of cardiac muscle ce...	6	1	0.19	0.1786	1	BP
GO:0035283	central nervous system segmentation	6	1	0.19	0.1786	1	BP
GO:0035284	brain segmentation	6	1	0.19	0.1786	1	BP
GO:0060372	regulation of atrial cardiac muscle cell...	6	1	0.19	0.1786	1	BP
GO:0072531	pyrimidine-containing compound transmemb...	6	1	0.19	0.1786	1	BP
GO:0045071	negative regulation of viral genome repl...	6	1	0.19	0.1786	1	BP
GO:0021535	cell migration in hindbrain	6	1	0.19	0.1786	1	BP
GO:0035721	intraciliary retrograde transport	6	1	0.19	0.1786	1	BP
GO:0032615	interleukin-12 production	6	1	0.19	0.1786	1	BP
GO:0097152	mesenchymal cell apoptotic process	6	1	0.19	0.1786	1	BP
GO:0070571	negative regulation of neuron projection...	6	1	0.19	0.1786	1	BP
GO:0060441	epithelial tube branching involved in lu...	6	1	0.19	0.1786	1	BP
GO:0060444	branching involved in mammary gland duct...	6	1	0.19	0.1786	1	BP
GO:0060445	branching involved in salivary gland mor...	6	1	0.19	0.1786	1	BP
GO:0021681	cerebellar granular layer development	6	1	0.19	0.1786	1	BP
GO:0048047	mating behavior, sex discrimination	6	1	0.19	0.1786	1	BP
GO:0071390	cellular response to ecdysone	6	1	0.19	0.1786	1	BP
GO:0098914	membrane repolarization during atrial ca...	6	1	0.19	0.1786	1	BP
GO:0021633	optic nerve structural organization	6	1	0.19	0.1786	1	BP
GO:0042428	serotonin metabolic process	6	1	0.19	0.1786	1	BP
GO:1903901	negative regulation of viral life cycle	6	1	0.19	0.1786	1	BP
GO:0045988	negative regulation of striated muscle c...	6	1	0.19	0.1786	1	BP
GO:0035845	photoreceptor cell outer segment organiz...	6	1	0.19	0.1786	1	BP
GO:1901679	nucleotide transmembrane transport	6	1	0.19	0.1786	1	BP
GO:0002031	G protein-coupled receptor internalizati...	6	1	0.19	0.1786	1	BP
GO:0061641	CENP-A containing chromatin organization	6	1	0.19	0.1786	1	BP
GO:0000098	sulfur amino acid catabolic process	6	1	0.19	0.1786	1	BP
GO:0000056	ribosomal small subunit export from nucl...	6	1	0.19	0.1786	1	BP
GO:0043968	histone H2A acetylation	6	1	0.19	0.1786	1	BP
GO:0090161	Golgi ribbon formation	6	1	0.19	0.1786	1	BP
GO:1903393	positive regulation of adherens junction...	6	1	0.19	0.1786	1	BP
GO:0043984	histone H4-K16 acetylation	6	1	0.19	0.1786	1	BP
GO:0071425	hematopoietic stem cell proliferation	6	1	0.19	0.1786	1	BP
GO:0042135	neurotransmitter catabolic process	6	1	0.19	0.1786	1	BP
GO:1900244	positive regulation of synaptic vesicle ...	6	1	0.19	0.1786	1	BP
GO:1903332	regulation of protein folding	6	1	0.19	0.1786	1	BP
GO:0051780	behavioral response to nutrient	6	1	0.19	0.1786	1	BP
GO:1902857	positive regulation of non-motile cilium...	6	1	0.19	0.1786	1	BP
GO:1901046	positive regulation of oviposition	6	1	0.19	0.1786	1	BP
GO:1901030	positive regulation of mitochondrial out...	6	1	0.19	0.1786	1	BP
GO:0006935	chemotaxis	144	7	4.64	0.1791	1	BP
GO:2000113	negative regulation of cellular macromol...	306	13	9.86	0.1797	1	BP
GO:0048584	positive regulation of response to stimu...	390	16	12.57	0.1797	1	BP
GO:0061337	cardiac conduction	24	2	0.77	0.1799	1	BP
GO:0006626	protein targeting to mitochondrion	24	2	0.77	0.1799	1	BP
GO:1905515	non-motile cilium assembly	24	2	0.77	0.1799	1	BP
GO:0042051	compound eye photoreceptor development	24	2	0.77	0.1799	1	BP
GO:0048660	regulation of smooth muscle cell prolife...	24	2	0.77	0.1799	1	BP
GO:0043506	regulation of JUN kinase activity	24	2	0.77	0.1799	1	BP
GO:0043405	regulation of MAP kinase activity	69	4	2.22	0.1806	1	BP
GO:0000819	sister chromatid segregation	69	4	2.22	0.1806	1	BP
GO:0044839	cell cycle G2/M phase transition	69	4	2.22	0.1806	1	BP
GO:0050954	sensory perception of mechanical stimulu...	69	4	2.22	0.1806	1	BP
GO:0008654	phospholipid biosynthetic process	69	4	2.22	0.1806	1	BP
GO:0033993	response to lipid	171	8	5.51	0.1824	1	BP
GO:0042127	regulation of cell population proliferat...	307	13	9.89	0.1827	1	BP
GO:0071560	cellular response to transforming growth...	46	3	1.48	0.1833	1	BP
GO:0043281	regulation of cysteine-type endopeptidas...	46	3	1.48	0.1833	1	BP
GO:0071559	response to transforming growth factor b...	46	3	1.48	0.1833	1	BP
GO:0002757	immune response-activating signal transd...	46	3	1.48	0.1833	1	BP
GO:0007631	feeding behavior	46	3	1.48	0.1833	1	BP
GO:0045596	negative regulation of cell differentiat...	145	7	4.67	0.1835	1	BP
GO:0043488	regulation of mRNA stability	29	4	0.93	0.1853	1	BP
GO:0051668	localization within membrane	172	8	5.54	0.1865	1	BP
GO:1902679	negative regulation of RNA biosynthetic ...	253	11	8.15	0.1866	1	BP
GO:1903507	negative regulation of nucleic acid-temp...	253	11	8.15	0.1866	1	BP
GO:0006954	inflammatory response	70	4	2.26	0.1871	1	BP
GO:0070925	organelle assembly	254	11	8.18	0.19	1	BP
GO:0032496	response to lipopolysaccharide	47	3	1.51	0.1916	1	BP
GO:0042773	ATP synthesis coupled electron transport	25	2	0.81	0.1916	1	BP
GO:0042775	mitochondrial ATP synthesis coupled elec...	25	2	0.81	0.1916	1	BP
GO:0043462	regulation of ATP-dependent activity	25	2	0.81	0.1916	1	BP
GO:0019748	secondary metabolic process	25	2	0.81	0.1916	1	BP
GO:0007272	ensheathment of neurons	25	2	0.81	0.1916	1	BP
GO:0008366	axon ensheathment	25	2	0.81	0.1916	1	BP
GO:0048593	camera-type eye morphogenesis	25	2	0.81	0.1916	1	BP
GO:0008298	intracellular mRNA localization	25	2	0.81	0.1916	1	BP
GO:0048659	smooth muscle cell proliferation	25	2	0.81	0.1916	1	BP
GO:0044264	cellular polysaccharide metabolic proces...	25	2	0.81	0.1916	1	BP
GO:0007043	cell-cell junction assembly	25	2	0.81	0.1916	1	BP
GO:0050921	positive regulation of chemotaxis	25	2	0.81	0.1916	1	BP
GO:0008610	lipid biosynthetic process	147	7	4.74	0.1924	1	BP
GO:0050795	regulation of behavior	71	4	2.29	0.1937	1	BP
GO:0009994	oocyte differentiation	71	4	2.29	0.1937	1	BP
GO:0009953	dorsal/ventral pattern formation	71	4	2.29	0.1937	1	BP
GO:0071840	cellular component organization or bioge...	1456	53	46.92	0.1963	1	BP
GO:0022604	regulation of cell morphogenesis	122	6	3.93	0.1975	1	BP
GO:0046483	heterocycle metabolic process	1167	44	37.6	0.1979	1	BP
GO:0010558	negative regulation of macromolecule bio...	312	13	10.05	0.1984	1	BP
GO:0048812	neuron projection morphogenesis	229	10	7.38	0.1985	1	BP
GO:0010389	regulation of G2/M transition of mitotic...	48	3	1.55	0.1999	1	BP
GO:0043406	positive regulation of MAP kinase activi...	48	3	1.55	0.1999	1	BP
GO:0045216	cell-cell junction organization	48	3	1.55	0.1999	1	BP
GO:0032409	regulation of transporter activity	48	3	1.55	0.1999	1	BP
GO:0048675	axon extension	48	3	1.55	0.1999	1	BP
GO:0045017	glycerolipid biosynthetic process	72	4	2.32	0.2004	1	BP
GO:1903320	regulation of protein modification by sm...	72	4	2.32	0.2004	1	BP
GO:0019752	carboxylic acid metabolic process	230	10	7.41	0.2022	1	BP
GO:0051259	protein complex oligomerization	123	6	3.96	0.2025	1	BP
GO:1902533	positive regulation of intracellular sig...	176	8	5.67	0.2032	1	BP
GO:0007349	cellularization	26	2	0.84	0.2035	1	BP
GO:0019229	regulation of vasoconstriction	26	2	0.84	0.2035	1	BP
GO:0019218	regulation of steroid metabolic process	26	2	0.84	0.2035	1	BP
GO:0005976	polysaccharide metabolic process	26	2	0.84	0.2035	1	BP
GO:0022037	metencephalon development	26	2	0.84	0.2035	1	BP
GO:0060079	excitatory postsynaptic potential	26	2	0.84	0.2035	1	BP
GO:0035194	post-transcriptional gene silencing by R...	26	2	0.84	0.2035	1	BP
GO:2001022	positive regulation of response to DNA d...	26	2	0.84	0.2035	1	BP
GO:0021549	cerebellum development	26	2	0.84	0.2035	1	BP
GO:0021536	diencephalon development	26	2	0.84	0.2035	1	BP
GO:0051261	protein depolymerization	26	2	0.84	0.2035	1	BP
GO:0090263	positive regulation of canonical Wnt sig...	26	2	0.84	0.2035	1	BP
GO:0065008	regulation of biological quality	822	33	26.49	0.2046	1	BP
GO:0051726	regulation of cell cycle	314	13	10.12	0.2048	1	BP
GO:0006735	NADH regeneration	7	1	0.23	0.2051	1	BP
GO:0060740	prostate gland epithelium morphogenesis	7	1	0.23	0.2051	1	BP
GO:0009404	toxin metabolic process	7	1	0.23	0.2051	1	BP
GO:0015988	energy coupled proton transmembrane tran...	7	1	0.23	0.2051	1	BP
GO:0001714	endodermal cell fate specification	7	1	0.23	0.2051	1	BP
GO:0071286	cellular response to magnesium ion	7	1	0.23	0.2051	1	BP
GO:2000050	regulation of non-canonical Wnt signalin...	7	1	0.23	0.2051	1	BP
GO:0071243	cellular response to arsenic-containing ...	7	1	0.23	0.2051	1	BP
GO:0003091	renal water homeostasis	7	1	0.23	0.2051	1	BP
GO:0035089	establishment of apical/basal cell polar...	7	1	0.23	0.2051	1	BP
GO:0051589	negative regulation of neurotransmitter ...	7	1	0.23	0.2051	1	BP
GO:0032330	regulation of chondrocyte differentiatio...	7	1	0.23	0.2051	1	BP
GO:0071715	icosanoid transport	7	1	0.23	0.2051	1	BP
GO:0035006	melanization defense response	7	1	0.23	0.2051	1	BP
GO:0046929	negative regulation of neurotransmitter ...	7	1	0.23	0.2051	1	BP
GO:1905770	regulation of mesodermal cell differenti...	7	1	0.23	0.2051	1	BP
GO:0060512	prostate gland morphogenesis	7	1	0.23	0.2051	1	BP
GO:1903214	regulation of protein targeting to mitoc...	7	1	0.23	0.2051	1	BP
GO:0061318	renal filtration cell differentiation	7	1	0.23	0.2051	1	BP
GO:0007280	pole cell migration	7	1	0.23	0.2051	1	BP
GO:0007221	positive regulation of transcription of ...	7	1	0.23	0.2051	1	BP
GO:0098780	response to mitochondrial depolarisation	7	1	0.23	0.2051	1	BP
GO:0042661	regulation of mesodermal cell fate speci...	7	1	0.23	0.2051	1	BP
GO:0097094	craniofacial suture morphogenesis	7	1	0.23	0.2051	1	BP
GO:1905564	positive regulation of vascular endothel...	7	1	0.23	0.2051	1	BP
GO:0046325	negative regulation of glucose import	7	1	0.23	0.2051	1	BP
GO:0048799	animal organ maturation	7	1	0.23	0.2051	1	BP
GO:0097064	ncRNA export from nucleus	7	1	0.23	0.2051	1	BP
GO:1903831	signal transduction involved in cellular...	7	1	0.23	0.2051	1	BP
GO:0051055	negative regulation of lipid biosyntheti...	7	1	0.23	0.2051	1	BP
GO:0002763	positive regulation of myeloid leukocyte...	7	1	0.23	0.2051	1	BP
GO:1901160	primary amino compound metabolic process	7	1	0.23	0.2051	1	BP
GO:0031641	regulation of myelination	7	1	0.23	0.2051	1	BP
GO:0014068	positive regulation of phosphatidylinosi...	7	1	0.23	0.2051	1	BP
GO:0060081	membrane hyperpolarization	7	1	0.23	0.2051	1	BP
GO:0014041	regulation of neuron maturation	7	1	0.23	0.2051	1	BP
GO:0014044	Schwann cell development	7	1	0.23	0.2051	1	BP
GO:2000479	regulation of cAMP-dependent protein kin...	7	1	0.23	0.2051	1	BP
GO:0095500	acetylcholine receptor signaling pathway	7	1	0.23	0.2051	1	BP
GO:0010863	positive regulation of phospholipase C a...	7	1	0.23	0.2051	1	BP
GO:0035455	response to interferon-alpha	7	1	0.23	0.2051	1	BP
GO:0031069	hair follicle morphogenesis	7	1	0.23	0.2051	1	BP
GO:0032892	positive regulation of organic acid tran...	7	1	0.23	0.2051	1	BP
GO:0048525	negative regulation of viral process	7	1	0.23	0.2051	1	BP
GO:0045668	negative regulation of osteoblast differ...	7	1	0.23	0.2051	1	BP
GO:0045686	negative regulation of glial cell differ...	7	1	0.23	0.2051	1	BP
GO:0045672	positive regulation of osteoclast differ...	7	1	0.23	0.2051	1	BP
GO:0045676	regulation of R7 cell differentiation	7	1	0.23	0.2051	1	BP
GO:0040010	positive regulation of growth rate	7	1	0.23	0.2051	1	BP
GO:0045616	regulation of keratinocyte differentiati...	7	1	0.23	0.2051	1	BP
GO:0001946	lymphangiogenesis	7	1	0.23	0.2051	1	BP
GO:0040040	thermosensory behavior	7	1	0.23	0.2051	1	BP
GO:0048690	regulation of axon extension involved in...	7	1	0.23	0.2051	1	BP
GO:0043518	negative regulation of DNA damage respon...	7	1	0.23	0.2051	1	BP
GO:1904799	regulation of neuron remodeling	7	1	0.23	0.2051	1	BP
GO:0048686	regulation of sprouting of injured axon	7	1	0.23	0.2051	1	BP
GO:0048677	axon extension involved in regeneration	7	1	0.23	0.2051	1	BP
GO:0110116	regulation of compound eye photoreceptor...	7	1	0.23	0.2051	1	BP
GO:0007603	phototransduction, visible light	7	1	0.23	0.2051	1	BP
GO:1904705	regulation of vascular associated smooth...	7	1	0.23	0.2051	1	BP
GO:2001032	regulation of double-strand break repair...	7	1	0.23	0.2051	1	BP
GO:0046718	viral entry into host cell	7	1	0.23	0.2051	1	BP
GO:0060384	innervation	7	1	0.23	0.2051	1	BP
GO:0003229	ventricular cardiac muscle tissue develo...	7	1	0.23	0.2051	1	BP
GO:0021554	optic nerve development	7	1	0.23	0.2051	1	BP
GO:0035767	endothelial cell chemotaxis	7	1	0.23	0.2051	1	BP
GO:0035751	regulation of lysosomal lumen pH	7	1	0.23	0.2051	1	BP
GO:1905902	regulation of mesoderm formation	7	1	0.23	0.2051	1	BP
GO:0072697	protein localization to cell cortex	7	1	0.23	0.2051	1	BP
GO:0032642	regulation of chemokine production	7	1	0.23	0.2051	1	BP
GO:0032602	chemokine production	7	1	0.23	0.2051	1	BP
GO:0097150	neuronal stem cell population maintenanc...	7	1	0.23	0.2051	1	BP
GO:1903959	regulation of anion transmembrane transp...	7	1	0.23	0.2051	1	BP
GO:0036303	lymph vessel morphogenesis	7	1	0.23	0.2051	1	BP
GO:0071392	cellular response to estradiol stimulus	7	1	0.23	0.2051	1	BP
GO:0007000	nucleolus organization	7	1	0.23	0.2051	1	BP
GO:0098926	postsynaptic signal transduction	7	1	0.23	0.2051	1	BP
GO:0051150	regulation of smooth muscle cell differe...	7	1	0.23	0.2051	1	BP
GO:0021631	optic nerve morphogenesis	7	1	0.23	0.2051	1	BP
GO:1900195	positive regulation of oocyte maturation	7	1	0.23	0.2051	1	BP
GO:0071374	cellular response to parathyroid hormone...	7	1	0.23	0.2051	1	BP
GO:0071377	cellular response to glucagon stimulus	7	1	0.23	0.2051	1	BP
GO:0021604	cranial nerve structural organization	7	1	0.23	0.2051	1	BP
GO:0046528	imaginal disc fusion	7	1	0.23	0.2051	1	BP
GO:0046529	imaginal disc fusion, thorax closure	7	1	0.23	0.2051	1	BP
GO:0008594	photoreceptor cell morphogenesis	7	1	0.23	0.2051	1	BP
GO:1904646	cellular response to amyloid-beta	7	1	0.23	0.2051	1	BP
GO:0042116	macrophage activation	7	1	0.23	0.2051	1	BP
GO:1900274	regulation of phospholipase C activity	7	1	0.23	0.2051	1	BP
GO:1900242	regulation of synaptic vesicle endocytos...	7	1	0.23	0.2051	1	BP
GO:2000641	regulation of early endosome to late end...	7	1	0.23	0.2051	1	BP
GO:1901018	positive regulation of potassium ion tra...	7	1	0.23	0.2051	1	BP
GO:1902855	regulation of non-motile cilium assembly	7	1	0.23	0.2051	1	BP
GO:0055010	ventricular cardiac muscle tissue morpho...	7	1	0.23	0.2051	1	BP
GO:1903423	positive regulation of synaptic vesicle ...	7	1	0.23	0.2051	1	BP
GO:1905144	response to acetylcholine	7	1	0.23	0.2051	1	BP
GO:1905145	cellular response to acetylcholine	7	1	0.23	0.2051	1	BP
GO:0120039	plasma membrane bounded cell projection ...	231	10	7.44	0.2059	1	BP
GO:0098662	inorganic cation transmembrane transport	150	7	4.83	0.2062	1	BP
GO:0072521	purine-containing compound metabolic pro...	150	7	4.83	0.2062	1	BP
GO:0006644	phospholipid metabolic process	98	5	3.16	0.2065	1	BP
GO:0071496	cellular response to external stimulus	98	5	3.16	0.2065	1	BP
GO:0046883	regulation of hormone secretion	73	4	2.35	0.2072	1	BP
GO:0032535	regulation of cellular component size	124	6	4	0.2077	1	BP
GO:0006357	regulation of transcription by RNA polym...	400	16	12.89	0.208	1	BP
GO:0045807	positive regulation of endocytosis	49	3	1.58	0.2083	1	BP
GO:0030705	cytoskeleton-dependent intracellular tra...	49	3	1.58	0.2083	1	BP
GO:0000578	embryonic axis specification	49	3	1.58	0.2083	1	BP
GO:0061013	regulation of mRNA catabolic process	31	4	1	0.2085	1	BP
GO:0018107	peptidyl-threonine phosphorylation	32	4	1.03	0.2086	1	BP
GO:0007267	cell-cell signaling	326	15	10.5	0.2108	1	BP
GO:0000122	negative regulation of transcription by ...	178	8	5.74	0.2118	1	BP
GO:0033554	cellular response to stress	546	21	17.59	0.2123	1	BP
GO:0016055	Wnt signaling pathway	99	5	3.19	0.2123	1	BP
GO:1901653	cellular response to peptide	99	5	3.19	0.2123	1	BP
GO:0048858	cell projection morphogenesis	233	10	7.51	0.2135	1	BP
GO:0006725	cellular aromatic compound metabolic pro...	1175	44	37.86	0.2138	1	BP
GO:0006796	phosphate-containing compound metabolic ...	650	30	20.94	0.2141	1	BP
GO:0018958	phenol-containing compound metabolic pro...	27	2	0.87	0.2154	1	BP
GO:0035051	cardiocyte differentiation	27	2	0.87	0.2154	1	BP
GO:0042551	neuron maturation	27	2	0.87	0.2154	1	BP
GO:0030431	sleep	27	2	0.87	0.2154	1	BP
GO:0034502	protein localization to chromosome	27	2	0.87	0.2154	1	BP
GO:0016322	neuron remodeling	27	2	0.87	0.2154	1	BP
GO:0016441	post-transcriptional gene silencing	27	2	0.87	0.2154	1	BP
GO:0044786	cell cycle DNA replication	27	2	0.87	0.2154	1	BP
GO:1902117	positive regulation of organelle assembl...	27	2	0.87	0.2154	1	BP
GO:1901606	alpha-amino acid catabolic process	27	2	0.87	0.2154	1	BP
GO:0042157	lipoprotein metabolic process	27	2	0.87	0.2154	1	BP
GO:0072175	epithelial tube formation	50	3	1.61	0.2168	1	BP
GO:0002237	response to molecule of bacterial origin	50	3	1.61	0.2168	1	BP
GO:0019058	viral life cycle	50	3	1.61	0.2168	1	BP
GO:0140056	organelle localization by membrane tethe...	50	3	1.61	0.2168	1	BP
GO:0051253	negative regulation of RNA metabolic pro...	272	13	8.76	0.2189	1	BP
GO:0006793	phosphorus metabolic process	652	30	21.01	0.2191	1	BP
GO:0031667	response to nutrient levels	153	7	4.93	0.2203	1	BP
GO:0042330	taxis	153	7	4.93	0.2203	1	BP
GO:0018210	peptidyl-threonine modification	33	4	1.06	0.2203	1	BP
GO:0009144	purine nucleoside triphosphate metabolic...	75	4	2.42	0.2209	1	BP
GO:0009205	purine ribonucleoside triphosphate metab...	75	4	2.42	0.2209	1	BP
GO:0007219	Notch signaling pathway	75	4	2.42	0.2209	1	BP
GO:1903706	regulation of hemopoiesis	75	4	2.42	0.2209	1	BP
GO:0032880	regulation of protein localization	235	10	7.57	0.2212	1	BP
GO:0002253	activation of immune response	51	3	1.64	0.2253	1	BP
GO:0046328	regulation of JNK cascade	51	3	1.64	0.2253	1	BP
GO:0022406	membrane docking	51	3	1.64	0.2253	1	BP
GO:0031324	negative regulation of cellular metaboli...	524	23	16.88	0.2255	1	BP
GO:0055002	striated muscle cell development	28	2	0.9	0.2274	1	BP
GO:0099024	plasma membrane invagination	28	2	0.9	0.2274	1	BP
GO:0060078	regulation of postsynaptic membrane pote...	28	2	0.9	0.2274	1	BP
GO:0051952	regulation of amine transport	28	2	0.9	0.2274	1	BP
GO:0050848	regulation of calcium-mediated signaling	28	2	0.9	0.2274	1	BP
GO:0014902	myotube differentiation	28	2	0.9	0.2274	1	BP
GO:0048546	digestive tract morphogenesis	28	2	0.9	0.2274	1	BP
GO:0019079	viral genome replication	28	2	0.9	0.2274	1	BP
GO:0003231	cardiac ventricle development	28	2	0.9	0.2274	1	BP
GO:0003206	cardiac chamber morphogenesis	28	2	0.9	0.2274	1	BP
GO:0042310	vasoconstriction	28	2	0.9	0.2274	1	BP
GO:0051293	establishment of spindle localization	28	2	0.9	0.2274	1	BP
GO:0042147	retrograde transport, endosome to Golgi	28	2	0.9	0.2274	1	BP
GO:0099565	chemical synaptic transmission, postsyna...	28	2	0.9	0.2274	1	BP
GO:0009199	ribonucleoside triphosphate metabolic pr...	76	4	2.45	0.2278	1	BP
GO:0007317	regulation of pole plasm oskar mRNA loca...	8	1	0.26	0.2308	1	BP
GO:0048339	paraxial mesoderm development	8	1	0.26	0.2308	1	BP
GO:0051823	regulation of synapse structural plastic...	8	1	0.26	0.2308	1	BP
GO:0006884	cell volume homeostasis	8	1	0.26	0.2308	1	BP
GO:0086070	SA node cell to atrial cardiac muscle ce...	8	1	0.26	0.2308	1	BP
GO:0045196	establishment or maintenance of neurobla...	8	1	0.26	0.2308	1	BP
GO:0086011	membrane repolarization during action po...	8	1	0.26	0.2308	1	BP
