GO.ID	Term	Annotated	Significant	Expected	pval_test	pval_adj	ontology
GO:1903523	negative regulation of blood circulation	10	1	0.36	0.31034	1	BP
GO:0007591	molting cycle, chitin-based cuticle	10	1	0.36	0.31034	1	BP
GO:0050850	positive regulation of calcium-mediated ...	10	1	0.36	0.31034	1	BP
GO:0060972	left/right pattern formation	10	1	0.36	0.31034	1	BP
GO:0035167	larval lymph gland hemopoiesis	10	1	0.36	0.31034	1	BP
GO:0003170	heart valve development	10	1	0.36	0.31034	1	BP
GO:0009066	aspartate family amino acid metabolic pr...	10	1	0.36	0.31034	1	BP
GO:1905954	positive regulation of lipid localizatio...	10	1	0.36	0.31034	1	BP
GO:0046717	acid secretion	10	1	0.36	0.31034	1	BP
GO:0006303	double-strand break repair via nonhomolo...	10	1	0.36	0.31034	1	BP
GO:0051446	positive regulation of meiotic cell cycl...	10	1	0.36	0.31034	1	BP
GO:0031397	negative regulation of protein ubiquitin...	10	1	0.36	0.31034	1	BP
GO:0007026	negative regulation of microtubule depol...	10	1	0.36	0.31034	1	BP
GO:0048041	focal adhesion assembly	10	1	0.36	0.31034	1	BP
GO:0071320	cellular response to cAMP	10	1	0.36	0.31034	1	BP
GO:0071300	cellular response to retinoic acid	10	1	0.36	0.31034	1	BP
GO:0010960	magnesium ion homeostasis	10	1	0.36	0.31034	1	BP
GO:0008542	visual learning	10	1	0.36	0.31034	1	BP
GO:0032008	positive regulation of TOR signaling	10	1	0.36	0.31034	1	BP
GO:0060282	positive regulation of oocyte developmen...	10	1	0.36	0.31034	1	BP
GO:0050974	detection of mechanical stimulus involve...	10	1	0.36	0.31034	1	BP
GO:0000002	mitochondrial genome maintenance	10	1	0.36	0.31034	1	BP
GO:0042278	purine nucleoside metabolic process	10	1	0.36	0.31034	1	BP
GO:0032922	circadian regulation of gene expression	10	1	0.36	0.31034	1	BP
GO:0007365	periodic partitioning	10	1	0.36	0.31034	1	BP
GO:0045935	positive regulation of nucleobase-contai...	271	14	9.86	0.31203	1	BP
GO:2001252	positive regulation of chromosome organi...	31	2	1.13	0.31229	1	BP
GO:0050792	regulation of viral process	31	2	1.13	0.31229	1	BP
GO:0051495	positive regulation of cytoskeleton orga...	31	2	1.13	0.31229	1	BP
GO:0060485	mesenchyme development	31	2	1.13	0.31229	1	BP
GO:0071322	cellular response to carbohydrate stimul...	31	2	1.13	0.31229	1	BP
GO:1903364	positive regulation of cellular protein ...	31	2	1.13	0.31229	1	BP
GO:0006520	cellular amino acid metabolic process	54	3	1.96	0.31324	1	BP
GO:0007178	transmembrane receptor protein serine/th...	54	3	1.96	0.31324	1	BP
GO:0021537	telencephalon development	54	3	1.96	0.31324	1	BP
GO:0008015	blood circulation	78	4	2.84	0.31477	1	BP
GO:0051254	positive regulation of RNA metabolic pro...	245	13	8.91	0.31628	1	BP
GO:0030182	neuron differentiation	333	14	12.12	0.31799	1	BP
GO:0050769	positive regulation of neurogenesis	103	5	3.75	0.31929	1	BP
GO:0000902	cell morphogenesis	230	10	8.37	0.32213	1	BP
GO:0060562	epithelial tube morphogenesis	141	9	5.13	0.32303	1	BP
GO:0003013	circulatory system process	79	4	2.87	0.32322	1	BP
GO:1903829	positive regulation of protein localizat...	79	4	2.87	0.32322	1	BP
GO:0048592	eye morphogenesis	79	4	2.87	0.32322	1	BP
GO:0044282	small molecule catabolic process	55	3	2	0.32343	1	BP
GO:0006952	defense response	154	7	5.6	0.32577	1	BP
GO:0009967	positive regulation of signal transducti...	205	9	7.46	0.32583	1	BP
GO:0006892	post-Golgi vesicle-mediated transport	32	2	1.16	0.32592	1	BP
GO:0017156	calcium-ion regulated exocytosis	32	2	1.16	0.32592	1	BP
GO:0001678	cellular glucose homeostasis	32	2	1.16	0.32592	1	BP
GO:0050714	positive regulation of protein secretion	32	2	1.16	0.32592	1	BP
GO:0090092	regulation of transmembrane receptor pro...	32	2	1.16	0.32592	1	BP
GO:0030217	T cell differentiation	32	2	1.16	0.32592	1	BP
GO:0051170	import into nucleus	32	2	1.16	0.32592	1	BP
GO:0051224	negative regulation of protein transport	32	2	1.16	0.32592	1	BP
GO:0043068	positive regulation of programmed cell d...	104	5	3.78	0.32667	1	BP
GO:0065009	regulation of molecular function	388	16	14.12	0.32823	1	BP
GO:0051246	regulation of protein metabolic process	376	17	13.68	0.3306	1	BP
GO:0198738	cell-cell signaling by wnt	80	4	2.91	0.33168	1	BP
GO:0046903	secretion	258	11	9.39	0.33265	1	BP
GO:0048232	male gamete generation	122	9	4.44	0.33332	1	BP
GO:0046879	hormone secretion	56	3	2.04	0.33361	1	BP
GO:1902807	negative regulation of cell cycle G1/S p...	11	1	0.4	0.33557	1	BP
GO:0071260	cellular response to mechanical stimulus	11	1	0.4	0.33557	1	BP
GO:0017158	regulation of calcium ion-dependent exoc...	11	1	0.4	0.33557	1	BP
GO:0021904	dorsal/ventral neural tube patterning	11	1	0.4	0.33557	1	BP
GO:1903146	regulation of autophagy of mitochondrion	11	1	0.4	0.33557	1	BP
GO:0043457	regulation of cellular respiration	11	1	0.4	0.33557	1	BP
GO:0045143	homologous chromosome segregation	11	1	0.4	0.33557	1	BP
GO:1902669	positive regulation of axon guidance	11	1	0.4	0.33557	1	BP
GO:1902653	secondary alcohol biosynthetic process	11	1	0.4	0.33557	1	BP
GO:0001570	vasculogenesis	11	1	0.4	0.33557	1	BP
GO:0032413	negative regulation of ion transmembrane...	11	1	0.4	0.33557	1	BP
GO:0035914	skeletal muscle cell differentiation	11	1	0.4	0.33557	1	BP
GO:0043122	regulation of I-kappaB kinase/NF-kappaB ...	11	1	0.4	0.33557	1	BP
GO:1905881	positive regulation of oogenesis	11	1	0.4	0.33557	1	BP
GO:0006614	SRP-dependent cotranslational protein ta...	11	1	0.4	0.33557	1	BP
GO:0045747	positive regulation of Notch signaling p...	11	1	0.4	0.33557	1	BP
GO:2000378	negative regulation of reactive oxygen s...	11	1	0.4	0.33557	1	BP
GO:0008333	endosome to lysosome transport	11	1	0.4	0.33557	1	BP
GO:0046470	phosphatidylcholine metabolic process	11	1	0.4	0.33557	1	BP
GO:0050732	negative regulation of peptidyl-tyrosine...	11	1	0.4	0.33557	1	BP
GO:1903533	regulation of protein targeting	11	1	0.4	0.33557	1	BP
GO:0050891	multicellular organismal water homeostas...	11	1	0.4	0.33557	1	BP
GO:0009651	response to salt stress	11	1	0.4	0.33557	1	BP
GO:2000134	negative regulation of G1/S transition o...	11	1	0.4	0.33557	1	BP
GO:0007549	dosage compensation	11	1	0.4	0.33557	1	BP
GO:0019068	virion assembly	11	1	0.4	0.33557	1	BP
GO:0070206	protein trimerization	11	1	0.4	0.33557	1	BP
GO:0001974	blood vessel remodeling	11	1	0.4	0.33557	1	BP
GO:0040036	regulation of fibroblast growth factor r...	11	1	0.4	0.33557	1	BP
GO:0048641	regulation of skeletal muscle tissue dev...	11	1	0.4	0.33557	1	BP
GO:0021846	cell proliferation in forebrain	11	1	0.4	0.33557	1	BP
GO:0032527	protein exit from endoplasmic reticulum	11	1	0.4	0.33557	1	BP
GO:0010677	negative regulation of cellular carbohyd...	11	1	0.4	0.33557	1	BP
GO:1901880	negative regulation of protein depolymer...	11	1	0.4	0.33557	1	BP
GO:0030811	regulation of nucleotide catabolic proce...	11	1	0.4	0.33557	1	BP
GO:1900368	regulation of post-transcriptional gene ...	11	1	0.4	0.33557	1	BP
GO:0016126	sterol biosynthetic process	11	1	0.4	0.33557	1	BP
GO:0048069	eye pigmentation	11	1	0.4	0.33557	1	BP
GO:0021695	cerebellar cortex development	11	1	0.4	0.33557	1	BP
GO:0033762	response to glucagon	11	1	0.4	0.33557	1	BP
GO:0042446	hormone biosynthetic process	11	1	0.4	0.33557	1	BP
GO:0051123	RNA polymerase II preinitiation complex ...	11	1	0.4	0.33557	1	BP
GO:0016242	negative regulation of macroautophagy	11	1	0.4	0.33557	1	BP
GO:0006110	regulation of glycolytic process	11	1	0.4	0.33557	1	BP
GO:2000573	positive regulation of DNA biosynthetic ...	11	1	0.4	0.33557	1	BP
GO:0060147	regulation of post-transcriptional gene ...	11	1	0.4	0.33557	1	BP
GO:1903391	regulation of adherens junction organiza...	11	1	0.4	0.33557	1	BP
GO:0046685	response to arsenic-containing substance	11	1	0.4	0.33557	1	BP
GO:0090181	regulation of cholesterol metabolic proc...	11	1	0.4	0.33557	1	BP
GO:0031114	regulation of microtubule depolymerizati...	11	1	0.4	0.33557	1	BP
GO:0030855	epithelial cell differentiation	146	9	5.31	0.33726	1	BP
GO:0010389	regulation of G2/M transition of mitotic...	33	2	1.2	0.33948	1	BP
GO:1904950	negative regulation of establishment of ...	33	2	1.2	0.33948	1	BP
GO:0001838	embryonic epithelial tube formation	33	2	1.2	0.33948	1	BP
GO:0030278	regulation of ossification	33	2	1.2	0.33948	1	BP
GO:0010632	regulation of epithelial cell migration	33	2	1.2	0.33948	1	BP
GO:0006310	DNA recombination	33	2	1.2	0.33948	1	BP
GO:0061640	cytoskeleton-dependent cytokinesis	33	2	1.2	0.33948	1	BP
GO:0010970	transport along microtubule	33	2	1.2	0.33948	1	BP
GO:0046649	lymphocyte activation	81	4	2.95	0.34016	1	BP
GO:0048646	anatomical structure formation involved ...	197	11	7.17	0.34082	1	BP
GO:0051674	localization of cell	234	10	8.51	0.34248	1	BP
GO:0048870	cell motility	234	10	8.51	0.34248	1	BP
GO:0060537	muscle tissue development	57	3	2.07	0.3438	1	BP
GO:0032103	positive regulation of response to exter...	57	3	2.07	0.3438	1	BP
GO:0043933	protein-containing complex organization	339	14	12.33	0.34403	1	BP
GO:0009059	macromolecule biosynthetic process	617	28	22.45	0.34413	1	BP
GO:0048477	oogenesis	157	7	5.71	0.34416	1	BP
GO:0060322	head development	157	7	5.71	0.34416	1	BP
GO:0007423	sensory organ development	183	8	6.66	0.3463	1	BP
GO:0003008	system process	287	12	10.44	0.34654	1	BP
GO:0006974	cellular response to DNA damage stimulus	132	6	4.8	0.34711	1	BP
GO:0009628	response to abiotic stimulus	261	11	9.5	0.34729	1	BP
GO:0007188	adenylate cyclase-modulating G protein-c...	23	4	0.84	0.34828	1	BP
GO:0050804	modulation of chemical synaptic transmis...	82	4	2.98	0.34865	1	BP
GO:0099177	regulation of trans-synaptic signaling	82	4	2.98	0.34865	1	BP
GO:0007167	enzyme linked receptor protein signaling...	158	7	5.75	0.35033	1	BP
GO:0045321	leukocyte activation	158	7	5.75	0.35033	1	BP
GO:0048666	neuron development	288	12	10.48	0.35125	1	BP
GO:0010941	regulation of cell death	262	11	9.53	0.35221	1	BP
GO:0018394	peptidyl-lysine acetylation	34	2	1.24	0.35297	1	BP
GO:0071560	cellular response to transforming growth...	34	2	1.24	0.35297	1	BP
GO:0071559	response to transforming growth factor b...	34	2	1.24	0.35297	1	BP
GO:0008344	adult locomotory behavior	34	2	1.24	0.35297	1	BP
GO:0050773	regulation of dendrite development	34	2	1.24	0.35297	1	BP
GO:0046434	organophosphate catabolic process	34	2	1.24	0.35297	1	BP
GO:0031023	microtubule organizing center organizati...	34	2	1.24	0.35297	1	BP
GO:0006906	vesicle fusion	34	2	1.24	0.35297	1	BP
GO:0008286	insulin receptor signaling pathway	34	2	1.24	0.35297	1	BP
GO:0060491	regulation of cell projection assembly	34	2	1.24	0.35297	1	BP
GO:1902105	regulation of leukocyte differentiation	34	2	1.24	0.35297	1	BP
GO:0120032	regulation of plasma membrane bounded ce...	34	2	1.24	0.35297	1	BP
GO:0000122	negative regulation of transcription by ...	133	6	4.84	0.35382	1	BP
GO:0010562	positive regulation of phosphorus metabo...	133	6	4.84	0.35382	1	BP
GO:0045937	positive regulation of phosphate metabol...	133	6	4.84	0.35382	1	BP
GO:0033044	regulation of chromosome organization	58	3	2.11	0.35398	1	BP
GO:0042692	muscle cell differentiation	58	3	2.11	0.35398	1	BP
GO:0051098	regulation of binding	58	3	2.11	0.35398	1	BP
GO:0009994	oocyte differentiation	58	3	2.11	0.35398	1	BP
GO:0030162	regulation of proteolysis	108	5	3.93	0.35638	1	BP
GO:1903047	mitotic cell cycle process	159	7	5.79	0.35652	1	BP
GO:0040017	positive regulation of locomotion	83	4	3.02	0.35714	1	BP
GO:0006281	DNA repair	83	4	3.02	0.35714	1	BP
GO:0048869	cellular developmental process	664	30	24.16	0.35919	1	BP
GO:0001525	angiogenesis	43	5	1.56	0.3596	1	BP
GO:0021983	pituitary gland development	12	1	0.44	0.3599	1	BP
GO:2001169	regulation of ATP biosynthetic process	12	1	0.44	0.3599	1	BP
GO:0030952	establishment or maintenance of cytoskel...	12	1	0.44	0.3599	1	BP
GO:0007492	endoderm development	12	1	0.44	0.3599	1	BP
GO:1901983	regulation of protein acetylation	12	1	0.44	0.3599	1	BP
GO:0007455	eye-antennal disc morphogenesis	12	1	0.44	0.3599	1	BP
GO:0071230	cellular response to amino acid stimulus	12	1	0.44	0.3599	1	BP
GO:0032392	DNA geometric change	12	1	0.44	0.3599	1	BP
GO:0008049	male courtship behavior	12	1	0.44	0.3599	1	BP
GO:0045176	apical protein localization	12	1	0.44	0.3599	1	BP
GO:0034766	negative regulation of ion transmembrane...	12	1	0.44	0.3599	1	BP
GO:0032410	negative regulation of transporter activ...	12	1	0.44	0.3599	1	BP
GO:0006613	cotranslational protein targeting to mem...	12	1	0.44	0.3599	1	BP
GO:0002260	lymphocyte homeostasis	12	1	0.44	0.3599	1	BP
GO:0022029	telencephalon cell migration	12	1	0.44	0.3599	1	BP
GO:0001676	long-chain fatty acid metabolic process	12	1	0.44	0.3599	1	BP
GO:0043277	apoptotic cell clearance	12	1	0.44	0.3599	1	BP
GO:0000132	establishment of mitotic spindle orienta...	12	1	0.44	0.3599	1	BP
GO:0032233	positive regulation of actin filament bu...	12	1	0.44	0.3599	1	BP
GO:0045844	positive regulation of striated muscle t...	12	1	0.44	0.3599	1	BP
GO:0050764	regulation of phagocytosis	12	1	0.44	0.3599	1	BP
GO:0030104	water homeostasis	12	1	0.44	0.3599	1	BP
GO:0002700	regulation of production of molecular me...	12	1	0.44	0.3599	1	BP
GO:0045598	regulation of fat cell differentiation	12	1	0.44	0.3599	1	BP
GO:0007595	lactation	12	1	0.44	0.3599	1	BP
GO:0021795	cerebral cortex cell migration	12	1	0.44	0.3599	1	BP
GO:0006911	phagocytosis, engulfment	12	1	0.44	0.3599	1	BP
GO:0050810	regulation of steroid biosynthetic proce...	12	1	0.44	0.3599	1	BP
GO:0006940	regulation of smooth muscle contraction	12	1	0.44	0.3599	1	BP
GO:0050832	defense response to fungus	12	1	0.44	0.3599	1	BP
GO:0048542	lymph gland development	12	1	0.44	0.3599	1	BP
GO:0045682	regulation of epidermis development	12	1	0.44	0.3599	1	BP
GO:0045639	positive regulation of myeloid cell diff...	12	1	0.44	0.3599	1	BP
GO:0043536	positive regulation of blood vessel endo...	12	1	0.44	0.3599	1	BP
GO:0021885	forebrain cell migration	12	1	0.44	0.3599	1	BP
GO:0031987	locomotion involved in locomotory behavi...	12	1	0.44	0.3599	1	BP
GO:0035262	gonad morphogenesis	12	1	0.44	0.3599	1	BP
GO:0048644	muscle organ morphogenesis	12	1	0.44	0.3599	1	BP
GO:0048636	positive regulation of muscle organ deve...	12	1	0.44	0.3599	1	BP
GO:1901863	positive regulation of muscle tissue dev...	12	1	0.44	0.3599	1	BP
GO:1901879	regulation of protein depolymerization	12	1	0.44	0.3599	1	BP
GO:0051341	regulation of oxidoreductase activity	12	1	0.44	0.3599	1	BP
GO:1902475	L-alpha-amino acid transmembrane transpo...	12	1	0.44	0.3599	1	BP
GO:0015807	L-amino acid transport	12	1	0.44	0.3599	1	BP
GO:0032508	DNA duplex unwinding	12	1	0.44	0.3599	1	BP
GO:0051303	establishment of chromosome localization	12	1	0.44	0.3599	1	BP
GO:0070830	bicellular tight junction assembly	12	1	0.44	0.3599	1	BP
GO:0030521	androgen receptor signaling pathway	12	1	0.44	0.3599	1	BP
GO:0044788	modulation by host of viral process	12	1	0.44	0.3599	1	BP
GO:0030539	male genitalia development	12	1	0.44	0.3599	1	BP
GO:0033238	regulation of cellular amine metabolic p...	12	1	0.44	0.3599	1	BP
GO:0060415	muscle tissue morphogenesis	12	1	0.44	0.3599	1	BP
GO:1902106	negative regulation of leukocyte differe...	12	1	0.44	0.3599	1	BP
GO:1903902	positive regulation of viral life cycle	12	1	0.44	0.3599	1	BP
GO:0046552	photoreceptor cell fate commitment	12	1	0.44	0.3599	1	BP
GO:0046580	negative regulation of Ras protein signa...	12	1	0.44	0.3599	1	BP
GO:0046532	regulation of photoreceptor cell differe...	12	1	0.44	0.3599	1	BP
GO:0060122	inner ear receptor cell stereocilium org...	12	1	0.44	0.3599	1	BP
GO:0043001	Golgi to plasma membrane protein transpo...	12	1	0.44	0.3599	1	BP
GO:0006283	transcription-coupled nucleotide-excisio...	12	1	0.44	0.3599	1	BP
GO:0046634	regulation of alpha-beta T cell activati...	12	1	0.44	0.3599	1	BP
GO:1902742	apoptotic process involved in developmen...	12	1	0.44	0.3599	1	BP
GO:0010564	regulation of cell cycle process	134	6	4.88	0.36055	1	BP
GO:0034330	cell junction organization	134	6	4.88	0.36055	1	BP
GO:0050790	regulation of catalytic activity	290	12	10.55	0.36072	1	BP
GO:0023056	positive regulation of signaling	238	10	8.66	0.36308	1	BP
GO:0010647	positive regulation of cell communicatio...	238	10	8.66	0.36308	1	BP
GO:0043414	macromolecule methylation	59	3	2.15	0.36414	1	BP
GO:0002694	regulation of leukocyte activation	59	3	2.15	0.36414	1	BP
GO:0009914	hormone transport	59	3	2.15	0.36414	1	BP
GO:0019637	organophosphate metabolic process	179	10	6.51	0.36558	1	BP
GO:0070482	response to oxygen levels	84	4	3.06	0.36564	1	BP
GO:0040011	locomotion	344	14	12.52	0.36612	1	BP
GO:0060538	skeletal muscle organ development	35	2	1.27	0.36636	1	BP
GO:0048705	skeletal system morphogenesis	35	2	1.27	0.36636	1	BP
GO:0000819	sister chromatid segregation	35	2	1.27	0.36636	1	BP
GO:0050678	regulation of epithelial cell proliferat...	35	2	1.27	0.36636	1	BP
GO:1902275	regulation of chromatin organization	35	2	1.27	0.36636	1	BP
GO:0006109	regulation of carbohydrate metabolic pro...	35	2	1.27	0.36636	1	BP
GO:0097746	blood vessel diameter maintenance	35	2	1.27	0.36636	1	BP
GO:0051276	chromosome organization	187	8	6.8	0.3694	1	BP
GO:0120036	plasma membrane bounded cell projection ...	319	13	11.61	0.37287	1	BP
GO:0031175	neuron projection development	240	10	8.73	0.37346	1	BP
GO:0043434	response to peptide hormone	85	4	3.09	0.37414	1	BP
GO:0043161	proteasome-mediated ubiquitin-dependent ...	85	4	3.09	0.37414	1	BP
GO:0032535	regulation of cellular component size	85	4	3.09	0.37414	1	BP
GO:0044772	mitotic cell cycle phase transition	85	4	3.09	0.37414	1	BP
GO:0002065	columnar/cuboidal epithelial cell differ...	85	4	3.09	0.37414	1	BP
GO:0016032	viral process	60	3	2.18	0.37428	1	BP
GO:0030111	regulation of Wnt signaling pathway	60	3	2.18	0.37428	1	BP
GO:0051701	biological process involved in interacti...	16	3	0.58	0.37457	1	BP
GO:0016477	cell migration	214	9	7.79	0.37458	1	BP
GO:0051640	organelle localization	162	7	5.89	0.37514	1	BP
GO:0033554	cellular response to stress	373	15	13.57	0.37682	1	BP
GO:0032412	regulation of ion transmembrane transpor...	36	2	1.31	0.37965	1	BP
GO:0050863	regulation of T cell activation	36	2	1.31	0.37965	1	BP
GO:0030705	cytoskeleton-dependent intracellular tra...	36	2	1.31	0.37965	1	BP
GO:0035265	organ growth	36	2	1.31	0.37965	1	BP
GO:0008213	protein alkylation	36	2	1.31	0.37965	1	BP
GO:0097480	establishment of synaptic vesicle locali...	36	2	1.31	0.37965	1	BP
GO:0099111	microtubule-based transport	36	2	1.31	0.37965	1	BP
GO:0006479	protein methylation	36	2	1.31	0.37965	1	BP
GO:0010001	glial cell differentiation	36	2	1.31	0.37965	1	BP
GO:0000082	G1/S transition of mitotic cell cycle	36	2	1.31	0.37965	1	BP
GO:0090174	organelle membrane fusion	36	2	1.31	0.37965	1	BP
GO:0022898	regulation of transmembrane transporter ...	36	2	1.31	0.37965	1	BP
GO:0043903	regulation of biological process involve...	36	2	1.31	0.37965	1	BP
GO:0003002	regionalization	152	9	5.53	0.38201	1	BP
GO:0000280	nuclear division	86	4	3.13	0.38264	1	BP
GO:0009409	response to cold	13	1	0.47	0.38334	1	BP
GO:0045446	endothelial cell differentiation	13	1	0.47	0.38334	1	BP
GO:0032368	regulation of lipid transport	13	1	0.47	0.38334	1	BP
GO:2001259	positive regulation of cation channel ac...	13	1	0.47	0.38334	1	BP
GO:0000381	regulation of alternative mRNA splicing,...	13	1	0.47	0.38334	1	BP
GO:0001836	release of cytochrome c from mitochondri...	13	1	0.47	0.38334	1	BP
GO:0002168	instar larval development	13	1	0.47	0.38334	1	BP
GO:0033077	T cell differentiation in thymus	13	1	0.47	0.38334	1	BP
GO:0042659	regulation of cell fate specification	13	1	0.47	0.38334	1	BP
GO:0051058	negative regulation of small GTPase medi...	13	1	0.47	0.38334	1	BP
GO:0014066	regulation of phosphatidylinositol 3-kin...	13	1	0.47	0.38334	1	BP
GO:0061178	regulation of insulin secretion involved...	13	1	0.47	0.38334	1	BP
GO:0003382	epithelial cell morphogenesis	13	1	0.47	0.38334	1	BP
GO:0019674	NAD metabolic process	13	1	0.47	0.38334	1	BP
GO:0006029	proteoglycan metabolic process	13	1	0.47	0.38334	1	BP
GO:0050775	positive regulation of dendrite morphoge...	13	1	0.47	0.38334	1	BP
GO:0003333	amino acid transmembrane transport	13	1	0.47	0.38334	1	BP
GO:1903573	negative regulation of response to endop...	13	1	0.47	0.38334	1	BP
GO:0060033	anatomical structure regression	13	1	0.47	0.38334	1	BP
GO:0050864	regulation of B cell activation	13	1	0.47	0.38334	1	BP
GO:0060966	regulation of gene silencing by RNA	13	1	0.47	0.38334	1	BP
GO:0051932	synaptic transmission, GABAergic	13	1	0.47	0.38334	1	BP
GO:2000179	positive regulation of neural precursor ...	13	1	0.47	0.38334	1	BP
GO:0032890	regulation of organic acid transport	13	1	0.47	0.38334	1	BP
GO:0050830	defense response to Gram-positive bacter...	13	1	0.47	0.38334	1	BP
GO:0045669	positive regulation of osteoblast differ...	13	1	0.47	0.38334	1	BP
GO:0033138	positive regulation of peptidyl-serine p...	13	1	0.47	0.38334	1	BP
GO:1902414	protein localization to cell junction	13	1	0.47	0.38334	1	BP
GO:0045047	protein targeting to ER	13	1	0.47	0.38334	1	BP
GO:0046889	positive regulation of lipid biosyntheti...	13	1	0.47	0.38334	1	BP
GO:0090317	negative regulation of intracellular pro...	13	1	0.47	0.38334	1	BP
GO:0060420	regulation of heart growth	13	1	0.47	0.38334	1	BP
GO:0007019	microtubule depolymerization	13	1	0.47	0.38334	1	BP
GO:0002062	chondrocyte differentiation	13	1	0.47	0.38334	1	BP
GO:0031338	regulation of vesicle fusion	13	1	0.47	0.38334	1	BP
GO:0098930	axonal transport	13	1	0.47	0.38334	1	BP
GO:0002028	regulation of sodium ion transport	13	1	0.47	0.38334	1	BP
GO:0034341	response to interferon-gamma	13	1	0.47	0.38334	1	BP
GO:1901607	alpha-amino acid biosynthetic process	13	1	0.47	0.38334	1	BP
GO:0008585	female gonad development	13	1	0.47	0.38334	1	BP
GO:0050000	chromosome localization	13	1	0.47	0.38334	1	BP
GO:0043966	histone H3 acetylation	13	1	0.47	0.38334	1	BP
GO:0031111	negative regulation of microtubule polym...	13	1	0.47	0.38334	1	BP
GO:1901019	regulation of calcium ion transmembrane ...	13	1	0.47	0.38334	1	BP
GO:1902903	regulation of supramolecular fiber organ...	61	3	2.22	0.38439	1	BP
GO:0050865	regulation of cell activation	61	3	2.22	0.38439	1	BP
GO:0048545	response to steroid hormone	61	3	2.22	0.38439	1	BP
GO:0051272	positive regulation of cellular componen...	61	3	2.22	0.38439	1	BP
GO:0009101	glycoprotein biosynthetic process	46	5	1.67	0.38534	1	BP
GO:0006511	ubiquitin-dependent protein catabolic pr...	112	5	4.07	0.38625	1	BP
GO:0051962	positive regulation of nervous system de...	112	5	4.07	0.38625	1	BP
GO:0045055	regulated exocytosis	112	5	4.07	0.38625	1	BP
GO:0000904	cell morphogenesis involved in different...	190	8	6.91	0.38684	1	BP
GO:0043085	positive regulation of catalytic activit...	190	8	6.91	0.38684	1	BP
GO:0030163	protein catabolic process	164	7	5.97	0.3876	1	BP
GO:0031331	positive regulation of cellular cataboli...	87	4	3.17	0.39112	1	BP
GO:0030030	cell projection organization	323	13	11.75	0.39139	1	BP
GO:0009167	purine ribonucleoside monophosphate meta...	37	2	1.35	0.39283	1	BP
GO:0009126	purine nucleoside monophosphate metaboli...	37	2	1.35	0.39283	1	BP
GO:0007405	neuroblast proliferation	37	2	1.35	0.39283	1	BP
GO:0072175	epithelial tube formation	37	2	1.35	0.39283	1	BP
GO:0002793	positive regulation of peptide secretion	37	2	1.35	0.39283	1	BP
GO:0051054	positive regulation of DNA metabolic pro...	37	2	1.35	0.39283	1	BP
GO:0008306	associative learning	37	2	1.35	0.39283	1	BP
GO:0019058	viral life cycle	37	2	1.35	0.39283	1	BP
GO:0035296	regulation of tube diameter	37	2	1.35	0.39283	1	BP
GO:0006367	transcription initiation from RNA polyme...	37	2	1.35	0.39283	1	BP
GO:0006338	chromatin remodeling	37	2	1.35	0.39283	1	BP
GO:0007034	vacuolar transport	37	2	1.35	0.39283	1	BP
GO:1901605	alpha-amino acid metabolic process	37	2	1.35	0.39283	1	BP
GO:0006260	DNA replication	37	2	1.35	0.39283	1	BP
GO:1902749	regulation of cell cycle G2/M phase tran...	37	2	1.35	0.39283	1	BP
GO:0000910	cytokinesis	37	2	1.35	0.39283	1	BP
GO:0019941	modification-dependent protein catabolic...	113	5	4.11	0.39372	1	BP
GO:0001775	cell activation	165	7	6	0.39384	1	BP
GO:0060548	negative regulation of cell death	165	7	6	0.39384	1	BP
GO:1901990	regulation of mitotic cell cycle phase t...	62	3	2.26	0.39448	1	BP
GO:0001701	in utero embryonic development	62	3	2.26	0.39448	1	BP
GO:0032259	methylation	62	3	2.26	0.39448	1	BP
GO:0030100	regulation of endocytosis	62	3	2.26	0.39448	1	BP
GO:0031399	regulation of protein modification proce...	245	10	8.91	0.39958	1	BP
GO:0005975	carbohydrate metabolic process	88	4	3.2	0.39959	1	BP
GO:0002252	immune effector process	140	6	5.09	0.4011	1	BP
GO:0045859	regulation of protein kinase activity	114	5	4.15	0.40118	1	BP
GO:0009798	axis specification	63	3	2.29	0.40452	1	BP
GO:0048813	dendrite morphogenesis	63	3	2.29	0.40452	1	BP
GO:0009410	response to xenobiotic stimulus	63	3	2.29	0.40452	1	BP
GO:0032409	regulation of transporter activity	38	2	1.38	0.40588	1	BP
GO:0046395	carboxylic acid catabolic process	38	2	1.38	0.40588	1	BP
GO:0016054	organic acid catabolic process	38	2	1.38	0.40588	1	BP
GO:0060041	retina development in camera-type eye	38	2	1.38	0.40588	1	BP
GO:0009060	aerobic respiration	38	2	1.38	0.40588	1	BP
GO:1904019	epithelial cell apoptotic process	14	1	0.51	0.40594	1	BP
GO:0001776	leukocyte homeostasis	14	1	0.51	0.40594	1	BP
GO:1903409	reactive oxygen species biosynthetic pro...	14	1	0.51	0.40594	1	BP
GO:0051851	modulation by host of symbiont process	14	1	0.51	0.40594	1	BP
GO:0061951	establishment of protein localization to...	14	1	0.51	0.40594	1	BP
GO:0015914	phospholipid transport	14	1	0.51	0.40594	1	BP
GO:0045448	mitotic cell cycle, embryonic	14	1	0.51	0.40594	1	BP
GO:0042733	embryonic digit morphogenesis	14	1	0.51	0.40594	1	BP
GO:0009119	ribonucleoside metabolic process	14	1	0.51	0.40594	1	BP
GO:0032479	regulation of type I interferon producti...	14	1	0.51	0.40594	1	BP
GO:1903202	negative regulation of oxidative stress-...	14	1	0.51	0.40594	1	BP
GO:0048278	vesicle docking	14	1	0.51	0.40594	1	BP
GO:0007249	I-kappaB kinase/NF-kappaB signaling	14	1	0.51	0.40594	1	BP
GO:1903844	regulation of cellular response to trans...	14	1	0.51	0.40594	1	BP
GO:0008347	glial cell migration	14	1	0.51	0.40594	1	BP
GO:0006096	glycolytic process	14	1	0.51	0.40594	1	BP
