GO.ID	Term	Annotated	Significant	Expected	pval_test	pval_adj	ontology
GO:0048865	stem cell fate commitment	13	1	0.55	0.42998	1	BP
GO:0009794	regulation of mitotic cell cycle, embryo...	13	1	0.55	0.42998	1	BP
GO:0048859	formation of anatomical boundary	13	1	0.55	0.42998	1	BP
GO:0042594	response to starvation	79	4	3.34	0.43006	1	BP
GO:0030099	myeloid cell differentiation	79	4	3.34	0.43006	1	BP
GO:0045137	development of primary sexual characteri...	79	4	3.34	0.43006	1	BP
GO:0006401	RNA catabolic process	79	4	3.34	0.43006	1	BP
GO:0008406	gonad development	79	4	3.34	0.43006	1	BP
GO:0048592	eye morphogenesis	102	5	4.31	0.43311	1	BP
GO:0048699	generation of neurons	472	21	19.93	0.43315	1	BP
GO:0022407	regulation of cell-cell adhesion	57	3	2.41	0.43535	1	BP
GO:0051651	maintenance of location in cell	57	3	2.41	0.43535	1	BP
GO:0033993	response to lipid	171	8	7.22	0.43557	1	BP
GO:0090501	RNA phosphodiester bond hydrolysis	35	2	1.48	0.43916	1	BP
GO:0045047	protein targeting to ER	35	2	1.48	0.43916	1	BP
GO:0043467	regulation of generation of precursor me...	35	2	1.48	0.43916	1	BP
GO:0048663	neuron fate commitment	35	2	1.48	0.43916	1	BP
GO:0010675	regulation of cellular carbohydrate meta...	35	2	1.48	0.43916	1	BP
GO:0018022	peptidyl-lysine methylation	35	2	1.48	0.43916	1	BP
GO:2000278	regulation of DNA biosynthetic process	35	2	1.48	0.43916	1	BP
GO:0006754	ATP biosynthetic process	35	2	1.48	0.43916	1	BP
GO:0009124	nucleoside monophosphate biosynthetic pr...	35	2	1.48	0.43916	1	BP
GO:0048771	tissue remodeling	35	2	1.48	0.43916	1	BP
GO:0014020	primary neural tube formation	35	2	1.48	0.43916	1	BP
GO:0032436	positive regulation of proteasomal ubiqu...	35	2	1.48	0.43916	1	BP
GO:0090068	positive regulation of cell cycle proces...	80	4	3.38	0.43968	1	BP
GO:0070727	cellular macromolecule localization	474	21	20.01	0.44158	1	BP
GO:0044092	negative regulation of molecular functio...	195	9	8.23	0.44165	1	BP
GO:0051046	regulation of secretion	172	8	7.26	0.44219	1	BP
GO:0031325	positive regulation of cellular metaboli...	646	38	27.28	0.44396	1	BP
GO:1901654	response to ketone	58	3	2.45	0.44668	1	BP
GO:0051963	regulation of synapse assembly	58	3	2.45	0.44668	1	BP
GO:0016482	cytosolic transport	58	3	2.45	0.44668	1	BP
GO:0045665	negative regulation of neuron differenti...	58	3	2.45	0.44668	1	BP
GO:0061005	cell differentiation involved in kidney ...	17	3	0.72	0.44859	1	BP
GO:0001756	somitogenesis	17	3	0.72	0.44859	1	BP
GO:0008544	epidermis development	81	4	3.42	0.44925	1	BP
GO:0048545	response to steroid hormone	81	4	3.42	0.44925	1	BP
GO:0051098	regulation of binding	81	4	3.42	0.44925	1	BP
GO:0060537	muscle tissue development	81	4	3.42	0.44925	1	BP
GO:0009798	axis specification	81	4	3.42	0.44925	1	BP
GO:0072521	purine-containing compound metabolic pro...	150	7	6.33	0.44955	1	BP
GO:0005975	carbohydrate metabolic process	127	6	5.36	0.45003	1	BP
GO:0032879	regulation of localization	550	28	23.22	0.45258	1	BP
GO:0030833	regulation of actin filament polymerizat...	36	2	1.52	0.45366	1	BP
GO:0001704	formation of primary germ layer	36	2	1.52	0.45366	1	BP
GO:1905475	regulation of protein localization to me...	36	2	1.52	0.45366	1	BP
GO:0009566	fertilization	36	2	1.52	0.45366	1	BP
GO:0072599	establishment of protein localization to...	36	2	1.52	0.45366	1	BP
GO:2000177	regulation of neural precursor cell prol...	36	2	1.52	0.45366	1	BP
GO:0060294	cilium movement involved in cell motilit...	36	2	1.52	0.45366	1	BP
GO:0000184	nuclear-transcribed mRNA catabolic proce...	36	2	1.52	0.45366	1	BP
GO:0006099	tricarboxylic acid cycle	14	1	0.59	0.45417	1	BP
GO:0010676	positive regulation of cellular carbohyd...	14	1	0.59	0.45417	1	BP
GO:0033143	regulation of intracellular steroid horm...	14	1	0.59	0.45417	1	BP
GO:0036003	positive regulation of transcription fro...	14	1	0.59	0.45417	1	BP
GO:1903533	regulation of protein targeting	14	1	0.59	0.45417	1	BP
GO:2000378	negative regulation of reactive oxygen s...	14	1	0.59	0.45417	1	BP
GO:0098927	vesicle-mediated transport between endos...	14	1	0.59	0.45417	1	BP
GO:0006361	transcription initiation from RNA polyme...	14	1	0.59	0.45417	1	BP
GO:0034243	regulation of transcription elongation f...	14	1	0.59	0.45417	1	BP
GO:1902930	regulation of alcohol biosynthetic proce...	14	1	0.59	0.45417	1	BP
GO:0006458	'de novo' protein folding	14	1	0.59	0.45417	1	BP
GO:0036335	intestinal stem cell homeostasis	14	1	0.59	0.45417	1	BP
GO:0045143	homologous chromosome segregation	14	1	0.59	0.45417	1	BP
GO:0045138	nematode male tail tip morphogenesis	14	1	0.59	0.45417	1	BP
GO:0006418	tRNA aminoacylation for protein translat...	14	1	0.59	0.45417	1	BP
GO:0043574	peroxisomal transport	14	1	0.59	0.45417	1	BP
GO:0061063	positive regulation of nematode larval d...	14	1	0.59	0.45417	1	BP
GO:0048016	inositol phosphate-mediated signaling	14	1	0.59	0.45417	1	BP
GO:0031987	locomotion involved in locomotory behavi...	14	1	0.59	0.45417	1	BP
GO:0021983	pituitary gland development	14	1	0.59	0.45417	1	BP
GO:0006101	citrate metabolic process	14	1	0.59	0.45417	1	BP
GO:0016126	sterol biosynthetic process	14	1	0.59	0.45417	1	BP
GO:0016226	iron-sulfur cluster assembly	14	1	0.59	0.45417	1	BP
GO:0045598	regulation of fat cell differentiation	14	1	0.59	0.45417	1	BP
GO:0032088	negative regulation of NF-kappaB transcr...	14	1	0.59	0.45417	1	BP
GO:0090181	regulation of cholesterol metabolic proc...	14	1	0.59	0.45417	1	BP
GO:0071470	cellular response to osmotic stress	14	1	0.59	0.45417	1	BP
GO:0045639	positive regulation of myeloid cell diff...	14	1	0.59	0.45417	1	BP
GO:0043039	tRNA aminoacylation	14	1	0.59	0.45417	1	BP
GO:1903307	positive regulation of regulated secreto...	14	1	0.59	0.45417	1	BP
GO:0006635	fatty acid beta-oxidation	14	1	0.59	0.45417	1	BP
GO:0032350	regulation of hormone metabolic process	14	1	0.59	0.45417	1	BP
GO:0031163	metallo-sulfur cluster assembly	14	1	0.59	0.45417	1	BP
GO:1904358	positive regulation of telomere maintena...	14	1	0.59	0.45417	1	BP
GO:0031111	negative regulation of microtubule polym...	14	1	0.59	0.45417	1	BP
GO:0010771	negative regulation of cell morphogenesi...	14	1	0.59	0.45417	1	BP
GO:0032413	negative regulation of ion transmembrane...	14	1	0.59	0.45417	1	BP
GO:0065002	intracellular protein transmembrane tran...	14	1	0.59	0.45417	1	BP
GO:0001755	neural crest cell migration	14	1	0.59	0.45417	1	BP
GO:0071310	cellular response to organic substance	477	21	20.14	0.45425	1	BP
GO:0098542	defense response to other organism	151	7	6.38	0.45661	1	BP
GO:0051726	regulation of cell cycle	314	14	13.26	0.45728	1	BP
GO:0006469	negative regulation of protein kinase ac...	59	3	2.49	0.45792	1	BP
GO:0051124	synaptic assembly at neuromuscular junct...	59	3	2.49	0.45792	1	BP
GO:0070997	neuron death	105	5	4.43	0.45848	1	BP
GO:0032269	negative regulation of cellular protein ...	221	10	9.33	0.45867	1	BP
GO:0048667	cell morphogenesis involved in neuron di...	221	10	9.33	0.45867	1	BP
GO:2000241	regulation of reproductive process	82	4	3.46	0.45878	1	BP
GO:0034645	cellular macromolecule biosynthetic proc...	916	50	38.68	0.46213	1	BP
GO:0044260	cellular macromolecule metabolic process	1518	72	64.09	0.46374	1	BP
GO:0051961	negative regulation of nervous system de...	106	5	4.48	0.46688	1	BP
GO:0042981	regulation of apoptotic process	316	14	13.34	0.46735	1	BP
GO:0001539	cilium or flagellum-dependent cell motil...	37	2	1.56	0.46795	1	BP
GO:1901989	positive regulation of cell cycle phase ...	37	2	1.56	0.46795	1	BP
GO:0030048	actin filament-based movement	37	2	1.56	0.46795	1	BP
GO:0031960	response to corticosteroid	37	2	1.56	0.46795	1	BP
GO:0071326	cellular response to monosaccharide stim...	37	2	1.56	0.46795	1	BP
GO:0071331	cellular response to hexose stimulus	37	2	1.56	0.46795	1	BP
GO:0071333	cellular response to glucose stimulus	37	2	1.56	0.46795	1	BP
GO:0060285	cilium-dependent cell motility	37	2	1.56	0.46795	1	BP
GO:0009145	purine nucleoside triphosphate biosynthe...	37	2	1.56	0.46795	1	BP
GO:0048706	embryonic skeletal system development	37	2	1.56	0.46795	1	BP
GO:0009206	purine ribonucleoside triphosphate biosy...	37	2	1.56	0.46795	1	BP
GO:0009719	response to endogenous stimulus	363	16	15.33	0.4681	1	BP
GO:0042692	muscle cell differentiation	83	4	3.5	0.46826	1	BP
GO:0050807	regulation of synapse organization	83	4	3.5	0.46826	1	BP
GO:1902533	positive regulation of intracellular sig...	176	8	7.43	0.46856	1	BP
GO:1903828	negative regulation of protein localizat...	60	3	2.53	0.46907	1	BP
GO:0021543	pallium development	60	3	2.53	0.46907	1	BP
GO:0006364	rRNA processing	60	3	2.53	0.46907	1	BP
GO:0031396	regulation of protein ubiquitination	60	3	2.53	0.46907	1	BP
GO:0045184	establishment of protein localization	434	19	18.32	0.47098	1	BP
GO:0006820	anion transport	130	6	5.49	0.47291	1	BP
GO:0022008	neurogenesis	505	22	21.32	0.47324	1	BP
GO:0023052	signaling	1024	44	43.24	0.47632	1	BP
GO:0001776	leukocyte homeostasis	15	1	0.63	0.47733	1	BP
GO:0010591	regulation of lamellipodium assembly	15	1	0.63	0.47733	1	BP
GO:0043457	regulation of cellular respiration	15	1	0.63	0.47733	1	BP
GO:0061515	myeloid cell development	15	1	0.63	0.47733	1	BP
GO:0042220	response to cocaine	15	1	0.63	0.47733	1	BP
GO:0032272	negative regulation of protein polymeriz...	15	1	0.63	0.47733	1	BP
GO:0048641	regulation of skeletal muscle tissue dev...	15	1	0.63	0.47733	1	BP
GO:0033238	regulation of cellular amine metabolic p...	15	1	0.63	0.47733	1	BP
GO:2000379	positive regulation of reactive oxygen s...	15	1	0.63	0.47733	1	BP
GO:0060071	Wnt signaling pathway, planar cell polar...	15	1	0.63	0.47733	1	BP
GO:0045428	regulation of nitric oxide biosynthetic ...	15	1	0.63	0.47733	1	BP
GO:0035167	larval lymph gland hemopoiesis	15	1	0.63	0.47733	1	BP
GO:1900368	regulation of post-transcriptional gene ...	15	1	0.63	0.47733	1	BP
GO:0038094	Fc-gamma receptor signaling pathway	15	1	0.63	0.47733	1	BP
GO:0038096	Fc-gamma receptor signaling pathway invo...	15	1	0.63	0.47733	1	BP
GO:0044788	modulation by host of viral process	15	1	0.63	0.47733	1	BP
GO:0040020	regulation of meiotic nuclear division	15	1	0.63	0.47733	1	BP
GO:0006296	nucleotide-excision repair, DNA incision...	15	1	0.63	0.47733	1	BP
GO:0046209	nitric oxide metabolic process	15	1	0.63	0.47733	1	BP
GO:0080164	regulation of nitric oxide metabolic pro...	15	1	0.63	0.47733	1	BP
GO:0042067	establishment of ommatidial planar polar...	15	1	0.63	0.47733	1	BP
GO:0060147	regulation of post-transcriptional gene ...	15	1	0.63	0.47733	1	BP
GO:0051496	positive regulation of stress fiber asse...	15	1	0.63	0.47733	1	BP
GO:0032007	negative regulation of TOR signaling	15	1	0.63	0.47733	1	BP
GO:0032008	positive regulation of TOR signaling	15	1	0.63	0.47733	1	BP
GO:0060261	positive regulation of transcription ini...	15	1	0.63	0.47733	1	BP
GO:0006809	nitric oxide biosynthetic process	15	1	0.63	0.47733	1	BP
GO:0061180	mammary gland epithelium development	15	1	0.63	0.47733	1	BP
GO:1903312	negative regulation of mRNA metabolic pr...	15	1	0.63	0.47733	1	BP
GO:0043038	amino acid activation	15	1	0.63	0.47733	1	BP
GO:0050850	positive regulation of calcium-mediated ...	15	1	0.63	0.47733	1	BP
GO:0051279	regulation of release of sequestered cal...	15	1	0.63	0.47733	1	BP
GO:0050886	endocrine process	15	1	0.63	0.47733	1	BP
GO:0007530	sex determination	15	1	0.63	0.47733	1	BP
GO:0051205	protein insertion into membrane	15	1	0.63	0.47733	1	BP
GO:0002433	immune response-regulating cell surface ...	15	1	0.63	0.47733	1	BP
GO:0051784	negative regulation of nuclear division	15	1	0.63	0.47733	1	BP
GO:0009247	glycolipid biosynthetic process	15	1	0.63	0.47733	1	BP
GO:0070534	protein K63-linked ubiquitination	15	1	0.63	0.47733	1	BP
GO:0032410	negative regulation of transporter activ...	15	1	0.63	0.47733	1	BP
GO:0014009	glial cell proliferation	15	1	0.63	0.47733	1	BP
GO:1903532	positive regulation of secretion by cell	84	4	3.55	0.47767	1	BP
GO:0019098	reproductive behavior	84	4	3.55	0.47767	1	BP
GO:0090150	establishment of protein localization to...	84	4	3.55	0.47767	1	BP
GO:0010769	regulation of cell morphogenesis involve...	84	4	3.55	0.47767	1	BP
GO:0051493	regulation of cytoskeleton organization	131	6	5.53	0.48048	1	BP
GO:0046907	intracellular transport	507	22	21.41	0.48152	1	BP
GO:0055082	cellular chemical homeostasis	178	8	7.52	0.48167	1	BP
GO:0030832	regulation of actin filament length	38	2	1.6	0.48202	1	BP
GO:0010821	regulation of mitochondrion organization	38	2	1.6	0.48202	1	BP
GO:2000060	positive regulation of ubiquitin-depende...	38	2	1.6	0.48202	1	BP
GO:1903825	organic acid transmembrane transport	38	2	1.6	0.48202	1	BP
GO:0009615	response to virus	38	2	1.6	0.48202	1	BP
GO:0034404	nucleobase-containing small molecule bio...	38	2	1.6	0.48202	1	BP
GO:0008064	regulation of actin polymerization or de...	38	2	1.6	0.48202	1	BP
GO:0046496	nicotinamide nucleotide metabolic proces...	38	2	1.6	0.48202	1	BP
GO:0006892	post-Golgi vesicle-mediated transport	38	2	1.6	0.48202	1	BP
GO:0019362	pyridine nucleotide metabolic process	38	2	1.6	0.48202	1	BP
GO:1901796	regulation of signal transduction by p53...	38	2	1.6	0.48202	1	BP
GO:1905039	carboxylic acid transmembrane transport	38	2	1.6	0.48202	1	BP
GO:0009142	nucleoside triphosphate biosynthetic pro...	38	2	1.6	0.48202	1	BP
GO:0009201	ribonucleoside triphosphate biosynthetic...	38	2	1.6	0.48202	1	BP
GO:0051248	negative regulation of protein metabolic...	225	10	9.5	0.4822	1	BP
GO:0051276	chromosome organization	319	14	13.47	0.48241	1	BP
GO:0006605	protein targeting	108	5	4.56	0.48355	1	BP
GO:0019932	second-messenger-mediated signaling	85	4	3.59	0.48703	1	BP
GO:1904951	positive regulation of establishment of ...	85	4	3.59	0.48703	1	BP
GO:0043086	negative regulation of catalytic activit...	132	6	5.57	0.48802	1	BP
GO:0019725	cellular homeostasis	226	10	9.54	0.48806	1	BP
GO:1901215	negative regulation of neuron death	62	3	2.62	0.49106	1	BP
GO:0051258	protein polymerization	62	3	2.62	0.49106	1	BP
GO:0001822	kidney development	77	7	3.25	0.49161	1	BP
GO:0009117	nucleotide metabolic process	180	8	7.6	0.4947	1	BP
GO:1901566	organonitrogen compound biosynthetic pro...	463	20	19.55	0.49472	1	BP
GO:0034655	nucleobase-containing compound catabolic...	133	6	5.62	0.49553	1	BP
GO:0050684	regulation of mRNA processing	39	2	1.65	0.49587	1	BP
GO:0072524	pyridine-containing compound metabolic p...	39	2	1.65	0.49587	1	BP
GO:0070972	protein localization to endoplasmic reti...	39	2	1.65	0.49587	1	BP
GO:0140053	mitochondrial gene expression	39	2	1.65	0.49587	1	BP
GO:1902905	positive regulation of supramolecular fi...	39	2	1.65	0.49587	1	BP
GO:0034764	positive regulation of transmembrane tra...	39	2	1.65	0.49587	1	BP
GO:0030198	extracellular matrix organization	39	2	1.65	0.49587	1	BP
GO:0035637	multicellular organismal signaling	39	2	1.65	0.49587	1	BP
GO:0051262	protein tetramerization	39	2	1.65	0.49587	1	BP
GO:0048762	mesenchymal cell differentiation	39	2	1.65	0.49587	1	BP
GO:0007622	rhythmic behavior	39	2	1.65	0.49587	1	BP
GO:0006874	cellular calcium ion homeostasis	86	4	3.63	0.49631	1	BP
GO:0030838	positive regulation of actin filament po...	16	1	0.68	0.49953	1	BP
GO:0048582	positive regulation of post-embryonic de...	16	1	0.68	0.49953	1	BP
GO:0006904	vesicle docking involved in exocytosis	16	1	0.68	0.49953	1	BP
GO:0032206	positive regulation of telomere maintena...	16	1	0.68	0.49953	1	BP
GO:2001057	reactive nitrogen species metabolic proc...	16	1	0.68	0.49953	1	BP
GO:0033138	positive regulation of peptidyl-serine p...	16	1	0.68	0.49953	1	BP
GO:0009651	response to salt stress	16	1	0.68	0.49953	1	BP
GO:0032890	regulation of organic acid transport	16	1	0.68	0.49953	1	BP
GO:1901998	toxin transport	16	1	0.68	0.49953	1	BP
GO:0031507	heterochromatin assembly	16	1	0.68	0.49953	1	BP
GO:0007031	peroxisome organization	16	1	0.68	0.49953	1	BP
GO:0035317	imaginal disc-derived wing hair organiza...	16	1	0.68	0.49953	1	BP
GO:0098930	axonal transport	16	1	0.68	0.49953	1	BP
GO:0002698	negative regulation of immune effector p...	16	1	0.68	0.49953	1	BP
GO:0045451	pole plasm oskar mRNA localization	16	1	0.68	0.49953	1	BP
GO:0051930	regulation of sensory perception of pain	16	1	0.68	0.49953	1	BP
GO:2000179	positive regulation of neural precursor ...	16	1	0.68	0.49953	1	BP
GO:0035162	embryonic hemopoiesis	16	1	0.68	0.49953	1	BP
GO:0034766	negative regulation of ion transmembrane...	16	1	0.68	0.49953	1	BP
GO:0043536	positive regulation of blood vessel endo...	16	1	0.68	0.49953	1	BP
GO:0033619	membrane protein proteolysis	16	1	0.68	0.49953	1	BP
GO:0060349	bone morphogenesis	16	1	0.68	0.49953	1	BP
GO:0045815	epigenetic maintenance of chromatin in t...	16	1	0.68	0.49953	1	BP
GO:0045844	positive regulation of striated muscle t...	16	1	0.68	0.49953	1	BP
GO:0046785	microtubule polymerization	16	1	0.68	0.49953	1	BP
GO:0031397	negative regulation of protein ubiquitin...	16	1	0.68	0.49953	1	BP
GO:2000648	positive regulation of stem cell prolife...	16	1	0.68	0.49953	1	BP
GO:0072350	tricarboxylic acid metabolic process	16	1	0.68	0.49953	1	BP
GO:0050732	negative regulation of peptidyl-tyrosine...	16	1	0.68	0.49953	1	BP
GO:0008206	bile acid metabolic process	16	1	0.68	0.49953	1	BP
GO:0048278	vesicle docking	16	1	0.68	0.49953	1	BP
GO:1901863	positive regulation of muscle tissue dev...	16	1	0.68	0.49953	1	BP
GO:0016601	Rac protein signal transduction	16	1	0.68	0.49953	1	BP
GO:0003382	epithelial cell morphogenesis	16	1	0.68	0.49953	1	BP
GO:0070509	calcium ion import	16	1	0.68	0.49953	1	BP
GO:0014031	mesenchymal cell development	16	1	0.68	0.49953	1	BP
GO:0014032	neural crest cell development	16	1	0.68	0.49953	1	BP
GO:0051897	positive regulation of protein kinase B ...	16	1	0.68	0.49953	1	BP
GO:0051171	regulation of nitrogen compound metaboli...	1010	51	42.64	0.50049	1	BP
GO:0006753	nucleoside phosphate metabolic process	181	8	7.64	0.50118	1	BP
GO:0044249	cellular biosynthetic process	1171	59	49.44	0.50141	1	BP
GO:0032147	activation of protein kinase activity	63	3	2.66	0.5019	1	BP
GO:0016054	organic acid catabolic process	63	3	2.66	0.5019	1	BP
GO:0046395	carboxylic acid catabolic process	63	3	2.66	0.5019	1	BP
GO:0042592	homeostatic process	394	17	16.64	0.50287	1	BP
GO:0098657	import into cell	134	6	5.66	0.50301	1	BP
GO:0002790	peptide secretion	134	6	5.66	0.50301	1	BP
GO:0030003	cellular cation homeostasis	134	6	5.66	0.50301	1	BP
GO:0010720	positive regulation of cell development	158	7	6.67	0.50548	1	BP
GO:0016236	macroautophagy	87	4	3.67	0.50553	1	BP
GO:0048812	neuron projection morphogenesis	229	10	9.67	0.50554	1	BP
GO:0072359	circulatory system development	194	12	8.19	0.50646	1	BP
GO:0043549	regulation of kinase activity	182	8	7.68	0.50764	1	BP
GO:0016567	protein ubiquitination	182	8	7.68	0.50764	1	BP
GO:0071396	cellular response to lipid	111	5	4.69	0.50823	1	BP
GO:0050776	regulation of immune response	111	5	4.69	0.50823	1	BP
GO:0051716	cellular response to stimulus	1223	52	51.64	0.50945	1	BP
GO:0043401	steroid hormone mediated signaling pathw...	40	2	1.69	0.50948	1	BP
GO:0001678	cellular glucose homeostasis	40	2	1.69	0.50948	1	BP
GO:0002696	positive regulation of leukocyte activat...	40	2	1.69	0.50948	1	BP
GO:0010927	cellular component assembly involved in ...	40	2	1.69	0.50948	1	BP
GO:0040025	vulval development	40	2	1.69	0.50948	1	BP
GO:0034614	cellular response to reactive oxygen spe...	40	2	1.69	0.50948	1	BP
GO:0071322	cellular response to carbohydrate stimul...	40	2	1.69	0.50948	1	BP
GO:0031398	positive regulation of protein ubiquitin...	40	2	1.69	0.50948	1	BP
GO:0002429	immune response-activating cell surface ...	40	2	1.69	0.50948	1	BP
GO:0014074	response to purine-containing compound	40	2	1.69	0.50948	1	BP
GO:0009636	response to toxic substance	135	6	5.7	0.51045	1	BP
GO:0050769	positive regulation of neurogenesis	135	6	5.7	0.51045	1	BP
GO:0010646	regulation of cell communication	680	29	28.71	0.51186	1	BP
GO:0065008	regulation of biological quality	822	35	34.71	0.51216	1	BP
GO:0071902	positive regulation of protein serine/th...	64	3	2.7	0.51261	1	BP
GO:0033673	negative regulation of kinase activity	64	3	2.7	0.51261	1	BP
GO:0009167	purine ribonucleoside monophosphate meta...	64	3	2.7	0.51261	1	BP
GO:0009411	response to UV	44	4	1.86	0.5138	1	BP
GO:0019216	regulation of lipid metabolic process	88	4	3.72	0.51468	1	BP
GO:0051047	positive regulation of secretion	88	4	3.72	0.51468	1	BP
GO:0001101	response to acid chemical	88	4	3.72	0.51468	1	BP
GO:0010817	regulation of hormone levels	112	5	4.73	0.51636	1	BP
GO:0034329	cell junction assembly	112	5	4.73	0.51636	1	BP
GO:0016570	histone modification	112	5	4.73	0.51636	1	BP
GO:1903530	regulation of secretion by cell	160	7	6.76	0.51921	1	BP
GO:0044770	cell cycle phase transition	184	8	7.77	0.52049	1	BP
GO:0010823	negative regulation of mitochondrion org...	17	1	0.72	0.52078	1	BP
GO:0071806	protein transmembrane transport	17	1	0.72	0.52078	1	BP
GO:0042129	regulation of T cell proliferation	17	1	0.72	0.52078	1	BP
GO:0060632	regulation of microtubule-based movement	17	1	0.72	0.52078	1	BP
GO:0006984	ER-nucleus signaling pathway	17	1	0.72	0.52078	1	BP
GO:0032233	positive regulation of actin filament bu...	17	1	0.72	0.52078	1	BP
GO:0006084	acetyl-CoA metabolic process	17	1	0.72	0.52078	1	BP
GO:0048636	positive regulation of muscle organ deve...	17	1	0.72	0.52078	1	BP
GO:1900087	positive regulation of G1/S transition o...	17	1	0.72	0.52078	1	BP
GO:0001658	branching involved in ureteric bud morph...	17	1	0.72	0.52078	1	BP
GO:0035316	non-sensory hair organization	17	1	0.72	0.52078	1	BP
GO:0021602	cranial nerve morphogenesis	17	1	0.72	0.52078	1	BP
GO:0055117	regulation of cardiac muscle contraction	17	1	0.72	0.52078	1	BP
GO:0044275	cellular carbohydrate catabolic process	17	1	0.72	0.52078	1	BP
GO:0045446	endothelial cell differentiation	17	1	0.72	0.52078	1	BP
GO:0006493	protein O-linked glycosylation	17	1	0.72	0.52078	1	BP
GO:2000178	negative regulation of neural precursor ...	17	1	0.72	0.52078	1	BP
GO:0021954	central nervous system neuron developmen...	17	1	0.72	0.52078	1	BP
GO:0007316	pole plasm RNA localization	17	1	0.72	0.52078	1	BP
GO:0033683	nucleotide-excision repair, DNA incision	17	1	0.72	0.52078	1	BP
GO:1903902	positive regulation of viral life cycle	17	1	0.72	0.52078	1	BP
GO:0019094	pole plasm mRNA localization	17	1	0.72	0.52078	1	BP
GO:0090329	regulation of DNA-templated DNA replicat...	17	1	0.72	0.52078	1	BP
GO:0090317	negative regulation of intracellular pro...	17	1	0.72	0.52078	1	BP
GO:0002062	chondrocyte differentiation	17	1	0.72	0.52078	1	BP
GO:0042052	rhabdomere development	17	1	0.72	0.52078	1	BP
GO:0043966	histone H3 acetylation	17	1	0.72	0.52078	1	BP
GO:0051481	negative regulation of cytosolic calcium...	17	1	0.72	0.52078	1	BP
GO:1901264	carbohydrate derivative transport	17	1	0.72	0.52078	1	BP
GO:0031338	regulation of vesicle fusion	17	1	0.72	0.52078	1	BP
GO:0019320	hexose catabolic process	17	1	0.72	0.52078	1	BP
GO:0016574	histone ubiquitination	17	1	0.72	0.52078	1	BP
GO:0007595	lactation	17	1	0.72	0.52078	1	BP
GO:0046631	alpha-beta T cell activation	17	1	0.72	0.52078	1	BP
GO:0098869	cellular oxidant detoxification	17	1	0.72	0.52078	1	BP
GO:0002431	Fc receptor mediated stimulatory signali...	17	1	0.72	0.52078	1	BP
GO:0042475	odontogenesis of dentin-containing tooth	17	1	0.72	0.52078	1	BP
GO:0003333	amino acid transmembrane transport	17	1	0.72	0.52078	1	BP
GO:0043207	response to external biotic stimulus	208	9	8.78	0.5217	1	BP
GO:0051707	response to other organism	208	9	8.78	0.5217	1	BP
GO:0048863	stem cell differentiation	68	5	2.87	0.52203	1	BP
GO:0006090	pyruvate metabolic process	41	2	1.73	0.52285	1	BP
GO:1901991	negative regulation of mitotic cell cycl...	41	2	1.73	0.52285	1	BP
GO:0007431	salivary gland development	41	2	1.73	0.52285	1	BP
GO:0030308	negative regulation of cell growth	41	2	1.73	0.52285	1	BP
GO:1901292	nucleoside phosphate catabolic process	41	2	1.73	0.52285	1	BP
GO:0015698	inorganic anion transport	41	2	1.73	0.52285	1	BP
GO:0008286	insulin receptor signaling pathway	41	2	1.73	0.52285	1	BP
GO:0016573	histone acetylation	41	2	1.73	0.52285	1	BP
GO:0009166	nucleotide catabolic process	41	2	1.73	0.52285	1	BP
GO:0000724	double-strand break repair via homologou...	41	2	1.73	0.52285	1	BP
GO:0000725	recombinational repair	41	2	1.73	0.52285	1	BP
GO:0050867	positive regulation of cell activation	41	2	1.73	0.52285	1	BP
GO:0009743	response to carbohydrate	65	3	2.74	0.52321	1	BP
GO:0006310	DNA recombination	65	3	2.74	0.52321	1	BP
GO:0051054	positive regulation of DNA metabolic pro...	65	3	2.74	0.52321	1	BP
GO:0055074	calcium ion homeostasis	89	4	3.76	0.52375	1	BP
GO:0010639	negative regulation of organelle organiz...	113	5	4.77	0.52443	1	BP
GO:0006875	cellular metal ion homeostasis	113	5	4.77	0.52443	1	BP
GO:0042326	negative regulation of phosphorylation	113	5	4.77	0.52443	1	BP
GO:0051223	regulation of protein transport	161	7	6.8	0.52602	1	BP
GO:0009952	anterior/posterior pattern specification	94	6	3.97	0.52827	1	BP
GO:0006518	peptide metabolic process	233	10	9.84	0.5286	1	BP
GO:1901576	organic substance biosynthetic process	1185	59	50.03	0.53018	1	BP
GO:0043603	cellular amide metabolic process	305	13	12.88	0.53122	1	BP
GO:0002684	positive regulation of immune system pro...	114	5	4.81	0.53245	1	BP
GO:1901987	regulation of cell cycle phase transitio...	138	6	5.83	0.53252	1	BP
GO:0044270	cellular nitrogen compound catabolic pro...	138	6	5.83	0.53252	1	BP
GO:0018205	peptidyl-lysine modification	90	4	3.8	0.53274	1	BP
GO:0002831	regulation of response to biotic stimulu...	66	3	2.79	0.53368	1	BP
GO:0031334	positive regulation of protein-containin...	66	3	2.79	0.53368	1	BP
GO:0051338	regulation of transferase activity	210	9	8.87	0.53374	1	BP
GO:0030041	actin filament polymerization	42	2	1.77	0.53597	1	BP
GO:0007162	negative regulation of cell adhesion	42	2	1.77	0.53597	1	BP
GO:0008344	adult locomotory behavior	42	2	1.77	0.53597	1	BP
GO:0022900	electron transport chain	42	2	1.77	0.53597	1	BP
GO:0018393	internal peptidyl-lysine acetylation	42	2	1.77	0.53597	1	BP
GO:0017157	regulation of exocytosis	42	2	1.77	0.53597	1	BP
GO:0071229	cellular response to acid chemical	42	2	1.77	0.53597	1	BP
GO:0050863	regulation of T cell activation	42	2	1.77	0.53597	1	BP
