GO.ID	Term	Annotated	Significant	Expected	pval_test	pval_adj	ontology
GO:1903902	positive regulation of viral life cycle	17	2	0.86	0.20988	1	BP
GO:0045879	negative regulation of smoothened signal...	17	2	0.86	0.20988	1	BP
GO:0002062	chondrocyte differentiation	17	2	0.86	0.20988	1	BP
GO:0071384	cellular response to corticosteroid stim...	17	2	0.86	0.20988	1	BP
GO:0051481	negative regulation of cytosolic calcium...	17	2	0.86	0.20988	1	BP
GO:0046888	negative regulation of hormone secretion	17	2	0.86	0.20988	1	BP
GO:1901264	carbohydrate derivative transport	17	2	0.86	0.20988	1	BP
GO:0002431	Fc receptor mediated stimulatory signali...	17	2	0.86	0.20988	1	BP
GO:0062149	detection of stimulus involved in sensor...	17	2	0.86	0.20988	1	BP
GO:1901532	regulation of hematopoietic progenitor c...	17	2	0.86	0.20988	1	BP
GO:0010942	positive regulation of cell death	166	11	8.36	0.21097	1	BP
GO:0003012	muscle system process	80	6	4.03	0.21301	1	BP
GO:0007163	establishment or maintenance of cell pol...	97	7	4.89	0.21402	1	BP
GO:0010469	regulation of signaling receptor activit...	32	3	1.61	0.21631	1	BP
GO:0051147	regulation of muscle cell differentiatio...	32	3	1.61	0.21631	1	BP
GO:1900542	regulation of purine nucleotide metaboli...	32	3	1.61	0.21631	1	BP
GO:0006928	movement of cell or subcellular componen...	455	29	22.92	0.21643	1	BP
GO:0009725	response to hormone	239	15	12.04	0.21798	1	BP
GO:0002764	immune response-regulating signaling pat...	64	5	3.22	0.21812	1	BP
GO:0032409	regulation of transporter activity	48	4	2.42	0.22052	1	BP
GO:0050678	regulation of epithelial cell proliferat...	48	4	2.42	0.22052	1	BP
GO:0043406	positive regulation of MAP kinase activi...	48	4	2.42	0.22052	1	BP
GO:0060359	response to ammonium ion	48	4	2.42	0.22052	1	BP
GO:0051302	regulation of cell division	48	4	2.42	0.22052	1	BP
GO:0006644	phospholipid metabolic process	98	7	4.94	0.22146	1	BP
GO:0006066	alcohol metabolic process	65	5	3.27	0.22745	1	BP
GO:0006898	receptor-mediated endocytosis	65	5	3.27	0.22745	1	BP
GO:0071827	plasma lipoprotein particle organization	5	1	0.25	0.22788	1	BP
GO:0035909	aorta morphogenesis	5	1	0.25	0.22788	1	BP
GO:0042159	lipoprotein catabolic process	5	1	0.25	0.22788	1	BP
GO:2000010	positive regulation of protein localizat...	5	1	0.25	0.22788	1	BP
GO:0071577	zinc ion transmembrane transport	5	1	0.25	0.22788	1	BP
GO:0032253	dense core granule localization	5	1	0.25	0.22788	1	BP
GO:0003171	atrioventricular valve development	5	1	0.25	0.22788	1	BP
GO:0006098	pentose-phosphate shunt	5	1	0.25	0.22788	1	BP
GO:0019896	axonal transport of mitochondrion	5	1	0.25	0.22788	1	BP
GO:0071684	organism emergence from protective struc...	5	1	0.25	0.22788	1	BP
GO:0034334	adherens junction maintenance	5	1	0.25	0.22788	1	BP
GO:0039528	cytoplasmic pattern recognition receptor...	5	1	0.25	0.22788	1	BP
GO:0001659	temperature homeostasis	5	1	0.25	0.22788	1	BP
GO:1900078	positive regulation of cellular response...	5	1	0.25	0.22788	1	BP
GO:1900027	regulation of ruffle assembly	5	1	0.25	0.22788	1	BP
GO:0033275	actin-myosin filament sliding	5	1	0.25	0.22788	1	BP
GO:1901950	dense core granule transport	5	1	0.25	0.22788	1	BP
GO:0050907	detection of chemical stimulus involved ...	5	1	0.25	0.22788	1	BP
GO:0000972	transcription-dependent tethering of RNA...	5	1	0.25	0.22788	1	BP
GO:0006359	regulation of transcription by RNA polym...	5	1	0.25	0.22788	1	BP
GO:0008090	retrograde axonal transport	5	1	0.25	0.22788	1	BP
GO:0090085	regulation of protein deubiquitination	5	1	0.25	0.22788	1	BP
GO:0090077	foam cell differentiation	5	1	0.25	0.22788	1	BP
GO:1902932	positive regulation of alcohol biosynthe...	5	1	0.25	0.22788	1	BP
GO:0000038	very long-chain fatty acid metabolic pro...	5	1	0.25	0.22788	1	BP
GO:0018904	ether metabolic process	5	1	0.25	0.22788	1	BP
GO:0048070	regulation of developmental pigmentation	5	1	0.25	0.22788	1	BP
GO:0040027	negative regulation of vulval developmen...	5	1	0.25	0.22788	1	BP
GO:0016334	establishment or maintenance of polarity...	5	1	0.25	0.22788	1	BP
GO:0030049	muscle filament sliding	5	1	0.25	0.22788	1	BP
GO:1902065	response to L-glutamate	5	1	0.25	0.22788	1	BP
GO:1902074	response to salt	5	1	0.25	0.22788	1	BP
GO:2000279	negative regulation of DNA biosynthetic ...	5	1	0.25	0.22788	1	BP
GO:0031952	regulation of protein autophosphorylatio...	5	1	0.25	0.22788	1	BP
GO:1902018	negative regulation of cilium assembly	5	1	0.25	0.22788	1	BP
GO:1990440	positive regulation of transcription fro...	5	1	0.25	0.22788	1	BP
GO:0045200	establishment of neuroblast polarity	5	1	0.25	0.22788	1	BP
GO:0120305	regulation of pigmentation	5	1	0.25	0.22788	1	BP
GO:0007465	R7 cell fate commitment	5	1	0.25	0.22788	1	BP
GO:0045760	positive regulation of action potential	5	1	0.25	0.22788	1	BP
GO:0036158	outer dynein arm assembly	5	1	0.25	0.22788	1	BP
GO:2000726	negative regulation of cardiac muscle ce...	5	1	0.25	0.22788	1	BP
GO:0047497	mitochondrion transport along microtubul...	5	1	0.25	0.22788	1	BP
GO:0060413	atrial septum morphogenesis	5	1	0.25	0.22788	1	BP
GO:0080182	histone H3-K4 trimethylation	5	1	0.25	0.22788	1	BP
GO:0071389	cellular response to mineralocorticoid s...	5	1	0.25	0.22788	1	BP
GO:0015874	norepinephrine transport	5	1	0.25	0.22788	1	BP
GO:0061355	Wnt protein secretion	5	1	0.25	0.22788	1	BP
GO:0034643	establishment of mitochondrion localizat...	5	1	0.25	0.22788	1	BP
GO:0007277	pole cell development	5	1	0.25	0.22788	1	BP
GO:0042045	epithelial fluid transport	5	1	0.25	0.22788	1	BP
GO:0006882	cellular zinc ion homeostasis	5	1	0.25	0.22788	1	BP
GO:0009312	oligosaccharide biosynthetic process	5	1	0.25	0.22788	1	BP
GO:0140718	facultative heterochromatin assembly	5	1	0.25	0.22788	1	BP
GO:0051156	glucose 6-phosphate metabolic process	5	1	0.25	0.22788	1	BP
GO:1903319	positive regulation of protein maturatio...	5	1	0.25	0.22788	1	BP
GO:0061117	negative regulation of heart growth	5	1	0.25	0.22788	1	BP
GO:0090205	positive regulation of cholesterol metab...	5	1	0.25	0.22788	1	BP
GO:0006620	post-translational protein targeting to ...	5	1	0.25	0.22788	1	BP
GO:0048280	vesicle fusion with Golgi apparatus	5	1	0.25	0.22788	1	BP
GO:0048243	norepinephrine secretion	5	1	0.25	0.22788	1	BP
GO:0006607	NLS-bearing protein import into nucleus	5	1	0.25	0.22788	1	BP
GO:0051220	cytoplasmic sequestering of protein	5	1	0.25	0.22788	1	BP
GO:0032366	intracellular sterol transport	5	1	0.25	0.22788	1	BP
GO:0032367	intracellular cholesterol transport	5	1	0.25	0.22788	1	BP
GO:0072160	nephron tubule epithelial cell different...	5	1	0.25	0.22788	1	BP
GO:0046633	alpha-beta T cell proliferation	5	1	0.25	0.22788	1	BP
GO:0031112	positive regulation of microtubule polym...	5	1	0.25	0.22788	1	BP
GO:0014061	regulation of norepinephrine secretion	5	1	0.25	0.22788	1	BP
GO:0031294	lymphocyte costimulation	5	1	0.25	0.22788	1	BP
GO:0031295	T cell costimulation	5	1	0.25	0.22788	1	BP
GO:0055022	negative regulation of cardiac muscle ti...	5	1	0.25	0.22788	1	BP
GO:0030537	larval behavior	18	2	0.91	0.22879	1	BP
GO:0030500	regulation of bone mineralization	18	2	0.91	0.22879	1	BP
GO:0006081	cellular aldehyde metabolic process	18	2	0.91	0.22879	1	BP
GO:0021879	forebrain neuron differentiation	18	2	0.91	0.22879	1	BP
GO:0010660	regulation of muscle cell apoptotic proc...	18	2	0.91	0.22879	1	BP
GO:0034341	response to interferon-gamma	18	2	0.91	0.22879	1	BP
GO:0000096	sulfur amino acid metabolic process	18	2	0.91	0.22879	1	BP
GO:0006301	postreplication repair	18	2	0.91	0.22879	1	BP
GO:0051931	regulation of sensory perception	18	2	0.91	0.22879	1	BP
GO:0008045	motor neuron axon guidance	18	2	0.91	0.22879	1	BP
GO:0009950	dorsal/ventral axis specification	18	2	0.91	0.22879	1	BP
GO:0040024	dauer larval development	18	2	0.91	0.22879	1	BP
GO:1902099	regulation of metaphase/anaphase transit...	18	2	0.91	0.22879	1	BP
GO:0038034	signal transduction in absence of ligand	18	2	0.91	0.22879	1	BP
GO:0046470	phosphatidylcholine metabolic process	18	2	0.91	0.22879	1	BP
GO:0097192	extrinsic apoptotic signaling pathway in...	18	2	0.91	0.22879	1	BP
GO:0046716	muscle cell cellular homeostasis	18	2	0.91	0.22879	1	BP
GO:0043967	histone H4 acetylation	18	2	0.91	0.22879	1	BP
GO:0048194	Golgi vesicle budding	18	2	0.91	0.22879	1	BP
GO:0048199	vesicle targeting, to, from or within Go...	18	2	0.91	0.22879	1	BP
GO:1903350	response to dopamine	18	2	0.91	0.22879	1	BP
GO:1903351	cellular response to dopamine	18	2	0.91	0.22879	1	BP
GO:0061178	regulation of insulin secretion involved...	18	2	0.91	0.22879	1	BP
GO:0014910	regulation of smooth muscle cell migrati...	18	2	0.91	0.22879	1	BP
GO:1903432	regulation of TORC1 signaling	18	2	0.91	0.22879	1	BP
GO:0014909	smooth muscle cell migration	18	2	0.91	0.22879	1	BP
GO:0007602	phototransduction	18	2	0.91	0.22879	1	BP
GO:0016055	Wnt signaling pathway	99	7	4.99	0.22899	1	BP
GO:0002066	columnar/cuboidal epithelial cell develo...	99	7	4.99	0.22899	1	BP
GO:0090316	positive regulation of intracellular pro...	33	3	1.66	0.22981	1	BP
GO:0016202	regulation of striated muscle tissue dev...	33	3	1.66	0.22981	1	BP
GO:0042058	regulation of epidermal growth factor re...	33	3	1.66	0.22981	1	BP
GO:1901184	regulation of ERBB signaling pathway	33	3	1.66	0.22981	1	BP
GO:0048259	regulation of receptor-mediated endocyto...	33	3	1.66	0.22981	1	BP
GO:1901861	regulation of muscle tissue development	33	3	1.66	0.22981	1	BP
GO:0042490	mechanoreceptor differentiation	33	3	1.66	0.22981	1	BP
GO:0050808	synapse organization	134	9	6.75	0.2305	1	BP
GO:0071248	cellular response to metal ion	49	4	2.47	0.23146	1	BP
GO:0032434	regulation of proteasomal ubiquitin-depe...	49	4	2.47	0.23146	1	BP
GO:0010033	response to organic substance	610	36	30.73	0.2365	1	BP
GO:0033500	carbohydrate homeostasis	66	5	3.32	0.2369	1	BP
GO:0051146	striated muscle cell differentiation	66	5	3.32	0.2369	1	BP
GO:0009408	response to heat	66	5	3.32	0.2369	1	BP
GO:0070588	calcium ion transmembrane transport	66	5	3.32	0.2369	1	BP
GO:0009057	macromolecule catabolic process	336	20	16.92	0.24119	1	BP
GO:0006612	protein targeting to membrane	50	4	2.52	0.24253	1	BP
GO:0021545	cranial nerve development	22	4	1.11	0.2429	1	BP
GO:0006140	regulation of nucleotide metabolic proce...	34	3	1.71	0.24346	1	BP
GO:0030178	negative regulation of Wnt signaling pat...	34	3	1.71	0.24346	1	BP
GO:0010171	body morphogenesis	34	3	1.71	0.24346	1	BP
GO:0050727	regulation of inflammatory response	34	3	1.71	0.24346	1	BP
GO:0046620	regulation of organ growth	34	3	1.71	0.24346	1	BP
GO:0019098	reproductive behavior	84	6	4.23	0.24641	1	BP
GO:0031099	regeneration	67	5	3.37	0.24646	1	BP
GO:0045069	regulation of viral genome replication	19	2	0.96	0.24782	1	BP
GO:0032781	positive regulation of ATP-dependent act...	19	2	0.96	0.24782	1	BP
GO:0051646	mitochondrion localization	19	2	0.96	0.24782	1	BP
GO:0043266	regulation of potassium ion transport	19	2	0.96	0.24782	1	BP
GO:0043535	regulation of blood vessel endothelial c...	19	2	0.96	0.24782	1	BP
GO:0007419	ventral cord development	19	2	0.96	0.24782	1	BP
GO:0015844	monoamine transport	19	2	0.96	0.24782	1	BP
GO:0090224	regulation of spindle organization	19	2	0.96	0.24782	1	BP
GO:0044088	regulation of vacuole organization	19	2	0.96	0.24782	1	BP
GO:0002253	activation of immune response	51	4	2.57	0.25372	1	BP
GO:0050796	regulation of insulin secretion	51	4	2.57	0.25372	1	BP
GO:0051129	negative regulation of cellular componen...	190	15	9.57	0.25473	1	BP
GO:0001745	compound eye morphogenesis	68	5	3.43	0.25612	1	BP
GO:0060070	canonical Wnt signaling pathway	68	5	3.43	0.25612	1	BP
GO:1901615	organic hydroxy compound metabolic proce...	107	9	5.39	0.25668	1	BP
GO:0032446	protein modification by small protein co...	192	12	9.67	0.25687	1	BP
GO:0044270	cellular nitrogen compound catabolic pro...	138	9	6.95	0.2571	1	BP
GO:0045047	protein targeting to ER	35	3	1.76	0.25724	1	BP
GO:0043467	regulation of generation of precursor me...	35	3	1.76	0.25724	1	BP
GO:0019882	antigen processing and presentation	35	3	1.76	0.25724	1	BP
GO:0048634	regulation of muscle organ development	35	3	1.76	0.25724	1	BP
GO:0043280	positive regulation of cysteine-type end...	35	3	1.76	0.25724	1	BP
GO:0035725	sodium ion transmembrane transport	35	3	1.76	0.25724	1	BP
GO:0031124	mRNA 3'-end processing	35	3	1.76	0.25724	1	BP
GO:0048771	tissue remodeling	35	3	1.76	0.25724	1	BP
GO:0050801	ion homeostasis	174	11	8.76	0.2576	1	BP
GO:0071417	cellular response to organonitrogen comp...	156	10	7.86	0.25774	1	BP
GO:0071900	regulation of protein serine/threonine k...	103	7	5.19	0.25994	1	BP
GO:0021675	nerve development	23	4	1.16	0.2617	1	BP
GO:0035418	protein localization to synapse	12	4	0.6	0.26219	1	BP
GO:0023061	signal release	144	11	7.25	0.26446	1	BP
GO:0031329	regulation of cellular catabolic process	230	14	11.59	0.26485	1	BP
GO:0008582	regulation of synaptic assembly at neuro...	52	4	2.62	0.26502	1	BP
GO:0008016	regulation of heart contraction	52	4	2.62	0.26502	1	BP
GO:0002376	immune system process	464	28	23.37	0.26587	1	BP
GO:1903050	regulation of proteolysis involved in ce...	69	5	3.48	0.26587	1	BP
GO:0009056	catabolic process	569	32	28.66	0.26627	1	BP
GO:0006952	defense response	212	13	10.68	0.26681	1	BP
GO:0051336	regulation of hydrolase activity	212	13	10.68	0.26681	1	BP
GO:0003301	physiological cardiac muscle hypertrophy	6	1	0.3	0.26684	1	BP
GO:0071875	adrenergic receptor signaling pathway	6	1	0.3	0.26684	1	BP
GO:0010867	positive regulation of triglyceride bios...	6	1	0.3	0.26684	1	BP
GO:0071825	protein-lipid complex subunit organizati...	6	1	0.3	0.26684	1	BP
GO:1902857	positive regulation of non-motile cilium...	6	1	0.3	0.26684	1	BP
GO:0006991	response to sterol depletion	6	1	0.3	0.26684	1	BP
GO:0006999	nuclear pore organization	6	1	0.3	0.26684	1	BP
GO:1901679	nucleotide transmembrane transport	6	1	0.3	0.26684	1	BP
GO:0086069	bundle of His cell to Purkinje myocyte c...	6	1	0.3	0.26684	1	BP
GO:0086050	membrane repolarization during bundle of...	6	1	0.3	0.26684	1	BP
GO:0086052	membrane repolarization during SA node c...	6	1	0.3	0.26684	1	BP
GO:0045071	negative regulation of viral genome repl...	6	1	0.3	0.26684	1	BP
GO:0086028	bundle of His cell to Purkinje myocyte s...	6	1	0.3	0.26684	1	BP
GO:0086043	bundle of His cell action potential	6	1	0.3	0.26684	1	BP
GO:0071549	cellular response to dexamethasone stimu...	6	1	0.3	0.26684	1	BP
GO:1903729	regulation of plasma membrane organizati...	6	1	0.3	0.26684	1	BP
GO:0032252	secretory granule localization	6	1	0.3	0.26684	1	BP
GO:0071501	cellular response to sterol depletion	6	1	0.3	0.26684	1	BP
GO:1904262	negative regulation of TORC1 signaling	6	1	0.3	0.26684	1	BP
GO:0010667	negative regulation of cardiac muscle ce...	6	1	0.3	0.26684	1	BP
GO:0051654	establishment of mitochondrion localizat...	6	1	0.3	0.26684	1	BP
GO:0003298	physiological muscle hypertrophy	6	1	0.3	0.26684	1	BP
GO:0043124	negative regulation of I-kappaB kinase/N...	6	1	0.3	0.26684	1	BP
GO:1902656	calcium ion import into cytosol	6	1	0.3	0.26684	1	BP
GO:1903818	positive regulation of voltage-gated pot...	6	1	0.3	0.26684	1	BP
GO:0046058	cAMP metabolic process	6	1	0.3	0.26684	1	BP
GO:0003283	atrial septum development	6	1	0.3	0.26684	1	BP
GO:0031581	hemidesmosome assembly	6	1	0.3	0.26684	1	BP
GO:0046033	AMP metabolic process	6	1	0.3	0.26684	1	BP
GO:0072531	pyrimidine-containing compound transmemb...	6	1	0.3	0.26684	1	BP
GO:0099624	atrial cardiac muscle cell membrane repo...	6	1	0.3	0.26684	1	BP
GO:0003209	cardiac atrium morphogenesis	6	1	0.3	0.26684	1	BP
GO:0035313	wound healing, spreading of epidermal ce...	6	1	0.3	0.26684	1	BP
GO:0019682	glyceraldehyde-3-phosphate metabolic pro...	6	1	0.3	0.26684	1	BP
GO:0021633	optic nerve structural organization	6	1	0.3	0.26684	1	BP
GO:1905208	negative regulation of cardiocyte differ...	6	1	0.3	0.26684	1	BP
GO:0098914	membrane repolarization during atrial ca...	6	1	0.3	0.26684	1	BP
GO:1901046	positive regulation of oviposition	6	1	0.3	0.26684	1	BP
GO:0000098	sulfur amino acid catabolic process	6	1	0.3	0.26684	1	BP
GO:0000083	regulation of transcription involved in ...	6	1	0.3	0.26684	1	BP
GO:0010940	positive regulation of necrotic cell dea...	6	1	0.3	0.26684	1	BP
GO:0035196	production of miRNAs involved in gene si...	6	1	0.3	0.26684	1	BP
GO:1900363	regulation of mRNA polyadenylation	6	1	0.3	0.26684	1	BP
GO:1902902	negative regulation of autophagosome ass...	6	1	0.3	0.26684	1	BP
GO:0001975	response to amphetamine	6	1	0.3	0.26684	1	BP
GO:0048072	compound eye pigmentation	6	1	0.3	0.26684	1	BP
GO:0061050	regulation of cell growth involved in ca...	6	1	0.3	0.26684	1	BP
GO:0040035	hermaphrodite genitalia development	6	1	0.3	0.26684	1	BP
GO:0048047	mating behavior, sex discrimination	6	1	0.3	0.26684	1	BP
GO:0061049	cell growth involved in cardiac muscle c...	6	1	0.3	0.26684	1	BP
GO:0051044	positive regulation of membrane protein ...	6	1	0.3	0.26684	1	BP
GO:1902019	regulation of cilium-dependent cell moti...	6	1	0.3	0.26684	1	BP
GO:0019991	septate junction assembly	6	1	0.3	0.26684	1	BP
GO:1902042	negative regulation of extrinsic apoptot...	6	1	0.3	0.26684	1	BP
GO:0045217	cell-cell junction maintenance	6	1	0.3	0.26684	1	BP
GO:0007339	binding of sperm to zona pellucida	6	1	0.3	0.26684	1	BP
GO:0019934	cGMP-mediated signaling	6	1	0.3	0.26684	1	BP
GO:0014829	vascular associated smooth muscle contra...	6	1	0.3	0.26684	1	BP
GO:2000780	negative regulation of double-strand bre...	6	1	0.3	0.26684	1	BP
GO:0060372	regulation of atrial cardiac muscle cell...	6	1	0.3	0.26684	1	BP
GO:1903901	negative regulation of viral life cycle	6	1	0.3	0.26684	1	BP
GO:0035721	intraciliary retrograde transport	6	1	0.3	0.26684	1	BP
GO:0090326	positive regulation of locomotion involv...	6	1	0.3	0.26684	1	BP
GO:0090313	regulation of protein targeting to membr...	6	1	0.3	0.26684	1	BP
GO:0032988	ribonucleoprotein complex disassembly	6	1	0.3	0.26684	1	BP
GO:0032933	SREBP signaling pathway	6	1	0.3	0.26684	1	BP
GO:0007141	male meiosis I	6	1	0.3	0.26684	1	BP
GO:0071354	cellular response to interleukin-6	6	1	0.3	0.26684	1	BP
GO:0120261	regulation of heterochromatin organizati...	6	1	0.3	0.26684	1	BP
GO:0006862	nucleotide transport	6	1	0.3	0.26684	1	BP
GO:0017121	plasma membrane phospholipid scrambling	6	1	0.3	0.26684	1	BP
GO:0043968	histone H2A acetylation	6	1	0.3	0.26684	1	BP
GO:0097201	negative regulation of transcription fro...	6	1	0.3	0.26684	1	BP
GO:0048485	sympathetic nervous system development	6	1	0.3	0.26684	1	BP
GO:0006829	zinc ion transport	6	1	0.3	0.26684	1	BP
GO:0043984	histone H4-K16 acetylation	6	1	0.3	0.26684	1	BP
GO:0060295	regulation of cilium movement involved i...	6	1	0.3	0.26684	1	BP
GO:0008103	oocyte microtubule cytoskeleton polariza...	6	1	0.3	0.26684	1	BP
GO:0048150	behavioral response to ether	6	1	0.3	0.26684	1	BP
GO:0018195	peptidyl-arginine modification	6	1	0.3	0.26684	1	BP
GO:0006658	phosphatidylserine metabolic process	6	1	0.3	0.26684	1	BP
GO:0071294	cellular response to zinc ion	6	1	0.3	0.26684	1	BP
GO:0051295	establishment of meiotic spindle localiz...	6	1	0.3	0.26684	1	BP
GO:0031445	regulation of heterochromatin assembly	6	1	0.3	0.26684	1	BP
GO:0009154	purine ribonucleotide catabolic process	6	1	0.3	0.26684	1	BP
GO:0030224	monocyte differentiation	6	1	0.3	0.26684	1	BP
GO:0050856	regulation of T cell receptor signaling ...	6	1	0.3	0.26684	1	BP
GO:0098703	calcium ion import across plasma membran...	6	1	0.3	0.26684	1	BP
GO:0046636	negative regulation of alpha-beta T cell...	6	1	0.3	0.26684	1	BP
GO:0042332	gravitaxis	6	1	0.3	0.26684	1	BP
GO:0051780	behavioral response to nutrient	6	1	0.3	0.26684	1	BP
GO:0014051	gamma-aminobutyric acid secretion	6	1	0.3	0.26684	1	BP
GO:0055069	zinc ion homeostasis	6	1	0.3	0.26684	1	BP
GO:0045955	negative regulation of calcium ion-depen...	6	1	0.3	0.26684	1	BP
GO:0042428	serotonin metabolic process	6	1	0.3	0.26684	1	BP
GO:0055026	negative regulation of cardiac muscle ti...	6	1	0.3	0.26684	1	BP
GO:0007637	proboscis extension reflex	6	1	0.3	0.26684	1	BP
GO:0030851	granulocyte differentiation	6	1	0.3	0.26684	1	BP
GO:0042407	cristae formation	6	1	0.3	0.26684	1	BP
GO:0071880	adenylate cyclase-activating adrenergic ...	6	1	0.3	0.26684	1	BP
GO:0008585	female gonad development	20	2	1.01	0.26689	1	BP
GO:0006939	smooth muscle contraction	20	2	1.01	0.26689	1	BP
GO:0003151	outflow tract morphogenesis	20	2	1.01	0.26689	1	BP
GO:0010657	muscle cell apoptotic process	20	2	1.01	0.26689	1	BP
GO:0002832	negative regulation of response to bioti...	20	2	1.01	0.26689	1	BP
GO:0050974	detection of mechanical stimulus involve...	20	2	1.01	0.26689	1	BP
GO:0006378	mRNA polyadenylation	20	2	1.01	0.26689	1	BP
GO:0044784	metaphase/anaphase transition of cell cy...	20	2	1.01	0.26689	1	BP
GO:1905818	regulation of chromosome separation	20	2	1.01	0.26689	1	BP
GO:0040028	regulation of vulval development	20	2	1.01	0.26689	1	BP
GO:0048010	vascular endothelial growth factor recep...	20	2	1.01	0.26689	1	BP
GO:0001936	regulation of endothelial cell prolifera...	20	2	1.01	0.26689	1	BP
GO:0043631	RNA polyadenylation	20	2	1.01	0.26689	1	BP
GO:0035773	insulin secretion involved in cellular r...	20	2	1.01	0.26689	1	BP
GO:1903051	negative regulation of proteolysis invol...	20	2	1.01	0.26689	1	BP
GO:0002028	regulation of sodium ion transport	20	2	1.01	0.26689	1	BP
GO:0060218	hematopoietic stem cell differentiation	20	2	1.01	0.26689	1	BP
GO:0030203	glycosaminoglycan metabolic process	20	2	1.01	0.26689	1	BP
GO:0007525	somatic muscle development	20	2	1.01	0.26689	1	BP
GO:0042491	inner ear auditory receptor cell differe...	20	2	1.01	0.26689	1	BP
GO:0048701	embryonic cranial skeleton morphogenesis	20	2	1.01	0.26689	1	BP
GO:0051603	proteolysis involved in cellular protein...	176	11	8.87	0.2698	1	BP
GO:0043161	proteasome-mediated ubiquitin-dependent ...	122	8	6.15	0.27	1	BP
GO:0006937	regulation of muscle contraction	36	3	1.81	0.27113	1	BP
GO:0009566	fertilization	36	3	1.81	0.27113	1	BP
GO:0072599	establishment of protein localization to...	36	3	1.81	0.27113	1	BP
GO:0003205	cardiac chamber development	36	3	1.81	0.27113	1	BP
GO:0034605	cellular response to heat	36	3	1.81	0.27113	1	BP
GO:0031348	negative regulation of defense response	36	3	1.81	0.27113	1	BP
GO:0071375	cellular response to peptide hormone sti...	87	6	4.38	0.27242	1	BP
GO:0006954	inflammatory response	70	5	3.53	0.27571	1	BP
GO:0040014	regulation of multicellular organism gro...	53	4	2.67	0.27641	1	BP
GO:0090257	regulation of muscle system process	53	4	2.67	0.27641	1	BP
GO:0099111	microtubule-based transport	53	4	2.67	0.27641	1	BP
GO:0043065	positive regulation of apoptotic process	141	9	7.1	0.27769	1	BP
GO:0002164	larval development	141	9	7.1	0.27769	1	BP
GO:0009605	response to external stimulus	526	31	26.49	0.28179	1	BP
GO:0007409	axonogenesis	160	10	8.06	0.2837	1	BP
GO:0051345	positive regulation of hydrolase activit...	142	9	7.15	0.28466	1	BP
GO:1901989	positive regulation of cell cycle phase ...	37	3	1.86	0.2851	1	BP
GO:0030048	actin filament-based movement	37	3	1.86	0.2851	1	BP
GO:0031960	response to corticosteroid	37	3	1.86	0.2851	1	BP
GO:0008356	asymmetric cell division	37	3	1.86	0.2851	1	BP
GO:0110148	biomineralization	37	3	1.86	0.2851	1	BP
GO:0071326	cellular response to monosaccharide stim...	37	3	1.86	0.2851	1	BP
GO:0071331	cellular response to hexose stimulus	37	3	1.86	0.2851	1	BP
GO:0071333	cellular response to glucose stimulus	37	3	1.86	0.2851	1	BP
GO:0048738	cardiac muscle tissue development	37	3	1.86	0.2851	1	BP
GO:0031214	biomineral tissue development	37	3	1.86	0.2851	1	BP
GO:0000082	G1/S transition of mitotic cell cycle	71	5	3.58	0.28562	1	BP
GO:0009953	dorsal/ventral pattern formation	71	5	3.58	0.28562	1	BP
GO:0006022	aminoglycan metabolic process	21	2	1.06	0.28597	1	BP
GO:0044458	motile cilium assembly	21	2	1.06	0.28597	1	BP
GO:0007097	nuclear migration	21	2	1.06	0.28597	1	BP
GO:0001935	endothelial cell proliferation	21	2	1.06	0.28597	1	BP
GO:0009069	serine family amino acid metabolic proce...	21	2	1.06	0.28597	1	BP
GO:0070374	positive regulation of ERK1 and ERK2 cas...	21	2	1.06	0.28597	1	BP
GO:0045773	positive regulation of axon extension	21	2	1.06	0.28597	1	BP
GO:0062014	negative regulation of small molecule me...	21	2	1.06	0.28597	1	BP
GO:0002088	lens development in camera-type eye	21	2	1.06	0.28597	1	BP
GO:0070167	regulation of biomineral tissue developm...	21	2	1.06	0.28597	1	BP
GO:0110149	regulation of biomineralization	21	2	1.06	0.28597	1	BP
GO:0051306	mitotic sister chromatid separation	21	2	1.06	0.28597	1	BP
GO:0035601	protein deacylation	21	2	1.06	0.28597	1	BP
GO:0046545	development of primary female sexual cha...	21	2	1.06	0.28597	1	BP
GO:0098722	asymmetric stem cell division	21	2	1.06	0.28597	1	BP
GO:0098732	macromolecule deacylation	21	2	1.06	0.28597	1	BP
GO:0000731	DNA synthesis involved in DNA repair	21	2	1.06	0.28597	1	BP
GO:0070887	cellular response to chemical stimulus	566	33	28.51	0.28632	1	BP
GO:0016042	lipid catabolic process	54	4	2.72	0.28788	1	BP
GO:0120032	regulation of plasma membrane bounded ce...	54	4	2.72	0.28788	1	BP
GO:0006473	protein acetylation	54	4	2.72	0.28788	1	BP
GO:0060491	regulation of cell projection assembly	54	4	2.72	0.28788	1	BP
GO:1904396	regulation of neuromuscular junction dev...	54	4	2.72	0.28788	1	BP
GO:0001754	eye photoreceptor cell differentiation	54	4	2.72	0.28788	1	BP
GO:0007165	signal transduction	936	54	47.15	0.28885	1	BP
GO:0006950	response to stress	807	44	40.65	0.28912	1	BP
GO:0031347	regulation of defense response	89	6	4.48	0.29013	1	BP
GO:0044782	cilium organization	125	8	6.3	0.29237	1	BP
GO:0045017	glycerolipid biosynthetic process	72	5	3.63	0.29561	1	BP
GO:0098771	inorganic ion homeostasis	162	10	8.16	0.29696	1	BP
GO:0009896	positive regulation of catabolic process	144	9	7.25	0.29875	1	BP
GO:2000060	positive regulation of ubiquitin-depende...	38	3	1.91	0.29914	1	BP
GO:0034404	nucleobase-containing small molecule bio...	38	3	1.91	0.29914	1	BP
GO:0017156	calcium-ion regulated exocytosis	38	3	1.91	0.29914	1	BP
GO:0030073	insulin secretion	55	4	2.77	0.29942	1	BP
GO:0060986	endocrine hormone secretion	10	3	0.5	0.30032	1	BP
GO:0030812	negative regulation of nucleotide catabo...	7	1	0.35	0.30385	1	BP
