GO.ID	Term	Annotated	Significant	Expected	pval_test	pval_adj	ontology
GO:0021516	dorsal spinal cord development	5	1	0.21	0.19415	1	BP
GO:0021546	rhombomere development	5	1	0.21	0.19415	1	BP
GO:2000352	negative regulation of endothelial cell ...	5	1	0.21	0.19415	1	BP
GO:1901950	dense core granule transport	5	1	0.21	0.19415	1	BP
GO:1905276	regulation of epithelial tube formation	5	1	0.21	0.19415	1	BP
GO:2000331	regulation of terminal button organizati...	5	1	0.21	0.19415	1	BP
GO:0021683	cerebellar granular layer morphogenesis	5	1	0.21	0.19415	1	BP
GO:0021684	cerebellar granular layer formation	5	1	0.21	0.19415	1	BP
GO:0070091	glucagon secretion	5	1	0.21	0.19415	1	BP
GO:0070092	regulation of glucagon secretion	5	1	0.21	0.19415	1	BP
GO:2000404	regulation of T cell migration	5	1	0.21	0.19415	1	BP
GO:2000406	positive regulation of T cell migration	5	1	0.21	0.19415	1	BP
GO:0010962	regulation of glucan biosynthetic proces...	5	1	0.21	0.19415	1	BP
GO:0030916	otic vesicle formation	5	1	0.21	0.19415	1	BP
GO:0034244	negative regulation of transcription elo...	5	1	0.21	0.19415	1	BP
GO:0000052	citrulline metabolic process	5	1	0.21	0.19415	1	BP
GO:0032663	regulation of interleukin-2 production	5	1	0.21	0.19415	1	BP
GO:0032609	interferon-gamma production	5	1	0.21	0.19415	1	BP
GO:0043586	tongue development	5	1	0.21	0.19415	1	BP
GO:0033563	dorsal/ventral axon guidance	5	1	0.21	0.19415	1	BP
GO:0033564	anterior/posterior axon guidance	5	1	0.21	0.19415	1	BP
GO:0016348	imaginal disc-derived leg joint morphoge...	5	1	0.21	0.19415	1	BP
GO:0040034	regulation of development, heterochronic	5	1	0.21	0.19415	1	BP
GO:0033523	histone H2B ubiquitination	5	1	0.21	0.19415	1	BP
GO:0046475	glycerophospholipid catabolic process	5	1	0.21	0.19415	1	BP
GO:0035268	protein mannosylation	5	1	0.21	0.19415	1	BP
GO:0006116	NADH oxidation	5	1	0.21	0.19415	1	BP
GO:0150117	positive regulation of cell-substrate ju...	5	1	0.21	0.19415	1	BP
GO:0150118	negative regulation of cell-substrate ju...	5	1	0.21	0.19415	1	BP
GO:2000737	negative regulation of stem cell differe...	5	1	0.21	0.19415	1	BP
GO:0007439	ectodermal digestive tract development	5	1	0.21	0.19415	1	BP
GO:0072079	nephron tubule formation	5	1	0.21	0.19415	1	BP
GO:0090382	phagosome maturation	5	1	0.21	0.19415	1	BP
GO:0031033	myosin filament organization	5	1	0.21	0.19415	1	BP
GO:0090328	regulation of olfactory learning	5	1	0.21	0.19415	1	BP
GO:0090311	regulation of protein deacetylation	5	1	0.21	0.19415	1	BP
GO:0035898	parathyroid hormone secretion	5	1	0.21	0.19415	1	BP
GO:0007157	heterophilic cell-cell adhesion via plas...	5	1	0.21	0.19415	1	BP
GO:0035855	megakaryocyte development	5	1	0.21	0.19415	1	BP
GO:0071389	cellular response to mineralocorticoid s...	5	1	0.21	0.19415	1	BP
GO:2000514	regulation of CD4-positive, alpha-beta T...	5	1	0.21	0.19415	1	BP
GO:0006882	cellular zinc ion homeostasis	5	1	0.21	0.19415	1	BP
GO:0043950	positive regulation of cAMP-mediated sig...	5	1	0.21	0.19415	1	BP
GO:2000679	positive regulation of transcription reg...	5	1	0.21	0.19415	1	BP
GO:0010447	response to acidic pH	5	1	0.21	0.19415	1	BP
GO:2000615	regulation of histone H3-K9 acetylation	5	1	0.21	0.19415	1	BP
GO:0051447	negative regulation of meiotic cell cycl...	5	1	0.21	0.19415	1	BP
GO:0006560	proline metabolic process	5	1	0.21	0.19415	1	BP
GO:2000649	regulation of sodium ion transmembrane t...	5	1	0.21	0.19415	1	BP
GO:0140718	facultative heterochromatin assembly	5	1	0.21	0.19415	1	BP
GO:0006531	aspartate metabolic process	5	1	0.21	0.19415	1	BP
GO:1903319	positive regulation of protein maturatio...	5	1	0.21	0.19415	1	BP
GO:0006620	post-translational protein targeting to ...	5	1	0.21	0.19415	1	BP
GO:0009164	nucleoside catabolic process	5	1	0.21	0.19415	1	BP
GO:0046668	regulation of retinal cell programmed ce...	5	1	0.21	0.19415	1	BP
GO:0046669	regulation of compound eye retinal cell ...	5	1	0.21	0.19415	1	BP
GO:0046655	folic acid metabolic process	5	1	0.21	0.19415	1	BP
GO:0060841	venous blood vessel development	5	1	0.21	0.19415	1	BP
GO:0019400	alditol metabolic process	5	1	0.21	0.19415	1	BP
GO:1904380	endoplasmic reticulum mannose trimming	5	1	0.21	0.19415	1	BP
GO:0005979	regulation of glycogen biosynthetic proc...	5	1	0.21	0.19415	1	BP
GO:0070525	tRNA threonylcarbamoyladenosine metaboli...	5	1	0.21	0.19415	1	BP
GO:0003381	epithelial cell morphogenesis involved i...	5	1	0.21	0.19415	1	BP
GO:0003384	apical constriction involved in gastrula...	5	1	0.21	0.19415	1	BP
GO:0106070	regulation of adenylate cyclase-activati...	5	1	0.21	0.19415	1	BP
GO:0051894	positive regulation of focal adhesion as...	5	1	0.21	0.19415	1	BP
GO:0051895	negative regulation of focal adhesion as...	5	1	0.21	0.19415	1	BP
GO:0042330	taxis	153	9	6.46	0.19417	1	BP
GO:0048523	negative regulation of cellular process	976	46	41.21	0.19573	1	BP
GO:0030111	regulation of Wnt signaling pathway	74	5	3.12	0.20043	1	BP
GO:0055123	digestive system development	55	4	2.32	0.20058	1	BP
GO:0006261	DNA-templated DNA replication	55	4	2.32	0.20058	1	BP
GO:0046486	glycerolipid metabolic process	94	6	3.97	0.2035	1	BP
GO:0000398	mRNA splicing, via spliceosome	94	6	3.97	0.2035	1	BP
GO:0000375	RNA splicing, via transesterification re...	94	6	3.97	0.2035	1	BP
GO:0000377	RNA splicing, via transesterification re...	94	6	3.97	0.2035	1	BP
GO:0030155	regulation of cell adhesion	94	6	3.97	0.2035	1	BP
GO:0060401	cytosolic calcium ion transport	37	3	1.56	0.20357	1	BP
GO:0048738	cardiac muscle tissue development	37	3	1.56	0.20357	1	BP
GO:2000145	regulation of cell motility	155	9	6.54	0.20445	1	BP
GO:0072001	renal system development	90	9	3.8	0.20543	1	BP
GO:1903201	regulation of oxidative stress-induced c...	20	2	0.84	0.20569	1	BP
GO:0019730	antimicrobial humoral response	20	2	0.84	0.20569	1	BP
GO:0021872	forebrain generation of neurons	20	2	0.84	0.20569	1	BP
GO:0002685	regulation of leukocyte migration	20	2	0.84	0.20569	1	BP
GO:0000380	alternative mRNA splicing, via spliceoso...	20	2	0.84	0.20569	1	BP
GO:0060218	hematopoietic stem cell differentiation	20	2	0.84	0.20569	1	BP
GO:0006687	glycosphingolipid metabolic process	20	2	0.84	0.20569	1	BP
GO:0006672	ceramide metabolic process	20	2	0.84	0.20569	1	BP
GO:0014065	phosphatidylinositol 3-kinase signaling	20	2	0.84	0.20569	1	BP
GO:0048701	embryonic cranial skeleton morphogenesis	20	2	0.84	0.20569	1	BP
GO:0007267	cell-cell signaling	326	17	13.76	0.20724	1	BP
GO:0007219	Notch signaling pathway	75	5	3.17	0.20801	1	BP
GO:1901888	regulation of cell junction assembly	75	5	3.17	0.20801	1	BP
GO:0048839	inner ear development	56	4	2.36	0.20947	1	BP
GO:0009060	aerobic respiration	56	4	2.36	0.20947	1	BP
GO:0071383	cellular response to steroid hormone sti...	56	4	2.36	0.20947	1	BP
GO:0008593	regulation of Notch signaling pathway	56	4	2.36	0.20947	1	BP
GO:0097305	response to alcohol	95	6	4.01	0.21024	1	BP
GO:2000045	regulation of G1/S transition of mitotic...	38	3	1.6	0.21469	1	BP
GO:1903509	liposaccharide metabolic process	38	3	1.6	0.21469	1	BP
GO:0006661	phosphatidylinositol biosynthetic proces...	38	3	1.6	0.21469	1	BP
GO:0006664	glycolipid metabolic process	38	3	1.6	0.21469	1	BP
GO:0000122	negative regulation of transcription by ...	178	10	7.52	0.21548	1	BP
GO:2000147	positive regulation of cell motility	76	5	3.21	0.21569	1	BP
GO:0032956	regulation of actin cytoskeleton organiz...	76	5	3.21	0.21569	1	BP
GO:0060249	anatomical structure homeostasis	116	7	4.9	0.21588	1	BP
GO:0050673	epithelial cell proliferation	57	4	2.41	0.21847	1	BP
GO:0042770	signal transduction in response to DNA d...	57	4	2.41	0.21847	1	BP
GO:0043170	macromolecule metabolic process	1696	81	71.61	0.22126	1	BP
GO:0060675	ureteric bud morphogenesis	21	2	0.89	0.22145	1	BP
GO:0050680	negative regulation of epithelial cell p...	21	2	0.89	0.22145	1	BP
GO:0001824	blastocyst development	21	2	0.89	0.22145	1	BP
GO:0006073	cellular glucan metabolic process	21	2	0.89	0.22145	1	BP
GO:0007044	cell-substrate junction assembly	21	2	0.89	0.22145	1	BP
GO:0009064	glutamine family amino acid metabolic pr...	21	2	0.89	0.22145	1	BP
GO:0009069	serine family amino acid metabolic proce...	21	2	0.89	0.22145	1	BP
GO:0150115	cell-substrate junction organization	21	2	0.89	0.22145	1	BP
GO:0062014	negative regulation of small molecule me...	21	2	0.89	0.22145	1	BP
GO:0060419	heart growth	21	2	0.89	0.22145	1	BP
GO:0002088	lens development in camera-type eye	21	2	0.89	0.22145	1	BP
GO:0000422	autophagy of mitochondrion	21	2	0.89	0.22145	1	BP
GO:0071479	cellular response to ionizing radiation	21	2	0.89	0.22145	1	BP
GO:0048149	behavioral response to ethanol	21	2	0.89	0.22145	1	BP
GO:0035601	protein deacylation	21	2	0.89	0.22145	1	BP
GO:0098732	macromolecule deacylation	21	2	0.89	0.22145	1	BP
GO:0072171	mesonephric tubule morphogenesis	21	2	0.89	0.22145	1	BP
GO:0005977	glycogen metabolic process	21	2	0.89	0.22145	1	BP
GO:0044042	glucan metabolic process	21	2	0.89	0.22145	1	BP
GO:0061726	mitochondrion disassembly	21	2	0.89	0.22145	1	BP
GO:0001568	blood vessel development	97	6	4.1	0.22396	1	BP
GO:0032989	cellular component morphogenesis	309	16	13.05	0.22545	1	BP
GO:0032101	regulation of response to external stimu...	159	9	6.71	0.22569	1	BP
GO:0001709	cell fate determination	39	3	1.65	0.22594	1	BP
GO:2000377	regulation of reactive oxygen species me...	39	3	1.65	0.22594	1	BP
GO:0034250	positive regulation of cellular amide me...	39	3	1.65	0.22594	1	BP
GO:0006119	oxidative phosphorylation	39	3	1.65	0.22594	1	BP
GO:0007159	leukocyte cell-cell adhesion	39	3	1.65	0.22594	1	BP
GO:2001235	positive regulation of apoptotic signali...	39	3	1.65	0.22594	1	BP
GO:0050792	regulation of viral process	39	3	1.65	0.22594	1	BP
GO:0000075	cell cycle checkpoint signaling	58	4	2.45	0.22758	1	BP
GO:0009913	epidermal cell differentiation	58	4	2.45	0.22758	1	BP
GO:0009267	cellular response to starvation	58	4	2.45	0.22758	1	BP
GO:0071875	adrenergic receptor signaling pathway	6	1	0.25	0.22824	1	BP
GO:0009713	catechol-containing compound biosyntheti...	6	1	0.25	0.22824	1	BP
GO:1904406	negative regulation of nitric oxide meta...	6	1	0.25	0.22824	1	BP
GO:0006991	response to sterol depletion	6	1	0.25	0.22824	1	BP
GO:1901679	nucleotide transmembrane transport	6	1	0.25	0.22824	1	BP
GO:0043306	positive regulation of mast cell degranu...	6	1	0.25	0.22824	1	BP
GO:0045071	negative regulation of viral genome repl...	6	1	0.25	0.22824	1	BP
GO:0042102	positive regulation of T cell proliferat...	6	1	0.25	0.22824	1	BP
GO:0045019	negative regulation of nitric oxide bios...	6	1	0.25	0.22824	1	BP
GO:0051599	response to hydrostatic pressure	6	1	0.25	0.22824	1	BP
GO:0001825	blastocyst formation	6	1	0.25	0.22824	1	BP
GO:0035046	pronuclear migration	6	1	0.25	0.22824	1	BP
GO:0032292	peripheral nervous system axon ensheathm...	6	1	0.25	0.22824	1	BP
GO:0071549	cellular response to dexamethasone stimu...	6	1	0.25	0.22824	1	BP
GO:0032252	secretory granule localization	6	1	0.25	0.22824	1	BP
GO:0071501	cellular response to sterol depletion	6	1	0.25	0.22824	1	BP
GO:1904262	negative regulation of TORC1 signaling	6	1	0.25	0.22824	1	BP
GO:0002759	regulation of antimicrobial humoral resp...	6	1	0.25	0.22824	1	BP
GO:0002775	antimicrobial peptide production	6	1	0.25	0.22824	1	BP
GO:0071677	positive regulation of mononuclear cell ...	6	1	0.25	0.22824	1	BP
GO:0010667	negative regulation of cardiac muscle ce...	6	1	0.25	0.22824	1	BP
GO:1902656	calcium ion import into cytosol	6	1	0.25	0.22824	1	BP
GO:0071600	otic vesicle morphogenesis	6	1	0.25	0.22824	1	BP
GO:0033119	negative regulation of RNA splicing	6	1	0.25	0.22824	1	BP
GO:2001024	negative regulation of response to drug	6	1	0.25	0.22824	1	BP
GO:0032785	negative regulation of DNA-templated tra...	6	1	0.25	0.22824	1	BP
GO:1900073	regulation of neuromuscular synaptic tra...	6	1	0.25	0.22824	1	BP
GO:0032885	regulation of polysaccharide biosyntheti...	6	1	0.25	0.22824	1	BP
GO:0021681	cerebellar granular layer development	6	1	0.25	0.22824	1	BP
GO:1905208	negative regulation of cardiocyte differ...	6	1	0.25	0.22824	1	BP
GO:1905209	positive regulation of cardiocyte differ...	6	1	0.25	0.22824	1	BP
GO:0021603	cranial nerve formation	6	1	0.25	0.22824	1	BP
GO:0060045	positive regulation of cardiac muscle ce...	6	1	0.25	0.22824	1	BP
GO:0002688	regulation of leukocyte chemotaxis	6	1	0.25	0.22824	1	BP
GO:0045476	nurse cell apoptotic process	6	1	0.25	0.22824	1	BP
GO:0035456	response to interferon-beta	6	1	0.25	0.22824	1	BP
GO:2000403	positive regulation of lymphocyte migrat...	6	1	0.25	0.22824	1	BP
GO:0042693	muscle cell fate commitment	6	1	0.25	0.22824	1	BP
GO:0090050	positive regulation of cell migration in...	6	1	0.25	0.22824	1	BP
GO:0051956	negative regulation of amino acid transp...	6	1	0.25	0.22824	1	BP
GO:2000169	regulation of peptidyl-cysteine S-nitros...	6	1	0.25	0.22824	1	BP
GO:0032623	interleukin-2 production	6	1	0.25	0.22824	1	BP
GO:0001975	response to amphetamine	6	1	0.25	0.22824	1	BP
GO:0040035	hermaphrodite genitalia development	6	1	0.25	0.22824	1	BP
GO:0040037	negative regulation of fibroblast growth...	6	1	0.25	0.22824	1	BP
GO:0046459	short-chain fatty acid metabolic process	6	1	0.25	0.22824	1	BP
GO:1902083	negative regulation of peptidyl-cysteine...	6	1	0.25	0.22824	1	BP
GO:0051044	positive regulation of membrane protein ...	6	1	0.25	0.22824	1	BP
GO:1902019	regulation of cilium-dependent cell moti...	6	1	0.25	0.22824	1	BP
GO:0035283	central nervous system segmentation	6	1	0.25	0.22824	1	BP
GO:0035284	brain segmentation	6	1	0.25	0.22824	1	BP
GO:0007339	binding of sperm to zona pellucida	6	1	0.25	0.22824	1	BP
GO:1903901	negative regulation of viral life cycle	6	1	0.25	0.22824	1	BP
GO:0097475	motor neuron migration	6	1	0.25	0.22824	1	BP
GO:0002920	regulation of humoral immune response	6	1	0.25	0.22824	1	BP
GO:0090326	positive regulation of locomotion involv...	6	1	0.25	0.22824	1	BP
GO:0090313	regulation of protein targeting to membr...	6	1	0.25	0.22824	1	BP
GO:0015740	C4-dicarboxylate transport	6	1	0.25	0.22824	1	BP
GO:2001224	positive regulation of neuron migration	6	1	0.25	0.22824	1	BP
GO:0007156	homophilic cell adhesion via plasma memb...	6	1	0.25	0.22824	1	BP
GO:0140115	export across plasma membrane	6	1	0.25	0.22824	1	BP
GO:0032933	SREBP signaling pathway	6	1	0.25	0.22824	1	BP
GO:0071390	cellular response to ecdysone	6	1	0.25	0.22824	1	BP
GO:0071312	cellular response to alkaloid	6	1	0.25	0.22824	1	BP
GO:0007263	nitric oxide mediated signal transductio...	6	1	0.25	0.22824	1	BP
GO:0071305	cellular response to vitamin D	6	1	0.25	0.22824	1	BP
GO:0006862	nucleotide transport	6	1	0.25	0.22824	1	BP
GO:0007214	gamma-aminobutyric acid signaling pathwa...	6	1	0.25	0.22824	1	BP
GO:0009395	phospholipid catabolic process	6	1	0.25	0.22824	1	BP
GO:0022011	myelination in peripheral nervous system	6	1	0.25	0.22824	1	BP
GO:0006829	zinc ion transport	6	1	0.25	0.22824	1	BP
GO:0043970	histone H3-K9 acetylation	6	1	0.25	0.22824	1	BP
GO:0060295	regulation of cilium movement involved i...	6	1	0.25	0.22824	1	BP
GO:0046898	response to cycloheximide	6	1	0.25	0.22824	1	BP
GO:0010457	centriole-centriole cohesion	6	1	0.25	0.22824	1	BP
GO:1904036	negative regulation of epithelial cell a...	6	1	0.25	0.22824	1	BP
GO:1904037	positive regulation of epithelial cell a...	6	1	0.25	0.22824	1	BP
GO:1903392	negative regulation of adherens junction...	6	1	0.25	0.22824	1	BP
GO:1903393	positive regulation of adherens junction...	6	1	0.25	0.22824	1	BP
GO:0006515	protein quality control for misfolded or...	6	1	0.25	0.22824	1	BP
GO:0051177	meiotic sister chromatid cohesion	6	1	0.25	0.22824	1	BP
GO:0002367	cytokine production involved in immune r...	6	1	0.25	0.22824	1	BP
GO:0033005	positive regulation of mast cell activat...	6	1	0.25	0.22824	1	BP
GO:0033008	positive regulation of mast cell activat...	6	1	0.25	0.22824	1	BP
GO:0036507	protein demannosylation	6	1	0.25	0.22824	1	BP
GO:0036508	protein alpha-1,2-demannosylation	6	1	0.25	0.22824	1	BP
GO:0071218	cellular response to misfolded protein	6	1	0.25	0.22824	1	BP
GO:0098703	calcium ion import across plasma membran...	6	1	0.25	0.22824	1	BP
GO:0070593	dendrite self-avoidance	6	1	0.25	0.22824	1	BP
GO:0060561	apoptotic process involved in morphogene...	6	1	0.25	0.22824	1	BP
GO:0051788	response to misfolded protein	6	1	0.25	0.22824	1	BP
GO:0055069	zinc ion homeostasis	6	1	0.25	0.22824	1	BP
GO:0042423	catecholamine biosynthetic process	6	1	0.25	0.22824	1	BP
GO:0042428	serotonin metabolic process	6	1	0.25	0.22824	1	BP
GO:0072273	metanephric nephron morphogenesis	6	1	0.25	0.22824	1	BP
GO:0030851	granulocyte differentiation	6	1	0.25	0.22824	1	BP
GO:0003338	metanephros morphogenesis	6	1	0.25	0.22824	1	BP
GO:0071880	adenylate cyclase-activating adrenergic ...	6	1	0.25	0.22824	1	BP
GO:0009750	response to fructose	6	1	0.25	0.22824	1	BP
GO:0071496	cellular response to external stimulus	98	6	4.14	0.23092	1	BP
GO:0006644	phospholipid metabolic process	98	6	4.14	0.23092	1	BP
GO:0006650	glycerophospholipid metabolic process	78	5	3.29	0.23131	1	BP
GO:0001667	ameboidal-type cell migration	119	7	5.02	0.23478	1	BP
GO:0001894	tissue homeostasis	59	4	2.49	0.23678	1	BP
GO:0032102	negative regulation of response to exter...	59	4	2.49	0.23678	1	BP
GO:0110053	regulation of actin filament organizatio...	59	4	2.49	0.23678	1	BP
GO:0009948	anterior/posterior axis specification	59	4	2.49	0.23678	1	BP
GO:0090276	regulation of peptide hormone secretion	59	4	2.49	0.23678	1	BP
GO:0001841	neural tube formation	40	3	1.69	0.2373	1	BP
GO:0051494	negative regulation of cytoskeleton orga...	40	3	1.69	0.2373	1	BP
GO:0046887	positive regulation of hormone secretion	40	3	1.69	0.2373	1	BP
GO:0055001	muscle cell development	40	3	1.69	0.2373	1	BP
GO:0032784	regulation of DNA-templated transcriptio...	22	2	0.93	0.2373	1	BP
GO:0009620	response to fungus	22	2	0.93	0.2373	1	BP
GO:2000142	regulation of DNA-templated transcriptio...	22	2	0.93	0.2373	1	BP
GO:0001952	regulation of cell-matrix adhesion	22	2	0.93	0.2373	1	BP
GO:0044728	DNA methylation or demethylation	22	2	0.93	0.2373	1	BP
GO:0061014	positive regulation of mRNA catabolic pr...	22	2	0.93	0.2373	1	BP
GO:1900407	regulation of cellular response to oxida...	22	2	0.93	0.2373	1	BP
GO:0014823	response to activity	22	2	0.93	0.2373	1	BP
GO:0061157	mRNA destabilization	22	2	0.93	0.2373	1	BP
GO:0050779	RNA destabilization	22	2	0.93	0.2373	1	BP
GO:0009409	response to cold	22	2	0.93	0.2373	1	BP
GO:1903429	regulation of cell maturation	22	2	0.93	0.2373	1	BP
GO:0046626	regulation of insulin receptor signaling...	22	2	0.93	0.2373	1	BP
GO:0050870	positive regulation of T cell activation	22	2	0.93	0.2373	1	BP
GO:0032456	endocytic recycling	22	2	0.93	0.2373	1	BP
GO:0019219	regulation of nucleobase-containing comp...	693	41	29.26	0.2391	1	BP
GO:0006812	cation transport	221	16	9.33	0.24052	1	BP
GO:0006396	RNA processing	248	13	10.47	0.2435	1	BP
GO:0001708	cell fate specification	60	4	2.53	0.24608	1	BP
GO:0043270	positive regulation of ion transport	60	4	2.53	0.24608	1	BP
GO:0000956	nuclear-transcribed mRNA catabolic proce...	60	4	2.53	0.24608	1	BP
GO:0090287	regulation of cellular response to growt...	60	4	2.53	0.24608	1	BP
GO:0051270	regulation of cellular component movemen...	184	10	7.77	0.2463	1	BP
GO:2000736	regulation of stem cell differentiation	25	4	1.06	0.24706	1	BP
GO:0002573	myeloid leukocyte differentiation	41	3	1.73	0.24876	1	BP
GO:0031644	regulation of nervous system process	41	3	1.73	0.24876	1	BP
GO:0051099	positive regulation of binding	41	3	1.73	0.24876	1	BP
GO:1902105	regulation of leukocyte differentiation	41	3	1.73	0.24876	1	BP
GO:0001655	urogenital system development	96	9	4.05	0.25109	1	BP
GO:0071870	cellular response to catecholamine stimu...	23	2	0.97	0.25321	1	BP
GO:0042795	snRNA transcription by RNA polymerase II	23	2	0.97	0.25321	1	BP
GO:0007062	sister chromatid cohesion	23	2	0.97	0.25321	1	BP
GO:0034763	negative regulation of transmembrane tra...	23	2	0.97	0.25321	1	BP
GO:0006112	energy reserve metabolic process	23	2	0.97	0.25321	1	BP
GO:0072088	nephron epithelium morphogenesis	23	2	0.97	0.25321	1	BP
GO:0072078	nephron tubule morphogenesis	23	2	0.97	0.25321	1	BP
GO:0035821	modulation of process of another organis...	23	2	0.97	0.25321	1	BP
GO:0034644	cellular response to UV	23	2	0.97	0.25321	1	BP
GO:0030316	osteoclast differentiation	23	2	0.97	0.25321	1	BP
GO:0060119	inner ear receptor cell development	23	2	0.97	0.25321	1	BP
GO:0009301	snRNA transcription	23	2	0.97	0.25321	1	BP
GO:0042335	cuticle development	23	2	0.97	0.25321	1	BP
GO:0051209	release of sequestered calcium ion into ...	23	2	0.97	0.25321	1	BP
GO:0090598	male anatomical structure morphogenesis	23	2	0.97	0.25321	1	BP
GO:0071868	cellular response to monoamine stimulus	23	2	0.97	0.25321	1	BP
GO:0071869	response to catecholamine	23	2	0.97	0.25321	1	BP
GO:0022604	regulation of cell morphogenesis	122	7	5.15	0.25422	1	BP
GO:0072657	protein localization to membrane	143	8	6.04	0.25439	1	BP
GO:0032970	regulation of actin filament-based proce...	81	5	3.42	0.25533	1	BP
GO:0046879	hormone secretion	81	5	3.42	0.25533	1	BP
GO:0048871	multicellular organismal homeostasis	81	5	3.42	0.25533	1	BP
GO:0043543	protein acylation	61	4	2.58	0.25545	1	BP
GO:0048519	negative regulation of biological proces...	1071	49	45.22	0.25945	1	BP
GO:0050920	regulation of chemotaxis	42	3	1.77	0.2603	1	BP
GO:0018991	oviposition	42	3	1.77	0.2603	1	BP
GO:0009896	positive regulation of catabolic process	144	8	6.08	0.26047	1	BP
GO:1905114	cell surface receptor signaling pathway ...	123	7	5.19	0.26081	1	BP
GO:0060669	embryonic placenta morphogenesis	7	1	0.3	0.2609	1	BP
GO:0010830	regulation of myotube differentiation	7	1	0.3	0.2609	1	BP
GO:0060631	regulation of meiosis I	7	1	0.3	0.2609	1	BP
GO:0043304	regulation of mast cell degranulation	7	1	0.3	0.2609	1	BP
GO:0045058	T cell selection	7	1	0.3	0.2609	1	BP
GO:0035066	positive regulation of histone acetylati...	7	1	0.3	0.2609	1	BP
GO:0043496	regulation of protein homodimerization a...	7	1	0.3	0.2609	1	BP
GO:0002228	natural killer cell mediated immunity	7	1	0.3	0.2609	1	BP
GO:0048525	negative regulation of viral process	7	1	0.3	0.2609	1	BP
GO:1905331	negative regulation of morphogenesis of ...	7	1	0.3	0.2609	1	BP
GO:0035036	sperm-egg recognition	7	1	0.3	0.2609	1	BP
GO:0042267	natural killer cell mediated cytotoxicit...	7	1	0.3	0.2609	1	BP
GO:0061614	miRNA transcription	7	1	0.3	0.2609	1	BP
GO:1904799	regulation of neuron remodeling	7	1	0.3	0.2609	1	BP
GO:1905155	positive regulation of membrane invagina...	7	1	0.3	0.2609	1	BP
GO:0003229	ventricular cardiac muscle tissue develo...	7	1	0.3	0.2609	1	BP
GO:0002888	positive regulation of myeloid leukocyte...	7	1	0.3	0.2609	1	BP
GO:0060992	response to fungicide	7	1	0.3	0.2609	1	BP
GO:0032891	negative regulation of organic acid tran...	7	1	0.3	0.2609	1	BP
GO:0033280	response to vitamin D	7	1	0.3	0.2609	1	BP
GO:0033227	dsRNA transport	7	1	0.3	0.2609	1	BP
GO:0097064	ncRNA export from nucleus	7	1	0.3	0.2609	1	BP
GO:0072697	protein localization to cell cortex	7	1	0.3	0.2609	1	BP
GO:0050922	negative regulation of chemotaxis	7	1	0.3	0.2609	1	BP
GO:0050918	positive chemotaxis	7	1	0.3	0.2609	1	BP
GO:0072678	T cell migration	7	1	0.3	0.2609	1	BP
GO:0031641	regulation of myelination	7	1	0.3	0.2609	1	BP
GO:0031638	zymogen activation	7	1	0.3	0.2609	1	BP
GO:1903672	positive regulation of sprouting angioge...	7	1	0.3	0.2609	1	BP
GO:0007000	nucleolus organization	7	1	0.3	0.2609	1	BP
GO:0042558	pteridine-containing compound metabolic ...	7	1	0.3	0.2609	1	BP
GO:2000479	regulation of cAMP-dependent protein kin...	7	1	0.3	0.2609	1	BP
GO:0080009	mRNA methylation	7	1	0.3	0.2609	1	BP
GO:0090049	regulation of cell migration involved in...	7	1	0.3	0.2609	1	BP
GO:0000028	ribosomal small subunit assembly	7	1	0.3	0.2609	1	BP
GO:0033598	mammary gland epithelial cell proliferat...	7	1	0.3	0.2609	1	BP
GO:0045144	meiotic sister chromatid segregation	7	1	0.3	0.2609	1	BP
GO:0040010	positive regulation of growth rate	7	1	0.3	0.2609	1	BP
GO:0036303	lymph vessel morphogenesis	7	1	0.3	0.2609	1	BP
GO:0048011	neurotrophin TRK receptor signaling path...	7	1	0.3	0.2609	1	BP
GO:0001946	lymphangiogenesis	7	1	0.3	0.2609	1	BP
GO:1905564	positive regulation of vascular endothel...	7	1	0.3	0.2609	1	BP
GO:2000272	negative regulation of signaling recepto...	7	1	0.3	0.2609	1	BP
GO:0006195	purine nucleotide catabolic process	7	1	0.3	0.2609	1	BP
GO:0051043	regulation of membrane protein ectodomai...	7	1	0.3	0.2609	1	BP
GO:1903959	regulation of anion transmembrane transp...	7	1	0.3	0.2609	1	BP
GO:0035234	ectopic germ cell programmed cell death	7	1	0.3	0.2609	1	BP
GO:0045792	negative regulation of cell size	7	1	0.3	0.2609	1	BP
GO:0035767	endothelial cell chemotaxis	7	1	0.3	0.2609	1	BP
GO:0045722	positive regulation of gluconeogenesis	7	1	0.3	0.2609	1	BP
GO:0007400	neuroblast fate determination	7	1	0.3	0.2609	1	BP
GO:2001241	positive regulation of extrinsic apoptot...	7	1	0.3	0.2609	1	BP
GO:1990266	neutrophil migration	7	1	0.3	0.2609	1	BP
GO:0006760	folic acid-containing compound metabolic...	7	1	0.3	0.2609	1	BP
GO:0007130	synaptonemal complex assembly	7	1	0.3	0.2609	1	BP
GO:0006735	NADH regeneration	7	1	0.3	0.2609	1	BP
GO:0071374	cellular response to parathyroid hormone...	7	1	0.3	0.2609	1	BP
GO:0071377	cellular response to glucagon stimulus	7	1	0.3	0.2609	1	BP
GO:0000469	cleavage involved in rRNA processing	7	1	0.3	0.2609	1	BP
GO:0030318	melanocyte differentiation	7	1	0.3	0.2609	1	BP
GO:0007294	germarium-derived oocyte fate determinat...	7	1	0.3	0.2609	1	BP
GO:0035809	regulation of urine volume	7	1	0.3	0.2609	1	BP
GO:0051354	negative regulation of oxidoreductase ac...	7	1	0.3	0.2609	1	BP
GO:0006896	Golgi to vacuole transport	7	1	0.3	0.2609	1	BP
GO:1901160	primary amino compound metabolic process	7	1	0.3	0.2609	1	BP
GO:0035561	regulation of chromatin binding	7	1	0.3	0.2609	1	BP
GO:0007221	positive regulation of transcription of ...	7	1	0.3	0.2609	1	BP
GO:0042044	fluid transport	7	1	0.3	0.2609	1	BP
GO:0060100	positive regulation of phagocytosis, eng...	7	1	0.3	0.2609	1	BP
GO:0003091	renal water homeostasis	7	1	0.3	0.2609	1	BP
GO:0045661	regulation of myoblast differentiation	7	1	0.3	0.2609	1	BP
