GO.ID	Term	Annotated	Significant	Expected	pval_test	pval_adj	ontology
GO:0045444	fat cell differentiation	31	7	1.04	0.0016	1	BP
GO:0071346	cellular response to interferon-gamma	16	4	0.54	0.0016	1	BP
GO:0030811	regulation of nucleotide catabolic proce...	17	4	0.57	0.0021	1	BP
GO:0006110	regulation of glycolytic process	17	4	0.57	0.0021	1	BP
GO:2001169	regulation of ATP biosynthetic process	18	4	0.61	0.0026	1	BP
GO:0046580	negative regulation of Ras protein signa...	18	4	0.61	0.0026	1	BP
GO:0031648	protein destabilization	9	3	0.3	0.0027	1	BP
GO:0007053	spindle assembly involved in male meiosi...	3	2	0.1	0.0033	1	BP
GO:2000112	regulation of cellular macromolecule bio...	658	34	22.18	0.0034	1	BP
GO:0071219	cellular response to molecule of bacteri...	21	4	0.71	0.0047	1	BP
GO:0042127	regulation of cell population proliferat...	307	19	10.35	0.0055	1	BP
GO:0010256	endomembrane system organization	137	11	4.62	0.0055	1	BP
GO:0046323	glucose import	22	4	0.74	0.0055	1	BP
GO:1900740	positive regulation of protein insertion...	4	2	0.13	0.0065	1	BP
GO:0045477	regulation of nurse cell apoptotic proce...	4	2	0.13	0.0065	1	BP
GO:0046498	S-adenosylhomocysteine metabolic process	4	2	0.13	0.0065	1	BP
GO:0045600	positive regulation of fat cell differen...	4	2	0.13	0.0065	1	BP
GO:1902231	positive regulation of intrinsic apoptot...	4	2	0.13	0.0065	1	BP
GO:0099563	modification of synaptic structure	4	2	0.13	0.0065	1	BP
GO:0072553	terminal button organization	12	3	0.4	0.0065	1	BP
GO:0061337	cardiac conduction	24	4	0.81	0.0077	1	BP
GO:0031328	positive regulation of cellular biosynth...	388	22	13.08	0.0078	1	BP
GO:0048190	wing disc dorsal/ventral pattern formati...	13	3	0.44	0.0083	1	BP
GO:0006508	proteolysis	325	19	10.95	0.0101	1	BP
GO:0035024	negative regulation of Rho protein signa...	5	2	0.17	0.0105	1	BP
GO:1990440	positive regulation of transcription fro...	5	2	0.17	0.0105	1	BP
GO:2000331	regulation of terminal button organizati...	5	2	0.17	0.0105	1	BP
GO:1904627	response to phorbol 13-acetate 12-myrist...	5	2	0.17	0.0105	1	BP
GO:1904628	cellular response to phorbol 13-acetate ...	5	2	0.17	0.0105	1	BP
GO:0002521	leukocyte differentiation	92	8	3.1	0.0111	1	BP
GO:0002573	myeloid leukocyte differentiation	41	5	1.38	0.0112	1	BP
GO:1902105	regulation of leukocyte differentiation	41	5	1.38	0.0112	1	BP
GO:1901565	organonitrogen compound catabolic proces...	305	18	10.28	0.0112	1	BP
GO:0042770	signal transduction in response to DNA d...	57	6	1.92	0.0113	1	BP
GO:0097659	nucleic acid-templated transcription	603	30	20.32	0.0116	1	BP
GO:0010467	gene expression	1040	46	35.05	0.0117	1	BP
GO:0031327	negative regulation of cellular biosynth...	330	19	11.12	0.0118	1	BP
GO:0032774	RNA biosynthetic process	605	30	20.39	0.0122	1	BP
GO:0006807	nitrogen compound metabolic process	1860	74	62.69	0.0124	1	BP
GO:0009890	negative regulation of biosynthetic proc...	332	19	11.19	0.0126	1	BP
GO:0006974	cellular response to DNA damage stimulus	227	16	7.65	0.013	1	BP
GO:1905269	positive regulation of chromatin organiz...	28	4	0.94	0.0133	1	BP
GO:0000077	DNA damage checkpoint signaling	43	5	1.45	0.0136	1	BP
GO:0010558	negative regulation of macromolecule bio...	312	18	10.52	0.0141	1	BP
GO:0010608	post-transcriptional regulation of gene ...	137	10	4.62	0.0154	1	BP
GO:0120261	regulation of heterochromatin organizati...	6	2	0.2	0.0154	1	BP
GO:0044346	fibroblast apoptotic process	6	2	0.2	0.0154	1	BP
GO:1903539	protein localization to postsynaptic mem...	6	2	0.2	0.0154	1	BP
GO:0071354	cellular response to interleukin-6	6	2	0.2	0.0154	1	BP
GO:0090435	protein localization to nuclear envelope	6	2	0.2	0.0154	1	BP
GO:0062237	protein localization to postsynapse	6	2	0.2	0.0154	1	BP
GO:0031445	regulation of heterochromatin assembly	6	2	0.2	0.0154	1	BP
GO:0052547	regulation of peptidase activity	61	6	2.06	0.0155	1	BP
GO:0031570	DNA integrity checkpoint signaling	45	5	1.52	0.0164	1	BP
GO:0031123	RNA 3'-end processing	45	5	1.52	0.0164	1	BP
GO:0010557	positive regulation of macromolecule bio...	365	20	12.3	0.0164	1	BP
GO:0090304	nucleic acid metabolic process	973	43	32.79	0.0166	1	BP
GO:0006611	protein export from nucleus	62	6	2.09	0.0167	1	BP
GO:0010629	negative regulation of gene expression	415	22	13.99	0.0169	1	BP
GO:0032270	positive regulation of cellular protein ...	318	18	10.72	0.0169	1	BP
GO:0006351	transcription, DNA-templated	594	29	20.02	0.0172	1	BP
GO:0030163	protein catabolic process	226	14	7.62	0.0173	1	BP
GO:0006998	nuclear envelope organization	17	3	0.57	0.0179	1	BP
GO:0008285	negative regulation of cell population p...	142	10	4.79	0.0194	1	BP
GO:0008045	motor neuron axon guidance	18	3	0.61	0.0209	1	BP
GO:0046324	regulation of glucose import	18	3	0.61	0.0209	1	BP
GO:2001170	negative regulation of ATP biosynthetic ...	7	2	0.24	0.0211	1	BP
GO:0044003	modulation by symbiont of host process	7	2	0.24	0.0211	1	BP
GO:0032480	negative regulation of type I interferon...	7	2	0.24	0.0211	1	BP
GO:1904385	cellular response to angiotensin	7	2	0.24	0.0211	1	BP
GO:0046325	negative regulation of glucose import	7	2	0.24	0.0211	1	BP
GO:0045820	negative regulation of glycolytic proces...	7	2	0.24	0.0211	1	BP
GO:0010847	regulation of chromatin assembly	7	2	0.24	0.0211	1	BP
GO:0007526	larval somatic muscle development	7	2	0.24	0.0211	1	BP
GO:1990776	response to angiotensin	7	2	0.24	0.0211	1	BP
GO:0030812	negative regulation of nucleotide catabo...	7	2	0.24	0.0211	1	BP
GO:0099174	regulation of presynapse organization	7	2	0.24	0.0211	1	BP
GO:1900372	negative regulation of purine nucleotide...	7	2	0.24	0.0211	1	BP
GO:0030809	negative regulation of nucleotide biosyn...	7	2	0.24	0.0211	1	BP
GO:0016139	glycoside catabolic process	7	2	0.24	0.0211	1	BP
GO:0051168	nuclear export	67	6	2.26	0.0237	1	BP
GO:0033554	cellular response to stress	546	28	18.4	0.0238	1	BP
GO:2000113	negative regulation of cellular macromol...	306	17	10.31	0.024	1	BP
GO:0071222	cellular response to lipopolysaccharide	19	3	0.64	0.0243	1	BP
GO:0044403	biological process involved in symbiotic...	107	8	3.61	0.0259	1	BP
GO:0034641	cellular nitrogen compound metabolic pro...	1304	56	43.95	0.0259	1	BP
GO:2001235	positive regulation of apoptotic signali...	39	6	1.31	0.0266	1	BP
GO:0010212	response to ionizing radiation	51	5	1.72	0.027	1	BP
GO:0044238	primary metabolic process	1904	74	64.17	0.0274	1	BP
GO:0045821	positive regulation of glycolytic proces...	8	2	0.27	0.0276	1	BP
GO:0010829	negative regulation of glucose transmemb...	8	2	0.27	0.0276	1	BP
GO:0030813	positive regulation of nucleotide catabo...	8	2	0.27	0.0276	1	BP
GO:0035883	enteroendocrine cell differentiation	8	2	0.27	0.0276	1	BP
GO:0046500	S-adenosylmethionine metabolic process	8	2	0.27	0.0276	1	BP
GO:0010827	regulation of glucose transmembrane tran...	20	3	0.67	0.0279	1	BP
GO:0007525	somatic muscle development	20	3	0.67	0.0279	1	BP
GO:0006378	mRNA polyadenylation	20	3	0.67	0.0279	1	BP
GO:0043631	RNA polyadenylation	20	3	0.67	0.0279	1	BP
GO:1903036	positive regulation of response to wound...	20	3	0.67	0.0279	1	BP
GO:0031124	mRNA 3'-end processing	35	4	1.18	0.0285	1	BP
GO:0051247	positive regulation of protein metabolic...	337	18	11.36	0.029	1	BP
GO:0071478	cellular response to radiation	52	5	1.75	0.0291	1	BP
GO:0051726	regulation of cell cycle	314	17	10.58	0.0301	1	BP
GO:0018205	peptidyl-lysine modification	90	7	3.03	0.0301	1	BP
GO:0071479	cellular response to ionizing radiation	21	3	0.71	0.0317	1	BP
GO:0051603	proteolysis involved in cellular protein...	176	11	5.93	0.0321	1	BP
GO:0016570	histone modification	112	8	3.77	0.0329	1	BP
GO:0045935	positive regulation of nucleobase-contai...	392	20	13.21	0.0334	1	BP
GO:0070647	protein modification by small protein co...	246	14	8.29	0.0334	1	BP
GO:0016032	viral process	92	7	3.1	0.0334	1	BP
GO:0097193	intrinsic apoptotic signaling pathway	78	8	2.63	0.0335	1	BP
GO:2001252	positive regulation of chromosome organi...	54	5	1.82	0.0335	1	BP
GO:0071105	response to interleukin-11	1	1	0.03	0.0337	1	BP
GO:0090204	protein localization to nuclear pore	1	1	0.03	0.0337	1	BP
GO:0060734	regulation of endoplasmic reticulum stre...	1	1	0.03	0.0337	1	BP
GO:0031272	regulation of pseudopodium assembly	1	1	0.03	0.0337	1	BP
GO:0031274	positive regulation of pseudopodium asse...	1	1	0.03	0.0337	1	BP
GO:0006703	estrogen biosynthetic process	1	1	0.03	0.0337	1	BP
GO:2001160	regulation of histone H3-K79 methylation	1	1	0.03	0.0337	1	BP
GO:2001162	positive regulation of histone H3-K79 me...	1	1	0.03	0.0337	1	BP
GO:0016557	peroxisome membrane biogenesis	1	1	0.03	0.0337	1	BP
GO:0051873	killing by host of symbiont cells	1	1	0.03	0.0337	1	BP
GO:0043379	memory T cell differentiation	1	1	0.03	0.0337	1	BP
GO:2000074	regulation of type B pancreatic cell dev...	1	1	0.03	0.0337	1	BP
GO:0090713	immunological memory process	1	1	0.03	0.0337	1	BP
GO:0090715	immunological memory formation process	1	1	0.03	0.0337	1	BP
GO:0008062	eclosion rhythm	1	1	0.03	0.0337	1	BP
GO:0003064	regulation of heart rate by hormone	1	1	0.03	0.0337	1	BP
GO:2001284	regulation of BMP secretion	1	1	0.03	0.0337	1	BP
GO:0003053	circadian regulation of heart rate	1	1	0.03	0.0337	1	BP
GO:0002432	granuloma formation	1	1	0.03	0.0337	1	BP
GO:0038055	BMP secretion	1	1	0.03	0.0337	1	BP
GO:0034729	histone H3-K79 methylation	1	1	0.03	0.0337	1	BP
GO:0038018	Wnt receptor catabolic process	1	1	0.03	0.0337	1	BP
GO:0060661	submandibular salivary gland formation	1	1	0.03	0.0337	1	BP
GO:0099010	modification of postsynaptic structure	1	1	0.03	0.0337	1	BP
GO:1903745	negative regulation of pharyngeal pumpin...	1	1	0.03	0.0337	1	BP
GO:0061484	hematopoietic stem cell homeostasis	1	1	0.03	0.0337	1	BP
GO:1905553	regulation of blood vessel branching	1	1	0.03	0.0337	1	BP
GO:1905555	positive regulation of blood vessel bran...	1	1	0.03	0.0337	1	BP
GO:2000323	negative regulation of glucocorticoid re...	1	1	0.03	0.0337	1	BP
GO:0098886	modification of dendritic spine	1	1	0.03	0.0337	1	BP
GO:2000303	regulation of ceramide biosynthetic proc...	1	1	0.03	0.0337	1	BP
GO:2000304	positive regulation of ceramide biosynth...	1	1	0.03	0.0337	1	BP
GO:0098829	intestinal folate absorption	1	1	0.03	0.0337	1	BP
GO:1904447	folate import across plasma membrane	1	1	0.03	0.0337	1	BP
GO:0045850	positive regulation of nurse cell apopto...	1	1	0.03	0.0337	1	BP
GO:0035318	imaginal disc-derived wing hair outgrowt...	1	1	0.03	0.0337	1	BP
GO:0018197	peptidyl-aspartic acid modification	1	1	0.03	0.0337	1	BP
GO:0051958	methotrexate transport	1	1	0.03	0.0337	1	BP
GO:2000152	regulation of ubiquitin-specific proteas...	1	1	0.03	0.0337	1	BP
GO:2000158	positive regulation of ubiquitin-specifi...	1	1	0.03	0.0337	1	BP
GO:0000740	nuclear membrane fusion	1	1	0.03	0.0337	1	BP
GO:0010561	negative regulation of glycoprotein bios...	1	1	0.03	0.0337	1	BP
GO:0042983	amyloid precursor protein biosynthetic p...	1	1	0.03	0.0337	1	BP
GO:0042984	regulation of amyloid precursor protein ...	1	1	0.03	0.0337	1	BP
GO:0042985	negative regulation of amyloid precursor...	1	1	0.03	0.0337	1	BP
GO:0031001	response to brefeldin A	1	1	0.03	0.0337	1	BP
GO:1902350	cellular response to chloroquine	1	1	0.03	0.0337	1	BP
GO:0030715	oocyte growth in germarium-derived egg c...	1	1	0.03	0.0337	1	BP
GO:2000252	negative regulation of feeding behavior	1	1	0.03	0.0337	1	BP
GO:0048664	neuron fate determination	1	1	0.03	0.0337	1	BP
GO:0001907	killing by symbiont of host cells	1	1	0.03	0.0337	1	BP
GO:1902349	response to chloroquine	1	1	0.03	0.0337	1	BP
GO:1905038	regulation of membrane lipid metabolic p...	1	1	0.03	0.0337	1	BP
GO:0048689	formation of growth cone in injured axon	1	1	0.03	0.0337	1	BP
GO:1902308	regulation of peptidyl-serine dephosphor...	1	1	0.03	0.0337	1	BP
GO:1902309	negative regulation of peptidyl-serine d...	1	1	0.03	0.0337	1	BP
GO:1902499	positive regulation of protein autoubiqu...	1	1	0.03	0.0337	1	BP
GO:1902466	positive regulation of histone H3-K27 tr...	1	1	0.03	0.0337	1	BP
GO:0072574	hepatocyte proliferation	1	1	0.03	0.0337	1	BP
GO:0072575	epithelial cell proliferation involved i...	1	1	0.03	0.0337	1	BP
GO:0003245	cardiac muscle tissue growth involved in...	1	1	0.03	0.0337	1	BP
GO:0003247	post-embryonic cardiac muscle cell growt...	1	1	0.03	0.0337	1	BP
GO:1905912	regulation of calcium ion export across ...	1	1	0.03	0.0337	1	BP
GO:1905913	negative regulation of calcium ion expor...	1	1	0.03	0.0337	1	BP
GO:1903019	negative regulation of glycoprotein meta...	1	1	0.03	0.0337	1	BP
GO:0070836	caveola assembly	1	1	0.03	0.0337	1	BP
GO:0035726	common myeloid progenitor cell prolifera...	1	1	0.03	0.0337	1	BP
GO:0035711	T-helper 1 cell activation	1	1	0.03	0.0337	1	BP
GO:0045046	protein import into peroxisome membrane	1	1	0.03	0.0337	1	BP
GO:1903999	negative regulation of eating behavior	1	1	0.03	0.0337	1	BP
GO:0052042	positive regulation by symbiont of host ...	1	1	0.03	0.0337	1	BP
GO:0072674	multinuclear osteoclast differentiation	1	1	0.03	0.0337	1	BP
GO:0072675	osteoclast fusion	1	1	0.03	0.0337	1	BP
GO:0071348	cellular response to interleukin-11	1	1	0.03	0.0337	1	BP
GO:1900157	regulation of bone mineralization involv...	1	1	0.03	0.0337	1	BP
GO:1900159	positive regulation of bone mineralizati...	1	1	0.03	0.0337	1	BP
GO:0071335	hair follicle cell proliferation	1	1	0.03	0.0337	1	BP
GO:0071336	regulation of hair follicle cell prolife...	1	1	0.03	0.0337	1	BP
GO:0071338	positive regulation of hair follicle cel...	1	1	0.03	0.0337	1	BP
GO:0097284	hepatocyte apoptotic process	1	1	0.03	0.0337	1	BP
GO:1900144	positive regulation of BMP secretion	1	1	0.03	0.0337	1	BP
GO:0090403	oxidative stress-induced premature senes...	1	1	0.03	0.0337	1	BP
GO:1990619	histone H3-K9 deacetylation	1	1	0.03	0.0337	1	BP
GO:0060137	maternal process involved in parturition	1	1	0.03	0.0337	1	BP
GO:0019464	glycine decarboxylation via glycine clea...	1	1	0.03	0.0337	1	BP
GO:0036150	phosphatidylserine acyl-chain remodeling	1	1	0.03	0.0337	1	BP
GO:0097206	nephrocyte filtration	1	1	0.03	0.0337	1	BP
GO:0035521	monoubiquitinated histone deubiquitinati...	1	1	0.03	0.0337	1	BP
GO:0035522	monoubiquitinated histone H2A deubiquiti...	1	1	0.03	0.0337	1	BP
GO:0090152	establishment of protein localization to...	1	1	0.03	0.0337	1	BP
GO:0090153	regulation of sphingolipid biosynthetic ...	1	1	0.03	0.0337	1	BP
GO:0090154	positive regulation of sphingolipid bios...	1	1	0.03	0.0337	1	BP
GO:2000653	regulation of genetic imprinting	1	1	0.03	0.0337	1	BP
GO:0044532	modulation of apoptotic process in anoth...	1	1	0.03	0.0337	1	BP
GO:0044533	positive regulation of apoptotic process...	1	1	0.03	0.0337	1	BP
GO:0055050	astral spindle assembly involved in male...	1	1	0.03	0.0337	1	BP
GO:0051712	positive regulation of killing of cells ...	1	1	0.03	0.0337	1	BP
GO:0035630	bone mineralization involved in bone mat...	1	1	0.03	0.0337	1	BP
GO:0055049	astral spindle assembly	1	1	0.03	0.0337	1	BP
GO:0035606	peptidyl-cysteine S-trans-nitrosylation	1	1	0.03	0.0337	1	BP
GO:0051709	regulation of killing of cells of anothe...	1	1	0.03	0.0337	1	BP
GO:0031269	pseudopodium assembly	1	1	0.03	0.0337	1	BP
GO:0031214	biomineral tissue development	37	4	1.25	0.0341	1	BP
GO:0048738	cardiac muscle tissue development	37	4	1.25	0.0341	1	BP
GO:0110148	biomineralization	37	4	1.25	0.0341	1	BP
GO:0051173	positive regulation of nitrogen compound...	627	29	21.13	0.0345	1	BP
GO:2001171	positive regulation of ATP biosynthetic ...	9	2	0.3	0.0347	1	BP
GO:1900543	negative regulation of purine nucleotide...	9	2	0.3	0.0347	1	BP
GO:1903579	negative regulation of ATP metabolic pro...	9	2	0.3	0.0347	1	BP
GO:0070741	response to interleukin-6	9	2	0.3	0.0347	1	BP
GO:0016137	glycoside metabolic process	9	2	0.3	0.0347	1	BP
GO:0030011	maintenance of cell polarity	9	2	0.3	0.0347	1	BP
GO:0060548	negative regulation of cell death	224	13	7.55	0.0348	1	BP
GO:0032268	regulation of cellular protein metabolic...	522	25	17.59	0.0349	1	BP
GO:0051246	regulation of protein metabolic process	549	26	18.5	0.0356	1	BP
GO:0048144	fibroblast proliferation	22	3	0.74	0.0359	1	BP
GO:0048145	regulation of fibroblast proliferation	22	3	0.74	0.0359	1	BP
GO:0032456	endocytic recycling	22	3	0.74	0.0359	1	BP
GO:0070828	heterochromatin organization	22	3	0.74	0.0359	1	BP
GO:0031100	animal organ regeneration	22	3	0.74	0.0359	1	BP
GO:0080135	regulation of cellular response to stres...	187	13	6.3	0.036	1	BP
GO:0010468	regulation of gene expression	793	35	26.73	0.0366	1	BP
GO:0010035	response to inorganic substance	158	10	5.33	0.0375	1	BP
GO:0044267	cellular protein metabolic process	1049	44	35.36	0.0384	1	BP
GO:2001141	regulation of RNA biosynthetic process	553	26	18.64	0.0386	1	BP
GO:1903506	regulation of nucleic acid-templated tra...	553	26	18.64	0.0386	1	BP
GO:0019221	cytokine-mediated signaling pathway	75	6	2.53	0.0387	1	BP
GO:1903706	regulation of hemopoiesis	75	6	2.53	0.0387	1	BP
GO:1901575	organic substance catabolic process	485	26	16.35	0.039	1	BP
GO:0044271	cellular nitrogen compound biosynthetic ...	936	42	31.55	0.0397	1	BP
GO:1901360	organic cyclic compound metabolic proces...	1206	52	40.65	0.0398	1	BP
GO:0034763	negative regulation of transmembrane tra...	23	3	0.78	0.0403	1	BP
GO:0030316	osteoclast differentiation	23	3	0.78	0.0403	1	BP
GO:0002761	regulation of myeloid leukocyte differen...	23	3	0.78	0.0403	1	BP
GO:0035821	modulation of process of another organis...	23	3	0.78	0.0403	1	BP
GO:0070059	intrinsic apoptotic signaling pathway in...	23	3	0.78	0.0403	1	BP
GO:0061061	muscle structure development	160	10	5.39	0.0403	1	BP
GO:1901987	regulation of cell cycle phase transitio...	138	9	4.65	0.0403	1	BP
GO:0034250	positive regulation of cellular amide me...	39	4	1.31	0.0404	1	BP
GO:0016197	endosomal transport	76	6	2.56	0.0409	1	BP
GO:0009056	catabolic process	569	29	19.18	0.0413	1	BP
GO:0048147	negative regulation of fibroblast prolif...	10	2	0.34	0.0424	1	BP
GO:0031018	endocrine pancreas development	10	2	0.34	0.0424	1	BP
GO:0030810	positive regulation of nucleotide biosyn...	10	2	0.34	0.0424	1	BP
GO:1900373	positive regulation of purine nucleotide...	10	2	0.34	0.0424	1	BP
GO:0097421	liver regeneration	10	2	0.34	0.0424	1	BP
GO:0090303	positive regulation of wound healing	10	2	0.34	0.0424	1	BP
GO:0045980	negative regulation of nucleotide metabo...	10	2	0.34	0.0424	1	BP
GO:0044770	cell cycle phase transition	184	11	6.2	0.0425	1	BP
GO:0014706	striated muscle tissue development	77	6	2.6	0.0432	1	BP
GO:0031503	protein-containing complex localization	77	6	2.6	0.0432	1	BP
GO:0031398	positive regulation of protein ubiquitin...	40	4	1.35	0.0438	1	BP
GO:0000075	cell cycle checkpoint signaling	58	5	1.95	0.0438	1	BP
GO:0034504	protein localization to nucleus	78	6	2.63	0.0456	1	BP
GO:0052548	regulation of endopeptidase activity	59	5	1.99	0.0466	1	BP
GO:0043066	negative regulation of apoptotic process	187	11	6.3	0.0469	1	BP
GO:0051668	localization within membrane	172	12	5.8	0.0474	1	BP
GO:0030099	myeloid cell differentiation	79	6	2.66	0.048	1	BP
GO:0034654	nucleobase-containing compound biosynthe...	746	35	25.14	0.0484	1	BP
GO:0007346	regulation of mitotic cell cycle	188	11	6.34	0.0484	1	BP
GO:0032204	regulation of telomere maintenance	25	3	0.84	0.0499	1	BP
GO:0006355	regulation of transcription, DNA-templat...	540	25	18.2	0.0503	1	BP
GO:0051171	regulation of nitrogen compound metaboli...	1010	44	34.04	0.0505	1	BP
GO:0034248	regulation of cellular amide metabolic p...	122	8	4.11	0.0507	1	BP
GO:0071763	nuclear membrane organization	11	2	0.37	0.0507	1	BP
GO:0006509	membrane protein ectodomain proteolysis	11	2	0.37	0.0507	1	BP
GO:0016925	protein sumoylation	11	2	0.37	0.0507	1	BP
GO:0051926	negative regulation of calcium ion trans...	11	2	0.37	0.0507	1	BP
GO:0032922	circadian regulation of gene expression	11	2	0.37	0.0507	1	BP
GO:0050863	regulation of T cell activation	42	4	1.42	0.051	1	BP
GO:0008630	intrinsic apoptotic signaling pathway in...	30	5	1.01	0.0523	1	BP
GO:0009791	post-embryonic development	262	14	8.83	0.0528	1	BP
GO:0060537	muscle tissue development	81	6	2.73	0.0532	1	BP
GO:0044257	cellular protein catabolic process	191	11	6.44	0.0533	1	BP
GO:0080134	regulation of response to stress	272	16	9.17	0.0533	1	BP
GO:0017148	negative regulation of translation	43	4	1.45	0.0548	1	BP
GO:0035265	organ growth	43	4	1.45	0.0548	1	BP
GO:0043069	negative regulation of programmed cell d...	192	11	6.47	0.055	1	BP
GO:0031058	positive regulation of histone modificat...	26	3	0.88	0.055	1	BP
GO:0010628	positive regulation of gene expression	414	20	13.95	0.055	1	BP
GO:0045787	positive regulation of cell cycle	103	7	3.47	0.0562	1	BP
GO:0016070	RNA metabolic process	847	36	28.55	0.057	1	BP
GO:0006397	mRNA processing	125	8	4.21	0.0571	1	BP
GO:0090559	regulation of membrane permeability	16	4	0.54	0.0574	1	BP
GO:0019538	protein metabolic process	1104	45	37.21	0.0577	1	BP
GO:1901362	organic cyclic compound biosynthetic pro...	786	36	26.49	0.0585	1	BP
GO:0018193	peptidyl-amino acid modification	266	14	8.97	0.0586	1	BP
GO:0050807	regulation of synapse organization	83	6	2.8	0.0586	1	BP
GO:0010952	positive regulation of peptidase activit...	44	4	1.48	0.0588	1	BP
GO:1901985	positive regulation of protein acetylati...	12	2	0.4	0.0595	1	BP
GO:0048146	positive regulation of fibroblast prolif...	12	2	0.4	0.0595	1	BP
GO:0045740	positive regulation of DNA replication	12	2	0.4	0.0595	1	BP
GO:1903580	positive regulation of ATP metabolic pro...	12	2	0.4	0.0595	1	BP
GO:0033363	secretory granule organization	12	2	0.4	0.0595	1	BP
GO:0035418	protein localization to synapse	12	2	0.4	0.0595	1	BP
GO:0070228	regulation of lymphocyte apoptotic proce...	12	2	0.4	0.0595	1	BP
GO:0045023	G0 to G1 transition	12	2	0.4	0.0595	1	BP
GO:0048013	ephrin receptor signaling pathway	12	2	0.4	0.0595	1	BP
GO:0002067	glandular epithelial cell differentiatio...	12	2	0.4	0.0595	1	BP
GO:1901658	glycosyl compound catabolic process	12	2	0.4	0.0595	1	BP
GO:0061647	histone H3-K9 modification	12	2	0.4	0.0595	1	BP
GO:0006294	nucleotide-excision repair, preincision ...	12	2	0.4	0.0595	1	BP
GO:0035556	intracellular signal transduction	522	28	17.59	0.0597	1	BP
GO:0072347	response to anesthetic	27	3	0.91	0.0604	1	BP
GO:0030282	bone mineralization	27	3	0.91	0.0604	1	BP
GO:1901890	positive regulation of cell junction ass...	27	3	0.91	0.0604	1	BP
GO:0006417	regulation of translation	105	7	3.54	0.0612	1	BP
GO:0032200	telomere organization	45	4	1.52	0.0629	1	BP
GO:0000723	telomere maintenance	45	4	1.52	0.0629	1	BP
GO:0071456	cellular response to hypoxia	45	4	1.52	0.0629	1	BP
GO:1903322	positive regulation of protein modificat...	45	4	1.52	0.0629	1	BP
GO:0018130	heterocycle biosynthetic process	764	35	25.75	0.0651	1	BP
GO:0019438	aromatic compound biosynthetic process	764	35	25.75	0.0651	1	BP
GO:0051054	positive regulation of DNA metabolic pro...	65	5	2.19	0.0658	1	BP
GO:0043149	stress fiber assembly	28	3	0.94	0.0661	1	BP
GO:1903707	negative regulation of hemopoiesis	28	3	0.94	0.0661	1	BP
GO:0030038	contractile actin filament bundle assemb...	28	3	0.94	0.0661	1	BP
GO:0031401	positive regulation of protein modificat...	222	12	7.48	0.0661	1	BP
GO:0045498	sex comb development	2	1	0.07	0.0663	1	BP
GO:0001765	membrane raft assembly	2	1	0.07	0.0663	1	BP
GO:0010383	cell wall polysaccharide metabolic proce...	2	1	0.07	0.0663	1	BP
GO:2001166	regulation of histone H2B ubiquitination	2	1	0.07	0.0663	1	BP
GO:2001168	positive regulation of histone H2B ubiqu...	2	1	0.07	0.0663	1	BP
GO:0030961	peptidyl-arginine hydroxylation	2	1	0.07	0.0663	1	BP
GO:0042772	DNA damage response, signal transduction...	2	1	0.07	0.0663	1	BP
GO:2000051	negative regulation of non-canonical Wnt...	2	1	0.07	0.0663	1	BP
GO:0071244	cellular response to carbon dioxide	2	1	0.07	0.0663	1	BP
GO:0051835	positive regulation of synapse structura...	2	1	0.07	0.0663	1	BP
GO:0099639	neurotransmitter receptor transport, end...	2	1	0.07	0.0663	1	BP
GO:0070932	histone H3 deacetylation	2	1	0.07	0.0663	1	BP
GO:0001826	inner cell mass cell differentiation	2	1	0.07	0.0663	1	BP
GO:0003062	regulation of heart rate by chemical sig...	2	1	0.07	0.0663	1	BP
GO:0000320	re-entry into mitotic cell cycle	2	1	0.07	0.0663	1	BP
GO:0006546	glycine catabolic process	2	1	0.07	0.0663	1	BP
GO:0071895	odontoblast differentiation	2	1	0.07	0.0663	1	BP
GO:0033085	negative regulation of T cell differenti...	2	1	0.07	0.0663	1	BP
GO:0002188	translation reinitiation	2	1	0.07	0.0663	1	BP
GO:0071852	fungal-type cell wall organization or bi...	2	1	0.07	0.0663	1	BP
GO:0051683	establishment of Golgi localization	2	1	0.07	0.0663	1	BP
GO:1901329	regulation of odontoblast differentiatio...	2	1	0.07	0.0663	1	BP
GO:1905868	regulation of 3'-UTR-mediated mRNA stabi...	2	1	0.07	0.0663	1	BP
GO:0060684	epithelial-mesenchymal cell signaling	2	1	0.07	0.0663	1	BP
GO:1903786	regulation of glutathione biosynthetic p...	2	1	0.07	0.0663	1	BP
GO:1903788	positive regulation of glutathione biosy...	2	1	0.07	0.0663	1	BP
GO:0051601	exocyst localization	2	1	0.07	0.0663	1	BP
GO:0070341	fat cell proliferation	2	1	0.07	0.0663	1	BP
GO:0070344	regulation of fat cell proliferation	2	1	0.07	0.0663	1	BP
GO:0070345	negative regulation of fat cell prolifer...	2	1	0.07	0.0663	1	BP
GO:0010269	response to selenium ion	2	1	0.07	0.0663	1	BP
GO:0002281	macrophage activation involved in immune...	2	1	0.07	0.0663	1	BP
GO:0072185	metanephric cap development	2	1	0.07	0.0663	1	BP
GO:0072186	metanephric cap morphogenesis	2	1	0.07	0.0663	1	BP
GO:1902010	negative regulation of translation in re...	2	1	0.07	0.0663	1	BP
GO:2000322	regulation of glucocorticoid receptor si...	2	1	0.07	0.0663	1	BP
GO:1903840	response to arsenite(3-)	2	1	0.07	0.0663	1	BP
GO:1903841	cellular response to arsenite(3-)	2	1	0.07	0.0663	1	BP
GO:1903842	response to arsenite ion	2	1	0.07	0.0663	1	BP
GO:0098887	neurotransmitter receptor transport, end...	2	1	0.07	0.0663	1	BP
GO:1903843	cellular response to arsenite ion	2	1	0.07	0.0663	1	BP
GO:0031640	killing of cells of another organism	2	1	0.07	0.0663	1	BP
GO:0031642	negative regulation of myelination	2	1	0.07	0.0663	1	BP
GO:0098838	folate transmembrane transport	2	1	0.07	0.0663	1	BP
GO:0044364	disruption of cells of another organism	2	1	0.07	0.0663	1	BP
