GO.ID	Term	Annotated	Significant	Expected	pval_test	pval_adj	ontology
GO:0099174	regulation of presynapse organization	7	1	0.24	0.2136	1	BP
GO:0070886	positive regulation of calcineurin-NFAT ...	7	1	0.24	0.2136	1	BP
GO:0070873	regulation of glycogen metabolic process	7	1	0.24	0.2136	1	BP
GO:0032469	endoplasmic reticulum calcium ion homeos...	7	1	0.24	0.2136	1	BP
GO:0021522	spinal cord motor neuron differentiation	7	1	0.24	0.2136	1	BP
GO:0021511	spinal cord patterning	7	1	0.24	0.2136	1	BP
GO:0021513	spinal cord dorsal/ventral patterning	7	1	0.24	0.2136	1	BP
GO:0051055	negative regulation of lipid biosyntheti...	7	1	0.24	0.2136	1	BP
GO:0035176	social behavior	7	1	0.24	0.2136	1	BP
GO:0014041	regulation of neuron maturation	7	1	0.24	0.2136	1	BP
GO:0014048	regulation of glutamate secretion	7	1	0.24	0.2136	1	BP
GO:1903514	release of sequestered calcium ion into ...	7	1	0.24	0.2136	1	BP
GO:0106058	positive regulation of calcineurin-media...	7	1	0.24	0.2136	1	BP
GO:0097094	craniofacial suture morphogenesis	7	1	0.24	0.2136	1	BP
GO:0097062	dendritic spine maintenance	7	1	0.24	0.2136	1	BP
GO:0097064	ncRNA export from nucleus	7	1	0.24	0.2136	1	BP
GO:1905770	regulation of mesodermal cell differenti...	7	1	0.24	0.2136	1	BP
GO:1901374	acetate ester transport	7	1	0.24	0.2136	1	BP
GO:0010719	negative regulation of epithelial to mes...	7	1	0.24	0.2136	1	BP
GO:0010863	positive regulation of phospholipase C a...	7	1	0.24	0.2136	1	BP
GO:0007000	nucleolus organization	7	1	0.24	0.2136	1	BP
GO:0010880	regulation of release of sequestered cal...	7	1	0.24	0.2136	1	BP
GO:0061418	regulation of transcription from RNA pol...	7	1	0.24	0.2136	1	BP
GO:0050685	positive regulation of mRNA processing	7	1	0.24	0.2136	1	BP
GO:0035809	regulation of urine volume	7	1	0.24	0.2136	1	BP
GO:0003230	cardiac atrium development	7	1	0.24	0.2136	1	BP
GO:0032892	positive regulation of organic acid tran...	7	1	0.24	0.2136	1	BP
GO:0045661	regulation of myoblast differentiation	7	1	0.24	0.2136	1	BP
GO:0140747	regulation of ncRNA transcription	7	1	0.24	0.2136	1	BP
GO:0006896	Golgi to vacuole transport	7	1	0.24	0.2136	1	BP
GO:0051443	positive regulation of ubiquitin-protein...	7	1	0.24	0.2136	1	BP
GO:1904799	regulation of neuron remodeling	7	1	0.24	0.2136	1	BP
GO:0044719	regulation of imaginal disc-derived wing...	7	1	0.24	0.2136	1	BP
GO:0070911	global genome nucleotide-excision repair	7	1	0.24	0.2136	1	BP
GO:0042069	regulation of catecholamine metabolic pr...	7	1	0.24	0.2136	1	BP
GO:0042053	regulation of dopamine metabolic process	7	1	0.24	0.2136	1	BP
GO:0042661	regulation of mesodermal cell fate speci...	7	1	0.24	0.2136	1	BP
GO:0015870	acetylcholine transport	7	1	0.24	0.2136	1	BP
GO:0036474	cell death in response to hydrogen perox...	7	1	0.24	0.2136	1	BP
GO:0035036	sperm-egg recognition	7	1	0.24	0.2136	1	BP
GO:0060314	regulation of ryanodine-sensitive calciu...	7	1	0.24	0.2136	1	BP
GO:0048934	peripheral nervous system neuron differe...	7	1	0.24	0.2136	1	BP
GO:0048935	peripheral nervous system neuron develop...	7	1	0.24	0.2136	1	BP
GO:1904590	negative regulation of protein import	7	1	0.24	0.2136	1	BP
GO:0050922	negative regulation of chemotaxis	7	1	0.24	0.2136	1	BP
GO:0003091	renal water homeostasis	7	1	0.24	0.2136	1	BP
GO:0007400	neuroblast fate determination	7	1	0.24	0.2136	1	BP
GO:0002286	T cell activation involved in immune res...	7	1	0.24	0.2136	1	BP
GO:0003081	regulation of systemic arterial blood pr...	7	1	0.24	0.2136	1	BP
GO:0045933	positive regulation of muscle contractio...	7	1	0.24	0.2136	1	BP
GO:1901836	regulation of transcription of nucleolar...	7	1	0.24	0.2136	1	BP
GO:0045596	negative regulation of cell differentiat...	145	7	4.89	0.2141	1	BP
GO:0036293	response to decreased oxygen levels	95	5	3.2	0.2145	1	BP
GO:0050795	regulation of behavior	71	4	2.39	0.2158	1	BP
GO:0008543	fibroblast growth factor receptor signal...	26	2	0.88	0.2177	1	BP
GO:0019229	regulation of vasoconstriction	26	2	0.88	0.2177	1	BP
GO:0050772	positive regulation of axonogenesis	26	2	0.88	0.2177	1	BP
GO:0006283	transcription-coupled nucleotide-excisio...	26	2	0.88	0.2177	1	BP
GO:0046364	monosaccharide biosynthetic process	26	2	0.88	0.2177	1	BP
GO:0005976	polysaccharide metabolic process	26	2	0.88	0.2177	1	BP
GO:0010389	regulation of G2/M transition of mitotic...	48	3	1.62	0.2185	1	BP
GO:0007204	positive regulation of cytosolic calcium...	48	3	1.62	0.2185	1	BP
GO:0071704	organic substance metabolic process	1982	71	66.8	0.2202	1	BP
GO:0001655	urogenital system development	96	5	3.24	0.2207	1	BP
GO:2001233	regulation of apoptotic signaling pathwa...	96	5	3.24	0.2207	1	BP
GO:0007626	locomotory behavior	121	6	4.08	0.2211	1	BP
GO:0051248	negative regulation of protein metabolic...	225	10	7.58	0.2227	1	BP
GO:0090305	nucleic acid phosphodiester bond hydroly...	72	4	2.43	0.223	1	BP
GO:0010467	gene expression	1040	39	35.05	0.224	1	BP
GO:0019725	cellular homeostasis	226	10	7.62	0.2268	1	BP
GO:0045931	positive regulation of mitotic cell cycl...	49	3	1.65	0.2275	1	BP
GO:0007417	central nervous system development	253	11	8.53	0.2282	1	BP
GO:0046883	regulation of hormone secretion	73	4	2.46	0.2303	1	BP
GO:0034599	cellular response to oxidative stress	73	4	2.46	0.2303	1	BP
GO:0000041	transition metal ion transport	27	2	0.91	0.2303	1	BP
GO:0042157	lipoprotein metabolic process	27	2	0.91	0.2303	1	BP
GO:0042551	neuron maturation	27	2	0.91	0.2303	1	BP
GO:0042048	olfactory behavior	27	2	0.91	0.2303	1	BP
GO:0016322	neuron remodeling	27	2	0.91	0.2303	1	BP
GO:0072175	epithelial tube formation	50	3	1.69	0.2365	1	BP
GO:0008306	associative learning	50	3	1.69	0.2365	1	BP
GO:0030111	regulation of Wnt signaling pathway	74	4	2.49	0.2376	1	BP
GO:0044772	mitotic cell cycle phase transition	150	7	5.06	0.2393	1	BP
GO:1904666	regulation of ubiquitin protein ligase a...	8	1	0.27	0.2402	1	BP
GO:0010996	response to auditory stimulus	8	1	0.27	0.2402	1	BP
GO:0048134	germ-line cyst formation	8	1	0.27	0.2402	1	BP
GO:1903204	negative regulation of oxidative stress-...	8	1	0.27	0.2402	1	BP
GO:0072488	ammonium transmembrane transport	8	1	0.27	0.2402	1	BP
GO:0016101	diterpenoid metabolic process	8	1	0.27	0.2402	1	BP
GO:0010454	negative regulation of cell fate commitm...	8	1	0.27	0.2402	1	BP
GO:0070861	regulation of protein exit from endoplas...	8	1	0.27	0.2402	1	BP
GO:0046534	positive regulation of photoreceptor cel...	8	1	0.27	0.2402	1	BP
GO:0021517	ventral spinal cord development	8	1	0.27	0.2402	1	BP
GO:2000288	positive regulation of myoblast prolifer...	8	1	0.27	0.2402	1	BP
GO:0048867	stem cell fate determination	8	1	0.27	0.2402	1	BP
GO:2000242	negative regulation of reproductive proc...	8	1	0.27	0.2402	1	BP
GO:1902100	negative regulation of metaphase/anaphas...	8	1	0.27	0.2402	1	BP
GO:1902101	positive regulation of metaphase/anaphas...	8	1	0.27	0.2402	1	BP
GO:2000209	regulation of anoikis	8	1	0.27	0.2402	1	BP
GO:1902254	negative regulation of intrinsic apoptot...	8	1	0.27	0.2402	1	BP
GO:2000758	positive regulation of peptidyl-lysine a...	8	1	0.27	0.2402	1	BP
GO:0006107	oxaloacetate metabolic process	8	1	0.27	0.2402	1	BP
GO:0070633	transepithelial transport	8	1	0.27	0.2402	1	BP
GO:0032222	regulation of synaptic transmission, cho...	8	1	0.27	0.2402	1	BP
GO:0007095	mitotic G2 DNA damage checkpoint signali...	8	1	0.27	0.2402	1	BP
GO:0007096	regulation of exit from mitosis	8	1	0.27	0.2402	1	BP
GO:0071475	cellular hyperosmotic salinity response	8	1	0.27	0.2402	1	BP
GO:1902751	positive regulation of cell cycle G2/M p...	8	1	0.27	0.2402	1	BP
GO:0003179	heart valve morphogenesis	8	1	0.27	0.2402	1	BP
GO:1905820	positive regulation of chromosome separa...	8	1	0.27	0.2402	1	BP
GO:1905819	negative regulation of chromosome separa...	8	1	0.27	0.2402	1	BP
GO:0035883	enteroendocrine cell differentiation	8	1	0.27	0.2402	1	BP
GO:0010882	regulation of cardiac muscle contraction...	8	1	0.27	0.2402	1	BP
GO:1902875	regulation of embryonic pattern specific...	8	1	0.27	0.2402	1	BP
GO:0032881	regulation of polysaccharide metabolic p...	8	1	0.27	0.2402	1	BP
GO:0035510	DNA dealkylation	8	1	0.27	0.2402	1	BP
GO:0010518	positive regulation of phospholipase act...	8	1	0.27	0.2402	1	BP
GO:0051412	response to corticosterone	8	1	0.27	0.2402	1	BP
GO:0000289	nuclear-transcribed mRNA poly(A) tail sh...	8	1	0.27	0.2402	1	BP
GO:0042532	negative regulation of tyrosine phosphor...	8	1	0.27	0.2402	1	BP
GO:0006884	cell volume homeostasis	8	1	0.27	0.2402	1	BP
GO:0043928	exonucleolytic catabolism of deadenylate...	8	1	0.27	0.2402	1	BP
GO:0070987	error-free translesion synthesis	8	1	0.27	0.2402	1	BP
GO:0098751	bone cell development	8	1	0.27	0.2402	1	BP
GO:2000001	regulation of DNA damage checkpoint	8	1	0.27	0.2402	1	BP
GO:0032570	response to progesterone	8	1	0.27	0.2402	1	BP
GO:0010633	negative regulation of epithelial cell m...	8	1	0.27	0.2402	1	BP
GO:0060967	negative regulation of gene silencing by...	8	1	0.27	0.2402	1	BP
GO:0007317	regulation of pole plasm oskar mRNA loca...	8	1	0.27	0.2402	1	BP
GO:0002121	inter-male aggressive behavior	8	1	0.27	0.2402	1	BP
GO:0006089	lactate metabolic process	8	1	0.27	0.2402	1	BP
GO:1904580	regulation of intracellular mRNA localiz...	8	1	0.27	0.2402	1	BP
GO:0060193	positive regulation of lipase activity	8	1	0.27	0.2402	1	BP
GO:0070296	sarcoplasmic reticulum calcium ion trans...	8	1	0.27	0.2402	1	BP
GO:0003084	positive regulation of systemic arterial...	8	1	0.27	0.2402	1	BP
GO:2000351	regulation of endothelial cell apoptotic...	8	1	0.27	0.2402	1	BP
GO:0031323	regulation of cellular metabolic process	1087	44	36.64	0.2425	1	BP
GO:0042310	vasoconstriction	28	2	0.94	0.243	1	BP
GO:0006360	transcription by RNA polymerase I	28	2	0.94	0.243	1	BP
GO:0110020	regulation of actomyosin structure organ...	28	2	0.94	0.243	1	BP
GO:0042147	retrograde transport, endosome to Golgi	28	2	0.94	0.243	1	BP
GO:0042274	ribosomal small subunit biogenesis	28	2	0.94	0.243	1	BP
GO:0050848	regulation of calcium-mediated signaling	28	2	0.94	0.243	1	BP
GO:0051952	regulation of amine transport	28	2	0.94	0.243	1	BP
GO:0030038	contractile actin filament bundle assemb...	28	2	0.94	0.243	1	BP
GO:0006821	chloride transport	28	2	0.94	0.243	1	BP
GO:0010507	negative regulation of autophagy	28	2	0.94	0.243	1	BP
GO:0008217	regulation of blood pressure	28	2	0.94	0.243	1	BP
GO:0043149	stress fiber assembly	28	2	0.94	0.243	1	BP
GO:0006397	mRNA processing	125	6	4.21	0.2434	1	BP
GO:0044237	cellular metabolic process	1990	72	67.07	0.2478	1	BP
GO:0055082	cellular chemical homeostasis	178	8	6	0.2485	1	BP
GO:0055080	cation homeostasis	152	7	5.12	0.2496	1	BP
GO:0006950	response to stress	807	34	27.2	0.2503	1	BP
GO:0008152	metabolic process	2058	74	69.36	0.2518	1	BP
GO:0019222	regulation of metabolic process	1186	47	39.97	0.2532	1	BP
GO:0002181	cytoplasmic translation	52	3	1.75	0.2548	1	BP
GO:0030307	positive regulation of cell growth	52	3	1.75	0.2548	1	BP
GO:1903008	organelle disassembly	29	2	0.98	0.2556	1	BP
GO:0040018	positive regulation of multicellular org...	29	2	0.98	0.2556	1	BP
GO:0044106	cellular amine metabolic process	29	2	0.98	0.2556	1	BP
GO:0090277	positive regulation of peptide hormone s...	29	2	0.98	0.2556	1	BP
GO:0043488	regulation of mRNA stability	29	2	0.98	0.2556	1	BP
GO:0015837	amine transport	29	2	0.98	0.2556	1	BP
GO:0016999	antibiotic metabolic process	29	2	0.98	0.2556	1	BP
GO:0007422	peripheral nervous system development	29	2	0.98	0.2556	1	BP
GO:0009894	regulation of catabolic process	260	11	8.76	0.2561	1	BP
GO:0048514	blood vessel morphogenesis	77	4	2.6	0.26	1	BP
GO:0001822	kidney development	77	4	2.6	0.26	1	BP
GO:0006979	response to oxidative stress	128	6	4.31	0.2607	1	BP
GO:0019722	calcium-mediated signaling	53	3	1.79	0.264	1	BP
GO:0050821	protein stabilization	53	3	1.79	0.264	1	BP
GO:1902749	regulation of cell cycle G2/M phase tran...	53	3	1.79	0.264	1	BP
GO:0090257	regulation of muscle system process	53	3	1.79	0.264	1	BP
GO:0001954	positive regulation of cell-matrix adhes...	9	1	0.3	0.2658	1	BP
GO:1902369	negative regulation of RNA catabolic pro...	9	1	0.3	0.2658	1	BP
GO:0048261	negative regulation of receptor-mediated...	9	1	0.3	0.2658	1	BP
GO:0030101	natural killer cell activation	9	1	0.3	0.2658	1	BP
GO:0008053	mitochondrial fusion	9	1	0.3	0.2658	1	BP
GO:0032941	secretion by tissue	9	1	0.3	0.2658	1	BP
GO:0032946	positive regulation of mononuclear cell ...	9	1	0.3	0.2658	1	BP
GO:0006376	mRNA splice site selection	9	1	0.3	0.2658	1	BP
GO:2000181	negative regulation of blood vessel morp...	9	1	0.3	0.2658	1	BP
GO:0006309	apoptotic DNA fragmentation	9	1	0.3	0.2658	1	BP
GO:0032482	Rab protein signal transduction	9	1	0.3	0.2658	1	BP
GO:2000291	regulation of myoblast proliferation	9	1	0.3	0.2658	1	BP
GO:0003351	epithelial cilium movement involved in e...	9	1	0.3	0.2658	1	BP
GO:0090325	regulation of locomotion involved in loc...	9	1	0.3	0.2658	1	BP
GO:0030706	germarium-derived oocyte differentiation	9	1	0.3	0.2658	1	BP
GO:0051602	response to electrical stimulus	9	1	0.3	0.2658	1	BP
GO:0014003	oligodendrocyte development	9	1	0.3	0.2658	1	BP
GO:0043051	regulation of pharyngeal pumping	9	1	0.3	0.2658	1	BP
GO:0042276	error-prone translesion synthesis	9	1	0.3	0.2658	1	BP
GO:0009250	glucan biosynthetic process	9	1	0.3	0.2658	1	BP
GO:0098900	regulation of action potential	9	1	0.3	0.2658	1	BP
GO:0070665	positive regulation of leukocyte prolife...	9	1	0.3	0.2658	1	BP
GO:1902229	regulation of intrinsic apoptotic signal...	9	1	0.3	0.2658	1	BP
GO:0035206	regulation of hemocyte proliferation	9	1	0.3	0.2658	1	BP
GO:0009225	nucleotide-sugar metabolic process	9	1	0.3	0.2658	1	BP
GO:0006293	nucleotide-excision repair, preincision ...	9	1	0.3	0.2658	1	BP
GO:0071472	cellular response to salt stress	9	1	0.3	0.2658	1	BP
GO:0016525	negative regulation of angiogenesis	9	1	0.3	0.2658	1	BP
GO:0033046	negative regulation of sister chromatid ...	9	1	0.3	0.2658	1	BP
GO:0007063	regulation of sister chromatid cohesion	9	1	0.3	0.2658	1	BP
GO:0060603	mammary gland duct morphogenesis	9	1	0.3	0.2658	1	BP
GO:0008407	chaeta morphogenesis	9	1	0.3	0.2658	1	BP
GO:0046320	regulation of fatty acid oxidation	9	1	0.3	0.2658	1	BP
GO:0046326	positive regulation of glucose import	9	1	0.3	0.2658	1	BP
GO:0005978	glycogen biosynthetic process	9	1	0.3	0.2658	1	BP
GO:0072577	endothelial cell apoptotic process	9	1	0.3	0.2658	1	BP
GO:0006721	terpenoid metabolic process	9	1	0.3	0.2658	1	BP
GO:0050686	negative regulation of mRNA processing	9	1	0.3	0.2658	1	BP
GO:0050671	positive regulation of lymphocyte prolif...	9	1	0.3	0.2658	1	BP
GO:0010517	regulation of phospholipase activity	9	1	0.3	0.2658	1	BP
GO:0006858	extracellular transport	9	1	0.3	0.2658	1	BP
GO:0062033	positive regulation of mitotic sister ch...	9	1	0.3	0.2658	1	BP
GO:0050910	detection of mechanical stimulus involve...	9	1	0.3	0.2658	1	BP
GO:0033120	positive regulation of RNA splicing	9	1	0.3	0.2658	1	BP
GO:0043276	anoikis	9	1	0.3	0.2658	1	BP
GO:0090070	positive regulation of ribosome biogenes...	9	1	0.3	0.2658	1	BP
GO:0090075	relaxation of muscle	9	1	0.3	0.2658	1	BP
GO:0061844	antimicrobial humoral immune response me...	9	1	0.3	0.2658	1	BP
GO:2000380	regulation of mesoderm development	9	1	0.3	0.2658	1	BP
GO:0009056	catabolic process	569	22	19.18	0.267	1	BP
GO:0021537	telencephalon development	78	4	2.63	0.2675	1	BP
GO:0009308	amine metabolic process	30	2	1.01	0.2683	1	BP
GO:0022904	respiratory electron transport chain	30	2	1.01	0.2683	1	BP
GO:1901992	positive regulation of mitotic cell cycl...	30	2	1.01	0.2683	1	BP
GO:0016079	synaptic vesicle exocytosis	30	2	1.01	0.2683	1	BP
GO:0034728	nucleosome organization	30	2	1.01	0.2683	1	BP
GO:0021766	hippocampus development	30	2	1.01	0.2683	1	BP
GO:0051093	negative regulation of developmental pro...	209	9	7.04	0.269	1	BP
GO:0090304	nucleic acid metabolic process	973	36	32.79	0.2719	1	BP
GO:0045165	cell fate commitment	130	6	4.38	0.2723	1	BP
GO:0051276	chromosome organization	319	13	10.75	0.273	1	BP
GO:0051170	import into nucleus	54	3	1.82	0.2733	1	BP
GO:0035295	tube development	320	13	10.79	0.2769	1	BP
GO:0006914	autophagy	131	6	4.42	0.2782	1	BP
GO:0061919	process utilizing autophagic mechanism	131	6	4.42	0.2782	1	BP
GO:0098661	inorganic anion transmembrane transport	31	2	1.04	0.281	1	BP
GO:0008637	apoptotic mitochondrial changes	31	2	1.04	0.281	1	BP
GO:0071805	potassium ion transmembrane transport	31	2	1.04	0.281	1	BP
GO:0051241	negative regulation of multicellular org...	239	10	8.06	0.2822	1	BP
GO:0051961	negative regulation of nervous system de...	106	5	3.57	0.2851	1	BP
GO:0046879	hormone secretion	81	4	2.73	0.2904	1	BP
GO:0045445	myoblast differentiation	10	1	0.34	0.2907	1	BP
GO:0009988	cell-cell recognition	10	1	0.34	0.2907	1	BP
GO:0035904	aorta development	10	1	0.34	0.2907	1	BP
GO:0007218	neuropeptide signaling pathway	10	1	0.34	0.2907	1	BP
GO:0031018	endocrine pancreas development	10	1	0.34	0.2907	1	BP
GO:0021515	cell differentiation in spinal cord	10	1	0.34	0.2907	1	BP
GO:0003352	regulation of cilium movement	10	1	0.34	0.2907	1	BP
GO:0014072	response to isoquinoline alkaloid	10	1	0.34	0.2907	1	BP
GO:0030716	oocyte fate determination	10	1	0.34	0.2907	1	BP
GO:0014017	neuroblast fate commitment	10	1	0.34	0.2907	1	BP
GO:0046039	GTP metabolic process	10	1	0.34	0.2907	1	BP
GO:0036010	protein localization to endosome	10	1	0.34	0.2907	1	BP
GO:0090199	regulation of release of cytochrome c fr...	10	1	0.34	0.2907	1	BP
GO:0032228	regulation of synaptic transmission, GAB...	10	1	0.34	0.2907	1	BP
GO:0071474	cellular hyperosmotic response	10	1	0.34	0.2907	1	BP
GO:0030513	positive regulation of BMP signaling pat...	10	1	0.34	0.2907	1	BP
GO:1901976	regulation of cell cycle checkpoint	10	1	0.34	0.2907	1	BP
GO:0016081	synaptic vesicle docking	10	1	0.34	0.2907	1	BP
GO:0051385	response to mineralocorticoid	10	1	0.34	0.2907	1	BP
GO:0010828	positive regulation of glucose transmemb...	10	1	0.34	0.2907	1	BP
GO:0006750	glutathione biosynthetic process	10	1	0.34	0.2907	1	BP
GO:0000291	nuclear-transcribed mRNA catabolic proce...	10	1	0.34	0.2907	1	BP
GO:0051450	myoblast proliferation	10	1	0.34	0.2907	1	BP
GO:1903317	regulation of protein maturation	10	1	0.34	0.2907	1	BP
GO:0010644	cell communication by electrical couplin...	10	1	0.34	0.2907	1	BP
GO:0007310	oocyte dorsal/ventral axis specification	10	1	0.34	0.2907	1	BP
GO:0015695	organic cation transport	10	1	0.34	0.2907	1	BP
GO:0090069	regulation of ribosome biogenesis	10	1	0.34	0.2907	1	BP
GO:0060191	regulation of lipase activity	10	1	0.34	0.2907	1	BP
GO:0043278	response to morphine	10	1	0.34	0.2907	1	BP
GO:1900181	negative regulation of protein localizat...	10	1	0.34	0.2907	1	BP
GO:0051703	biological process involved in intraspec...	10	1	0.34	0.2907	1	BP
GO:0007059	chromosome segregation	107	5	3.61	0.2917	1	BP
GO:0035148	tube formation	56	3	1.89	0.2919	1	BP
GO:0007605	sensory perception of sound	56	3	1.89	0.2919	1	BP
GO:0051246	regulation of protein metabolic process	549	21	18.5	0.2924	1	BP
GO:0044344	cellular response to fibroblast growth f...	32	2	1.08	0.2937	1	BP
GO:0050805	negative regulation of synaptic transmis...	32	2	1.08	0.2937	1	BP
GO:0032231	regulation of actin filament bundle asse...	32	2	1.08	0.2937	1	BP
GO:0007028	cytoplasm organization	32	2	1.08	0.2937	1	BP
GO:0060606	tube closure	32	2	1.08	0.2937	1	BP
GO:0001843	neural tube closure	32	2	1.08	0.2937	1	BP
GO:0051304	chromosome separation	32	2	1.08	0.2937	1	BP
GO:0071774	response to fibroblast growth factor	32	2	1.08	0.2937	1	BP
GO:0050767	regulation of neurogenesis	242	10	8.16	0.2956	1	BP
GO:0070482	response to oxygen levels	108	5	3.64	0.2984	1	BP
GO:0010604	positive regulation of macromolecule met...	666	25	22.45	0.3008	1	BP
GO:0050769	positive regulation of neurogenesis	135	6	4.55	0.3021	1	BP
GO:0098771	inorganic ion homeostasis	162	7	5.46	0.3033	1	BP
GO:0035239	tube morphogenesis	244	10	8.22	0.3046	1	BP
GO:0016311	dephosphorylation	109	5	3.67	0.3051	1	BP
GO:0050768	negative regulation of neurogenesis	83	4	2.8	0.3058	1	BP
GO:0048639	positive regulation of developmental gro...	83	4	2.8	0.3058	1	BP
GO:0006289	nucleotide-excision repair	33	2	1.11	0.3063	1	BP
GO:0010508	positive regulation of autophagy	33	2	1.11	0.3063	1	BP
GO:0007269	neurotransmitter secretion	58	3	1.95	0.3106	1	BP
GO:0000302	response to reactive oxygen species	58	3	1.95	0.3106	1	BP
GO:0009749	response to glucose	58	3	1.95	0.3106	1	BP
GO:0099643	signal release from synapse	58	3	1.95	0.3106	1	BP
GO:0104004	cellular response to environmental stimu...	84	4	2.83	0.3136	1	BP
GO:1903532	positive regulation of secretion by cell	84	4	2.83	0.3136	1	BP
GO:0048588	developmental cell growth	84	4	2.83	0.3136	1	BP
GO:0010769	regulation of cell morphogenesis involve...	84	4	2.83	0.3136	1	BP
GO:0071214	cellular response to abiotic stimulus	84	4	2.83	0.3136	1	BP
GO:0001501	skeletal system development	84	4	2.83	0.3136	1	BP
GO:1903203	regulation of oxidative stress-induced n...	11	1	0.37	0.3147	1	BP
GO:1903793	positive regulation of anion transport	11	1	0.37	0.3147	1	BP
GO:0046823	negative regulation of nucleocytoplasmic...	11	1	0.37	0.3147	1	BP
GO:0010907	positive regulation of glucose metabolic...	11	1	0.37	0.3147	1	BP
GO:0051590	positive regulation of neurotransmitter ...	11	1	0.37	0.3147	1	BP
GO:0030262	apoptotic nuclear changes	11	1	0.37	0.3147	1	BP
GO:0032922	circadian regulation of gene expression	11	1	0.37	0.3147	1	BP
GO:0042417	dopamine metabolic process	11	1	0.37	0.3147	1	BP
GO:0042149	cellular response to glucose starvation	11	1	0.37	0.3147	1	BP
GO:0030717	oocyte karyosome formation	11	1	0.37	0.3147	1	BP
GO:0014047	glutamate secretion	11	1	0.37	0.3147	1	BP
GO:1902110	positive regulation of mitochondrial mem...	11	1	0.37	0.3147	1	BP
GO:0002687	positive regulation of leukocyte migrati...	11	1	0.37	0.3147	1	BP
GO:1902253	regulation of intrinsic apoptotic signal...	11	1	0.37	0.3147	1	BP
GO:1903651	positive regulation of cytoplasmic trans...	11	1	0.37	0.3147	1	BP
GO:1902235	regulation of endoplasmic reticulum stre...	11	1	0.37	0.3147	1	BP
GO:0033692	cellular polysaccharide biosynthetic pro...	11	1	0.37	0.3147	1	BP
GO:0007501	mesodermal cell fate specification	11	1	0.37	0.3147	1	BP
GO:0001710	mesodermal cell fate commitment	11	1	0.37	0.3147	1	BP
GO:0061988	karyosome formation	11	1	0.37	0.3147	1	BP
GO:0003170	heart valve development	11	1	0.37	0.3147	1	BP
GO:1901343	negative regulation of vasculature devel...	11	1	0.37	0.3147	1	BP
GO:0006277	DNA amplification	11	1	0.37	0.3147	1	BP
GO:0051955	regulation of amino acid transport	11	1	0.37	0.3147	1	BP
GO:1905508	protein localization to microtubule orga...	11	1	0.37	0.3147	1	BP
GO:0009593	detection of chemical stimulus	11	1	0.37	0.3147	1	BP
GO:0034260	negative regulation of GTPase activity	11	1	0.37	0.3147	1	BP
GO:1903998	regulation of eating behavior	11	1	0.37	0.3147	1	BP
GO:0072002	Malpighian tubule development	11	1	0.37	0.3147	1	BP
GO:0036498	IRE1-mediated unfolded protein response	11	1	0.37	0.3147	1	BP
GO:0036475	neuron death in response to oxidative st...	11	1	0.37	0.3147	1	BP
GO:1901222	regulation of NIK/NF-kappaB signaling	11	1	0.37	0.3147	1	BP
GO:1902669	positive regulation of axon guidance	11	1	0.37	0.3147	1	BP
GO:0044818	mitotic G2/M transition checkpoint	11	1	0.37	0.3147	1	BP
GO:0000737	DNA catabolic process, endonucleolytic	11	1	0.37	0.3147	1	BP
GO:1903431	positive regulation of cell maturation	11	1	0.37	0.3147	1	BP
GO:0007307	eggshell chorion gene amplification	11	1	0.37	0.3147	1	BP
GO:0019184	nonribosomal peptide biosynthetic proces...	11	1	0.37	0.3147	1	BP
GO:0044058	regulation of digestive system process	11	1	0.37	0.3147	1	BP
GO:2000369	regulation of clathrin-dependent endocyt...	11	1	0.37	0.3147	1	BP
GO:0071539	protein localization to centrosome	11	1	0.37	0.3147	1	BP
GO:0010629	negative regulation of gene expression	415	16	13.99	0.3183	1	BP
GO:0010171	body morphogenesis	34	2	1.15	0.3189	1	BP
GO:0042752	regulation of circadian rhythm	34	2	1.15	0.3189	1	BP
GO:0001819	positive regulation of cytokine producti...	34	2	1.15	0.3189	1	BP
GO:0043487	regulation of RNA stability	34	2	1.15	0.3189	1	BP
GO:0060348	bone development	34	2	1.15	0.3189	1	BP
GO:0002244	hematopoietic progenitor cell differenti...	34	2	1.15	0.3189	1	BP
GO:0098660	inorganic ion transmembrane transport	165	7	5.56	0.3199	1	BP
GO:0009746	response to hexose	59	3	1.99	0.32	1	BP
GO:0090276	regulation of peptide hormone secretion	59	3	1.99	0.32	1	BP
GO:0007507	heart development	138	6	4.65	0.3202	1	BP
GO:0009914	hormone transport	85	4	2.86	0.3213	1	BP
GO:0016070	RNA metabolic process	847	31	28.55	0.323	1	BP
GO:0048638	regulation of developmental growth	166	7	5.59	0.3255	1	BP
GO:0032269	negative regulation of cellular protein ...	221	9	7.45	0.326	1	BP
GO:0060284	regulation of cell development	277	11	9.34	0.3282	1	BP
GO:0072359	circulatory system development	194	8	6.54	0.3288	1	BP
GO:0031668	cellular response to extracellular stimu...	86	4	2.9	0.3291	1	BP
GO:0043687	post-translational protein modification	86	4	2.9	0.3291	1	BP
GO:0031396	regulation of protein ubiquitination	60	3	2.02	0.3294	1	BP
GO:0001525	angiogenesis	60	3	2.02	0.3294	1	BP
GO:0034284	response to monosaccharide	60	3	2.02	0.3294	1	BP
GO:0009582	detection of abiotic stimulus	60	3	2.02	0.3294	1	BP
GO:0043270	positive regulation of ion transport	60	3	2.02	0.3294	1	BP
GO:0031401	positive regulation of protein modificat...	222	9	7.48	0.3309	1	BP
GO:0045132	meiotic chromosome segregation	35	2	1.18	0.3314	1	BP
GO:0032436	positive regulation of proteasomal ubiqu...	35	2	1.18	0.3314	1	BP
GO:0014020	primary neural tube formation	35	2	1.18	0.3314	1	BP
GO:0035108	limb morphogenesis	35	2	1.18	0.3314	1	BP
GO:0045765	regulation of angiogenesis	35	2	1.18	0.3314	1	BP
GO:0035725	sodium ion transmembrane transport	35	2	1.18	0.3314	1	BP
GO:0031124	mRNA 3'-end processing	35	2	1.18	0.3314	1	BP
GO:0034470	ncRNA processing	113	5	3.81	0.3322	1	BP
GO:0097190	apoptotic signaling pathway	140	6	4.72	0.3324	1	BP
GO:0010468	regulation of gene expression	793	29	26.73	0.3346	1	BP
GO:1900101	regulation of endoplasmic reticulum unfo...	12	1	0.4	0.3379	1	BP
GO:0007271	synaptic transmission, cholinergic	12	1	0.4	0.3379	1	BP
GO:1903779	regulation of cardiac conduction	12	1	0.4	0.3379	1	BP
