GO.ID	Term	Annotated	Significant	Expected	pval_test	pval_adj	ontology
GO:0090505	epiboly involved in wound healing	8	1	0.86	0.59815	1	BP
GO:0030595	leukocyte chemotaxis	8	1	0.86	0.59815	1	BP
GO:0043302	positive regulation of leukocyte degranu...	8	1	0.86	0.59815	1	BP
GO:0043303	mast cell degranulation	8	1	0.86	0.59815	1	BP
GO:0042130	negative regulation of T cell proliferat...	8	1	0.86	0.59815	1	BP
GO:1901616	organic hydroxy compound catabolic proce...	8	1	0.86	0.59815	1	BP
GO:0045070	positive regulation of viral genome repl...	8	1	0.86	0.59815	1	BP
GO:1902803	regulation of synaptic vesicle transport	8	1	0.86	0.59815	1	BP
GO:0002279	mast cell activation involved in immune ...	8	1	0.86	0.59815	1	BP
GO:0035075	response to ecdysone	8	1	0.86	0.59815	1	BP
GO:0030514	negative regulation of BMP signaling pat...	8	1	0.86	0.59815	1	BP
GO:0002200	somatic diversification of immune recept...	8	1	0.86	0.59815	1	BP
GO:1903747	regulation of establishment of protein l...	8	1	0.86	0.59815	1	BP
GO:0071696	ectodermal placode development	8	1	0.86	0.59815	1	BP
GO:0034394	protein localization to cell surface	8	1	0.86	0.59815	1	BP
GO:0044319	wound healing, spreading of cells	8	1	0.86	0.59815	1	BP
GO:0034331	cell junction maintenance	8	1	0.86	0.59815	1	BP
GO:0010644	cell communication by electrical couplin...	8	1	0.86	0.59815	1	BP
GO:0072553	terminal button organization	8	1	0.86	0.59815	1	BP
GO:0002886	regulation of myeloid leukocyte mediated...	8	1	0.86	0.59815	1	BP
GO:0021587	cerebellum morphogenesis	8	1	0.86	0.59815	1	BP
GO:0021515	cell differentiation in spinal cord	8	1	0.86	0.59815	1	BP
GO:1903579	negative regulation of ATP metabolic pro...	8	1	0.86	0.59815	1	BP
GO:0070979	protein K11-linked ubiquitination	8	1	0.86	0.59815	1	BP
GO:0043278	response to morphine	8	1	0.86	0.59815	1	BP
GO:0050961	detection of temperature stimulus involv...	8	1	0.86	0.59815	1	BP
GO:0050965	detection of temperature stimulus involv...	8	1	0.86	0.59815	1	BP
GO:0044409	entry into host	8	1	0.86	0.59815	1	BP
GO:0034405	response to fluid shear stress	8	1	0.86	0.59815	1	BP
GO:0007064	mitotic sister chromatid cohesion	8	1	0.86	0.59815	1	BP
GO:0072662	protein localization to peroxisome	8	1	0.86	0.59815	1	BP
GO:0072663	establishment of protein localization to...	8	1	0.86	0.59815	1	BP
GO:0002532	production of molecular mediator involve...	8	1	0.86	0.59815	1	BP
GO:1904591	positive regulation of protein import	8	1	0.86	0.59815	1	BP
GO:0060042	retina morphogenesis in camera-type eye	8	1	0.86	0.59815	1	BP
GO:0044273	sulfur compound catabolic process	8	1	0.86	0.59815	1	BP
GO:0060004	reflex	8	1	0.86	0.59815	1	BP
GO:0000096	sulfur amino acid metabolic process	8	1	0.86	0.59815	1	BP
GO:0006308	DNA catabolic process	8	1	0.86	0.59815	1	BP
GO:2000181	negative regulation of blood vessel morp...	8	1	0.86	0.59815	1	BP
GO:0022611	dormancy process	8	1	0.86	0.59815	1	BP
GO:0001964	startle response	8	1	0.86	0.59815	1	BP
GO:0006415	translational termination	8	1	0.86	0.59815	1	BP
GO:2000291	regulation of myoblast proliferation	8	1	0.86	0.59815	1	BP
GO:0043516	regulation of DNA damage response, signa...	8	1	0.86	0.59815	1	BP
GO:0033574	response to testosterone	8	1	0.86	0.59815	1	BP
GO:0048008	platelet-derived growth factor receptor ...	8	1	0.86	0.59815	1	BP
GO:0018023	peptidyl-lysine trimethylation	8	1	0.86	0.59815	1	BP
GO:0030002	cellular anion homeostasis	8	1	0.86	0.59815	1	BP
GO:0007303	cytoplasmic transport, nurse cell to ooc...	8	1	0.86	0.59815	1	BP
GO:0016445	somatic diversification of immunoglobuli...	8	1	0.86	0.59815	1	BP
GO:0043628	ncRNA 3'-end processing	8	1	0.86	0.59815	1	BP
GO:0035206	regulation of hemocyte proliferation	8	1	0.86	0.59815	1	BP
GO:0070373	negative regulation of ERK1 and ERK2 cas...	8	1	0.86	0.59815	1	BP
GO:0097484	dendrite extension	8	1	0.86	0.59815	1	BP
GO:2000725	regulation of cardiac muscle cell differ...	8	1	0.86	0.59815	1	BP
GO:0007446	imaginal disc growth	8	1	0.86	0.59815	1	BP
GO:0045742	positive regulation of epidermal growth ...	8	1	0.86	0.59815	1	BP
GO:0032945	negative regulation of mononuclear cell ...	8	1	0.86	0.59815	1	BP
GO:1900273	positive regulation of long-term synapti...	8	1	0.86	0.59815	1	BP
GO:0045838	positive regulation of membrane potentia...	8	1	0.86	0.59815	1	BP
GO:0060191	regulation of lipase activity	8	1	0.86	0.59815	1	BP
GO:0006734	NADH metabolic process	8	1	0.86	0.59815	1	BP
GO:0030320	cellular monovalent inorganic anion home...	8	1	0.86	0.59815	1	BP
GO:0032094	response to food	8	1	0.86	0.59815	1	BP
GO:0030301	cholesterol transport	8	1	0.86	0.59815	1	BP
GO:0042073	intraciliary transport	8	1	0.86	0.59815	1	BP
GO:0045581	negative regulation of T cell differenti...	8	1	0.86	0.59815	1	BP
GO:1901186	positive regulation of ERBB signaling pa...	8	1	0.86	0.59815	1	BP
GO:0007212	dopamine receptor signaling pathway	8	1	0.86	0.59815	1	BP
GO:1902305	regulation of sodium ion transmembrane t...	8	1	0.86	0.59815	1	BP
GO:0030421	defecation	8	1	0.86	0.59815	1	BP
GO:0010464	regulation of mesenchymal cell prolifera...	8	1	0.86	0.59815	1	BP
GO:0010458	exit from mitosis	8	1	0.86	0.59815	1	BP
GO:0009309	amine biosynthetic process	8	1	0.86	0.59815	1	BP
GO:0045620	negative regulation of lymphocyte differ...	8	1	0.86	0.59815	1	BP
GO:0006582	melanin metabolic process	8	1	0.86	0.59815	1	BP
GO:0071168	protein localization to chromatin	8	1	0.86	0.59815	1	BP
GO:0018196	peptidyl-asparagine modification	8	1	0.86	0.59815	1	BP
GO:0050766	positive regulation of phagocytosis	8	1	0.86	0.59815	1	BP
GO:1902175	regulation of oxidative stress-induced i...	8	1	0.86	0.59815	1	BP
GO:0006699	bile acid biosynthetic process	8	1	0.86	0.59815	1	BP
GO:0000245	spliceosomal complex assembly	8	1	0.86	0.59815	1	BP
GO:0071107	response to parathyroid hormone	8	1	0.86	0.59815	1	BP
GO:0030262	apoptotic nuclear changes	8	1	0.86	0.59815	1	BP
GO:0033003	regulation of mast cell activation	8	1	0.86	0.59815	1	BP
GO:0006622	protein targeting to lysosome	8	1	0.86	0.59815	1	BP
GO:0006625	protein targeting to peroxisome	8	1	0.86	0.59815	1	BP
GO:0016525	negative regulation of angiogenesis	8	1	0.86	0.59815	1	BP
GO:1900543	negative regulation of purine nucleotide...	8	1	0.86	0.59815	1	BP
GO:0002312	B cell activation involved in immune res...	8	1	0.86	0.59815	1	BP
GO:0006635	fatty acid beta-oxidation	8	1	0.86	0.59815	1	BP
GO:1903428	positive regulation of reactive oxygen s...	8	1	0.86	0.59815	1	BP
GO:0018279	protein N-linked glycosylation via aspar...	8	1	0.86	0.59815	1	BP
GO:0000737	DNA catabolic process, endonucleolytic	8	1	0.86	0.59815	1	BP
GO:0031128	developmental induction	8	1	0.86	0.59815	1	BP
GO:0002448	mast cell mediated immunity	8	1	0.86	0.59815	1	BP
GO:0010771	negative regulation of cell morphogenesi...	8	1	0.86	0.59815	1	BP
GO:0098815	modulation of excitatory postsynaptic po...	8	1	0.86	0.59815	1	BP
GO:0014072	response to isoquinoline alkaloid	8	1	0.86	0.59815	1	BP
GO:0032459	regulation of protein oligomerization	8	1	0.86	0.59815	1	BP
GO:0055078	sodium ion homeostasis	8	1	0.86	0.59815	1	BP
GO:0045980	negative regulation of nucleotide metabo...	8	1	0.86	0.59815	1	BP
GO:1901570	fatty acid derivative biosynthetic proce...	8	1	0.86	0.59815	1	BP
GO:0035987	endodermal cell differentiation	8	1	0.86	0.59815	1	BP
GO:0045910	negative regulation of DNA recombination	8	1	0.86	0.59815	1	BP
GO:0042401	cellular biogenic amine biosynthetic pro...	8	1	0.86	0.59815	1	BP
GO:0030858	positive regulation of epithelial cell d...	8	1	0.86	0.59815	1	BP
GO:0051898	negative regulation of protein kinase B ...	8	1	0.86	0.59815	1	BP
GO:0070664	negative regulation of leukocyte prolife...	8	1	0.86	0.59815	1	BP
GO:0030001	metal ion transport	127	17	13.65	0.59957	1	BP
GO:0071345	cellular response to cytokine stimulus	106	11	11.39	0.60018	1	BP
GO:0018105	peptidyl-serine phosphorylation	48	5	5.16	0.60089	1	BP
GO:0070588	calcium ion transmembrane transport	48	5	5.16	0.60089	1	BP
GO:0043412	macromolecule modification	599	65	64.39	0.60089	1	BP
GO:1901566	organonitrogen compound biosynthetic pro...	285	32	30.64	0.60168	1	BP
GO:0006996	organelle organization	671	74	72.13	0.60245	1	BP
GO:0099536	synaptic signaling	135	14	14.51	0.60338	1	BP
GO:0061136	regulation of proteasomal protein catabo...	41	8	4.41	0.60439	1	BP
GO:0051224	negative regulation of protein transport	32	6	3.44	0.6083	1	BP
GO:0051049	regulation of transport	296	37	31.82	0.60894	1	BP
GO:0010038	response to metal ion	68	7	7.31	0.60945	1	BP
GO:0030155	regulation of cell adhesion	68	7	7.31	0.60945	1	BP
GO:0070201	regulation of establishment of protein l...	121	15	13.01	0.61009	1	BP
GO:0006464	cellular protein modification process	572	62	61.49	0.61052	1	BP
GO:0036211	protein modification process	572	62	61.49	0.61052	1	BP
GO:0009887	animal organ morphogenesis	250	26	26.87	0.61137	1	BP
GO:0032879	regulation of localization	414	49	44.5	0.61193	1	BP
GO:0044270	cellular nitrogen compound catabolic pro...	78	8	8.38	0.61375	1	BP
GO:0016570	histone modification	78	8	8.38	0.61375	1	BP
GO:0050767	regulation of neurogenesis	184	19	19.78	0.61685	1	BP
GO:0048193	Golgi vesicle transport	79	20	8.49	0.61701	1	BP
GO:0034097	response to cytokine	117	12	12.58	0.61795	1	BP
GO:0043473	pigmentation	39	4	4.19	0.61814	1	BP
GO:0055123	digestive system development	39	4	4.19	0.61814	1	BP
GO:0006997	nucleus organization	29	3	3.12	0.61815	1	BP
GO:0043401	steroid hormone mediated signaling pathw...	29	3	3.12	0.61815	1	BP
GO:1903052	positive regulation of proteolysis invol...	29	3	3.12	0.61815	1	BP
GO:0046887	positive regulation of hormone secretion	29	3	3.12	0.61815	1	BP
GO:0048771	tissue remodeling	29	3	3.12	0.61815	1	BP
GO:1903320	regulation of protein modification by sm...	49	5	5.27	0.61987	1	BP
GO:0018209	peptidyl-serine modification	49	5	5.27	0.61987	1	BP
GO:0006812	cation transport	168	21	18.06	0.62094	1	BP
GO:0001837	epithelial to mesenchymal transition	19	2	2.04	0.62244	1	BP
GO:0010507	negative regulation of autophagy	19	2	2.04	0.62244	1	BP
GO:2001021	negative regulation of response to DNA d...	19	2	2.04	0.62244	1	BP
GO:0051607	defense response to virus	19	2	2.04	0.62244	1	BP
GO:0021545	cranial nerve development	19	2	2.04	0.62244	1	BP
GO:1903578	regulation of ATP metabolic process	19	2	2.04	0.62244	1	BP
GO:0045475	locomotor rhythm	19	2	2.04	0.62244	1	BP
GO:0051928	positive regulation of calcium ion trans...	19	2	2.04	0.62244	1	BP
GO:1905879	regulation of oogenesis	19	2	2.04	0.62244	1	BP
GO:0007315	pole plasm assembly	19	2	2.04	0.62244	1	BP
GO:0045766	positive regulation of angiogenesis	19	2	2.04	0.62244	1	BP
GO:1904018	positive regulation of vasculature devel...	19	2	2.04	0.62244	1	BP
GO:0072329	monocarboxylic acid catabolic process	19	2	2.04	0.62244	1	BP
GO:1903313	positive regulation of mRNA metabolic pr...	19	2	2.04	0.62244	1	BP
GO:0051282	regulation of sequestering of calcium io...	19	2	2.04	0.62244	1	BP
GO:0051283	negative regulation of sequestering of c...	19	2	2.04	0.62244	1	BP
GO:0050866	negative regulation of cell activation	19	2	2.04	0.62244	1	BP
GO:0140546	defense response to symbiont	19	2	2.04	0.62244	1	BP
GO:1903169	regulation of calcium ion transmembrane ...	19	2	2.04	0.62244	1	BP
GO:0005976	polysaccharide metabolic process	19	2	2.04	0.62244	1	BP
GO:0030703	eggshell formation	19	2	2.04	0.62244	1	BP
GO:0032456	endocytic recycling	19	2	2.04	0.62244	1	BP
GO:0043414	macromolecule methylation	59	6	6.34	0.62245	1	BP
GO:0031330	negative regulation of cellular cataboli...	52	9	5.59	0.62281	1	BP
GO:0031401	positive regulation of protein modificat...	156	16	16.77	0.62427	1	BP
GO:0045862	positive regulation of proteolysis	69	7	7.42	0.62547	1	BP
GO:0032869	cellular response to insulin stimulus	54	14	5.8	0.62554	1	BP
GO:0007507	heart development	108	11	11.61	0.6263	1	BP
GO:1903829	positive regulation of protein localizat...	79	8	8.49	0.62872	1	BP
GO:0030900	forebrain development	79	8	8.49	0.62872	1	BP
GO:0051259	protein complex oligomerization	79	8	8.49	0.62872	1	BP
GO:0016477	cell migration	214	22	23	0.63024	1	BP
GO:1904950	negative regulation of establishment of ...	33	6	3.55	0.63195	1	BP
GO:0040008	regulation of growth	176	18	18.92	0.63287	1	BP
GO:0006826	iron ion transport	18	6	1.93	0.63336	1	BP
GO:0019637	organophosphate metabolic process	179	26	19.24	0.63373	1	BP
GO:0071417	cellular response to organonitrogen comp...	117	20	12.58	0.6341	1	BP
GO:0051674	localization of cell	234	24	25.15	0.63863	1	BP
GO:0048870	cell motility	234	24	25.15	0.63863	1	BP
GO:0019722	calcium-mediated signaling	40	4	4.3	0.63869	1	BP
GO:0046474	glycerophospholipid biosynthetic process	40	4	4.3	0.63869	1	BP
GO:0061138	morphogenesis of a branching epithelium	40	4	4.3	0.63869	1	BP
GO:0051260	protein homooligomerization	40	4	4.3	0.63869	1	BP
GO:0070507	regulation of microtubule cytoskeleton o...	40	4	4.3	0.63869	1	BP
GO:0001763	morphogenesis of a branching structure	40	4	4.3	0.63869	1	BP
GO:0035264	multicellular organism growth	60	6	6.45	0.63933	1	BP
GO:0045907	positive regulation of vasoconstriction	9	1	0.97	0.64154	1	BP
GO:0001710	mesodermal cell fate commitment	9	1	0.97	0.64154	1	BP
GO:0061844	antimicrobial humoral immune response me...	9	1	0.97	0.64154	1	BP
GO:0043331	response to dsRNA	9	1	0.97	0.64154	1	BP
GO:0042149	cellular response to glucose starvation	9	1	0.97	0.64154	1	BP
GO:0071599	otic vesicle development	9	1	0.97	0.64154	1	BP
GO:0006921	cellular component disassembly involved ...	9	1	0.97	0.64154	1	BP
GO:0010591	regulation of lamellipodium assembly	9	1	0.97	0.64154	1	BP
GO:0010569	regulation of double-strand break repair...	9	1	0.97	0.64154	1	BP
GO:0042255	ribosome assembly	9	1	0.97	0.64154	1	BP
GO:0003156	regulation of animal organ formation	9	1	0.97	0.64154	1	BP
GO:0008631	intrinsic apoptotic signaling pathway in...	9	1	0.97	0.64154	1	BP
GO:0048661	positive regulation of smooth muscle cel...	9	1	0.97	0.64154	1	BP
GO:0006085	acetyl-CoA biosynthetic process	9	1	0.97	0.64154	1	BP
GO:0010614	negative regulation of cardiac muscle hy...	9	1	0.97	0.64154	1	BP
GO:0036010	protein localization to endosome	9	1	0.97	0.64154	1	BP
GO:0021575	hindbrain morphogenesis	9	1	0.97	0.64154	1	BP
GO:1903555	regulation of tumor necrosis factor supe...	9	1	0.97	0.64154	1	BP
GO:0016048	detection of temperature stimulus	9	1	0.97	0.64154	1	BP
GO:0050951	sensory perception of temperature stimul...	9	1	0.97	0.64154	1	BP
GO:2000369	regulation of clathrin-dependent endocyt...	9	1	0.97	0.64154	1	BP
GO:0032878	regulation of establishment or maintenan...	9	1	0.97	0.64154	1	BP
GO:0002576	platelet degranulation	9	1	0.97	0.64154	1	BP
GO:0021680	cerebellar Purkinje cell layer developme...	9	1	0.97	0.64154	1	BP
GO:0070050	neuron cellular homeostasis	9	1	0.97	0.64154	1	BP
GO:0035307	positive regulation of protein dephospho...	9	1	0.97	0.64154	1	BP
GO:0008053	mitochondrial fusion	9	1	0.97	0.64154	1	BP
GO:0032680	regulation of tumor necrosis factor prod...	9	1	0.97	0.64154	1	BP
GO:0010939	regulation of necrotic cell death	9	1	0.97	0.64154	1	BP
GO:0044793	negative regulation by host of viral pro...	9	1	0.97	0.64154	1	BP
GO:0046329	negative regulation of JNK cascade	9	1	0.97	0.64154	1	BP
GO:0009954	proximal/distal pattern formation	9	1	0.97	0.64154	1	BP
GO:0043574	peroxisomal transport	9	1	0.97	0.64154	1	BP
GO:0097366	response to bronchodilator	9	1	0.97	0.64154	1	BP
GO:0040009	regulation of growth rate	9	1	0.97	0.64154	1	BP
GO:0014741	negative regulation of muscle hypertroph...	9	1	0.97	0.64154	1	BP
GO:0061035	regulation of cartilage development	9	1	0.97	0.64154	1	BP
GO:0007379	segment specification	9	1	0.97	0.64154	1	BP
GO:0007300	ovarian nurse cell to oocyte transport	9	1	0.97	0.64154	1	BP
GO:0014855	striated muscle cell proliferation	9	1	0.97	0.64154	1	BP
GO:0150116	regulation of cell-substrate junction or...	9	1	0.97	0.64154	1	BP
GO:0045724	positive regulation of cilium assembly	9	1	0.97	0.64154	1	BP
GO:0016180	snRNA processing	9	1	0.97	0.64154	1	BP
GO:1901343	negative regulation of vasculature devel...	9	1	0.97	0.64154	1	BP
GO:0035710	CD4-positive, alpha-beta T cell activati...	9	1	0.97	0.64154	1	BP
GO:0019083	viral transcription	9	1	0.97	0.64154	1	BP
GO:0002092	positive regulation of receptor internal...	9	1	0.97	0.64154	1	BP
GO:0045823	positive regulation of heart contraction	9	1	0.97	0.64154	1	BP
GO:0046782	regulation of viral transcription	9	1	0.97	0.64154	1	BP
GO:0010332	response to gamma radiation	9	1	0.97	0.64154	1	BP
GO:0032026	response to magnesium ion	9	1	0.97	0.64154	1	BP
GO:0061462	protein localization to lysosome	9	1	0.97	0.64154	1	BP
GO:0032007	negative regulation of TOR signaling	9	1	0.97	0.64154	1	BP
GO:0051450	myoblast proliferation	9	1	0.97	0.64154	1	BP
GO:0045652	regulation of megakaryocyte differentiat...	9	1	0.97	0.64154	1	BP
GO:0048190	wing disc dorsal/ventral pattern formati...	9	1	0.97	0.64154	1	BP
GO:0090109	regulation of cell-substrate junction as...	9	1	0.97	0.64154	1	BP
GO:1990849	vacuolar localization	9	1	0.97	0.64154	1	BP
GO:0000266	mitochondrial fission	9	1	0.97	0.64154	1	BP
GO:0070734	histone H3-K27 methylation	9	1	0.97	0.64154	1	BP
GO:1902110	positive regulation of mitochondrial mem...	9	1	0.97	0.64154	1	BP
GO:0051145	smooth muscle cell differentiation	9	1	0.97	0.64154	1	BP
GO:0051148	negative regulation of muscle cell diffe...	9	1	0.97	0.64154	1	BP
GO:0050729	positive regulation of inflammatory resp...	9	1	0.97	0.64154	1	BP
GO:0046503	glycerolipid catabolic process	9	1	0.97	0.64154	1	BP
GO:0014911	positive regulation of smooth muscle cel...	9	1	0.97	0.64154	1	BP
GO:0098742	cell-cell adhesion via plasma-membrane a...	9	1	0.97	0.64154	1	BP
GO:0098739	import across plasma membrane	9	1	0.97	0.64154	1	BP
GO:0097529	myeloid leukocyte migration	9	1	0.97	0.64154	1	BP
GO:0007585	respiratory gaseous exchange by respirat...	9	1	0.97	0.64154	1	BP
GO:0046637	regulation of alpha-beta T cell differen...	9	1	0.97	0.64154	1	BP
GO:0007501	mesodermal cell fate specification	9	1	0.97	0.64154	1	BP
GO:0052126	movement in host environment	9	1	0.97	0.64154	1	BP
GO:1902743	regulation of lamellipodium organization	9	1	0.97	0.64154	1	BP
GO:0055013	cardiac muscle cell development	9	1	0.97	0.64154	1	BP
GO:0045920	negative regulation of exocytosis	9	1	0.97	0.64154	1	BP
GO:0032418	lysosome localization	9	1	0.97	0.64154	1	BP
GO:0051703	biological process involved in intraspec...	9	1	0.97	0.64154	1	BP
GO:0045932	negative regulation of muscle contractio...	9	1	0.97	0.64154	1	BP
GO:0030850	prostate gland development	9	1	0.97	0.64154	1	BP
GO:0051893	regulation of focal adhesion assembly	9	1	0.97	0.64154	1	BP
GO:1905475	regulation of protein localization to me...	30	3	3.22	0.64173	1	BP
GO:0010950	positive regulation of endopeptidase act...	30	3	3.22	0.64173	1	BP
GO:0007308	oocyte construction	30	3	3.22	0.64173	1	BP
GO:0007309	oocyte axis specification	30	3	3.22	0.64173	1	BP
GO:0015850	organic hydroxy compound transport	30	3	3.22	0.64173	1	BP
GO:0071326	cellular response to monosaccharide stim...	30	3	3.22	0.64173	1	BP
GO:0007298	border follicle cell migration	30	3	3.22	0.64173	1	BP
GO:0071331	cellular response to hexose stimulus	30	3	3.22	0.64173	1	BP
GO:0071333	cellular response to glucose stimulus	30	3	3.22	0.64173	1	BP
GO:1903322	positive regulation of protein modificat...	30	3	3.22	0.64173	1	BP
GO:0030258	lipid modification	30	3	3.22	0.64173	1	BP
GO:0006606	protein import into nucleus	30	3	3.22	0.64173	1	BP
GO:0042471	ear morphogenesis	30	3	3.22	0.64173	1	BP
GO:0065004	protein-DNA complex assembly	30	3	3.22	0.64173	1	BP
GO:0048469	cell maturation	75	10	8.06	0.64198	1	BP
GO:0042551	neuron maturation	24	5	2.58	0.64337	1	BP
GO:0016322	neuron remodeling	24	5	2.58	0.64337	1	BP
GO:0060271	cilium assembly	80	8	8.6	0.64338	1	BP
GO:0045321	leukocyte activation	158	16	16.98	0.64577	1	BP
GO:0051046	regulation of secretion	129	13	13.87	0.646	1	BP
GO:0044265	cellular macromolecule catabolic process	184	26	19.78	0.64895	1	BP
GO:0034220	ion transmembrane transport	159	20	17.09	0.64936	1	BP
GO:0000278	mitotic cell cycle	197	20	21.18	0.6507	1	BP
GO:0006959	humoral immune response	20	2	2.15	0.65093	1	BP
GO:0016073	snRNA metabolic process	20	2	2.15	0.65093	1	BP
GO:0021536	diencephalon development	20	2	2.15	0.65093	1	BP
GO:0140053	mitochondrial gene expression	20	2	2.15	0.65093	1	BP
GO:0000045	autophagosome assembly	20	2	2.15	0.65093	1	BP
GO:0044728	DNA methylation or demethylation	20	2	2.15	0.65093	1	BP
GO:1903900	regulation of viral life cycle	20	2	2.15	0.65093	1	BP
GO:0007447	imaginal disc pattern formation	20	2	2.15	0.65093	1	BP
GO:0030317	flagellated sperm motility	20	2	2.15	0.65093	1	BP
GO:0061337	cardiac conduction	20	2	2.15	0.65093	1	BP
GO:1904064	positive regulation of cation transmembr...	20	2	2.15	0.65093	1	BP
GO:0097722	sperm motility	20	2	2.15	0.65093	1	BP
GO:0090277	positive regulation of peptide hormone s...	20	2	2.15	0.65093	1	BP
GO:1902117	positive regulation of organelle assembl...	20	2	2.15	0.65093	1	BP
GO:0097553	calcium ion transmembrane import into cy...	20	2	2.15	0.65093	1	BP
GO:0051208	sequestering of calcium ion	20	2	2.15	0.65093	1	BP
GO:0002449	lymphocyte mediated immunity	20	2	2.15	0.65093	1	BP
GO:0070555	response to interleukin-1	20	2	2.15	0.65093	1	BP
GO:0098771	inorganic ion homeostasis	123	17	13.22	0.65389	1	BP
GO:0051240	positive regulation of multicellular org...	255	26	27.41	0.65526	1	BP
GO:0030534	adult behavior	61	6	6.56	0.65576	1	BP
GO:1902903	regulation of supramolecular fiber organ...	61	6	6.56	0.65576	1	BP
GO:0001101	response to acid chemical	61	6	6.56	0.65576	1	BP
GO:1903047	mitotic cell cycle process	159	16	17.09	0.65629	1	BP
GO:0002066	columnar/cuboidal epithelial cell develo...	71	7	7.63	0.65639	1	BP
GO:0021700	developmental maturation	96	12	10.32	0.6565	1	BP
GO:0051924	regulation of calcium ion transport	41	4	4.41	0.65852	1	BP
GO:0044843	cell cycle G1/S phase transition	41	4	4.41	0.65852	1	BP
GO:0008593	regulation of Notch signaling pathway	41	4	4.41	0.65852	1	BP
GO:0051234	establishment of localization	748	92	80.41	0.66112	1	BP
GO:0097435	supramolecular fiber organization	101	10	10.86	0.66154	1	BP
GO:0010975	regulation of neuron projection developm...	111	11	11.93	0.66383	1	BP
GO:0042113	B cell activation	31	3	3.33	0.66427	1	BP
GO:0021987	cerebral cortex development	31	3	3.33	0.66427	1	BP
GO:0060485	mesenchyme development	31	3	3.33	0.66427	1	BP
GO:0071322	cellular response to carbohydrate stimul...	31	3	3.33	0.66427	1	BP
GO:1903364	positive regulation of cellular protein ...	31	3	3.33	0.66427	1	BP
GO:0050792	regulation of viral process	31	3	3.33	0.66427	1	BP
GO:0120035	regulation of plasma membrane bounded ce...	141	14	15.16	0.67144	1	BP
GO:0031344	regulation of cell projection organizati...	141	14	15.16	0.67144	1	BP
GO:0044782	cilium organization	82	8	8.81	0.6717	1	BP
GO:0099177	regulation of trans-synaptic signaling	82	8	8.81	0.6717	1	BP
GO:0050804	modulation of chemical synaptic transmis...	82	8	8.81	0.6717	1	BP
GO:0001701	in utero embryonic development	62	6	6.66	0.67173	1	BP
GO:0032259	methylation	62	6	6.66	0.67173	1	BP
GO:0043687	post-translational protein modification	62	6	6.66	0.67173	1	BP
GO:0033036	macromolecule localization	485	55	52.14	0.67178	1	BP
GO:0090317	negative regulation of intracellular pro...	13	4	1.4	0.67491	1	BP
GO:0035148	tube formation	42	4	4.51	0.6776	1	BP
GO:0040014	regulation of multicellular organism gro...	42	4	4.51	0.6776	1	BP
GO:1904062	regulation of cation transmembrane trans...	42	4	4.51	0.6776	1	BP
GO:0010594	regulation of endothelial cell migration	21	2	2.26	0.6777	1	BP
GO:0060993	kidney morphogenesis	21	2	2.26	0.6777	1	BP
GO:1901991	negative regulation of mitotic cell cycl...	21	2	2.26	0.6777	1	BP
GO:0043244	regulation of protein-containing complex...	21	2	2.26	0.6777	1	BP
GO:0050921	positive regulation of chemotaxis	21	2	2.26	0.6777	1	BP
GO:1901989	positive regulation of cell cycle phase ...	21	2	2.26	0.6777	1	BP
GO:0008038	neuron recognition	21	2	2.26	0.6777	1	BP
GO:0061013	regulation of mRNA catabolic process	21	2	2.26	0.6777	1	BP
GO:0007422	peripheral nervous system development	21	2	2.26	0.6777	1	BP
GO:0019079	viral genome replication	21	2	2.26	0.6777	1	BP
GO:0045619	regulation of lymphocyte differentiation	21	2	2.26	0.6777	1	BP
GO:0050731	positive regulation of peptidyl-tyrosine...	21	2	2.26	0.6777	1	BP
GO:1905037	autophagosome organization	21	2	2.26	0.6777	1	BP
GO:0071242	cellular response to ammonium ion	21	2	2.26	0.6777	1	BP
GO:0032355	response to estradiol	21	2	2.26	0.6777	1	BP
GO:0051896	regulation of protein kinase B signaling	21	2	2.26	0.6777	1	BP
GO:0008542	visual learning	10	1	1.07	0.68026	1	BP
GO:0090504	epiboly	10	1	1.07	0.68026	1	BP
GO:0043300	regulation of leukocyte degranulation	10	1	1.07	0.68026	1	BP
GO:0006972	hyperosmotic response	10	1	1.07	0.68026	1	BP
GO:1903793	positive regulation of anion transport	10	1	1.07	0.68026	1	BP
GO:1902808	positive regulation of cell cycle G1/S p...	10	1	1.07	0.68026	1	BP
GO:0051590	positive regulation of neurotransmitter ...	10	1	1.07	0.68026	1	BP
GO:0043486	histone exchange	10	1	1.07	0.68026	1	BP
GO:0048538	thymus development	10	1	1.07	0.68026	1	BP
GO:0003170	heart valve development	10	1	1.07	0.68026	1	BP
GO:0001556	oocyte maturation	10	1	1.07	0.68026	1	BP
GO:0032204	regulation of telomere maintenance	10	1	1.07	0.68026	1	BP
GO:0061647	histone H3-K9 modification	10	1	1.07	0.68026	1	BP
GO:1903523	negative regulation of blood circulation	10	1	1.07	0.68026	1	BP
GO:0060972	left/right pattern formation	10	1	1.07	0.68026	1	BP
GO:0007026	negative regulation of microtubule depol...	10	1	1.07	0.68026	1	BP
GO:0007031	peroxisome organization	10	1	1.07	0.68026	1	BP
GO:0097006	regulation of plasma lipoprotein particl...	10	1	1.07	0.68026	1	BP
GO:1905207	regulation of cardiocyte differentiation	10	1	1.07	0.68026	1	BP
GO:0034103	regulation of tissue remodeling	10	1	1.07	0.68026	1	BP
GO:0042509	regulation of tyrosine phosphorylation o...	10	1	1.07	0.68026	1	BP
GO:0034260	negative regulation of GTPase activity	10	1	1.07	0.68026	1	BP
GO:0048925	lateral line system development	10	1	1.07	0.68026	1	BP
GO:0010960	magnesium ion homeostasis	10	1	1.07	0.68026	1	BP
GO:0006334	nucleosome assembly	10	1	1.07	0.68026	1	BP
GO:1905898	positive regulation of response to endop...	10	1	1.07	0.68026	1	BP
