GO.ID	Term	Annotated	Significant	Expected	pval_test	pval_adj	ontology
GO:0044282	small molecule catabolic process	94	4	3.17	0.3915	1	BP
GO:0035637	multicellular organismal signaling	39	5	1.31	0.3917	1	BP
GO:0071236	cellular response to antibiotic	40	2	1.35	0.3931	1	BP
GO:1901136	carbohydrate derivative catabolic proces...	40	2	1.35	0.3931	1	BP
GO:0016485	protein processing	40	2	1.35	0.3931	1	BP
GO:0022604	regulation of cell morphogenesis	122	5	4.11	0.3937	1	BP
GO:0009161	ribonucleoside monophosphate metabolic p...	67	3	2.26	0.3948	1	BP
GO:0006629	lipid metabolic process	264	10	8.9	0.3978	1	BP
GO:0097305	response to alcohol	95	4	3.2	0.3993	1	BP
GO:0036293	response to decreased oxygen levels	95	4	3.2	0.3993	1	BP
GO:0007423	sensory organ development	236	9	7.95	0.4003	1	BP
GO:1901701	cellular response to oxygen-containing c...	236	9	7.95	0.4003	1	BP
GO:0048608	reproductive structure development	123	5	4.15	0.4005	1	BP
GO:0006468	protein phosphorylation	351	13	11.83	0.4024	1	BP
GO:0001776	leukocyte homeostasis	15	1	0.51	0.4029	1	BP
GO:0015914	phospholipid transport	15	1	0.51	0.4029	1	BP
GO:0071230	cellular response to amino acid stimulus	15	1	0.51	0.4029	1	BP
GO:0045187	regulation of circadian sleep/wake cycle...	15	1	0.51	0.4029	1	BP
GO:0043457	regulation of cellular respiration	15	1	0.51	0.4029	1	BP
GO:0038094	Fc-gamma receptor signaling pathway	15	1	0.51	0.4029	1	BP
GO:0038096	Fc-gamma receptor signaling pathway invo...	15	1	0.51	0.4029	1	BP
GO:0002433	immune response-regulating cell surface ...	15	1	0.51	0.4029	1	BP
GO:0032410	negative regulation of transporter activ...	15	1	0.51	0.4029	1	BP
GO:0032272	negative regulation of protein polymeriz...	15	1	0.51	0.4029	1	BP
GO:0061180	mammary gland epithelium development	15	1	0.51	0.4029	1	BP
GO:0071674	mononuclear cell migration	15	1	0.51	0.4029	1	BP
GO:0014015	positive regulation of gliogenesis	15	1	0.51	0.4029	1	BP
GO:1900077	negative regulation of cellular response...	15	1	0.51	0.4029	1	BP
GO:0014009	glial cell proliferation	15	1	0.51	0.4029	1	BP
GO:0048846	axon extension involved in axon guidance	15	1	0.51	0.4029	1	BP
GO:0050850	positive regulation of calcium-mediated ...	15	1	0.51	0.4029	1	BP
GO:0070265	necrotic cell death	15	1	0.51	0.4029	1	BP
GO:0006940	regulation of smooth muscle contraction	15	1	0.51	0.4029	1	BP
GO:0007520	myoblast fusion	15	1	0.51	0.4029	1	BP
GO:0010591	regulation of lamellipodium assembly	15	1	0.51	0.4029	1	BP
GO:0007530	sex determination	15	1	0.51	0.4029	1	BP
GO:0050802	circadian sleep/wake cycle, sleep	15	1	0.51	0.4029	1	BP
GO:0048641	regulation of skeletal muscle tissue dev...	15	1	0.51	0.4029	1	BP
GO:0022410	circadian sleep/wake cycle process	15	1	0.51	0.4029	1	BP
GO:1900368	regulation of post-transcriptional gene ...	15	1	0.51	0.4029	1	BP
GO:0046717	acid secretion	15	1	0.51	0.4029	1	BP
GO:0099175	regulation of postsynapse organization	15	1	0.51	0.4029	1	BP
GO:0032675	regulation of interleukin-6 production	15	1	0.51	0.4029	1	BP
GO:0032635	interleukin-6 production	15	1	0.51	0.4029	1	BP
GO:0044788	modulation by host of viral process	15	1	0.51	0.4029	1	BP
GO:0033209	tumor necrosis factor-mediated signaling...	15	1	0.51	0.4029	1	BP
GO:0048041	focal adhesion assembly	15	1	0.51	0.4029	1	BP
GO:1902284	neuron projection extension involved in ...	15	1	0.51	0.4029	1	BP
GO:0060122	inner ear receptor cell stereocilium org...	15	1	0.51	0.4029	1	BP
GO:0060147	regulation of post-transcriptional gene ...	15	1	0.51	0.4029	1	BP
GO:0034308	primary alcohol metabolic process	15	1	0.51	0.4029	1	BP
GO:0062207	regulation of pattern recognition recept...	15	1	0.51	0.4029	1	BP
GO:0006296	nucleotide-excision repair, DNA incision...	15	1	0.51	0.4029	1	BP
GO:0032008	positive regulation of TOR signaling	15	1	0.51	0.4029	1	BP
GO:0046627	negative regulation of insulin receptor ...	15	1	0.51	0.4029	1	BP
GO:0006220	pyrimidine nucleotide metabolic process	15	1	0.51	0.4029	1	BP
GO:0055021	regulation of cardiac muscle tissue grow...	15	1	0.51	0.4029	1	BP
GO:0032869	cellular response to insulin stimulus	68	3	2.29	0.404	1	BP
GO:0043523	regulation of neuron apoptotic process	68	3	2.29	0.404	1	BP
GO:0016573	histone acetylation	41	2	1.38	0.4051	1	BP
GO:0030308	negative regulation of cell growth	41	2	1.38	0.4051	1	BP
GO:0051099	positive regulation of binding	41	2	1.38	0.4051	1	BP
GO:0031644	regulation of nervous system process	41	2	1.38	0.4051	1	BP
GO:0030278	regulation of ossification	41	2	1.38	0.4051	1	BP
GO:2000243	positive regulation of reproductive proc...	41	2	1.38	0.4051	1	BP
GO:0008286	insulin receptor signaling pathway	41	2	1.38	0.4051	1	BP
GO:0042303	molting cycle	41	2	1.38	0.4051	1	BP
GO:0048736	appendage development	124	5	4.18	0.4074	1	BP
GO:0033036	macromolecule localization	690	26	23.26	0.4093	1	BP
GO:0048589	developmental growth	267	10	9	0.4121	1	BP
GO:0042330	taxis	153	6	5.16	0.4126	1	BP
GO:0044839	cell cycle G2/M phase transition	69	3	2.33	0.4132	1	BP
GO:0051338	regulation of transferase activity	210	8	7.08	0.4133	1	BP
GO:0045321	leukocyte activation	210	8	7.08	0.4133	1	BP
GO:0061458	reproductive system development	125	5	4.21	0.4142	1	BP
GO:0007163	establishment or maintenance of cell pol...	97	4	3.27	0.4148	1	BP
GO:0001568	blood vessel development	97	4	3.27	0.4148	1	BP
GO:1901214	regulation of neuron death	97	4	3.27	0.4148	1	BP
GO:0071229	cellular response to acid chemical	42	2	1.42	0.417	1	BP
GO:0007162	negative regulation of cell adhesion	42	2	1.42	0.417	1	BP
GO:0018393	internal peptidyl-lysine acetylation	42	2	1.42	0.417	1	BP
GO:0035315	hair cell differentiation	42	2	1.42	0.417	1	BP
GO:0050773	regulation of dendrite development	42	2	1.42	0.417	1	BP
GO:0044057	regulation of system process	125	8	4.21	0.4181	1	BP
GO:0015833	peptide transport	413	15	13.92	0.4196	1	BP
GO:0044262	cellular carbohydrate metabolic process	70	3	2.36	0.4224	1	BP
GO:0009887	animal organ morphogenesis	327	12	11.02	0.423	1	BP
GO:0051897	positive regulation of protein kinase B ...	16	1	0.54	0.4231	1	BP
GO:0010463	mesenchymal cell proliferation	16	1	0.54	0.4231	1	BP
GO:0034766	negative regulation of ion transmembrane...	16	1	0.54	0.4231	1	BP
GO:0016601	Rac protein signal transduction	16	1	0.54	0.4231	1	BP
GO:0032465	regulation of cytokinesis	16	1	0.54	0.4231	1	BP
GO:1903202	negative regulation of oxidative stress-...	16	1	0.54	0.4231	1	BP
GO:0033077	T cell differentiation in thymus	16	1	0.54	0.4231	1	BP
GO:0048278	vesicle docking	16	1	0.54	0.4231	1	BP
GO:0007229	integrin-mediated signaling pathway	16	1	0.54	0.4231	1	BP
GO:0035317	imaginal disc-derived wing hair organiza...	16	1	0.54	0.4231	1	BP
GO:0030148	sphingolipid biosynthetic process	16	1	0.54	0.4231	1	BP
GO:0014031	mesenchymal cell development	16	1	0.54	0.4231	1	BP
GO:0014032	neural crest cell development	16	1	0.54	0.4231	1	BP
GO:0060998	regulation of dendritic spine developmen...	16	1	0.54	0.4231	1	BP
GO:0051930	regulation of sensory perception of pain	16	1	0.54	0.4231	1	BP
GO:0035162	embryonic hemopoiesis	16	1	0.54	0.4231	1	BP
GO:0006904	vesicle docking involved in exocytosis	16	1	0.54	0.4231	1	BP
GO:0045669	positive regulation of osteoblast differ...	16	1	0.54	0.4231	1	BP
GO:0048679	regulation of axon regeneration	16	1	0.54	0.4231	1	BP
GO:0002698	negative regulation of immune effector p...	16	1	0.54	0.4231	1	BP
GO:0035214	eye-antennal disc development	16	1	0.54	0.4231	1	BP
GO:0019985	translesion synthesis	16	1	0.54	0.4231	1	BP
GO:0008206	bile acid metabolic process	16	1	0.54	0.4231	1	BP
GO:0006356	regulation of transcription by RNA polym...	16	1	0.54	0.4231	1	BP
GO:0033138	positive regulation of peptidyl-serine p...	16	1	0.54	0.4231	1	BP
GO:0070570	regulation of neuron projection regenera...	16	1	0.54	0.4231	1	BP
GO:0007031	peroxisome organization	16	1	0.54	0.4231	1	BP
GO:1900408	negative regulation of cellular response...	16	1	0.54	0.4231	1	BP
GO:0043050	pharyngeal pumping	16	1	0.54	0.4231	1	BP
GO:0016242	negative regulation of macroautophagy	16	1	0.54	0.4231	1	BP
GO:2000648	positive regulation of stem cell prolife...	16	1	0.54	0.4231	1	BP
GO:0006749	glutathione metabolic process	16	1	0.54	0.4231	1	BP
GO:0035295	tube development	320	14	10.79	0.4239	1	BP
GO:0097190	apoptotic signaling pathway	140	9	4.72	0.4249	1	BP
GO:0002064	epithelial cell development	127	5	4.28	0.4278	1	BP
GO:0007424	open tracheal system development	43	2	1.45	0.4288	1	BP
GO:0001889	liver development	43	2	1.45	0.4288	1	BP
GO:0007173	epidermal growth factor receptor signali...	43	2	1.45	0.4288	1	BP
GO:0018394	peptidyl-lysine acetylation	43	2	1.45	0.4288	1	BP
GO:0016051	carbohydrate biosynthetic process	43	2	1.45	0.4288	1	BP
GO:0043524	negative regulation of neuron apoptotic ...	43	2	1.45	0.4288	1	BP
GO:0035296	regulation of tube diameter	43	2	1.45	0.4288	1	BP
GO:0015850	organic hydroxy compound transport	43	2	1.45	0.4288	1	BP
GO:0046890	regulation of lipid biosynthetic process	43	2	1.45	0.4288	1	BP
GO:0002682	regulation of immune system process	213	8	7.18	0.4292	1	BP
GO:0016055	Wnt signaling pathway	99	4	3.34	0.4303	1	BP
GO:1901653	cellular response to peptide	99	4	3.34	0.4303	1	BP
GO:0071417	cellular response to organonitrogen comp...	156	6	5.26	0.4311	1	BP
GO:0009123	nucleoside monophosphate metabolic proce...	71	3	2.39	0.4315	1	BP
GO:0006457	protein folding	71	3	2.39	0.4315	1	BP
GO:0045930	negative regulation of mitotic cell cycl...	71	3	2.39	0.4315	1	BP
GO:0000082	G1/S transition of mitotic cell cycle	71	3	2.39	0.4315	1	BP
GO:0000904	cell morphogenesis involved in different...	243	9	8.19	0.4354	1	BP
GO:0065008	regulation of biological quality	822	32	27.7	0.4366	1	BP
GO:0001736	establishment of planar polarity	44	2	1.48	0.4405	1	BP
GO:0045861	negative regulation of proteolysis	44	2	1.48	0.4405	1	BP
GO:0032271	regulation of protein polymerization	44	2	1.48	0.4405	1	BP
GO:0000281	mitotic cytokinesis	44	2	1.48	0.4405	1	BP
GO:0007519	skeletal muscle tissue development	44	2	1.48	0.4405	1	BP
GO:0007635	chemosensory behavior	44	2	1.48	0.4405	1	BP
GO:0031929	TOR signaling	44	2	1.48	0.4405	1	BP
GO:0009411	response to UV	44	2	1.48	0.4405	1	BP
GO:0061008	hepaticobiliary system development	44	2	1.48	0.4405	1	BP
GO:0009792	embryo development ending in birth or eg...	273	10	9.2	0.4406	1	BP
GO:0021954	central nervous system neuron developmen...	17	1	0.57	0.4427	1	BP
GO:0055007	cardiac muscle cell differentiation	17	1	0.57	0.4427	1	BP
GO:0051899	membrane depolarization	17	1	0.57	0.4427	1	BP
GO:0033683	nucleotide-excision repair, DNA incision	17	1	0.57	0.4427	1	BP
GO:0016574	histone ubiquitination	17	1	0.57	0.4427	1	BP
GO:0019228	neuronal action potential	17	1	0.57	0.4427	1	BP
GO:0070988	demethylation	17	1	0.57	0.4427	1	BP
GO:0086003	cardiac muscle cell contraction	17	1	0.57	0.4427	1	BP
GO:0002431	Fc receptor mediated stimulatory signali...	17	1	0.57	0.4427	1	BP
GO:0001658	branching involved in ureteric bud morph...	17	1	0.57	0.4427	1	BP
GO:0042659	regulation of cell fate specification	17	1	0.57	0.4427	1	BP
GO:0035329	hippo signaling	17	1	0.57	0.4427	1	BP
GO:0045879	negative regulation of smoothened signal...	17	1	0.57	0.4427	1	BP
GO:0035316	non-sensory hair organization	17	1	0.57	0.4427	1	BP
GO:0010824	regulation of centrosome duplication	17	1	0.57	0.4427	1	BP
GO:0006984	ER-nucleus signaling pathway	17	1	0.57	0.4427	1	BP
GO:2000178	negative regulation of neural precursor ...	17	1	0.57	0.4427	1	BP
GO:0001938	positive regulation of endothelial cell ...	17	1	0.57	0.4427	1	BP
GO:0006305	DNA alkylation	17	1	0.57	0.4427	1	BP
GO:0006306	DNA methylation	17	1	0.57	0.4427	1	BP
GO:0051481	negative regulation of cytosolic calcium...	17	1	0.57	0.4427	1	BP
GO:0002062	chondrocyte differentiation	17	1	0.57	0.4427	1	BP
GO:1903902	positive regulation of viral life cycle	17	1	0.57	0.4427	1	BP
GO:0019320	hexose catabolic process	17	1	0.57	0.4427	1	BP
GO:0036445	neuronal stem cell division	17	1	0.57	0.4427	1	BP
GO:0042129	regulation of T cell proliferation	17	1	0.57	0.4427	1	BP
GO:0043966	histone H3 acetylation	17	1	0.57	0.4427	1	BP
GO:1903391	regulation of adherens junction organiza...	17	1	0.57	0.4427	1	BP
GO:0000079	regulation of cyclin-dependent protein s...	17	1	0.57	0.4427	1	BP
GO:0046631	alpha-beta T cell activation	17	1	0.57	0.4427	1	BP
GO:1902743	regulation of lamellipodium organization	17	1	0.57	0.4427	1	BP
GO:0060795	cell fate commitment involved in formati...	17	1	0.57	0.4427	1	BP
GO:0055057	neuroblast division	17	1	0.57	0.4427	1	BP
GO:1901019	regulation of calcium ion transmembrane ...	17	1	0.57	0.4427	1	BP
GO:0022603	regulation of anatomical structure morph...	216	8	7.28	0.4451	1	BP
GO:0050804	modulation of chemical synaptic transmis...	101	4	3.4	0.4456	1	BP
GO:0099177	regulation of trans-synaptic signaling	101	4	3.4	0.4456	1	BP
GO:0071345	cellular response to cytokine stimulus	151	9	5.09	0.4471	1	BP
GO:0006820	anion transport	130	5	4.38	0.4482	1	BP
GO:1901700	response to oxygen-containing compound	362	13	12.2	0.4486	1	BP
GO:0010562	positive regulation of phosphorus metabo...	188	7	6.34	0.4502	1	BP
GO:0045937	positive regulation of phosphate metabol...	188	7	6.34	0.4502	1	BP
GO:0051716	cellular response to stimulus	1223	49	41.22	0.4507	1	BP
GO:0045184	establishment of protein localization	434	17	14.63	0.4519	1	BP
GO:0006814	sodium ion transport	45	2	1.52	0.4521	1	BP
GO:0007164	establishment of tissue polarity	45	2	1.52	0.4521	1	BP
GO:0032412	regulation of ion transmembrane transpor...	45	2	1.52	0.4521	1	BP
GO:0030336	negative regulation of cell migration	45	2	1.52	0.4521	1	BP
GO:0048705	skeletal system morphogenesis	45	2	1.52	0.4521	1	BP
GO:0022898	regulation of transmembrane transporter ...	45	2	1.52	0.4521	1	BP
GO:0009266	response to temperature stimulus	102	4	3.44	0.4532	1	BP
GO:0051347	positive regulation of transferase activ...	131	5	4.42	0.4549	1	BP
GO:0040008	regulation of growth	247	9	8.32	0.4554	1	BP
GO:0007409	axonogenesis	160	6	5.39	0.4557	1	BP
GO:0014070	response to organic cyclic compound	218	8	7.35	0.4557	1	BP
GO:0002791	regulation of peptide secretion	103	4	3.47	0.4608	1	BP
GO:0198738	cell-cell signaling by wnt	103	4	3.47	0.4608	1	BP
GO:0001775	cell activation	219	8	7.38	0.461	1	BP
GO:1904029	regulation of cyclin-dependent protein k...	18	1	0.61	0.4616	1	BP
GO:1903432	regulation of TORC1 signaling	18	1	0.61	0.4616	1	BP
GO:1904019	epithelial cell apoptotic process	18	1	0.61	0.4616	1	BP
GO:1902807	negative regulation of cell cycle G1/S p...	18	1	0.61	0.4616	1	BP
GO:0061951	establishment of protein localization to...	18	1	0.61	0.4616	1	BP
GO:0007492	endoderm development	18	1	0.61	0.4616	1	BP
GO:0006826	iron ion transport	18	1	0.61	0.4616	1	BP
GO:0001892	embryonic placenta development	18	1	0.61	0.4616	1	BP
GO:0070936	protein K48-linked ubiquitination	18	1	0.61	0.4616	1	BP
GO:1903725	regulation of phospholipid metabolic pro...	18	1	0.61	0.4616	1	BP
GO:0070303	negative regulation of stress-activated ...	18	1	0.61	0.4616	1	BP
GO:0046365	monosaccharide catabolic process	18	1	0.61	0.4616	1	BP
GO:0032210	regulation of telomere maintenance via t...	18	1	0.61	0.4616	1	BP
GO:0014033	neural crest cell differentiation	18	1	0.61	0.4616	1	BP
GO:0048864	stem cell development	18	1	0.61	0.4616	1	BP
GO:0051931	regulation of sensory perception	18	1	0.61	0.4616	1	BP
GO:0014910	regulation of smooth muscle cell migrati...	18	1	0.61	0.4616	1	BP
GO:2000144	positive regulation of DNA-templated tra...	18	1	0.61	0.4616	1	BP
GO:2000134	negative regulation of G1/S transition o...	18	1	0.61	0.4616	1	BP
GO:0014909	smooth muscle cell migration	18	1	0.61	0.4616	1	BP
GO:0032873	negative regulation of stress-activated ...	18	1	0.61	0.4616	1	BP
GO:0030718	germ-line stem cell population maintenan...	18	1	0.61	0.4616	1	BP
GO:0010660	regulation of muscle cell apoptotic proc...	18	1	0.61	0.4616	1	BP
GO:0043627	response to estrogen	18	1	0.61	0.4616	1	BP
GO:0006301	postreplication repair	18	1	0.61	0.4616	1	BP
GO:0009950	dorsal/ventral axis specification	18	1	0.61	0.4616	1	BP
GO:0030537	larval behavior	18	1	0.61	0.4616	1	BP
GO:0042306	regulation of protein import into nucleu...	18	1	0.61	0.4616	1	BP
GO:0060420	regulation of heart growth	18	1	0.61	0.4616	1	BP
GO:0030500	regulation of bone mineralization	18	1	0.61	0.4616	1	BP
GO:1902107	positive regulation of leukocyte differe...	18	1	0.61	0.4616	1	BP
GO:0000096	sulfur amino acid metabolic process	18	1	0.61	0.4616	1	BP
GO:0043967	histone H4 acetylation	18	1	0.61	0.4616	1	BP
GO:0090102	cochlea development	18	1	0.61	0.4616	1	BP
GO:0034198	cellular response to amino acid starvati...	18	1	0.61	0.4616	1	BP
GO:0043086	negative regulation of catalytic activit...	132	5	4.45	0.4616	1	BP
GO:0043009	chordate embryonic development	161	6	5.43	0.4618	1	BP
GO:0040011	locomotion	453	16	15.27	0.4619	1	BP
GO:0015031	protein transport	407	16	13.72	0.4632	1	BP
GO:0032940	secretion by cell	307	11	10.35	0.4634	1	BP
GO:0010770	positive regulation of cell morphogenesi...	46	2	1.55	0.4635	1	BP
GO:0050714	positive regulation of protein secretion	46	2	1.55	0.4635	1	BP
GO:0038127	ERBB signaling pathway	46	2	1.55	0.4635	1	BP
GO:0051495	positive regulation of cytoskeleton orga...	46	2	1.55	0.4635	1	BP
GO:0006475	internal protein amino acid acetylation	46	2	1.55	0.4635	1	BP
GO:0002252	immune effector process	191	7	6.44	0.4671	1	BP
GO:0030855	epithelial cell differentiation	191	7	6.44	0.4671	1	BP
GO:0007476	imaginal disc-derived wing morphogenesis	75	3	2.53	0.4674	1	BP
GO:0016050	vesicle organization	104	4	3.51	0.4684	1	BP
GO:0008015	blood circulation	102	7	3.44	0.4695	1	BP
GO:0006928	movement of cell or subcellular componen...	455	16	15.34	0.4695	1	BP
GO:0048667	cell morphogenesis involved in neuron di...	221	8	7.45	0.4716	1	BP
GO:0060341	regulation of cellular localization	230	10	7.75	0.4735	1	BP
GO:0007568	aging	163	6	5.49	0.4739	1	BP
GO:0048731	system development	1016	35	34.24	0.4741	1	BP
GO:0022612	gland morphogenesis	47	2	1.58	0.4748	1	BP
GO:0006606	protein import into nucleus	47	2	1.58	0.4748	1	BP
GO:0007030	Golgi organization	47	2	1.58	0.4748	1	BP
GO:0044706	multi-multicellular organism process	47	2	1.58	0.4748	1	BP
GO:0007472	wing disc morphogenesis	76	3	2.56	0.4762	1	BP
GO:0032868	response to insulin	76	3	2.56	0.4762	1	BP
GO:0032956	regulation of actin cytoskeleton organiz...	76	3	2.56	0.4762	1	BP
GO:0003013	circulatory system process	103	7	3.47	0.478	1	BP
GO:0042749	regulation of circadian sleep/wake cycle	19	1	0.64	0.4798	1	BP
GO:0048488	synaptic vesicle endocytosis	19	1	0.64	0.4798	1	BP
GO:1990928	response to amino acid starvation	19	1	0.64	0.4798	1	BP
GO:0010453	regulation of cell fate commitment	19	1	0.64	0.4798	1	BP
GO:0120192	tight junction assembly	19	1	0.64	0.4798	1	BP
GO:0120193	tight junction organization	19	1	0.64	0.4798	1	BP
GO:1904356	regulation of telomere maintenance via t...	19	1	0.64	0.4798	1	BP
GO:0001656	metanephros development	19	1	0.64	0.4798	1	BP
GO:0043266	regulation of potassium ion transport	19	1	0.64	0.4798	1	BP
GO:0042632	cholesterol homeostasis	19	1	0.64	0.4798	1	BP
GO:0008355	olfactory learning	19	1	0.64	0.4798	1	BP
GO:0019674	NAD metabolic process	19	1	0.64	0.4798	1	BP
GO:0140238	presynaptic endocytosis	19	1	0.64	0.4798	1	BP
GO:0030216	keratinocyte differentiation	19	1	0.64	0.4798	1	BP
GO:0060966	regulation of gene silencing by RNA	19	1	0.64	0.4798	1	BP
GO:0050810	regulation of steroid biosynthetic proce...	19	1	0.64	0.4798	1	BP
GO:0035195	miRNA-mediated gene silencing	19	1	0.64	0.4798	1	BP
GO:0003407	neural retina development	19	1	0.64	0.4798	1	BP
GO:0007614	short-term memory	19	1	0.64	0.4798	1	BP
GO:0072527	pyrimidine-containing compound metabolic...	19	1	0.64	0.4798	1	BP
GO:0045069	regulation of viral genome replication	19	1	0.64	0.4798	1	BP
GO:0033260	nuclear DNA replication	19	1	0.64	0.4798	1	BP
GO:0051489	regulation of filopodium assembly	19	1	0.64	0.4798	1	BP
GO:0061512	protein localization to cilium	19	1	0.64	0.4798	1	BP
GO:0046825	regulation of protein export from nucleu...	19	1	0.64	0.4798	1	BP
GO:0042446	hormone biosynthetic process	19	1	0.64	0.4798	1	BP
GO:0016239	positive regulation of macroautophagy	19	1	0.64	0.4798	1	BP
GO:0043954	cellular component maintenance	19	1	0.64	0.4798	1	BP
GO:0060259	regulation of feeding behavior	19	1	0.64	0.4798	1	BP
GO:0042255	ribosome assembly	19	1	0.64	0.4798	1	BP
GO:0055092	sterol homeostasis	19	1	0.64	0.4798	1	BP
GO:0051781	positive regulation of cell division	19	1	0.64	0.4798	1	BP
GO:0055024	regulation of cardiac muscle tissue deve...	19	1	0.64	0.4798	1	BP
GO:0001558	regulation of cell growth	106	4	3.57	0.4834	1	BP
GO:0072359	circulatory system development	194	7	6.54	0.484	1	BP
GO:0030100	regulation of endocytosis	77	3	2.6	0.485	1	BP
GO:0050878	regulation of body fluid levels	77	3	2.6	0.485	1	BP
GO:0040029	regulation of gene expression, epigeneti...	77	3	2.6	0.485	1	BP
GO:0044843	cell cycle G1/S phase transition	77	3	2.6	0.485	1	BP
GO:0010959	regulation of metal ion transport	77	3	2.6	0.485	1	BP
GO:0032409	regulation of transporter activity	48	2	1.62	0.4859	1	BP
GO:0048675	axon extension	48	2	1.62	0.4859	1	BP
GO:0003008	system process	378	16	12.74	0.4863	1	BP
GO:0009653	anatomical structure morphogenesis	666	23	22.45	0.4869	1	BP
GO:0071407	cellular response to organic cyclic comp...	136	5	4.58	0.4883	1	BP
GO:0044092	negative regulation of molecular functio...	195	7	6.57	0.4896	1	BP
GO:0030900	forebrain development	107	4	3.61	0.4908	1	BP
GO:0001505	regulation of neurotransmitter levels	107	4	3.61	0.4908	1	BP
GO:0001944	vasculature development	107	4	3.61	0.4908	1	BP
GO:0051248	negative regulation of protein metabolic...	225	8	7.58	0.4925	1	BP
GO:0007281	germ cell development	264	11	8.9	0.4935	1	BP
GO:0030707	ovarian follicle cell development	78	3	2.63	0.4937	1	BP
GO:0006260	DNA replication	78	3	2.63	0.4937	1	BP
GO:0022613	ribonucleoprotein complex biogenesis	137	5	4.62	0.4949	1	BP
GO:0071248	cellular response to metal ion	49	2	1.65	0.4969	1	BP
GO:2000146	negative regulation of cell motility	49	2	1.65	0.4969	1	BP
GO:0045931	positive regulation of mitotic cell cycl...	49	2	1.65	0.4969	1	BP
GO:0042745	circadian sleep/wake cycle	20	1	0.67	0.4975	1	BP
GO:0010332	response to gamma radiation	20	1	0.67	0.4975	1	BP
GO:0051568	histone H3-K4 methylation	20	1	0.67	0.4975	1	BP
GO:0000380	alternative mRNA splicing, via spliceoso...	20	1	0.67	0.4975	1	BP
GO:0019730	antimicrobial humoral response	20	1	0.67	0.4975	1	BP
GO:1903201	regulation of oxidative stress-induced c...	20	1	0.67	0.4975	1	BP
GO:0043297	apical junction assembly	20	1	0.67	0.4975	1	BP
GO:0002832	negative regulation of response to bioti...	20	1	0.67	0.4975	1	BP
GO:0006939	smooth muscle contraction	20	1	0.67	0.4975	1	BP
GO:0040028	regulation of vulval development	20	1	0.67	0.4975	1	BP
GO:0001936	regulation of endothelial cell prolifera...	20	1	0.67	0.4975	1	BP
GO:0010657	muscle cell apoptotic process	20	1	0.67	0.4975	1	BP
GO:0043666	regulation of phosphoprotein phosphatase...	20	1	0.67	0.4975	1	BP
GO:0072525	pyridine-containing compound biosyntheti...	20	1	0.67	0.4975	1	BP
GO:0042398	cellular modified amino acid biosyntheti...	20	1	0.67	0.4975	1	BP
GO:0042491	inner ear auditory receptor cell differe...	20	1	0.67	0.4975	1	BP
GO:0048010	vascular endothelial growth factor recep...	20	1	0.67	0.4975	1	BP
GO:0019363	pyridine nucleotide biosynthetic process	20	1	0.67	0.4975	1	BP
GO:0019359	nicotinamide nucleotide biosynthetic pro...	20	1	0.67	0.4975	1	BP
GO:0002028	regulation of sodium ion transport	20	1	0.67	0.4975	1	BP
GO:0032092	positive regulation of protein binding	20	1	0.67	0.4975	1	BP
GO:0010923	negative regulation of phosphatase activ...	20	1	0.67	0.4975	1	BP
GO:0050974	detection of mechanical stimulus involve...	20	1	0.67	0.4975	1	BP
GO:0060218	hematopoietic stem cell differentiation	20	1	0.67	0.4975	1	BP
GO:0045859	regulation of protein kinase activity	167	6	5.63	0.4981	1	BP
GO:0070482	response to oxygen levels	108	4	3.64	0.4982	1	BP
GO:0019752	carboxylic acid metabolic process	230	13	7.75	0.4995	1	BP
GO:0046907	intracellular transport	507	19	17.09	0.5007	1	BP
GO:0040007	growth	345	12	11.63	0.5014	1	BP
GO:0001701	in utero embryonic development	79	3	2.66	0.5023	1	BP
GO:0042594	response to starvation	79	3	2.66	0.5023	1	BP
GO:0030534	adult behavior	79	3	2.66	0.5023	1	BP
GO:0061564	axon development	168	6	5.66	0.504	1	BP
GO:0043269	regulation of ion transport	109	4	3.67	0.5056	1	BP
GO:0099504	synaptic vesicle cycle	50	2	1.69	0.5077	1	BP
GO:0001738	morphogenesis of a polarized epithelium	50	2	1.69	0.5077	1	BP
GO:0006612	protein targeting to membrane	50	2	1.69	0.5077	1	BP
GO:0045785	positive regulation of cell adhesion	50	2	1.69	0.5077	1	BP
GO:0065004	protein-DNA complex assembly	50	2	1.69	0.5077	1	BP
GO:0006367	transcription initiation from RNA polyme...	50	2	1.69	0.5077	1	BP
GO:0060485	mesenchyme development	50	2	1.69	0.5077	1	BP
GO:0046661	male sex differentiation	50	2	1.69	0.5077	1	BP
GO:0140056	organelle localization by membrane tethe...	50	2	1.69	0.5077	1	BP
GO:0009451	RNA modification	50	2	1.69	0.5077	1	BP
GO:0003012	muscle system process	80	3	2.7	0.5109	1	BP
GO:0090068	positive regulation of cell cycle proces...	80	3	2.7	0.5109	1	BP
GO:0031325	positive regulation of cellular metaboli...	646	30	21.77	0.5118	1	BP
GO:0048812	neuron projection morphogenesis	229	8	7.72	0.5133	1	BP
GO:0033043	regulation of organelle organization	329	13	11.09	0.5144	1	BP
GO:0001824	blastocyst development	21	1	0.71	0.5146	1	BP
GO:0072384	organelle transport along microtubule	21	1	0.71	0.5146	1	BP
GO:0048149	behavioral response to ethanol	21	1	0.71	0.5146	1	BP
GO:0048103	somatic stem cell division	21	1	0.71	0.5146	1	BP
GO:0060675	ureteric bud morphogenesis	21	1	0.71	0.5146	1	BP
GO:0031532	actin cytoskeleton reorganization	21	1	0.71	0.5146	1	BP
GO:0045773	positive regulation of axon extension	21	1	0.71	0.5146	1	BP
GO:0072171	mesonephric tubule morphogenesis	21	1	0.71	0.5146	1	BP
GO:0000731	DNA synthesis involved in DNA repair	21	1	0.71	0.5146	1	BP
GO:0006911	phagocytosis, engulfment	21	1	0.71	0.5146	1	BP
GO:0001959	regulation of cytokine-mediated signalin...	21	1	0.71	0.5146	1	BP
GO:0001942	hair follicle development	21	1	0.71	0.5146	1	BP
GO:0001935	endothelial cell proliferation	21	1	0.71	0.5146	1	BP
GO:0032526	response to retinoic acid	21	1	0.71	0.5146	1	BP
